"url"	"title"	"company_name"	"company_score"	"description"	"time_posted"	"metadata"	"date_scraped"	"city"	"page"
"https://www.indeed.com/viewjob?jk=edc79a70839aa535"	"Data Scientist"	"Seattle Cancer Care Alliance"	"80 reviews"	"$103,000 - $131,000 a year (Indeed Est.) The Seattle Cancer Care Alliance (SCCA), located in Seattle, Washington, is part of a dynamic collaboration among three organizations known nationally and internationally for their patient care and research: Fred Hutchinson Cancer Research Center, University of Washington, and Seattle Children's. Over the past 25 years, these institutions have worked together to support their mission of adult and pediatric oncology patient care services, research and education.

SCCAs Advanced Analytics Program harnesses the power of data to help SCCA deliver state of the art cancer care. The Data Scientist will join this growing team of innovative, results-oriented and collaborative professionals who employ advanced analytics to improve the experience of our patients, providers staff. We combine data science expertise with a deep understanding of oncology data and strong clinical and business partnerships to deliver valuable products and demonstrate the extraordinary opportunities for analytics in healthcare. The Data Scientist is a critical member of this team who will inform our strategy, expand our capabilities, and deliver solutions that make SCCA a national leader in analytics for oncology.

Responsibilities
Build positive, productive relationships with clinical and business partners to understand their information needs, identify data science opportunities, and ensure our products add value. Partners may include SCCA executives, directors and managers, providers, researchers, administrators, clinical staff, and outside institutions or agencies
Develop a robust understanding of SCCAs data and data systems financial, operational and clinical to ensure effective, reliable, and responsible use of data
Build solutions that apply machine learning techniques to address complex business problems, derive actionable insights, and maximize decision-making confidence
Lead or participate in all aspects of solution development, including exploratory data analysis, feature selection engineering, model build, testing and deployment
Create data visualizations and present solutions to technical and non-technical audiences
Identify and implement industry best practices for data science in healthcare
Make recommendations on technical infrastructure, analytic competencies, and project selection to inform and execute the strategy of the Advanced Analytics Program

Qualifications

Required
BA/BS in computer science, statistics, healthcare informatics or similar degree
5+ years of applicable analytics or data science experience
Deep knowledge of machine learning techniques, such as statistical modeling, predictive modeling, natural language processing
Demonstrated ability to apply machine learning to solve complex business problems
Proficiency in Python or R programming
Extensive experience in exploratory data analysis, feature engineering, and data visualization
Experience with SQL relational databases
Ability to communicate and collaborate effectively with technical and non-technical audiences
High degree of personal initiative and strong problem-solving skills

Preferred
Masters degree or in computer science, statistics, healthcare informatics or similar degree
Familiarity with industry and/or experience working with healthcare data, especially in oncology or population health
Experience with model explanation/interpretation methodologies, such as LIME or Shapley values
Strong data visualization skills
"	"7 days ago"	"$103,000 - $131,000 a year (Indeed Est.) "	2018-10-15	"Seattle%2C+WA"	60
"https://www.indeed.com/viewjob?jk=5461afc8c24ea7cd"	"BIOENGINEERING DATA ANALYST"	"University of Washington"	"877 reviews"	"As a UW employee, you will enjoy generous benefits and work/life programs. For a complete description of our benefits for this position, please visit our website, click here.
Please note that this position has been reposted. If you have already submitted your application, you need not submit it again, as it has already been received.
As a UW employee, you have a unique opportunity to change lives on our campuses, in our state and around the world. UW employees offer their boundless energy, creative problem solving skills and dedication to build stronger minds and a healthier world.

UW faculty and staff also enjoy outstanding benefits, professional growth opportunities and unique resources in an environment noted for diversity, intellectual excitement, artistic pursuits and natural beauty. All of which has allowed the UW to be nationally recognized as a “Great College to Work For” for four consecutive years.

Every day UW Bioengineering invents the future of medicine. We bridge the traditional disciplines of medicine and engineering to drive health care forward for those in remote parts of the world and here at home. Students, scientists, engineers, and physicians come together here to develop innovative and cost-effective approaches to improve health care.

UW Bioengineering naturally evolved from partnerships between engineering and medicine. Today, our faculty and students continually reach across traditional boundaries in education and research. The interdisciplinary scope of our research spans five overarching themes: regenerative medicine and biomaterials, molecular and cellular engineering, imaging and image-guided therapy, technology to improve access to health care, and systems and synthetic biology.

UW Bioengineering currently has an outstanding opportunity for a BIOENGINEERING DATA ANALYST.

The Sanders Lab is a 15-person interdisciplinary group of bioengineers, clinicians, mechanical and electrical engineers and software specialists. The research is focused on development and implementation of novel measurement techniques for external prosthetics. The goal of the projects is to create instruments to help practitioners better understand patient prosthetic fit problems and select treatments to improve function and quality of life.
Job Description:

This position relies on critical thinking, data analysis, and the capability to work well with a team of engineers and practitioners. The candidate will be expected to document work clearly towards the preparation of manuscripts and reports.

Major duties and responsibilities are:
Limb volume and prosthetic fit/activity data analysis and interpretation:
Use Matlab to write scripts to process collected data
Conduct engineering signal analysis of limb volume and signals from other prosthesis sensors
Use models to generate hypotheses about relationships between limb fluid volume, prosthetic fit, sensor data, and other variables
Analysis for design of prosthesis controller algorithm:
Present interpretations to senior researchers and research prosthetists
Data collection on people with limb loss:
Operate instrumentation as part of a team to collect sensor data on people with limb loss (may require domestic travel)
Minimum Requirements:
Bachelor of Science degree in engineering or science.
Minimum 12 months experience working in a research or industry environment.
Proficient in Matlab, and/or other programming languages commonly used for data analysis.
Ability to run detailed scientific protocals with human subjects for data collection.
Ability to present analysis results and developed algorithms in clear, readily understandable form.
Ability to independently prioritize and organize work to meet deadlines; ability to seek help.
Capability to write manuscript-quality description of analysis methods and results.
Willingness and ability to learn new systems and to implement new processes in response to changes.
Capability to work well with a team of interdisciplinary engineers and practitioners
Desired:

Knowledge, skills and abilities that are desirable, providing for an enhanced level of job performance, include:
Ability to create and use innovative waveform characterization strategies to relate measured variables to prosthetic fit outcomes
Proficient in advanced analysis of unpredictable systems (machine learning, fuzzy logic, etc.)
Experience with Labview programming
Demonstrated ability to conduct analysis of complex, multivariate data, particularly of biomechanical systems."	NA	"character(0)"	2018-10-15	"Seattle%2C+WA"	60
"https://www.indeed.com/viewjob?jk=c8ee2c3d5322e24a"	"Qualitative Data Analyst Intern"	"Fred Hutchinson Cancer Research Center"	"94 reviews"	"Part-time, Temporary, InternshipOverview
Cures Start Here. At Fred Hutchinson Cancer Research Center, home to three Nobel laureates, interdisciplinary teams of world-renowned scientists seek new and innovative ways to prevent, diagnose and treat cancer, HIV/AIDS and other life-threatening diseases. Fred Hutch’s pioneering work in bone marrow transplantation led to the development of immunotherapy, which harnesses the power of the immune system to treat cancer. An independent, nonprofit research institute based in Seattle, Fred Hutch houses the nation’s first cancer prevention research program, as well as the clinical coordinating center of the Women’s Health Initiative and the international headquarters of the HIV Vaccine Trials Network. Careers Start Here.
Seattle Translational Tumor Research (STTR) creates environments which enable researchers and clinicians to accelerate scientific discovery and translate it into cures for patients; and has three main objectives:
Build seamless infrastructure to optimize and speed translational and precision medicine research
Strengthen tumor-specific translational research programs across liquid and solid tumors
Strengthen partnerships between Seattle-area translational research institutions
STTR is currently implementing a survey of Fred Hutch-based faculty and staff. The survey is intended as a landscape assessment and needs gathering activity to inform STTR and Fred Hutch leadership about the current state of informatics needs and support across Fred Hutch.
Our goal is to use the results to inform the development of the translational research pipeline by better understanding bottlenecks and barriers to large-scale translational research. By understanding which data types are most commonly used in research projects, we can help inform the development of new tools in Oncoscape (http://oncoscape.sttrcancer.org/#/) to enable more novel approaches to data visualization and analysis (in partnership with interested informatics/computational faculty). We can also use the data to work with groups across Fred Hutch (HDC and the Translational Genomics Data Coordinating Center) to help researchers access the tools and technologies needed to navigate this space, and to help develop and increase access to best practices and data standards in this space. In addition, this survey will allow STTR to more effectively connect investigators (both clinical and wet lab) to resources for informatics support across the Fred Hutch investigator network.
To date, we have surveyed over 60 clinicians, researchers and staff across Fred Hutch and have conducted preliminary analyses of findings using the quantitative data generated from our survey. We hope to take our analysis deeper and draw further connections amongst investigators through further analysis of this data set and through analysis of the qualitative data collected through the survey. Working alongside various groups at Fred Hutch, such as Center IT, the Hutch Data Commonwealth, and faculty from the Computational Biology division we plan to use this information to identify or develop effective bioinformatics solutions that advance researcher’s abilities to conduct large-scale translational research.
Responsibilities
Conduct further quantitative analysis of survey data
Begin qualitative analysis of survey data – using an established coding system and online program (no prior experience required)
Summarize and create a report on findings
Present findings to relevant stakeholders at Fred HutchQualifications
Current student (Master's level preferred)
Knowledge of qualitative analysis methodsOur Commitment to Diversity
We are committed to cultivating a workplace in which diverse perspectives and experiences are welcomed and respected. We are proud to be an Equal Opportunity and VEVRAA Employer. We do not discriminate on the basis of race, color, religion, creed, ancestry, national origin, sex, age, disability, marital or veteran status, sexual orientation, gender identity, political ideology, or membership in any other legally protected class. We are an Affirmative Action employer. We encourage individuals with diverse backgrounds to apply and desire priority referrals of protected veterans. If due to a disability you need assistance/and or a reasonable accommodation during the application or recruiting process, please send a request to our Employee Services Center at escmail@fredhutch.org or by calling 206-667-4700."	"10 days ago"	"Part-time, Temporary, Internship"	2018-10-15	"Seattle%2C+WA"	60
"https://www.indeed.com/viewjob?jk=9f1f0e93fe106d27"	"Senior Data Scientist-Seattle"	"Kaplan Test Prep"	"1,471 reviews"	"Job Title
Senior Data Scientist-Seattle
Job Description
Job Description
We are looking for Senior Data Scientists to be part of the Metis Data Science Instructional Team. We seek individuals who love and excel at analyzing and visualizing data to solve important problems, are passionate about teaching others to be premier data scientists, and are fun to be around and work with. An ideal candidate should be quick to learn and adapt, care about design of simple, powerful, beautiful interfaces and visuals, love writing code, thrive in creative team efforts, and also have interests and passions beyond data science.
RESPONSIBILITIES
Metis Senior Data Scientists provide incredible and inspiring Data Science instruction; support the design and teaching of new products and courses and infuse their expertise into our business operations; and continually sharpen their skills through consulting and passion project explorations. Metis calls this approach our 2-1-1 Instructor Model.
Teaching the Data Science Bootcamp
(2 quarters of the year)
Metis Senior Data Scientists spend half the year co-teaching two 12-week bootcamps (20-24 students). On any given day, the amount of lecture time is 1-2 hours, and the remainder of the day is spent directly engaging with and coaching individually the students.
Leading course discussions
Providing personalized support to students
Improving the quality of our curriculum
Offering career guidance and interview support
Developing & Teaching New Courses & Supporting Business Operations
(1 quarter of the year)
Metis Senior Data Scientists spend about one-quarter of the year helping to create and teach new course offerings, as well as infusing our functional areas – admissions, marketing, careers, instructor recruitment – with their domain expertise.
Creating new courses and/or enhancing existing courses
Providing data science training to corporations
Interviewing and providing feedback on applicants
Speaking at events and conferences
Writing articles and blogs
Assisting with instructor recruitment
Sharpening Skills & Pursuing Data Science Passion Projects
(1 quarter of the year)
Metis Senior Data Scientists spend about one-quarter of the year focused entirely on enhancing their skill set and building their data science knowledge in whatever way they choose. These three months are intended to be self-driven. Some ideas include:
Consulting on pro bono data science projects (e.g., with DataKind)
Providing in-house data science project expertise to specific companies
Authoring a book related to data science
Enrolling in data science classes
Working on open source passion projects
IDEAL APPLICANT
Has an exceptional background in at least two of the following three skill domains:
Computer Science
Math/Statistics
Data Science/Machine Learning
Has solid data science industry experience
Preferably has some teaching experience
Has excellent communication and listening skills
Approaches problems with a design perspective
Is passionate about continuous learning
Does not take themselves too seriously
PERKS OF THE ROLE
Part of a team that is transforming education
Three paid months per year to sharpen skills and pursue passion projects
Competitive compensation package
Opportunity to network and develop, both among Metis’ Data Science speaker community, as well as through Kaplan, the global educational company and parent company of Metis
Opportunity to work in different geographic locations (currently NYC, Chicago and San Francisco)
Location
Seattle, WA, USA
Additional Locations
Employee Type
Employee
Job Functional Area
Faculty Management
Kaplan is an Equal Opportunity Employer"	"5 days ago"	"character(0)"	2018-10-15	"Seattle%2C+WA"	60
"https://www.indeed.com/viewjob?jk=667e373629aceff8"	"Systems and Data Analyst (Junior Level)"	"BOEING"	"5,793 reviews"	"Everett,Washington,United States BAMAN2
The Application and End User Support (AE) Service division seeks a Systems and Data Analyst for the Systems Engineering portfolio.
The successful Systems and Data Analyst will:
Research and perform basic analysis of processes, applications, systems and data to identify functional requirements for application or system design.
Assist customers to clarify basic requirements.
Interpret and translate routine requirements into functional specifications.
Position Responsibilities:
Provide support for Airplane Certification and AOG applications.
Apply tools, delivery systems, and business expertise to the investigation and resolution of significant problems.
Review Trouble Tickets, prioritize the work (TFS), analyze results and work with customer engagement to disposition work and resolve problems.
Work with customers, end users, process analysts and developers to understand requirements and processes.
Provide Service Assist as needed (VT, PD, AM, OC, EB).
Work with the development team to transition AE SOW and acquire the knowledge necessary to support the products in the portfolio.
Continually engage with developers and product owners to on-board applications into the AE Service.
Applications include, but are not limited to: DCCS, CERTS, CertDW, LCS(CERT), and CPQT
Boeing is the world's largest aerospace company and leading manufacturer of commercial airplanes and defense, space and security systems. We are engineers and technicians. Skilled scientists and thinkers. Bold innovators and dreamers. Join us, and you can build something better for yourself, for our customers and for the world.
This position must meet Export Control compliance requirements, therefore a “US Person” as defined by 22 C.F.R. § 120.15 is required. “US Person” includes US Citizen, lawful permanent resident, refugee, or asylee.
Basic Qualifications (Required Skills/Experience):
2+ years SQL database experience
1+ years Oracle database experience
Team Foundation Server (TFS) experience
HP Service Manager (HPSM) experience
Preferred Qualifications (Desired Skills/Experience):
C# experience and .Net experience
1+ years of experience with database development and management (e.g. Sequel, Access, Excel, IVC, ACE, and ESPM)
Typical Education / Experience:
Technical bachelor's degree and typically 2 or more years' related work experience or a Master's degree or an equivalent combination of education and experience. A technical degree is defined as any four year degree, or greater, in a mathematic, scientific or information technology field of study.No CIO, Information & Analytics Individual Contributor No No Standard United States; The Boeing Company"	NA	"character(0)"	2018-10-15	"Seattle%2C+WA"	60
"https://www.indeed.com/viewjob?jk=49453c2db42f066c"	"Sr.Data Scientist"	"Cerebra Consulting INC"	"-"	"ContractJob SummaryJob Title: Senior Data Scientist / Data Scientist GuruLocation: Redmond, WADuration: 6+ monthsMandatory skills –*Expert in R, SPARK,Hands on experience in Machine Learning: H2O or Azure ML.Experience in Sparkling Water would be an advantage (needed for SPARK integration)Knowledge of Statistics.Must have worked in Campaign Analytics related projectsJob Type: Contract"	"10 days ago"	"Contract"	2018-10-15	"Seattle%2C+WA"	60
"https://www.indeed.com/viewjob?jk=f759d5a482536735"	"Senior Data Journalist"	"Textio"	"-"	"We believe that the future of writing is knowing who will respond to anything you write before you even publish it. Textio’s category-defining augmented writing platform is delighting customers, and we’re looking for a Senior Data Journalist with a strong sense of ownership to join our Seattle team.
You’ll start from a great foundation. We have a powerful brand, exceptional PR, and lots of great content. Best of all, Textio’s vast language data set allows our platform to discover fascinating narratives, and we love sharing them. All told, the Textio blog got hundreds of thousands of visitors last year. Our readership is executive, global, and growing fast. As more and more leaders realize that augmented writing is going to define enterprise technology over the next decade, there is a voracious appetite for data narratives about the way people are writing and talking.
If you’re a data-minded language person with a penchant for storytelling, there is no better content leadership job in the industry. (We know; we’ve read them all!)
What you'll be doing:
Plan, write, and collaborate on the narratives we tell, including building a rich, detailed, long-form writing discipline.
Own and create content for our Word Nerd blog from end to end, and tackle writing copy across multiple mediums.
Work with language data sets and turn data insights into compelling narratives.
Interview customers, industry leaders, and teammates across disciplines and tell their stories.
Cultivate a community of writers at Textio and among our customers, edit their work, and help them bring out their best work. Last year, more than half our company wrote for our blog.
Partner with our marketing team on brand-building opportunities and challenges. How can we maximize our social media influence? Make our emails land? Spread the word about augmented writing?
We’d love to hear from you if:
You’ve read our blog at https://textio.ai, and you love this kind of writing.
You know how to tell data stories for real people; your work speaks not only to data scientists and linguists, but to anyone.
You understand that the best data narratives are funny, fascinating, or both.
You have a background in linguistics, psychology, data journalism, or another social science, and/or you know how to use math to understand how language works and explain it to people.
You know how to make a story last across channels (social media, webinar, email marketing, etc.) and bring a testing mentality help us improve. You’re eager to prove that you can innovate by trying new tactics.
You are a superb communicator verbally and in writing—Textio stands for editorial quality, and you do too.
You ask smart questions and are an exceptional listener who can find the gem in a customer interview.
You understand that sometimes a great data visualization is worth a thousand words.
You are a disciplined self-starter who has the ability to juggle multiple, demanding initiatives concurrently.
You sweat the small stuff and keep SEO in mind.
You have a point of view but are low ego.
This is a leadership role on our growing brand team. Great writing about language data is a mainstay of what we do at Textio, and you’re just the right person to develop this discipline for us.
Textio embraces diversity and equal opportunity in a serious way. We are committed to building a team that represents a variety of backgrounds, perspectives, and skills. The more inclusive we are, the better our work will be. If there is anything we can do to create a more comfortable interview experience for you, please let us know.
Working at Textio is outstanding. Learn more about our philosophy, benefits, and team at https://textio.com/careers/. Reach out and share your story with us!"	"3 days ago"	"character(0)"	2018-10-15	"Seattle%2C+WA"	60
"https://www.indeed.com/viewjob?jk=4d294400feee0d9c"	"c(\"Data Scientist\", \"As a Data Scientist You Will:\", \"Your Toolset Includes:\", \"Your Qualifications:\", \"Why We’ll Hire You:\", \"Benefits of Working at Rover.com:\")"	"Rover"	"422 reviews"	"Who we are:
Rover.com connects pet parents with the nation’s largest network of pet sitters and dog walkers. On Rover, pet parents can easily discover, book, and manage personalized care for their dogs including pet sitting, dog walking, and doggy day care. Founded in 2011 on the belief that everyone should have the opportunity to experience the unconditional love of a dog, Rover improves and simplifies life for pet parents and the dogs they love.
We're headquartered in downtown Seattle. We're an agile, fast-growing startup, and our leadership comes from some of the country's most respected tech companies. Our Senior Leadership team has been recognized by Forbes, Seattle Business, and Geekwire. For the past three years we have been nominated as one of Seattle's \"Best Places to Work\" by Seattle Business Magazine, and celebrated awards in 2016 and 2017 by Seattle Met magazine and the Puget Sound Business Journal. We're also the recipient of World’s Most Dog-Friendly Offices in 2016 by Inc.com. Needless to say (but we're going to say it anyway)—we love dogs, and we wouldn't dream of going to work without them by our sides.
Who we're looking for:
