"url"	"title"	"company_name"	"company_score"	"description"	"time_posted"	"metadata"	"date_scraped"	"city"	"page"
"https://www.indeed.com/viewjob?jk=085c651c9a9cca49"	"Data Scientist - Client Services"	"Morning Consult"	"2 reviews"	"The Role:
Morning Consult is re-defining how public opinion data is measured – from collection, to storage, to visualization. We’re looking to add talented, ambitious technical talent to our Client Services team to continue pushing the boundaries of survey research.

This role requires you to be hands on with all aspects of the data collection process, such as programming complex survey questionnaires, administering survey experiments, and improving sampling/weighting methods.

The ideal candidate will be a strong partner to both internal and external stakeholders, and also continuously work to enhance the quality and presentation of data internally.
Key Responsibilities:Own all aspects of the client data collection process, including: * Import and program survey questionnaires into online survey platforms
Monitor survey completion process
Import, format, analyze, and pull custom data sets
Use statistical techniques and develop predictive statistical models
Work within internal Client Services teams to ensure quality and timely completion of surveys and client deliverables
Implement best practices, build and automate tools to improve data collection methods
Continuously improve through feedback
Desired Skills:1-3 years of experience in highly analytical role at a fast-paced company (or equivalent)
A bachelor’s or master’s degree in economics, statistics, computer science, math, economics, physics, or engineering (or equivalent)
Expertise with R statistical software (i.e., data visualization and processing)
Knowledge of descriptive/inferential statistics and econometrics
Experience with online survey design, online survey panels and online weighting methodologies
Preferred experience with Python, Amazon Web Services, Qualtrics, hypothesis testing, A/B testing
About Morning Consult:
Morning Consult is a leading technology company revolutionizing ways to collect, organize, and share survey research data to transform how leaders in business and government make key decisions. With offices in New York, Washington D.C., and Chicago, Morning Consult provides rapid and rigorously tested research, news, and brand-tracking technology for over 150 of the world’s biggest companies and industry associations. Morning Consult conducts regular surveys for major media organizations including POLITICO, Bloomberg, The New York Times, AdAge, and Vox.
Read more about our company and work:A breakout company broke the dam in 2016 polling, and now it wants to become

'the Bloomberg of public opinion'
[http://www.businessinsider.com/morning-consult-election-polls-2016-11] – Business Insider, November 2016
These are the 20 #dctech startups worth watching this year

[https://technical.ly/dc/2017/02/09/top-startups-dc-reallist/] – Technical.ly DC, February 2017
Is Trump Hate-Tweeting You? Find Out if It’s Really a Crisis

[https://www.wired.com/2017/02/trump-hate-tweeting-find-really-crisis/] – Wired.com, February 2017
Is Sushi ‘Healthy’? What About Granola? Where Americans and Nutritionists

Disagree
[https://www.nytimes.com/interactive/2016/07/05/upshot/is-sushi-healthy-what-about-granola-where-americans-and-nutritionists-disagree.html], July 2016
National Impact of Franchising [https://franchiseeconomy.com/], International Franchise Association 2017
"	"14 days ago"	"character(0)"	2018-10-15	"Washington%2C+DC"	20
"https://www.indeed.com/viewjob?jk=eef81866547d25bc"	"Data Scientist​"	"VivusTech"	"-"	"Discover patterns and solve strategic business problems using both structured and unstructured data sets across many environments
Develop predictive models and optimization models that drive better outcomes for customers, patients and SOC operations
The first project will focus on predicting demand (volume) and matching up with optimized supply (physician resource). Understand levers to the physician supply requirements and provide capacity planning to optimize supply and demand equation while supporting excellent patient care
Collaborate with business owners, gather requirement, determine the best fitting method of analysis, translate and articulate analytical results, make recommendations with common sense approach to a non-technical business audience including executive management, internal staffs and external customers
Train and mentor team members as needed
The individual must possess the following knowledge, skills and abilities to be able to perform the essential functions of the job, with or without reasonable accommodation.
REQUIRED QUALIFICATIONS:
Strong practical knowledge and experience of analytical techniques and methodologies such as machine learning/supervised and unsupervised techniques, segmentation, mix and time series modeling, stochastic modeling, response modeling, lift modeling, experimental design, neural networks, data mining, Bayesian inference, text analytics and optimization techniques
Desired skills include programming in multiple languages (i.e. SQL, R, Python), working with large data sets, data collection, data normalization, and data visualization.
Ability to demonstrate professionalism, reliability, resourcefulness, flexibility, and attention to detail, and to maintain strict privacy of confidential data
Successful track record of thriving in a fast paced, flexible, and dynamic environment
Ability to manage multiple, concurrent projects of varying size and scope and core team activities in a fast paced environment. Ability to set reasonable timeline to meet objectives and prioritize conflicting deadlines
Energetic and enthusiastic self-starter comfortable taking the initiative to develop new levels of analytics
Ability to build consensus, collaborate and motivate others
Ability to work independently and collaboratively
A Bachelor’s degree in Statistics
1+ years of full-time work experience in data science, advanced analytics, machine learning and predictive analytics
Experience driving large analytic projects, research and programs to completion"	"12 days ago"	"character(0)"	2018-10-15	"Washington%2C+DC"	20
"https://www.indeed.com/viewjob?jk=e5d631a6028aed59"	"Data Scientist"	"General Electric"	"4,638 reviews"	"Role Summary:
The Data Scientist will contribute to the development and deployment of modern machine learning, operational research, semantic analysis, and statistical methods for finding structure in large data sets. In this role, the Data Scientist will perform feature extraction, real time analytics methods, in addition to analytic prototyping, scale up, scaling and solutions integration.Essential Responsibilities:Work alongside software developers and software engineers to translate algorithms into commercially viable products and services.Work in technical teams in development, deployment, and application of applied analytics, predictive analytics, and prescriptive analytics.Perform exploratory and targeted data analyses using descriptive statistics and other methods.Work with data engineers on data quality assessment, data cleansing and data analytics.Generate reports, annotated code, and other projects artifacts to document, archive, and communicate your work and outcomes.Share and discuss findings with team members.Perform exploratory and targeted data analyses using descriptive statistics and other machine learning methods such as classification (supervised learning), clustering or association (unsupervised learning) or deep learning/AI (neural network).
Feature extraction, real time analytics methods, in addition to analytic prototyping, scaling and solutions integration.Qualifications/Requirements:Basic Qualifications:
Bachelor’s Degree in a “STEM” major (Science, Technology, Engineering, Mathematics)Eligibility Requirements:
Legal authorization to work in the U.S. is required. We will not sponsor individuals for employment visas, now or in the future, for this jobUS Secret clearance requirementDesired Characteristics:Minimum of 2 years of professional experience in data and analyticsDemonstrated skill in data management methodsDemonstrated skill in feature extraction and realtime analytics development and deploymentDemonstrated skill in prescriptive analytics and analytic prototyping#DTRAbout Us:
GE is the world's Digital Industrial Company, transforming industry with software-defined machines and solutions that are connected, responsive and predictive. Through our people, leadership development, services, technology and scale, GE delivers better outcomes for global customers by speaking the language of industry.
GE offers a great work environment, professional development, challenging careers, and competitive compensation. GE is an Equal Opportunity Employer. Employment decisions are made without regard to race, color, religion, national or ethnic origin, sex, sexual orientation, gender identity or expression, age, disability, protected veteran status or other characteristics protected by law.Locations: United States; District of Columbia; Washington
GE will only employ those who are legally authorized to work in the United States for this opening."	NA	"character(0)"	2018-10-15	"Washington%2C+DC"	20
"https://www.indeed.com/viewjob?jk=f7e08d24e11ccc8e"	"Data Scientist-Big Data Privacy"	"Knexus Research Corp."	"-"	"Temporary, OtherFull Time, Temporary (Multiple Positions)
About Us: Knexus Research Corporation is a leading artificial intelligence and machine learning R&D company with a mission to advance the state-of-the-art in autonomy, data analytics, and decision aids for supporting national science and technology initiatives.
The Opportunity: As a Data Scientist you will be part of a team prototyping and evaluating ground-breaking privacy preserving algorithms for large data sets. This position gives you a rare opportunity to learn about and make significant contributions to the emerging field of privacy analytics over big data.
Duration: This is a temporary (12-18 months), full-time position.
Where: Our head office is located in the heart of National Harbor, MD, a waterfront district that overlooks the Potomac River, downstream from DC, with VA on one side and MD on the other.
Responsibilities
Assist with data analytics requirement gathering from analysts & subject matter experts
Review and analyze existing data models survey data and recommend design changes
Support design and development of new statistical analyses of survey data
Design and prototype data models and routines for synthetic data generation and analysis.
Document, report and present findings and recommendations to the team
Required Qualifications and Experience
Bachelor's of Science or Graduate Degree in computer science, statistics, or related field
Data modeling and database design including schema design for big data analysis
Experience with statistical modeling and analyses of large datasets
Experience with PythonBonus Experience
Experience in the field of Differential Privacy
Experience with analysis and modeling of survey and questionnaire data
Experience with statistical programming languages such as R or SAS
Professional software engineering experience
Familiarity with social science research using census data
Familiarity with theoretical statistics
Work Environment
Lab-like, Inventive: web technologies, AI, machine learning skunkworks
Open: Investigate, experiment, learn, actively discuss, listen, and be heard
Casual: Leggings, flip-flops or shorts are ok!
Flexible: Like to sleep in late, and work into the evening? That's ok too
Work alongside top AI scientists and engineers!Perks & Benefits
Competitive salary commensurate with experience and qualifications
Performance bonus
Fully vested company contributions to employee retirement plan
Great health insurance (medical, Rx, dental & vision) with company contribution
We pay your Short Term Disability, Life and Accidental insurances
3 weeks of paid time off per year that increases with tenure, plus, 10 Federal Holidays!
Monthly telecommuting allowance (so you can work from home when necessary)
Free covered parking at the head officeInterview and Selection: Applicants should be prepared to discuss and explain their computer science and development experience, participate in a Python programming test, submit any publications they have authored, and submit code or knowledge engineering samples as applicable.
All qualified applicants will receive consideration for employment without regard to race, color, religion, sex, national origin, gender identity and expression, age, disability, or Vietnam era, or other eligible veteran status, or any other protected factor.
Release Date: October 2018"	"15 days ago"	"Temporary, Other"	2018-10-15	"Washington%2C+DC"	20
"https://www.indeed.com/viewjob?jk=5901fbd81e3119f4"	"Senior Data Scientist"	"American Nurses Association, Inc"	"45 reviews"	"Business Unit: American Nurses Credentialing Center

Department: Measurement Services

Salary Grade: 14

Employee Referral Bonus Amount: $500.00

TO APPLY: Apply online or email resume to chet.reisler@ana.orgKey technical expert, accountable for exam performance and psychometrics, resolution of data issues, and research addressing ANCC strategic goals. Leads efforts and provides consultation for MS staff to resolve data problems and establish data quality standards; develops presentations and publications for departments, Board of Directors, Commission on Certification, and other stakeholders; and proposes resources to support MS research activity. Serves as an expert in test development, scoring, research, and quantitative analyses. Develops software applications, programming, and syntax for report generation, statistical analyses, and graphic representations. Conducts quality assurance on scores, item functioning, and psychometric properties of exams. Drafts research reports. Ensures validity, reliability, and psychometric soundness of certification exams, using established industry and best practices.DUTIES:Conduct ongoing analysis of data systems. Review data management plans, revisions, and specifications and provide feedback. Plan and lead research (e.g., job analysis, validation, survey sampling, speededness and readability, test security, calibration, equating) to enhance exam performance, customer services, and product line as well as inform strategic planning. Monitor and evaluate item performance, differential item functioning, item drift, and exam psychometrics.
Program for advanced statistical analyses using software programs (e.g., SAS, SPSS, Winsteps, R, SQL). Create and implement report generation, data collection, and sampling plans; develop conceptual frameworks for research and analyses; and recommend and adapt analytical and statistical methods. Identify strategies to generate useful feedback for examinees. Draw conclusions from research and make recommendations. Provide results, conclusions, and visuals and present to internal and external stakeholders (e.g., Executive Leadership, Boards of Directors, Commissions/Councils, program staff, governmental agencies, members of credentialed organizations). Travel as needed to deliver presentations at various venues or to meet with potential or current stakeholders.
Plan and lead test development activities (e.g., standard setting, item and exam performance, exam field testing, form building). Facilitate focus groups, prepare meeting materials, review materials created by colleagues, analyze data, and write technical research reports and summaries. Coordinate with colleagues, subject matter experts, and vendors.
Ensure compliance with industry best practice and accreditation requirements of ANCC certification programs. Maintain all necessary documentation in support of accreditation requirements. Establish data quality standards in collaboration with program staff. Troubleshoot issues and data errors. Consult with program staff on data preparation and data coding problems and assist in developing means for correcting the problems. Propose tools and resources to support research activity and enhance data system operations. Collaborate with ANA IT staff to evaluate and implement potential enhancements, to resolve quality assurance issues, and to ensure data systems are operational. Perform functional, cost-benefit, and risk analysis to support design changes. Assess risks and recommend mitigation strategies.
Perform other duties as assigned to support the department’s objectives and strategic goals.QUALIFICATIONS REQUIREDEducationMaster’s degree (Ph.D. preferred) in industrial-organizational (I/O) psychology, testing and measurement, psychometrics, mathematics, research and statistics, or related field, with emphasis on quantitative analyses.Related Work ExperienceFive years of professional experience. Two years of assessment development, psychometrics, data management and analyses, and technical report writing.SkillsResearch design and completion
Data collection, utilization, validation, security
Data management and visualization
Advanced data analysis (e.g., scaling and equating [CTT or IRT], simulation, sampling)
Choosing and applying appropriate analysis techniques
Test construction, development of alternative items, and test validation
Meeting facilitation
Oral and written communication
Advanced use of office computer software (e.g., Microsoft Word, Excel, PowerPoint) and database and statistical software (e.g., SAS, SPSS, R, SQL)
Analytical thinking
Technical documentation and report writing
Producing concise, high-level summaries and briefings to non-technical audiences
Identifying and using emerging technologies"	NA	"character(0)"	2018-10-15	"Washington%2C+DC"	20
"https://www.indeed.com/viewjob?jk=5b153217147485d2"	"HP032 Data Technician"	"ADNET Systems, Inc."	"9 reviews"	"Part-timeHP032 Junior Data Technician, Part Time
College student seeking part time position? I've got just the job for you at NASA. Our team environment encourages and empowers you to do your best work. Come share your knowledge with the world. Work side by side with top scientists. NASA has been voted top 50 Places in United States to work since 2010.
NASA's Goddard Space Flight Center nestled in the Maryland suburbs of Greenbelt is just 30 minutes from the heartbeat of America - Washington, D.C. Now you can have it all, the nightlife, museums, great food and theatre. Work in a place that pushes the envelope of science every day, yet spy a deer or a Canadian goose as you stroll the grounds of Goddard during lunch.
We are seeking a Junior Data Technician to support the Solar Data Analysis Center (SDAC) at NASA's Goddard Space Flight Center in Greenbelt, MD. The position is part-time at 8 hours per week and entails providing onsite back-up support to a lead Systems Administrator. Accordingly, it is an excellent opportunity for a college student who is currently studying for a career in computer systems administration and is interested in gaining professional IT experience working at an operating Data Center.
The position requires a candidate who is a problem-solver, is a fast learner, and can work both independently and as part of a team. Previous experience working in a computer-related environment that involved diagnosing and repairing hardware and software issues is a strong plus. Additional on the job training will be provided.
Duties include:
Support the lead systems administrator with installing new and decommissioning old server hardware.
Assist with performing operating system and software upgrades on Linux and Mac OS servers and desktop computers.
Patch, upgrade, and configure software and operating systems to comply with GSFC IT security policies.
Install application software.
Diagnose and resolve computer and networking issues for local and remote users.
Perform and manage system backups.
Requirements:
Minimum 1-year experience using Mac OS and/or Linux computer systems.
Preferably working on a Bachelors (or equivalent) degree in Science, Computing or Engineering.
US Citizenship."	"10 days ago"	"Part-time"	2018-10-15	"Washington%2C+DC"	20
