"url"	"title"	"company_name"	"company_score"	"description"	"time_posted"	"metadata"	"date_scraped"	"city"	"page"
We are looking for people who understand that behind every data point there is a pet and a pet person. When you develop and deploy an algorithm, you are not just producing a score or rule set, you are altering the customer experience and impacting the business in measurable ways. You should be excited to tackle a broad array of problems and work in a fast-paced, collaborative startup environment.
What does Data Science mean at Rover?
At Rover we obsess over our customers’ needs, relying heavily on data to improve the customer journey, and to continuously optimize outcomes in our marketplaces. Our entire organization is metric driven and underpinned by data science. Data scientists are responsible for defining the right metrics, understanding nuanced marketplace dynamics, and developing models and algorithms that power our business and technology.
As a Data Scientist You Will:
Identify opportunities to operate the marketplace more efficiently, working closely with business, product, and engineering leaders
Build multivariate models to arrive at inferences or predict future behavior
Develop algorithms that match owners with providers or solve other customer needs
Design and analyze A/B user tests and marketplace experiments, often in partnership with product managers
Deploy machine learning models at scale, writing production code in collaboration with machine learning platform engineers
Your Toolset Includes:
SQL
Python or R
Google Analytics or similar user funnel analytics tools
Tableau, Looker, or similar data visualization tools
Data-informed decision making with rigorous split testing.
Integrated teams with developers, designers and analysts working side-by-side.
Your Qualifications:
B.S in a quantitative discipline required; advanced degree (MS or PhD) preferred
Strong analytical, technical and coding skills
Expertise in one or more core data science disciplines (e.g, supervised learning, machine learning, etc)
Marketplace experience preferred
Experience in online user testing preferred
2+ years of experience in a technical role
Why We’ll Hire You:
You are familiar with more than just the basics, and have more than cursory experience with at least sub-discipline in the broad field of data science. In other words, you know where the sharp edges are, and can lead decisions around what techniques are and are not appropriate to employ for particular classes of problem
You’re a deeply analytical thinker who is passionate about finding structure in data, and using data to drive real value to the end user (and thus the business).
You are passionate about our core business. You will instinctively dig into every aspect of what it means to be a dog sitter and a dog owner on the Rover platform.
You can take abstractly defined problems and work with (imperfect) data to drive decisions
You are a great partner to engineers and business owners alike
You can pitch your own ideas and shepherd them through to completion
You show a pattern of being self-started, self-taught and self-directed
You favor open communication with willingness to ask and answer questions
You are output- and outcome-oriented
You have excellent written and verbal communication skills
You play nicely with others (and dogs)
Benefits of Working at Rover.com:
Competitive compensation
401k
Stock options
4 weeks paid time off
Competitive benefits package, including medical, dental, and vision insurance
Commuter benefits
Bring your dog to work (and unlimited puppy time)
Doggy benefits, including $1,000 toward adopting your first dog
Stocked fridges, coffee, soda, and lots of treats (for humans and dogs)
Free catered lunches semi-monthly
Regular team activities, including happy hours, snow tubing, game nights, and more
50 free dog walks a year
This position is based at Rover HQ in Downtown Seattle.
Competitive salary & benefits depending on experience.
Candidates must be eligible to work in the US."	NA	"character(0)"	2018-10-15	"Seattle%2C+WA"	60
"https://www.indeed.com/viewjob?jk=8f1885cb99406b91"	"Data Scientist"	"Inabia Solutions and Consulting"	"-"	"$91,000 - $135,000 a year (Indeed Est.) Education in the field of computer science/statistics and having prior experience in data science
Knowledge of C#, SQL and R/Python is required
Proven working experience as a data scientist in the information technology sector
Solid technical background, with understanding or hands-on experience in software development, data science and statistics
Excellent written and verbal communication skills
Solid organizational skills including attention to detail and multi-tasking skills
Knowledge of machine learning is a plus
Our Client is immediately looking for a Data Scientist for Bellevue location.
Client is developing Predictive Analytics for Finance (Macro, Sector, Equity).
Client is using Big Data to make predictions in the Finance domain.
Expereince with Predictive Analytics , Machine Learning , Artificial Intelligence , Data Mining , R , Python , C# , SQL Server is required.
Client is building financial predictions with Big Data and AI/ML techniques.
Work closely with other data scientists in the team
Work independently on a project and take it to completion
Create and maintain comprehensive project documentation
Create and maintain data-generation/model-prediction pipelines
Work on ad-hoc projects as required"	NA	"$91,000 - $135,000 a year (Indeed Est.) "	2018-10-15	"Seattle%2C+WA"	60
"https://www.indeed.com/viewjob?jk=09e596b5d58041f0"	"Data Scientist - Verticals"	"Uber"	"548 reviews"	"At Uber, we ignite opportunity by setting the world in motion. We take on big problems to help drivers, riders, delivery partners, and eaters get moving in more than 600 cities around the world.
We welcome people from all backgrounds who seek the opportunity to help build a future where everyone and everything can move independently. If you have the curiosity, passion, and collaborative spirit, work with us, and let’s move the world forward, together.
About the Role
The Rider team at Uber is responsible for accelerating demand growth across 600+ cities worldwide. The Data Scientist - Rider role will provide the data expertise as we drive towards enhancing growth and deepening engagement. In this position, you will offer a data-driven perspective and work closely with product, engineering, and marketing. You will be on the forefront of analysis and leverage our data sources to propose new ideas related to every area of our product, including quantifying the value of riders, exploring trends in user behavior, and optimizing features via experimentation. Our team's autonomy gives us the flexibility to focus on the highest-impact projects in this dynamic and challenging role as we bring increasing numbers of users onto the Uber platform.
What you'll do
Leverage data to perform intensive analysis across all areas of our business to drive product development
Design experiments and interpret the results to draw detailed and actionable conclusions
Generate ideas for exploratory analysis to shape future projects and provide recommendations for actions
Perform time-series analyses, hypothesis testing, and causal analyses to statistically assess relative impact and extract trends
Build models to enhance understanding of user behavior and predict future performance of cohorts
Create dashboards and reports to regularly communicate results and monitor key metrics
Present findings to senior management to strengthen business decisions
Collaborate with cross-functional teams across disciplines such as product, engineering, operations, and marketing
What you'll need
Minimum 3 years of experience in a quantitative analysis role
MS or PhD in Math, Economics, Statistics, Engineering, Computer Science, or other quantitative field (advanced degrees are a plus)
SQL skills and the ability to use tools such as Python, R to work efficiently at scale with large data sets
Advanced knowledge of experimentation and statistical methods
Experience in modeling and machine learning
Working knowledge of big data technology
Work closely with cross-functional teams to execute on decisions
Self-driven with the ability to work in a self-guided manner
Superb communication and organization skills
About the Team
The Rider team at Uber is responsible for accelerating growth and deepening engagement across 600+ cities worldwide, with the Verticals team focused specifically on creating a magical experience at Airports, events, and via scheduled rides. The Data Scientist's role will provide the data expertise as we drive towards enhancing growth and deepening engagement."	"26 days ago"	"character(0)"	2018-10-15	"Seattle%2C+WA"	60
"https://www.indeed.com/viewjob?jk=1bd62a175ad7db24"	"Senior Economic Forecasting Analyst – Load Research #23579"	"Puget Sound Energy"	"99 reviews"	"JOB SUMMARY: Puget Sound Energy’s Pricing and Cost of Service Department is looking for a Senior Economic Forecasting Analyst – Load Research to join our team.

Initiate and lead the utility’s class load research projects and load profiling activities to support cost of service, rate design and pricing, load forecasting, product and service development, resource planning, and other fiscal planning functions. Provide the strategy for implementing company policy and directives assigned in regulatory proceedings through rate research, statistical analysis, graphical representations, expert testimony, witness support, and other duties as. Provide training, direction and guidance to other regulatory analysts. Perform complex data queries and analysis using the company’s multiple database platforms to support regulatory filings and various data requests. Prepare, collect, compile, analyze, and report on technical, demographic, and financial data of the utility for regulatory reporting, filing, and proceedings.

At the discretion of the hiring team, this role may be filled at a lower level.

Families and businesses depend on PSE to provide the energy they need to pursue their dreams. Our steadfast commitment to serving Washington communities with safe, dependable and efficient energy started in 1873. Today we’re building the Northwest’s energy future through efforts like our award winning energy efficiency programs and our leadership in renewable energy.

At PSE we value and respect our employees and provide them opportunities to excel. We offer an expansive pay package that includes competitive compensation, annual goals-based incentive bonuses, comprehensive cafeteria-style benefits, 401(K), a company paid retirement pension plan, and an employee assistance and wellness program.
JOB REQUIREMENT:JOB RESPONSIBILTY: • Retrieve data from multiple data sources and present them in a logical format. This may involve programming.
Coordinate with IT to solve data gaps. Provide on-going support for the tools/templates developed.
Provide statistical and analytical support on pricing, rate design, and cost allocation to be used in regulatory filings and internal reporting.
Develop optimum sample designs and deployment plans for the utility’s load research programs.
Work with IT and Meter Data Warehouse staff to monitor and maintain quality of interval load readings being collected from sampled customers’ metering devices.
Prepare regulatory filings, reports, and rate case testimony.
Provide summary statistics or qualitative findings from data retrieved.
Develop hourly load profiles for target customers, rate schedules, and classes.
Participate in and provide support for the development of regulatory policy and strategy.
Work cooperatively with staff from other departments to communicate load information and obtain input from others in aligning load research services with needs.
Perform other duties as assigned. MINIMUM QUALIFICATIONS:
Bachelor’s in economics, statistics, mathematics, engineering, or applicable field or an equivalent combination of education and relevant experience
8 years of experience in utility load analysis or related field
Knowledge of statistics and econometrics and their applications
Familiarity with quantitative techniques and software
Proficiency in SAS Programming
Effective written and oral communication skills
Excellent interpersonal skills and ability to develop and cultivate strong working relationships
Proficiency in Microsoft Office tools
DESIRED QUALIFICATIONS:Intermediate or advanced knowledge of statistics
Programming experience and knowledge of SAP-BW
Experience strategically implementing data research and drafting testimony or other regulatory filings
Master’s degree (in economics or statistics a plus)
Experience in load research and profiling
Work experience with meter data, and data from MV-90, MDMS and CIS
Work experience with load research software such as SAS, Oracle Utilities Load Analysis (Lodestar) , iWave, EnergyProbe, Visualize-IT, etc.
Understanding of the fundamentals of cost of service studies and resource planning
Skilled at self-prioritization
"	NA	"character(0)"	2018-10-15	"Seattle%2C+WA"	60
"https://www.indeed.com/viewjob?jk=4d294400feee0d9c"	"c(\"Data Scientist\", \"As a Data Scientist You Will:\", \"Your Toolset Includes:\", \"Your Qualifications:\", \"Why We’ll Hire You:\", \"Benefits of Working at Rover.com:\")"	"Rover"	"422 reviews"	"Who we are:
Rover.com connects pet parents with the nation’s largest network of pet sitters and dog walkers. On Rover, pet parents can easily discover, book, and manage personalized care for their dogs including pet sitting, dog walking, and doggy day care. Founded in 2011 on the belief that everyone should have the opportunity to experience the unconditional love of a dog, Rover improves and simplifies life for pet parents and the dogs they love.
We're headquartered in downtown Seattle. We're an agile, fast-growing startup, and our leadership comes from some of the country's most respected tech companies. Our Senior Leadership team has been recognized by Forbes, Seattle Business, and Geekwire. For the past three years we have been nominated as one of Seattle's \"Best Places to Work\" by Seattle Business Magazine, and celebrated awards in 2016 and 2017 by Seattle Met magazine and the Puget Sound Business Journal. We're also the recipient of World’s Most Dog-Friendly Offices in 2016 by Inc.com. Needless to say (but we're going to say it anyway)—we love dogs, and we wouldn't dream of going to work without them by our sides.
Who we're looking for:
We are looking for people who understand that behind every data point there is a pet and a pet person. When you develop and deploy an algorithm, you are not just producing a score or rule set, you are altering the customer experience and impacting the business in measurable ways. You should be excited to tackle a broad array of problems and work in a fast-paced, collaborative startup environment.
What does Data Science mean at Rover?
At Rover we obsess over our customers’ needs, relying heavily on data to improve the customer journey, and to continuously optimize outcomes in our marketplaces. Our entire organization is metric driven and underpinned by data science. Data scientists are responsible for defining the right metrics, understanding nuanced marketplace dynamics, and developing models and algorithms that power our business and technology.
As a Data Scientist You Will:
Identify opportunities to operate the marketplace more efficiently, working closely with business, product, and engineering leaders
Build multivariate models to arrive at inferences or predict future behavior
Develop algorithms that match owners with providers or solve other customer needs
Design and analyze A/B user tests and marketplace experiments, often in partnership with product managers
Deploy machine learning models at scale, writing production code in collaboration with machine learning platform engineers
Your Toolset Includes:
SQL
Python or R
Google Analytics or similar user funnel analytics tools
Tableau, Looker, or similar data visualization tools
Data-informed decision making with rigorous split testing.
Integrated teams with developers, designers and analysts working side-by-side.
Your Qualifications:
B.S in a quantitative discipline required; advanced degree (MS or PhD) preferred
Strong analytical, technical and coding skills
Expertise in one or more core data science disciplines (e.g, supervised learning, machine learning, etc)
Marketplace experience preferred
Experience in online user testing preferred
2+ years of experience in a technical role
Why We’ll Hire You:
You are familiar with more than just the basics, and have more than cursory experience with at least sub-discipline in the broad field of data science. In other words, you know where the sharp edges are, and can lead decisions around what techniques are and are not appropriate to employ for particular classes of problem
You’re a deeply analytical thinker who is passionate about finding structure in data, and using data to drive real value to the end user (and thus the business).
You are passionate about our core business. You will instinctively dig into every aspect of what it means to be a dog sitter and a dog owner on the Rover platform.
You can take abstractly defined problems and work with (imperfect) data to drive decisions
You are a great partner to engineers and business owners alike
You can pitch your own ideas and shepherd them through to completion
You show a pattern of being self-started, self-taught and self-directed
You favor open communication with willingness to ask and answer questions
You are output- and outcome-oriented
You have excellent written and verbal communication skills
You play nicely with others (and dogs)
Benefits of Working at Rover.com:
Competitive compensation
401k
Stock options
4 weeks paid time off
Competitive benefits package, including medical, dental, and vision insurance
Commuter benefits
Bring your dog to work (and unlimited puppy time)
Doggy benefits, including $1,000 toward adopting your first dog
Stocked fridges, coffee, soda, and lots of treats (for humans and dogs)
Free catered lunches semi-monthly
Regular team activities, including happy hours, snow tubing, game nights, and more
50 free dog walks a year
This position is based at Rover HQ in Downtown Seattle.
Competitive salary & benefits depending on experience.
Candidates must be eligible to work in the US."	NA	"character(0)"	2018-10-15	"Seattle%2C+WA"	60
"https://www.indeed.com/viewjob?jk=201abf95039ec4a1"	"c(\"Machine Learning Researcher, Platform Architecture\", \"Key Qualifications\", \"\nDescription\", \"\nEducation\")"	"Apple"	"6,252 reviews"	"We are looking for engineers with a passion for using machine learning to build intelligent applications. In this highly accomplished, deeply technical and close-knit team of data scientists and machine learning engineers, you will create tools that are used by millions of people. You will design and implement new machine learning algorithms and techniques and collaborate with the most innovative product development teams in the world.
We research new machine learning algorithms, models and techniques that will power amazingly intelligent user experiences. We are looking for new ambitious members to join our research ML group. In this role, you will design new models and algorithms, and actively engage with the academic community by publishing your work and participating in academic efforts. You will also have the opportunity to supply to every cool project around Apple, and use your data science, machine learning and artificial intelligence skills to transfer your ideas into solutions for some of the most challenging technical problems in the next generation of products that will delight millions of people.
Key Qualifications
STRONG ACADEMIC AND PUBLICATION RECORD
Deep technical skills in machine learning, deep learning, computer vision, natural language processing, or artificial intelligence
A passion for creating innovative techniques and making these methods robust and scalable
ABILITY TO EXPLAIN AND PRESENT DEEP TECHNICAL IDEAS
Creative, reciprocal, & innovation focused
Description
As a member of the ML Research team, you will design and evaluate new algorithms, models and methods that will affect Apple and the broad ML community. You will also collaborate with teams across Apple, who are building the newest, most compelling intelligent applications in the world. You will also be a trusted advisor for standard methodology machine learning development.
- Your responsibilities include:
- Researching, developing and implementing the most innovative machine learning, artificial intelligence, computer vision and NLP techniques
- Publishing papers, software and building presentations
- Transferring machine learning solutions to data scientists and engineers on product teams
- Providing technical mentorship to product teams on the choice of machine learning approaches appropriate for a task
- Providing architectural mentorship on transitioning prototypes to high-performance production models
- Providing feedback on tools and new features needed back to platform development teams
Education
- PhD in Machine learning, Statistics, Computer Science, Physics, or related field or
- MS in related field with a strong academic track record
- 3+ years of research experience in academia or industry"	NA	"character(0)"	2018-10-15	"Seattle%2C+WA"	60
