"url"	"title"	"company_name"	"company_score"	"description"	"time_posted"	"metadata"	"date_scraped"	"city"	"page"
"https://www.indeed.com/viewjob?jk=332910f278167d29"	"Marketing Data Scientist"	"ICF"	"417 reviews"	"Working at ICF Working at ICF means applying a passion for meaningful work with intellectual rigor to help solve the leading issues of our day. Smart, compassionate, innovative, committed, ICF employees tackle unprecedented challenges to benefit people, businesses, and governments around the globe. We believe in collaboration, mutual respect, open communication, and opportunity for growth. If you’re seeking to make a difference in the world, visit www.icf.com/careers to find your next career. ICF—together for tomorrow. MARKETING DATA SCIENTIST Fairfax, VA ICF delivers the analytics, creativity, and digital innovation of a world-class marketing agency, amplified by domain expertise and resources of a leading international consulting firm. As we continue to drive market transformation for our energy sector clients, we seek a Marketing Data Scientist to help us develop best-in-class strategies and recommendations for our clients. Our line of business owns private- and public-sector energy sector marketing accounts and oversees the marketing automation, paid media, demand generation, customer engagement, and marketing strategy functions within ICF’s Commercial Energy service portfolio. The Marketing Team is responsible for generating customer awareness of and demand for clients’ electric and natural gas utility programs through a wide range of marketing and communications channels— such as organic search, search engine advertising, social media advertising and earned strategies, display advertising, broadcast media, direct mail, email marketing and earned media. We’re seeking a Marketing Data Scientist who wants to perform a wide variety of data-driven tasks and is passionate about swimming in data to uncover actionable insights. For example, this person will own development of a lead forecasting model (i.e., how much of marketing performance is impacted by variables such as segmentation, media spend, promotions, program participation data, year-on-year trends, external variables, and macroeconomic factors). The Data Scientist will also own the modeling and forecasting of additional key marketing metrics. The outputs from these models will be used to develop marketing strategies and recommendations. Key Responsibilities: Statistical modeling - develop models to describe the relationship between any business-relevant independent and dependent variables Marketing forecast development - analyze all available existing data sets to determine which variables are more predictive of marketing awareness building and lead generation performance Analyze the effectiveness of marketing campaigns and tactics such as looking at CTR, conversion rates, open rates, and participation in programs Identification of opportunities for process improvement and innovative solutions to marketing analytics challenges Data cleansing/processing - work with IT to create automated processes to ingest and cleanse data from multiple data sources, partners, and vendors Data management - work with IT to develop and maintain databases that support marketing analysis. Basic Qualifications: MS/BS in a technical field: Economics, Statistics, Computer Science, Engineering or related discipline 5+ years of experience in a combination of business intelligence / marketing analytic roles Strong demonstrated quantitative and qualitative research skills using standard statistical software such as SAS, R, Stata Preferred Skills/Experience: Experience with data visualization technologies, such as Tableau, a plus Strong organizational skills and customer service focus Experience in implementing and streamlining data processes, including marketing automation efforts plus experience with non-theoretical, “messy” datasets Ability to work collaboratively and cohesively in a team environment Professional Skills: Excellent listening, written, and oral communication skills paired with an excellent sense of humor Ability to exercise independent judgment while effectively prioritizing and executing tasks while under pressure Builds and maintains relationships with users to ensure buy-in and adoption of processes and solutions Strong analytical and problem-solving capabilities Team player with the ability to work in a fast-paced environment ICF offers an excellent benefits package, an award winning talent development program, and fosters a highly skilled, energized and empowered workforce. ICF is an equal opportunity employer that values diversity at all levels. (EOE – Minorities/Females/ Protected Veterans Status/Disability Status/Sexual Orientation/Gender Identity) Reasonable Accommodations are available for disabled veterans and applicants with disabilities in all phases of the application and employment process. To request an accommodation please email icfcareercenter@icf.com and we will be happy to assist. All information you provide will be kept confidential and will be used only to the extent required to provide needed reasonable accommodations. Read more about non-discrimination: EEO is the law and Pay Transparency Statement. Fairfax, VA (VA01)"	"3 days ago"	"character(0)"	2018-10-15	"Washington%2C+DC"	60
"https://www.indeed.com/viewjob?jk=12f23534628e3095"	"Data Scientist"	"Azimuth Corporation"	"12 reviews"	"ContractDescription: Apply complex analysis of data in support of mission problems, with expertise in problem solving, scripting in multiple languages, as well as the creation and/or implementation of tools and processes that aid in advanced analytics, testing and quality assurance, and DevOps. Use and develop statistical analysis, modeling, simulation, and machine learning methods. Comfort with complex mathematical concepts and models. Scripting, data collection and data management services; perform enterprise-wide data collection, storage, and manipulation; and, develop and implement automated testing frameworks. Requirements: Active Top Secret security clearance with SCI eligibility BS degree in a related scientific or engineering discipline from an accredited college or university and ten (10) to fourteen (14) years of progressive experience, or an MS degree in a related scientific or engineering discipline, and eight (8) to twelve (12) years of progressive experience, or a Ph.D. degree in a related scientific or engineering discipline and four (4) to seven (7) years of progressive experience. Experience with the following tools/languages: Python, R, STATA, Mathematica, Pig/Piglet, SQL, PostgreSQL, NoSQL, MSSQL, C++, bash, JMP, ROOT, Latex, MATLAB, Java, Javascript, XML, C++, MapReduce. Experience with AWS/cloud development and solutions architecture Experience with Agile Methodology/Scrum Development and DevOps Familiar with Jira and Confluence Experience working with multiple stakeholders, gathering requirements, analysis and integration resulting in informed deconning making, explaining highly technical concepts to a non-technical audience Preferred Qualifications (Nice to have but not required): AWS Solutions Architect Certified ScrumMaster Master’s Degree/PHD “Azimuth Corporation is an Equal Opportunity/Affirmative Action employer. All qualified applicants will receive consideration for employment without regard to race, color, religion, sex, national origin, disability, gender identity, sexual orientation or protected veteran status.”"	"12 days ago"	"Contract"	2018-10-15	"Washington%2C+DC"	60
"https://www.indeed.com/viewjob?jk=dba1a06a9c90b45b"	"Data Scientist"	"Leidos"	"584 reviews"	"Job Description: Leidos is looking for a Data Scientist for a position in the Northern VA area. This position requires the ability to obtain a TS/SCI with Polygraph clearance. The selected candidate will independently compile data to address the most complex intelligence issues or problems. As well as identify and network with appropriate internal and external sources to gather and/or exchange data on specialized matters; Determine the nature of analytic problems, evaluate options, and offer recommendations for resolution; Build and exploit databases and files; Advise on the methods and data needed and/or available to evaluate the intelligence problem; Collaborate with data collectors and analysts to identify and close gaps on complex monitoring problems; devise creative data collection and analysis strategies to fill monitoring gaps. The qualified applicant will provide accurate, timely, complex and sophisticated data analysis; determine and employ the most appropriate research design for data collection and analysis; Analyze, evaluate, and assess quantitative data (using statistical software, computer models, geospatial models, software languages, mathematical models) to contribute to or develop software tools, analytic models, or reports. Mandatory Skills:- Typically requires BS degree and 2 - 4 years of prior relevant experience or Masters with less than 2 years of prior relevant experience.- Demonstrated experience or knowledge of appropriate analytic methods and methodological tools in one or more of the following areas: - Applied mathematics (e.g., probability and statistics, formal modeling, computational social sciences) - Computer programming (e.g., programming languages, math/statistics packages, computer science, machine learning, scientific computing) - Visualization (e.g., GIS/geospatial analysis, telemetry analysis) 3) Demonstrated experience or academic experience with large data sets and technical data."	NA	"character(0)"	2018-10-15	"Washington%2C+DC"	60
"https://www.indeed.com/viewjob?jk=ca2c583f443e1e96"	"Data Scientist"	"IT Concepts Inc."	"-"	"The Role: The Data Scientist is responsible for researching and developing statistical learning models for data analysis, as well as collaborate with customers and stakeholders to devise possible solutions. The Data Scientist keeps up-to-date with latest technology trends, communicates results and ideas to key decision makers, and implements new statistical or other mathematical methodologies as needed for specific models or analysis. Optimize joint development efforts through appropriate database use and project design. The Company: We opened our doors in 2003 and have developed long-standing relationships with our customers, both public and private We’re an SBA 8(a) and CVE certified Service Disabled Veteran Owned Small Business We’re ISO 27001:2013, ISO 20000-1:2011, and ISO 9001:2015 certified and have CMMI DEV and SVC ML3 ratings We’ve been named part of: Inc 5000’s Fastest Growing Private Companies in 2016; Washington Business Journal’s Fastest Growing Companies in 2015, 2016 and 2017; Washington Business Journal’s Best Places to Work in 2015, 2016 and 2017 The Employer: We offer great benefits - Paid Time Off, Medical, Dental and Vision Insurance, 401(k) with company matching We invest in our employees – We offer an annual training budget to our employees and opportunities for growth within the organization We work hard, we play hard – We value work/life balance. We hold seasonal company events and a Washington Nationals Season Tickets lottery What will you be doing?: Research and develop statistical learning models for data analysis Collaborate with customers and stakeholders to devise possible solutions for data warehousing/data sharing environments Keep up-to-date with the latest technology trends, communicating results and ideas to key decision makers Implement new statistical or other mathematical methodologies as needed for specific models or analysis Support synergizing data solutions with IT requirements management products for new initiatives to include data modeling Communicate and coordinate with program stakeholders You meet our “must haves” if: You have Master’s Degree in Computer Science, Statistics, Applied Math or related field, and 7+ years’ practical experience with SAS, ETL, data processing, database programming and data analytics. Ability to understand various data structures and common methods in data transformation. Your experience includes Extensive background in data mining and statistical analysis Excellent pattern recognition and predictive modeling skills Excellent verbal and written communication skills Experience interfacing directly with clients and managing customer relationships You value teamwork, demonstrate integrity and honesty, are passionate, innovative and strive for excellence Clearance requirements: Must have an active Secret Clearance at the time of hire IT Concepts is an Affirmative Action/Equal Opportunity Employer. As such, any personnel decisions (hire, promotion, job status, etc.) on applicants and/or employees are based on merit, qualifications, competence and business needs, not on race, color, citizenship status, national origin, ancestry, gender, sexual orientation, gender identity, age, religion, creed, physical or mental disability, pregnancy, childbirth or related medical condition, genetic information of the employee or family member of the employee, marital status, veteran status, political affiliation, or any other factor protected by federal, state or local law. To perform this job successfully, an individual must be able to perform each essential duty satisfactorily. Reasonable Accommodations may be made to enable qualified individuals with disabilities to perform the essential functions."	"6 days ago"	"character(0)"	2018-10-15	"Washington%2C+DC"	60
"https://www.indeed.com/viewjob?jk=20e6a9fa88eeb586"	"Senior Data Scientist"	"ThreatConnect, Inc."	"-"	"Company Description ThreatConnect® arms organizations with a powerful defense against cyber threats and the confidence to make strategic business decisions. Founded in 2011, ThreatConnect officially launched the ThreatConnect Platform in 2013. Since then, ThreatConnect has grown to more than 20,000 users worldwide. Today, ThreatConnect provides a suite of products designed to meet the threat intelligence aggregation, analysis and automation needs of security teams at any maturity level - built on the industry's only intelligence-driven, extensible security platform. If you want to work on building a world-class security platform, you will enjoy a career that truly makes an impact. For more information on the benefits of working at ThreatConnect, visit www.threatconnect.com/careers Job Description We’re analysts first. We know what it takes to work at the front lines of cyber defense. We know that we’re stronger together than we are apart. And, we’re strategic business thinkers. Since 2011, we’ve led the threat intelligence revolution, building the industry’s most comprehensive threat intelligence platform along with its largest trusted cybersecurity community. Our ideal team member will have a passion for security analytics and have experience applying statistical and machine learning techniques across a broad set of problems. We are seeking motivated developers and analysts who can positively answer the following:Do you think of yourself as a scientist? Are you excited at the prospect of developing, articulating, and testing a hypothesis? Can you explain the results in a compelling fashion to both technical and non-technical audiences? Do you have the ability to prototype solutions within a distributed computing architecture? Do you want to work in a fast, growing, dynamic start-up environment? Do you like the idea of defining and pursuing a shared vision with other security and engineering enthusiasts? We are headquartered in Arlington, VA and maintain a tight collaborative environment across the “locals” and many remote teams. Location in the Northern VA/MD/DC area is desired, but remote work within the United States for the right candidate will be possible. ResponsibilitiesCollaborate with threat intelligence analysts, users, and stakeholders to define requirements and specifications for accessing and making use of data Collaborate with intelligence research and product management teams to identify new sources of data to drive discovery, analysis, and recommendation capabilities Evaluate options for data management infrastructure and tools, design comparison tests, prototype as needed, advise on build/buy decisions Develop, test, and apply optimized algorithms and statistical models for discovering new threat intelligence data, minimizing false positives, and recommending courses of action for internal and external stakeholders Leverage dynamic feedback from customer users and integrated devices for implementing appropriate workflows within the ThreatConnect platform Interface regularly with threat researchers to identify new ways to capture and leverage meaningful context and relationships across disparate data sets Work directly with product management, engineering, QA, and related team leads to ensure timely completion of products in conjunction with product roadmaps Other tasks as needed Requirements Qualifications:Bachelor’s Degree or higher At least 2 years of experience as a Data Scientist/Modeler/Research Analyst in areas of threat intelligence, network security, probability, etc. dealing with large data sets Proficiency in Python or similar scripting languages Proficiency with Structured Query Languages (SQL) Experience with Map Reduce, Spark, Pig, or other distributed programming Must possess strong written and verbal communications skills Legally authorized to work in the United States Benefits Work-Life Balance:10 Paid Federal Holidays Accrued Paid Time Off (PTO) for vacation/sick, time Your birthday off Employee recognition program with quarterly awards Employee referral program Military leave options available Education reimbursement program for job-related college courses and professional training Company-provided refreshments at our headquarters Quarterly events with your geographic team Annual company party Medical:MEDICAL PREMIUM FOR INDIVIDUALS AND FAMILIES ARE 100% COVERED Prescription drug coverage Dental coverage Vision coverage Company-paid short term and long term disability Company-paid insurance and AD&D coverage Financial:401K retirement savings plan with company matching program up to 6% Health Savings Account Cell phone stipend"	NA	"character(0)"	2018-10-15	"Washington%2C+DC"	60
"https://www.indeed.com/viewjob?jk=736360e793529a0f"	"Data Scientist/Data Engineer"	"General Dynamics Mission Systems"	"262 reviews"	"Basic Qualifications KNOWLEDGE SKILLS AND ABILITIES: Experience with software development (i.e., Integrated Development Environments (IDE), build automation, version control, dependency management, application lifecycle management, integrated testing, unit testing, software development methodologies, and operating systems) (e.g., Eclipse, IntelliJ IDEA, Maven, Git, Spring Boot, JIRA, Jenkins, Junit, Scrum, Windows, or Red Hat Linux) Experience with data management/flow (e.g., NiFi or Logstash) Experience with Programming Paradigms (i.e., Functional and Object-Oriented) (e.g., Scala, Java, or R) Experience with visualization (e.g., Kibana) Experience in Signals Intelligence (SIGINT) Experience with databases systems (i.e., NoSQL column and document-oriented) (e.g., Accumulo, MongoDB, or Elasticsearch) Experience in machine learning (i.e., Linear Discriminant Analysis, Classification and Regression Trees, K-Nearest Neighbors, Support Vector Machines, and Random Forest) (e.g., R or MapReduce) Education Requirements: Bachelor's degree in software engineering or a related technical field is required (or equivalent experience), plus a minimum of 10 years of relevant experience; or Master's degree plus a minimum of 8 years of relevant experience. Agile experience preferred. Clearance Requirements: Department of Defense TS/SCI with Polygraph security clearance is required at time of hire. Applicants selected will be subject to a U.S. Government security investigation and must meet eligibility requirements for access to classified information. Due to the nature of work performed within our facilities, U.S. citizenship is required. Responsibilities for this Position General Dynamics Mission Systems has an immediate opening for a Data Scientist/Data Engineer. This position provides an opportunity to further advance the cutting-edge technology that supports some of our nation’s core defense/intelligence services and systems. General Dynamics Mission Systems employees work closely with esteemed customers to develop solutions that allow them to carry out high-stakes national security missions. REPRESENTATIVE DUTIES AND TASKS: The Data Scientist will be part of a team, forward deployed within the customer space in support of the system. The candidate will have hybrid experience in software development and data science, ideally with subject matter expertise in Signals Intelligence (SIGINT). Must have experience in design, development, and troubleshooting of analytics. Various mission areas require assistance in determining the value of their products and workflow. The candidate will forward deploy to work with mission subject matter experts and create analytics that will feed the application, a data-driven tool that enriches and visualizes outcomes. Tasking will include developing and evolving analytics for situational awareness, trending, and change detection. The work will involve identifying source data, combination methods, and visualization needs. The candidate will work mostly independently on site, but must also be able to work with software engineer(s) in getting the data to the application and participate in incorporating code into the application’s codebase. #CJ3 Company Overview General Dynamics Mission Systems (GDMS) engineers a diverse portfolio of high technology solutions, products and services that enable customers to successfully execute missions across all domains of operation. With a global team of 13,000+ top professionals, we partner with the best in industry to expand the bounds of innovation in the defense and scientific arenas. Given the nature of our work and who we are, we value trust, honesty, alignment and transparency. We offer highly competitive benefits and pride ourselves in being a great place to work with a shared sense of purpose. You will also enjoy a flexible work environment where contributions are recognized and rewarded. If who we are and what we do resonates with you, we invite you to join our high performance team!"	NA	"character(0)"	2018-10-15	"Washington%2C+DC"	60
