"url"	"title"	"company_name"	"company_score"	"description"	"time_posted"	"metadata"	"date_scraped"	"city"	"page"
"https://www.indeed.com/viewjob?jk=2ddc548ea3f366de"	"Google AI Resident, 2019 Start (Fixed-Term Employee)"	"Google"	"2,617 reviews"	"Application Timeline:
We are accepting applications until January 28, 2019.
Our team will review applications on a rolling basis and interviews will begin in November 2018. It is in your best interest to submit your application early.
The Google AI Residency Program will have 3 start dates over the course of 5 months, from June to October 2019. Exact dates are yet to be determined.
Note: By applying to this position your application is automatically submitted to the following locations: Mountain View, CA, USA; New York, NY, USA; Cambridge, MA, USA; Seattle, WA, USA
About the Program:
The Google AI Residency Program (formerly known as the Google Brain Residency Program) is a 12-month role designed to advance your career in machine learning research. The goal of the residency is to help residents become productive and successful AI researchers.
As part of this program, Residents collaborate with distinguished scientists from various Google AI teams working on machine learning applications and problems. Residents have the opportunity to do everything from conducting fundamental research to contributing to products and services used by billions of people. We also encourage our Residents to publish their work externally. Take a look at the impactful research done by earlier cohorts.
The AI Residency Program will continue to be based out of the Bay Area (Mountain View and San Francisco), as well as New York City, Cambridge (Massachusetts), Montreal and Toronto, Canada. In 2019, we will see the program expand to Seattle (Washington State), Accra (Ghana), Tel Aviv (Israel) and Zurich (Switzerland). Residents are placed based on interest, project fit, location preference and team needs. All are expected to work on site.
We encourage candidates from all over the world to apply. You may have research experience in another field (e.g. human-computer interaction, mathematics, physics, bioinformatics, etc.) and want to apply machine learning to this area, or have limited research experience but a strong desire to learn more. Current students will need to graduate from their degree program (BS/MS/PhD) before the residency begins. If a candidate requires work authorization for a location, Google will explore the available options on a case-by-case basis.
Your application should show evidence of proficiency in programming and in prerequisite courses (e.g., machine learning, user-centered interfaces or applications, data science, mathematical analysis). This can be demonstrated through links to open-source projects, notable performances in competitions, publications and blog posts, or projects that showcase implementation of one or more novel learning algorithms.
To start the application process, click on the “Apply” button on this page and provide the required materials in the appropriate sections (PDFs preferred):
1. In the “Resume Section:” attach an updated CV or resume.2. In the “Cover letter/other notes Section:” Copy and paste a cover letter which must include answers to the following questions:
What are your primary research interests and why do you think they are important?
How would participating in the AI Residency help you to explore your research interests and achieve your goals?
Give an example of an open-ended research question or project you’ve worked on. What made it challenging and how did you overcome those challenges? Alternatively, summarize and critique a machine learning paper you have read that you found interesting.**Although cover letters are optional for most job applications at Google (as noted on the website), it is a mandatory component for this application. Complete applications (cover letters included) will be prioritized for review over incomplete applications.
3. In the “Education Section:” attach a current or recent unofficial or official transcript in English if you have graduated in the last three years.
Under “Degree Status,” select “Now attending” to upload a transcript.Questions? See our FAQs at g.co/airesidency/faqs
There is always more information out there, and the Research and Machine Intelligence team has a never-ending quest to find it and make it accessible. We're constantly refining our signature search engine to provide better results, and developing offerings like Google Instant, Google Voice Search and Google Image Search to make it faster and more engaging. We're providing users around the world with great search results every day, but at Google, great just isn't good enough. We're just getting started.
Responsibilities
Work with research mentors to formulate research project(s) and/or novel application(s) of machine learning.
Conduct research and publish it in competitive venues.
Implement algorithms, experiments and/or human-computer interfaces using frameworks such as TensorFlow.
Learn and understand a large body of research in machine learning algorithms.
Qualifications
Minimum qualifications:BS degree or equivalent practical experience in a STEM field such as Computer Science, Mathematics, or Statistics.
Completed coursework in statistics, algorithms, calculus, linear algebra, or probability (or their equivalent).
Experience with one or more general purpose programming languages, including but not limited to: Python or C/C++
Experience with machine learning; or applications of machine learning to NLP, human-computer interaction, computer vision, speech, computer systems, robotics, algorithms, optimization, on-device learning, social networks, economics, information retrieval, journalism, or health care.

Preferred qualifications:Research experience in machine learning or deep learning (e.g. links to open-source work or link to novel learning algorithms).
Open-source project experience that demonstrates programming, mathematical, and machine learning abilities and interests.
At Google, we don’t just accept difference - we celebrate it, we support it, and we thrive on it for the benefit of our employees, our products and our community. Google is proud to be an equal opportunity workplace and is an affirmative action employer. We are committed to equal employment opportunity regardless of race, color, ancestry, religion, sex, national origin, sexual orientation, age, citizenship, marital status, disability, gender identity or Veteran status. We also consider qualified applicants regardless of criminal histories, consistent with legal requirements. If you have a disability or special need that requires accommodation, please let us know.
To all recruitment agencies: Google does not accept agency resumes. Please do not forward resumes to our jobs alias, Google employees or any other company location. Google is not responsible for any fees related to unsolicited resumes."	"5 days ago"	"character(0)"	2018-10-15	"New+York%2C+NY"	60
"https://www.indeed.com/viewjob?jk=8045ff529f06bf82"	"c(\"Data Scientist\", \"Requirements:\")"	"Thomas Publishing Company LLC"	"6 reviews"	"Thomas is looking for a Data Scientist to help build a world-class data team that will support and guide Thomas’ business strategy and operations. The right candidate will be a problem solver who is obsessive about all things data, and is enthusiastic about working with cutting-edge techniques, technologies and applications.

The Thomas Data Analytics team uses data-driven insights to fuel strategic growth for clients. You will apply your knowledge and skills in driving insights across our product platforms to come up with data powered solutions for our clients. We believe that our data should be put to work to bring the best ideas and stories to our clients!

You’ll solve complex marketing and business challenges – from cross-channel media and customer experience optimization, targeting and business strategy – by accessing, integrating, manipulating, mining, modeling a wide array of data sources.

This is an opportunity to work with a newly assembled team of data analysts, engineers and architects to establish best practices and processes as we transition to a data-focused organization, and will involve working with petabyte-scale data across a diverse set of data platforms. A key goal in the near future is creation of a data lake across our industry platforms to facilitate deeper analysis and bring sophisticated data tools and methods to bear in order to more effectively anticipate industry trends and events.
Requirements:
Technical
Bachelor’s or Master’s Degree preferably in Computer Science, Information Systems, Statistical Analysis or Economics
Familiarity with statistical analysis/modeling, data science and/or data design and development of actionable advanced analytical solutions that provide insights to decision makers
Hands-on experience mining data for decision focused insights
Ability to design complex systems and translate user requirements into business solutions
Background in predictive modeling and machine learning
2 years of experience with open source machine learning or statistical analysis tools
Experienced in at least one programming language (Java, Python, Scala, R)
Guru level experience with query tools and languages including SQL
Experience with NoSQL databases and related tools
Experience with Amazon AWS big data and machine learning technologies a plus (RedShift, Sagemaker, Comprehend etc.)
Non-technical
Strong communication skills – oral and written
Ability to guide and lead a data analytics team of 5 – collaborate with both technical and non-technical colleagues in product management and executive leadership groups
Ability to gauge the complexity of machine learning problems and a willingness to execute simple approaches for quick effective solutions as appropriate
Sharing knowledge, debating techniques, and conducting research to advance collective knowledge and skills of our practices
Demonstrated self-starter who thrives in a fast paced environment"	NA	"character(0)"	2018-10-15	"New+York%2C+NY"	60
"https://www.indeed.com/viewjob?jk=221ea7b5608dcacc"	"Data Scientist with Python"	"Kaiser Tech Inc"	"-"	"$50 - $65 an hourContractDuties include:·Develop decision support tools to help solve business problems·Interfacing with internal customers to understand the business and identify opportunities for improvement·Identifying solution techniques and implementing them independently, with external vendors, through academic alliances, or with BNSF Technology Services teams·Interfacing with BNSF Technology Services personnel to understand existing data structures and IT processes·Working with end-users to validate and enhance the tools·Identifying and initiating new projects part of technology initiatives·Communicating status and findings to senior management and key stakeholders·Extracting and cleaning large volumes of data to derive insights that can be used for process improvements.The duties and responsibilities in this posting are representative categories to be used in deciding whether to apply for the position. These general categories do not necessarily constitute an exhaustive list of duties of the position.QUALIFICATIONS:·Ph.D. or Master’s degree in Operations Research, Industrial Engineering, Applied Mathematics, Computer Science or a related field·Ph.D is preferred but Master’s degree with experience will be considered·Strong programing skills in R, Python, Hadoop·Practical experience applying quantitative techniques to solve real-world problems·Excellent written, verbal, and interpersonal communication skills·Ability to identify underlying problems and appropriate techniques for solving them·Ability to manipulate and extract information from very large, complex data setsCandidates must be able to work C2C or 1099Job Type: ContractSalary: $50.00 to $65.00 /hourExperience:Data Science: 7 years (Preferred)Education:Doctorate (Preferred)"	"30 days ago"	"c(\"$50 - $65 an hour\", \"Contract\")"	2018-10-15	"New+York%2C+NY"	60
"https://www.indeed.com/viewjob?jk=7d4403b3248ed396"	"AI Research Scientist"	"Bloomberg"	"665 reviews"	"News and social media move financial markets. Bloomberg is one of the largest producers of news in the world and ingests over 70,000 external news feeds and social media like Twitter each day. This data keeps our clients informed, and our team's insights help make sense of it for our customers.
Who are we? Bloomberg's Artificial Intelligence (AI) group: researchers and engineers who have a passion for solving complex problems. Our charter: to extract relevant, meaningful, tradable, and actionable information (pricings, earnings, recommendations and major events) from data (news, web, social media, and structured data) in real-time. Since our customers rely on this information to make swift financial decisions, we guarantee precision, accuracy and latency beyond most academic and industry standards.

We aren't just building products. The infrastructure and algorithms we develop are used across the company by data scientists. We publish papers, attend conferences and contribute back to the larger data science community whenever we can (bloomberg.com/company/d4gx/).

Who are you? A research scientist who wants to work in the areas of machine learning, natural language processing, information extraction, reinforcement learning, graphical models, recommender systems and knowledge graphs. You want to join a close-knit group and make a big impact.
We'll trust you to:Work with researchers in our Engineering AI group on live systems
Publish research findings in leading academic venues and represent Bloomberg at industry conferences
Write, test and maintain production-quality code
Design, experiment and evaluate models
You'll need to have:A PhD in AI, NLP, ML, Optimization, or equivalent experience in related fields
5+ years of experience programming in C++, Python or Java
3+ publications in top-tier conferences or journals (such as ACL, AAAI, SIGIR, KDD, EMNLP, ICML, NIPS or equivalent)
We'd love to see:A quantitative background (Probability, Statistics, Linear Algebra, etc.)
Experience with distributed computational frameworks (YARN, Spark, Hadoop)

If this sounds like you, apply! We are hiring for our NYC and London offices.

Check out our blog, TechAtBloomberg.com, to learn more about our publications and projects in data science. We just got back from NAACL! Read about a paper our team presented here: https://www.techatbloomberg.com/blog/bloombergs-advances-natural-language-processing-allow-improved-tagging-tweets-news/

Apply Now

AI Research ScientistNew York, NY

Posted Oct 5, 2017 - Requisition No. 62503

Apply Now

News and social media move financial markets. Bloomberg is one of the largest producers of news in the world and ingests over 70,000 external news feeds and social media like Twitter each day. This data keeps our clients informed, and our team's insights help make sense of it for our customers.
Who are we? Bloomberg's Artificial Intelligence (AI) group: researchers and engineers who have a passion for solving complex problems. Our charter: to extract relevant, meaningful, tradable, and actionable information (pricings, earnings, recommendations and major events) from data (news, web, social media, and structured data) in real-time. Since our customers rely on this information to make swift financial decisions, we guarantee precision, accuracy and latency beyond most academic and industry standards.

We aren't just building products. The infrastructure and algorithms we develop are used across the company by data scientists. We publish papers, attend conferences and contribute back to the larger data science community whenever we can (bloomberg.com/company/d4gx/).

Who are you? A research scientist who wants to work in the areas of machine learning, natural language processing, information extraction, reinforcement learning, graphical models, recommender systems and knowledge graphs. You want to join a close-knit group and make a big impact.
We'll trust you to:Work with researchers in our Engineering AI group on live systems
Publish research findings in leading academic venues and represent Bloomberg at industry conferences
Write, test and maintain production-quality code
Design, experiment and evaluate models
You'll need to have:A PhD in AI, NLP, ML, Optimization, or equivalent experience in related fields
5+ years of experience programming in C++, Python or Java
3+ publications in top-tier conferences or journals (such as ACL, AAAI, SIGIR, KDD, EMNLP, ICML, NIPS or equivalent)
We'd love to see:A quantitative background (Probability, Statistics, Linear Algebra, etc.)
Experience with distributed computational frameworks (YARN, Spark, Hadoop)

If this sounds like you, apply! We are hiring for our NYC and London offices.

Check out our blog, TechAtBloomberg.com, to learn more about our publications and projects in data science. We just got back from NAACL! Read about a paper our team presented here: https://www.techatbloomberg.com/blog/bloombergs-advances-natural-language-processing-allow-improved-tagging-tweets-news/"	NA	"character(0)"	2018-10-15	"New+York%2C+NY"	60
"https://www.indeed.com/viewjob?jk=0f28dc0aafb427e0"	"Data Scientist"	"National Debt Relief"	"99 reviews"	"We are seeking an innovative and passionate Data Scientist to join our growing team to help promote our analytical culture, while leveraging data to maximize marketing performance and deliver a best-in-class experience for the clients we serve.
The ideal candidate will apply analytical rigor and data driven reasoning to guide the development and execution of marketing strategies and experiential initiatives across the organization. This individual will bring a sense of curiosity to seek out opportunities for improvement through internally and externally sourced data. This person will play a critical role in providing thought leadership, building statistical models to understand consumer behavior and intent, and identifying optimization opportunities across programs.
This is an opportunity to grow with a diverse team and have a measurable impact on a rapidly growing organization. It is a great fit for an entrepreneurial professional with a strong background in statistical modeling and a passion for translating data into actionable insight. Principle Duties and Responsibilities:Develop and implement advanced statistical models to guide business strategy and deliver incremental growth and value throughout the company.
Perform analysis of structured and unstructured data to solve complex business problems.
Use statistical techniques to build marketing segments, evaluate scenarios, predict future outcomes, and optimize performance.
Lead complex research and analytics projects across teams.
Research, test, and validate new modeling techniques as appropriate for specific solutions.
Present and depict recommendations so that stakeholders can make data-informed decisions.
Qualifications:
5+ years of experience as a data scientist conducting data mining and building and implementing complex models in a fast-paced, marketing-driven environment.
Experience working with large internal and external data sets covering new and existing client programs to include direct mail, TV, radio, search engine marketing and email preferred.
Undergraduate degree in a quantitative discipline (i.e. Statistics, Mathematics, Computer Science or equivalent quantitative discipline), advanced degree is preferred.
Expert knowledge of SAS, R/Python and SQL or similar industry standard tools use for large-scale data analysis and modeling.
Experience linking multiple data platforms with data visualization tools is a plus.
In-depth knowledge and experience in data mining and statistical modeling techniques (regression, decision tree, time series, etc. Knowledge of optimization theory and statistical model application are also preferred.
Strong analytical and problem-solving skills with the ability to interpret large amounts of data with business insight to support growth.
Strong consultative acumen with responsibility for analytical project design, management, and presentation of results to internal and external stakeholders.
Ability to clearly present statistical solutions to non-statistical people, articulating value and insights to the business.
Strong project management skills with a proven ability to set clear goals and design detailed plan against tight timelines. Evidence of self-motivated initiatives, high productivity, and good team work is desired.
What We Offer:
We believe in a team-first culture, full of rewards and recognition for our employees. We are dedicated to our employees’ success and growth within the company, through our employee mentorship and leadership programs.
Our extensive benefits package includes:
Medical, Dental, and Vision Benefits
401(k) Match
Paid Holidays, Sick Days, and Vacation
6 Weeks Paid Parental Leave
Pre-tax Transit Benefits
Discounted Gym Membership
No-cost Life Insurance Benefits"	"24 days ago"	"character(0)"	2018-10-15	"New+York%2C+NY"	60
"https://www.indeed.com/viewjob?jk=aea9fe0330576ef8"	"Data Scientist"	"Fora Financial LLC"	"20 reviews"	"Fora Financial, located in NYC, is a leading financial services company providing working capital to small and mid-size businesses nationwide.
Established in 2008, we support small businesses in need of financing to sustain or grow their enterprise by providing innovative, customized, and flexible working capital solutions. We operate through a consultative approach, listening to customers and providing what best meets their needs in an ever-changing financial market. To date, Fora Financial has funded over 22,000 individual transactions to more than 15,000 unique customers. The company has funded over $750 million in working capital solutions for small businesses since its inception.
A Day in the Life of a Data Scientist:
Build predictive models including but not limited to credit risk. fraud, response, and offer acceptance propensity
Perform through testing and validation of models and support various aspects of the business with data analytics
Identify new data sources/patterns that add significant lift to predictive modeling capabilities
Conduct analysis and turn insights into actionable changes for predictive models or policies
Develop analytics and advanced visualization to assist with portfolio surveillance. Typical functions are loss forecasting, mix management, risk appetite management, collections strategy, and reporting related to KPIs that affect portfolio surveillance such as non-performance, loss rates and loss severity
Partner with IT to integrate and productionize new data sources for modeling use
What You Have:
B.S. degree or higher in Statistics, Applied Math, Computer Science, Engineering or other quantitative program
3 years minimum experience with credit risk modeling; 5 years minimum preferred
Proven track record of building new models and improving existing models
Deep understanding of consumer credit report variables/attributes at both summary and tradeline level
Experience with small business lending and portfolio management is a plus
Passionate about solving problems with data and high level of intellectual curiosity
Thorough understanding of statistical modeling techniques
Proficiency in at least one of the following languages: R, SAS, SQL, Python
Highly motivated to work on multiple projects in parallel and team player with a start up spirit
Solid written and oral communication skills and ability to share findings with non-technical audienceThe Benefits of Working for Fora Financial:
A good work/life balance
Medical, Dental, Vision Coverage
401K Match
Life Insurance at No Cost to Employees
Generous Time Off Plan Including Rollover Vacation Days
Commuter Benefits
Health Care and Dependent Care Flexible Spending"	"27 days ago"	"character(0)"	2018-10-15	"New+York%2C+NY"	60
