"url"	"title"	"company_name"	"company_score"	"description"	"time_posted"	"metadata"	"date_scraped"	"city"	"page"
"https://www.indeed.com/viewjob?jk=777e8861ec85b673"	"Receptionist, Directory Assistance"	"Autodesk"	"326 reviews"	"Receptionist, Directory Assistance 18WD30365 Americas-United States of America-California-San FranciscoReceptionist, Directory Assistance Location: San Francisco, CA- United States Job ID: 18WD30365 Position Overview Acts as primary point of contact for visitors with the company. Receives and directs people, calls, issues, and deliveries to the appropriate department or employee. Supports personnel that provide basic clerical support in a variety of administrative settings. Performs all work with the primary goal of customer satisfaction. Maintains a diligent sense of safety and security for company sites. Responsibilities Customer and Employee Support Act as point of contact in case of an emergency or disaster, coordinating with Facilities staff Answer and assist customers inquiring about Company technical support policy (May be) required to create and regularly update web pages (May) perform related clerical work such as word processing, filing, emailing mass communications, scheduling, or purchasing duties using electronic purchasing software system or procurement cards Use company intranet to look up employees’ contact information. Use company phone systems to receive calls and to contact employees. (May) use 2-way paging/phone system to contact Facilities or Security personnel. Maintain Reception phone lists Answer incoming calls, either directly to reception or redirected from phone system. Answer inquiries directly or direct calls to appropriate employee. (May also) answer or direct calls from employees. Communicate with employees on site-specific issues (i.e. found keys, car lights on, etc.) Maintain current knowledge base of Company products and information by reading Company News and Sales emails, announcements, and product brochures At lead level, (may) handle scheduling or work assignments, and delegation of tasks. (May) receive after hour calls from other DA/Receptionists relating to schedule issues. Responsible for resolving scheduling issues Receptionist Provide continuous coverage for the front desk. Greet visitors and notify personnel of visitor arrival. Monitor employee and visitor flow in and out of buildings. Maintain security requirements by ensuring visitors sign visitor log and by distributing guest badges Ensure that unauthorized individuals are not granted access to buildings. Ensure that employees are using proper access badges. Alert Security or Facilities staff of any disturbances or potentially dangerous intruders. May be trained on alarm systems and provide first level response Maintain professional appearance of building lobby or reception area. Maintain and distribute lobby materials such as newspapers or magazines Pass out and collect employment applications and other related forms on request. Receive completed employment applications and resumes and route to HR for processing Receive and route all deliveries at the front desk. Interact with vendors, couriers and delivery personnel. Contact appropriate employees to accept deliveries Report building issues to Facilities Department. In locations with no dedicated Facilities resource, (may) contact Building Management and schedule appointments with vendors. (May) manage card key and/or photo ID system for building. (May also) handle event set-up and/or clean up In some locations, (may be) responsible for mail sorting and distribution, shipping, and/or courier services. (May) assist with conference room bookings, loaner equipment (remote controls, adaptors, headphones, etc) distribution Directory Assistance Responsible for managing all incoming inquiries to the Company main phone number in a personal and professional manner Determine the nature of the individual caller inquiries, and direct calls appropriately (May) perform database data entry and maintenance tasks. Maintain accurate and timely problem tracking and resolution records. Provide information to callers using Directory Assistance department’s various resources; direct calls and faxes to the appropriate contact/department Answer inquiries on various product learning resource centers Responsible for updating reference lists utilized to perform job effectively Minimum Qualifications Provides administrative or technical support at an intermediate level. Incumbents at this level are gaining or have attained full proficiency in their specific area of discipline Able to Interact comfortably with employees across team and with customers Be able to work under moderate supervision. May seek the advice of senior personnel in the functional area HS Diploma or equivalent 1 – 2 + years’ experience About Autodesk With Autodesk software, you have the power to Make Anything. The future of making is here, bringing with it radical changes in the way things are designed, made, and used. It's disrupting every industry: architecture, engineering, and construction; manufacturing; and media and entertainment. With the right knowledge and tools, this disruption is your opportunity. Our software is used by everyone - from design professionals, engineers and architects to digital scientists, students and hobbyists. We constantly explore new ways to integrate all dimensions of diversity across our employees, customers, partners, and communities. Our ultimate goal is to expand opportunities for anyone to imagine, design, and make a better world. At Autodesk, we're building a diverse workplace and an inclusive culture to give more people the chance to imagine, design, and make a better world."	"2 days ago"	"character(0)"	2018-10-15	"San+Francisco%2C+CA"	100
"https://www.indeed.com/viewjob?jk=d8446ef18e6282b8"	"Data Scientist"	"Ace Technologies"	"16 reviews"	"ContractJob Classification: developer: applications Location: San Francisco(California) Skills: Data Scientist, Python, SAS, SQL, AWS, Hadoop Description: Data Scientist San Francisco, CA 6-9 month contract Interview: phone then skype (will hire off of Skype)This person MUST HAVE strong skills in Python, SAS and SQL, and AWS experience would be a PLUS. They also need to be a self-starter. TOP SKILLS:MUST HAVE Python experience on Hadoop and Pyspark.Good to have SAS or R experience (secondary)Other tools & DB: SAS, SQL (Netezza, SQL Server, Teradata), R, Excel RESPONSIBILITIES:The Senior Data Analytics Engineer/Python Developer will work with the Regulatory Affairs department to deliver analytical models to support rate case filings.The resource must have programming experience with statistical analysis and modeling projects.The resource must be comfortable interacting and communicating with both Business and IT project team members and needs to be a self-starter.The Data Analytics Engineer/Python Developer must have expertise in mathematics and applied statistics with programming skills to create predictive models and tools on large scale data sets (in tens of TB) and operationalize the models on Big data clusters on AWS QUALIFICATIONS: Data analysis: excellent analytical and problem-solving skills. Have proactive and strategic thinking and ability to align research with the business and innovate research output. Modeling concepts: Machine Learning, Time series analysis, Clustering, Generalized Linear and Additive Models, Nonlinear Regression, Classification, Neural Networks, Decision trees, Text mining, OCR Computer Programming: excellent programming skill for complex algorithms. Must have good SQL skills. Other programming languages: SAS, R, Python (top skill), C Analytical Tools: Python (#1), SAS (#2) SQL (Netezza, SQL Server, Teradata), R, Excel, Spark, Hadoop Utility or regulated industry experience (preferred)"	"14 days ago"	"Contract"	2018-10-15	"San+Francisco%2C+CA"	100
"https://www.indeed.com/viewjob?jk=30db1c21b2866bba"	"Data Scientist"	"1-800 Radiator & A/C"	"4 reviews"	"Employer Description: 1-800 Radiator & A/C is seeking a professional and motivated individual with analytical and business intelligence capabilities to join our Analytics team as a Data Scientist. This is a full-time position with comprehensive benefits based at our Corporate Headquarters in Benicia, CA.Job Description: This is a key position within a rapidly growing enterprise. High performers in this role have an opportunity to quickly assume additional responsibilities, develop their knowledge and understanding of our business model, and have preferred access to promotional opportunities! The position is based at our corporate headquarters in Benicia, CA, less than one hour from 3 major airports and the Napa/Sonoma region of Northern California.Responsibilities: Work with stakeholders throughout the organization (Operations/Supply Chain, Sales/Marketing, Finance, etc.) to identify opportunities for leveraging company data to drive business solutionsDevelop scalable statistical, machine learning or mathematical solutions for complex business problems such as Pricing, Inventory Reordering, and Demand ForecastingPerform analytical studies and generate actionable recommendations. Use statistical techniques and hypothesis testing to validate your findingsIdeal Candidate: 2-5 years of experience in leveraging data for business impactA deep understanding of statistical analysis (e.g. hypothesis testing, experimentation, regressions) and machine learning algorithms (supervised and unsupervised models)Demonstrated programming experience with at least one analytic tool (R, Python, Scala, etc.).Ability to write and optimize complex SQL queries.Experience in building and deploying cloud-based data pipelines and applications (GCP, AWS) is a plusAbility to communicate clearly and effectively to cross-functional partners of varying technical levelsAbility to work independently and proactively as well as collaborating in a teamA good sense of humor is always a big plus!Job Type: Full-timeExperience:Scala: 1 year (Preferred)AWS: 1 year (Preferred)Python: 1 year (Preferred)SQL: 1 year (Preferred)R: 1 year (Preferred)Location:Benicia, CA (Required)"	"12 days ago"	"character(0)"	2018-10-15	"San+Francisco%2C+CA"	100
"https://www.indeed.com/viewjob?jk=75659356a039c994"	"Senior Data Scientist, Recommendation Technology"	"OpenTable"	"34 reviews"	"$128,000 - $163,000 a year (Indeed Est.) Senior Data Scientist, Recommendation Technology (OpenTable, Inc., San Francisco, CA) Develop personalized Recommendation Technology to power user discovery and exploration of restaurants (including idea-generation, problem formulation, design, implementation, iteration, testing, deployment and continued improvement). Proactively perform data exploration to understand diner behavior and restaurant characteristics and identify opportunities for improving Recommendation Technology. Extract insights from data points to improve the user experience. Build sophisticated supervised and unsupervised Machine Learning and statistical models for data analysis, classification and regression. Integrate data ingestion, extraction, and transformation into formats for modeling and analysis. Optimize the performance of Recommendation Technology prototypes for deployment in real-time systems. A/B test recommender systems to demonstrate direct, measurable impact to user engagement, conversion, reservation frequency, and new user growth. Design, analyze and interpret experiment results. Use excellent oral and written communication skills to interact with colleagues across all levels of the organization, motivating and reporting on all aspects of Recommendation Technology with appropriate level of abstraction, and to partner with management in assisting with decision making and information interpretation. MINIMUM REQUIREMENTS: Master’s degrees or U.S. equivalent in Artificial Intelligence, Machine Learning, Computer Science, Applied Statistics, Applied Mathematics, Electrical Engineering, or a related field plus 3 years of professional experience in designing, developing, testing, deploying, maintaining and improving large-scale Machine Learning systems. Must also have the following: 1 year of professional experience in building and evaluating Machine Learning and statistical models (including Boosting or Ensemble methods, and Regression, Linear Models, Support Vector Machines, Matrix Factorization, Factorization Machines, Hidden Markov Models, Graphical Models, Mixture Models, Markov Decision Processes, Clustering Techniques, Time Series, Deep Learning/Neural Networks, and Bayesian Optimization); 1 year of professional experience in designing, prototyping, implementing, testing, deploying, and maintaining high-volume, production-level recommendation systems; 1 year of professional experience in implementing and deploying data ingestion, data transformation, data mining, and data cleansing systems; 1 year of professional experience in designing A/B test frameworks and A/B test experiments; 1 year of professional experience in implementing data introspection and monitoring/alerting tools in the context of Recommendation Technology; 1 year of professional experience in building robust, real-time software systems in distributed environments; 1 year of professional experience in developing software using Java, Scala, Python, C++, SQL, and Unix scripting; 1 year of professional experience in presenting complex scientific topics. CONTACT: Please submit resume online at:https://www.opentable.com/careers/technology/?p=job%2FooO87fwb. Please specify ad code XAKP. EOE. MFDV."	NA	"$128,000 - $163,000 a year (Indeed Est.) "	2018-10-15	"San+Francisco%2C+CA"	100
"https://www.indeed.com/viewjob?jk=d0d18093d324cca4"	"c(\"Data Scientist - Insurance\", \"Job requirements\", \"More details\")"	"Blue Owl"	"2 reviews"	"$137,000 - $174,000 a year (Indeed Est.) A million people a year die in car collisions around the world and we want that number to be zero. We invite you to help us build an InsurTech company that uses rich customer insights, advanced technology and data science to save lives by preventing car collisions before they happen. To this end, we recently helped launch our first product, hiroad.com, a cloud native insurance solution that rewards people for the act of driving well. With impressive funding, a compelling vision, and a world-class team, we're poised to re-engineer a trillion-dollar category from the ground up- and that's just where we're beginning. Longer term, we're out to change behavior and promote mindful living at a societal level. We're seeking someone to build and support critical backend systems and services that are core to our business. This includes the rewards system that will be used to increase driver safety, designing APIs, creating/managing databases, and writing automated test suites. General tools you build will be open sourced and will ideally be consumed by the greater community. Job requirements This role will require the candidate to be extremely hands on with building models and data driven tools. Past experience implementing complex data-driven solutions is required. Advanced Python skills. Should be familiar with Python’s scientific computing ecosystem. Advanced SAS skills. Should be familiar with SAS best practices. Deep experience with GLMs as well as modern machine learning methods. Actuarial science is a plus, but is not required. More details Salary: We invest in first-rate people and pay top-of-market salaries for most positions, factoring in experience and talent. We are unable to offer equity. Benefits: Full medical, dental, vision coverage, 401k, daily catered lunch, wellness reimbursement & on-site shower, four weeks of vacation, six weeks of parental leave, panoramic views, and more. Location: Near Montgomery Street BART station, San Francisco, California. Locals preferred, but relocation within the US considered for outstanding candidates. All are welcome at Blue Owl. We are an equal opportunity and affirmative action employer who values diversity and inclusion and looks for applicants who understand, embrace and thrive in a multicultural world. We do not discriminate on the basis of race, color, ancestry, religion, sex, national origin, sexual orientation, age, citizenship, marital status, disability, gender identity or Veteran status. Pursuant to the San Francisco Fair Chance Ordinance, we will consider for employment qualified applicants with arrest and conviction records."	NA	"$137,000 - $174,000 a year (Indeed Est.) "	2018-10-15	"San+Francisco%2C+CA"	100
"https://www.indeed.com/viewjob?jk=c9bdb952f06e70a5"	"Data Scientist, Product analytics"	"eBay Inc."	"1,505 reviews"	"Position: Data Scientist, Product Analytics Organization: StubHub, www.stubhub.com (an eBay company NASDAQ: EBAY) The Opportunity We are looking for an experienced Data scientist with exceptional product sense to help champion the use of data in product decision-making. In this role you will work closely with our Engineering, Product, Ops, and Design teams to evaluate product opportunities, track product metrics, develop and analyze experiments, and drive deep-dive studies to identify new opportunities. You will: Apply data & analytical skills to help understand how our customers use our products Partner closely with product leadership to define, measure and report on core product and feature metrics Design customer-facing experiments (A/B tests) and distill their results into actionable outcomes Execute cohort studies and drive analyses to understand customer behavior and identify opportunities for improving our product(s) Collaborate with data and business intelligence teams to develop reports and visualization dashboards Build financial models to project key business metrics - Traffic, conversion, Engagement - and develop KPIs to measure initiative performanceYou have: Strong quantitative background with Product analytics experience. Proven track record in solving business problems through fact based and scientific analytics Excellent technical skills - including the ability to query databases (SQL, Hive etc.), leveraging R/Python to analyze complex data, and using Tableau (or other visualization tools) to deliver insights at scale Deep understanding of statistics, experimental design, and causal inference The ability to translate analytical insights into clear recommendations and effectively deliver it to technical and non-technical stakeholders Worked in cross-functional and cross-cultural teams, and are able to communicate technically intricate concepts/results in business terms Passion for technology and consumer productsWhy StubHub? StubHub is the world's largest ticket marketplace, enabling fans to buy and sell tickets to tens of thousands of sports, concert, theater and other live entertainment events. StubHub reinvented the ticket resale market in 2000 and continues to lead it through innovation. The company's unique online marketplace, dedicated solely to tickets, provides all fans the choice to buy or sell their tickets in a safe, convenient and highly reliable environment. All transactions are processed and delivered by StubHub and backed by the company's FanProtect Guarantee™ processing a ticket every second today with billions of ticket sales each year globally. Company partners MLB, AEG, ESPN and many leading teams such as the San Francisco Giants and University of Texas, along with over 60 other teams in MLB, NBA, NHL and NCAA. Our Values StubHub One – We act as one team in pursuit of connecting people through inspiring event experiences. At StubHub, we are: Driven – We strive for excellence – constantly improving our game Courageous – We are bold & not afraid to challenge the status quo Inventive – We see what others don’t & pioneer new paths Richly Diverse – We recognize & respect everyone as a unique individual Brand – We experience the world through StubHub.This website uses cookies to enhance your experience. By continuing to browse the site, you agree to our use of cookies View our privacy policy View our accessibility info eBay Inc. is an equal opportunity employer. All qualified applicants will receive consideration for employment without regard to race, color, religion, national origin, sex, sexual orientation, gender identity, veteran status, and disability, or other legally protected status. If you are unable to submit an application because of incompatible assistive technology or a disability, please contact us at talent@ebay.com. We will make every effort to respond to your request for disability assistance as soon as possible. For more information see: EEO is the Law Poster EEO is the Law Poster Supplement"	"2 days ago"	"character(0)"	2018-10-15	"San+Francisco%2C+CA"	100
"https://www.indeed.com/viewjob?jk=45754869d697e448"	"Data Scientist"	"FlowCommand Inc."	"-"	"$80,000 - $140,000 a yearFlowCommand is hiring a lead data scientist for our San Francisco office. We are a sensor company that aims to accurately capture the behavior of high throughput fluid systems. With this information we can help optimize allocations while reducing spills and theft. This technology could change the way the oil and gas industry, water municipalities, and anyone dealing with high volume fluid, operate. Our sensors send ultrasonic data directly to our server via cellular/satellite; we then use a mix of physics equations, signal processing, and anomaly detection to determine the behavior of fluid (volume and speed) in pipes.As the first data engineer at FlowCommand, you will work closely with our small team split across Houston, San Francisco and Mexico City. You’ll leverage our remotely controllable flow-loop test facility in Houston to generate training data from our sensors. As the owner of this process, you will be building the foundational models and algorithms that our future suite of products will run on.Responsibilities: Increase accuracy of our measurementsIncrease the accuracy of our confidence in our measurementsCollaborate with engineers to build models that enable a fundamentally new sensor technologyUnderstand, source and leverage tangential/contextual datasetsIncrease the use-cases of our products by identifying correlations with tangential/contextual datasetsRequirementsExperience building production grade Machine Learning modelsExperience building models with limited training dataStrong written and verbal communication skills.Expert knowledge and demonstrable experience with Python and SQL.Team oriented and able to take an idea from conception to launch.Preferencesdegree in Statistics or Computer Science with a Machine Learning focus.Note:If you have a very strong theoretical knowledge of building these models from a PhD or something similar but no experience, you should still apply for considerationFlowCommand is proud to be an equal opportunity employer. All qualified applicants will receive consideration for employment without regard to race, color, religion, gender, gender identity or expression, sexual orientation, national origin, genetics, disability, age, or veteran status.Job Type: Full-timeSalary: $80,000.00 to $140,000.00 /yearExperience:Data Science: 1 year (Required)Education:Bachelor's (Preferred)Location:San Francisco Bay Area, CA (Required)Work authorization:United States (Required)"	"4 days ago"	"$80,000 - $140,000 a year"	2018-10-15	"San+Francisco%2C+CA"	100
"https://www.indeed.com/viewjob?jk=51013d1cd86d68ad"	"Senior Data Scientist"	"Indeed"	"354 reviews"	"Our mission: As the world’s number 1 job site, our mission is to help people get jobs. We need talented, passionate people working together to make this happen. We are looking to grow our teams with people who share our energy and enthusiasm for creating the best experience for job seekers. The team: We are a rapidly growing and highly capable engineering team building the most popular job site on the planet. Every month, over 200 million people count on us to help them find jobs, publish their resumes, process their job applications, and connect them to qualified candidates for their job openings. With engineering hubs in Seattle, San Francisco, Austin, Tokyo and Hyderabad, we are improving people's lives all around the world, one job at a time. Your job: As a Data Scientist at Indeed your role is to follow the data. Analyze, visualize, and model job search related data. You will build and implement machine learning models to make timely decisions. You will have access to unparalleled resources within Indeed to grow and develop both personally and professionally. We are looking for a mixture between a statistician, scientist, machine learning expert and engineer: someone who has passion for building and improving Internet-scale products informed by data. The ideal candidate understands human behavior and knows what to look for in the data. About you: Requirements * Ph.D. or M.S. in a quantitative field such as Computer Science, Operations Research, Statistics, Econometrics or Mathematics * Expertise in machine learning and statistical modeling * 5+ years professional or research experience in data science * Passion to answer Product/Engineering questions with data * Demonstrated mentorship experience We get excited about candidates who * Have full stack experience in data collection, aggregation, analysis, visualization, productionization, and monitoring of data science products * Can do small data modeling work: R, Python, Julia, Octave * Can do big data modeling work: Hadoop, Pig, Scala, Spark * Can fish for data: SQL, Pandas, MongoDB * Can deploy data science solutions: Java, Python, C++ Indeed provides a variety of benefits that help us focus on our mission of helping people get jobs. View our bounty of perks: [1] http://indeedhi.re/IndeedBenefits"	"8 days ago"	"character(0)"	2018-10-15	"San+Francisco%2C+CA"	100
