"url"	"title"	"company_name"	"company_score"	"description"	"time_posted"	"metadata"	"date_scraped"	"city"	"page"
"https://www.indeed.com/viewjob?jk=dd3698060602683f"	"c(\"Data Scientist - Fall Intern\", \"We Are Looking For:\", \"What You Will Do:\")"	"Yelp"	"320 reviews"	"InternshipAt Yelp, it’s our mission to connect people with great local businesses. Yelp’s unique dataset contains billions of interactions between users and local business around the globe, from a user reviewing a neighborhood coffee shop to requesting a repair quote with a photo of a leaky faucet.
The Data Science team performs analyses, builds models, and designs experiments that directly impact Yelp’s business and users. Our centralized team is the most wide-ranging consumer of data at Yelp, adept at tasks from modeling content growth and user behavior to sharing insights about the health of local economies.
We’re looking for interns to work side-by-side with our Data Scientists at Yelp to make sense of these interactions to deliver impactful analyses and products to our users, business partners and the general public.
We Are Looking For:
Pursuing a BA/BS, MS, or PhD in Statistics, Math, Physics, Economics, Computer Science or related quantitative discipline.
Fluency with SQL and Python or R for data analysis.
Solid understanding of statistical inference, experimental design and analysis.
Enthusiasm for clean code and sharing reproducible results.
Communication skills to work with partners on engineering, product and business teams.
An eye for great data visualization with Matplotlib, Plotly, ggplot, or Tableau.
Endless ideas about how to leverage Yelp's unique data set.
What You Will Do:
Define key metrics to track Yelp’s performance and inform product decisions.
Assess and frame questions from partners into actionable deliverables.
Design, execute, and analyze complex experiments impacting millions of users.
Devise and evaluate models for diverse business needs, such as identifying growth opportunities, personalizing user experience, and matching consumers to businesses.
Own analyses start-to-finish and communicate key insights to stakeholders.
Share your technical skills to develop and maintain high-quality, reusable analysis tools.
Interested in applying?
Sweet! Share with us why you want to work at Yelp and don't forget to mention any side projects, academic papers, and personal websites/blogs."	"23 days ago"	"Internship"	2018-10-15	"San+Francisco%2C+CA"	40
"https://www.indeed.com/viewjob?jk=1915a0676efd9fd8"	"Data Scientist"	"Epic Creations"	"-"	"Responsibilities:
Explore our large data set to identify key insights on user behavior that will motivate future innovation
Help understand our audience and to find metrics that best way to measure user engagement
Present your research and insights to all levels and functions of the company, clearly and concisely
Design and train Machine Learning models used in production in app
Work with Product managers, designers & engineers to help understand the product and better design user experience
Analyze new products features and A/B tests for Epic education platformRequirements:
An advanced degree in a quantitative or computational field (e.g., statistics, economics, math, computer science, etc.) and 2+ years of experience in quantitative analytics, data science, or another similar role
Experience analyzing a live consumer digital product
Coding proficiency in SQL, PHP (or similar coding language)
Strong statistical knowledge and experience with A/B testing
Comfort in a fast-paced, constantly evolving, deadline-driven environment.
Great communication and interpersonal skills
Work in the Redwood City office
Bonus:
Passion for children’s education
Professional experience with subscription products
Company
Epic! (www.getepic.com) is a leading digital media brand for kids, bringing unlimited reading and learning to millions of children in homes and in schools. Used in 87% of U.S. elementary schools, Epic!'s award-winning subscription-based platform encourages kids to explore their interests and learn in a fun, safe, kid-friendly environment.
Partnerships with 250 leading publishers such as HarperCollins, Macmillan, National Geographic Kids and Smithsonian bring an unparalleled selection of 25,000 high-quality books and videos to kids in the U.S. and around the world.
Epic! is a rapidly-growing, venture-backed startup located in beautiful Redwood City, with great restaurants and gourmet coffee shops nearby. Parking is easy, and our office is only a short walk from Caltrain. We're a small but mighty team; all passionate about what we're building. Our team includes alums from YouTube, Google, Disney, Crowdstar, Kiwi Crate, Goldman Sachs, Random House and Amazon. We have the support of top-tier investors and veterans of the children's publishing industry; and have been featured in the press by Forbes, Parenting, Techcrunch, USA Today, The TODAY Show, Good Morning America and Publishers Weekly."	"6 days ago"	"character(0)"	2018-10-15	"San+Francisco%2C+CA"	40
"https://www.indeed.com/viewjob?jk=eccec0beb985d4ba"	"Data Scientist - Client Demand Forecasting"	"Stitch Fix"	"157 reviews"	"About the Team
--------------

At Stitch Fix, our data science team leverages machines together with expert-human judgment to generate innovative recommendations and insights that innovate the way the company functions and helps our clients look and be their best selves. The Client Demand Forecasting team guides healthy sustainable company growth through visibility into client behavioral trends and forecasted demand.

About the Role
--------------

This role will focus on building time-series models to forecast key business metrics related to client acquisitions, engagement, and retention. You will get the opportunity to work cross-functionally with business partners to incorporate activity across the company into your forecasts (i.e. interpret & translate experimental results into business impact) and drive strategic decision making by providing insights into client behavior.

You're excited about this opportunity because you will…
--------------------------------------------------------------
have a huge impact on company planning & investment by providing insight into drivers of growth.
develop and use complex bayesian and time-series models for prediction and inference.
work cross-functionally with business partners to incorporate company initiatives, tests, and priorities into your forecasts.
own end-to-end model development.
work with a collaborative team to build a cutting-edge scalable demand forecasting platform.

We're excited about you because…
---------------------------------------------
you have a Master's or PhD in Statistics, Economics or a related field.
you have at least 2 years experience building models in business contexts.
you possess strong communication skills with both technical and non-technical audiences.
you are innovative and think outside of the box and trying new methods excites you.
you have strong standards for software engineering practices and can work within a shared codebase.
you are someone who likes a good challenge and is comfortable taking responsibility for high impact work.

Why you'll love working at Stitch Fix...
----------------------------------------
We are a group of bright, kind and goal oriented people. You can be your authentic self here, and are empowered to encourage others to do the same!
We are a successful, fast-growing company at the forefront of tech and fashion, redefining retail for the next generation.
We are a technologically and data-driven business.
We are committed to our clients and connected through our vision of \"Transforming the way people find what they love\".
We love solving problems, thinking creatively and trying new things.
We believe in autonomy & taking initiative.
We are challenged, developed and have meaningful impact.
We take what we do seriously. We don't take ourselves seriously.
We have a smart, experienced leadership team that wants to do it right & is open to new ideas.
We offer competitive compensation packages and comprehensive health benefits.
You will be proud to say that you work for Stitch Fix and will know that the work you do brings joy to our clients every day.

About Stitch Fix

Stitch Fix is an online personal style service for men and women combining art and science to disrupt and redefine the retail industry. We're the first fashion retailer to blend expert styling, proprietary technology and unique product to deliver a refined and deeply personalized shopping experience. We leverage vast amounts of client data to make decisions throughout the company. All of this results in a simple, powerful offering to our customers and a successful, growing business. We believe we are only scratching the surface of our opportunity; and we're looking for incredible people to contribute! We'd love for you to help us carry on the trend.
---------------------------------------------------------------------------------------------------------------------------------------------------------------------------------------------------------------------------------------------------------------------------------------------------------------------------------------------------------------------------------------------------------------------------------------------------------------------------------------------------------------------------------------------------------------------------------------------------------------------------------------------------------------------------------------------------"	"26 days ago"	"character(0)"	2018-10-15	"San+Francisco%2C+CA"	40
"https://www.indeed.com/viewjob?jk=fbd63f272d68d105"	"Data Scientist"	"BOLD"	"6 reviews"	"BOLD is an established and fast-growing technology company that transforms work lives. Since 2005, BOLD has delivered award-winning career services that have a meaningful and positive impact on job seekers and employers. BOLD's robust product line includes a professional resume and cover letter writing services, scientifically validated career tests, and employer tools that help companies hire, onboard, and communicate with their staff.
Position Summary:
In this critical role, you'll combine your analytical and data science skills to deliver key insights to our Product and Engineering teams. You will help develop data science and machine learning techniques that can be bundled as micro-services integral to Bold's data platform. You will work with teams whose domain experience include Big Data, Business Intelligence, and core product development.
Required Responsibilities:Leverage our rich data sets of user data to perform research, develop models and create data products with our Development & Product teams
Develop novel and scalable data systems that leverage Big Data sets and machine learning techniques to enhance user experience and engagement
Build a better understanding of our user base through exploratory and confirmatory analysis to increase user retention and B2B opportunities
Develop entity taxonomies, knowledge bases and graphing techniques to find deep insights and recommendations for users in career space
Develop deep learning techniques to do user segmentation and cohort analysis
Mentor and coach related team members
Required Qualifications:Bachelors or Masters in a relevant technical field, such as Computer Science, Statistics, Data Science, Data Engineering, Machine Learning
3-4 years of relevant experience in Data Science and Machine Learning
Deep understanding of data analysis, statistical techniques, natural language processing and knowledge base, graph systems
Expertise in database querying (SQL, noSQL), search techniques, web services etc,
Excellent problem-solving skills
Domain expertise of data analysis tools (Python, R, Octave/MATLAB, or similar)
Fluent in a programming language (Python, Ruby, PHP, Java or similar)
Understanding of cloud computing (Amazon Web Services or Microsoft Azure)
Familiarity with the Hadoop ecosystem, including HDFS, MapReduce, Hive, and Spark
Write reusable, efficient code to automate analysis and data processes
Ability to clearly communicate complex analytical methods and results to a non-technical audience
Ability to map Data Science techniques to solve product and business problems to increase consumer and retention
About BOLD:
BOLD is a fast-paced, innovative company full of smart, committed people, who are passionate about our products and love helping people find the career of their dreams. We balance work and fun while continuing to build a successful, fast-growing company that is changing the way people get jobs.

Our vision is to revolutionize the online career world by creating transformational products that help people find the careers they love and reach their full potential.

BOLD is an equal opportunity employer. All persons will receive consideration for employment without regard to race, color, religion, gender, pregnancy, national origin, ancestry, citizenship, age, legally protected physical or mental disability, covered veteran status, status in the U.S. uniformed services, sexual orientation, gender identity or expression, marital status, genetic information or membership in any other legally protected category.

Qualified applicants with arrest and conviction records will be considered for the position in accordance with San Francisco's Fair Chance Ordinance."	"3 days ago"	"character(0)"	2018-10-15	"San+Francisco%2C+CA"	40
"https://www.indeed.com/viewjob?jk=e243ef110b33bc02"	"Image Reconstruction"	"openwater (openwater.cc)"	"-"	"Job Summary:Openwater is creating a next-generation imaging technology that can enable us to see inside our bodies in great detail. With this advancement comes the promise of new abilities to diagnose and treat disease as well as the possibility for breakthroughs in BCI, such as communication by thought alone.We are seeking a self-motivated, enthusiastic and experienced scientist or engineer with a proven record and excellent communication skills to help realize this vision. In this role you will work with teams across functional groups on the acquisition, processing, and analysis of imaging data, developing state-of-the-art 2D and 3D reconstruction techniques and helping to evaluate, test and design scanning methods and systems.Responsibilities and Duties:Apply mathematical (geometry, linear algebra, statistics, numerical methods, error analysis), machine learning, data mining, computer vision, and pattern recognition methods to prototype and develop algorithms for converting raw sensor data into 2D and 3D representations and visualizations, and perform tracking, registration, classification and semantic annotation.Develop and maintain comprehensive clinical and technical biomedical instrumentation documentation.Participate in defining product requirements, quality metrics, schedule, assignments, etc.Optimize code for running on embedded and non-embedded platforms.Qualifications and Skills:Ph.D. or M.S./M.E. in Computer Science, EE, Physics, or related discipline is required. Ph.D. preferred.5+ years of experience in the following:Proven experience implementing algorithms for computer tomography.Image reconstruction from projection of objects.3D Image representation and visualization. Conversion of CT scans into animations.Solid experience developing and debugging image processing algorithms in a variety of languages, e.g. Matlab, Python and C++ or equivalent.Experience using software for CT visualization.Experience with existing computer vision libraries.5+ years of experience in at least 3 of the following:Video and image processing. Image enhancement in the spatial and digital domain: smoothing and sharpening filters, linear and nonlinear pixel transformations, histogram equalization.Image restoration in the presence of noise.Multiresolution and image compression.Image segmentation, detection and pattern recognition.Desired:Knowledge of medical data privacy laws and regulations.Experience in developing algorithms for embedded platforms.Familiarity with AI and deep learning methods.Familiarity with big data methods a plus.US Work authorization required.Job Type: Full-timeExperience:image reconstruction and visualization: 5 years (Preferred)Education:Master's (Required)"	NA	"character(0)"	2018-10-15	"San+Francisco%2C+CA"	40
"https://www.indeed.com/viewjob?jk=75659356a039c994"	"Senior Data Scientist, Recommendation Technology"	"OpenTable"	"34 reviews"	"$117,000 - $173,000 a year (Indeed Est.) Senior Data Scientist, Recommendation Technology (OpenTable, Inc., San Francisco, CA)
Develop personalized Recommendation Technology to power user discovery and exploration of restaurants (including idea-generation, problem formulation, design, implementation, iteration, testing, deployment and continued improvement). Proactively perform data exploration to understand diner behavior and restaurant characteristics and identify opportunities for improving Recommendation Technology. Extract insights from data points to improve the user experience. Build sophisticated supervised and unsupervised Machine Learning and statistical models for data analysis, classification and regression. Integrate data ingestion, extraction, and transformation into formats for modeling and analysis. Optimize the performance of Recommendation Technology prototypes for deployment in real-time systems. A/B test recommender systems to demonstrate direct, measurable impact to user engagement, conversion, reservation frequency, and new user growth. Design, analyze and interpret experiment results. Use excellent oral and written communication skills to interact with colleagues across all levels of the organization, motivating and reporting on all aspects of Recommendation Technology with appropriate level of abstraction, and to partner with management in assisting with decision making and information interpretation.
MINIMUM REQUIREMENTS: Master’s degrees or U.S. equivalent in Artificial Intelligence, Machine Learning, Computer Science, Applied Statistics, Applied Mathematics, Electrical Engineering, or a related field plus 3 years of professional experience in designing, developing, testing, deploying, maintaining and improving large-scale Machine Learning systems. Must also have the following: 1 year of professional experience in building and evaluating Machine Learning and statistical models (including Boosting or Ensemble methods, and Regression, Linear Models, Support Vector Machines, Matrix Factorization, Factorization Machines, Hidden Markov Models, Graphical Models, Mixture Models, Markov Decision Processes, Clustering Techniques, Time Series, Deep Learning/Neural Networks, and Bayesian Optimization); 1 year of professional experience in designing, prototyping, implementing, testing, deploying, and maintaining high-volume, production-level recommendation systems; 1 year of professional experience in implementing and deploying data ingestion, data transformation, data mining, and data cleansing systems; 1 year of professional experience in designing A/B test frameworks and A/B test experiments; 1 year of professional experience in implementing data introspection and monitoring/alerting tools in the context of Recommendation Technology; 1 year of professional experience in building robust, real-time software systems in distributed environments; 1 year of professional experience in developing software using Java, Scala, Python, C++, SQL, and Unix scripting; 1 year of professional experience in presenting complex scientific topics.
CONTACT: Please submit resume online at:https://www.opentable.com/careers/technology/?p=job%2FooO87fwb. Please specify ad code XAKP. EOE. MFDV."	NA	"$117,000 - $173,000 a year (Indeed Est.) "	2018-10-15	"San+Francisco%2C+CA"	40
"https://www.indeed.com/viewjob?jk=c9bdb952f06e70a5"	"Data Scientist, Product analytics"	"eBay Inc."	"1,505 reviews"	"Position: Data Scientist, Product Analytics
Organization: StubHub, www.stubhub.com (an eBay company NASDAQ: EBAY)
The Opportunity
We are looking for an experienced Data scientist with exceptional product sense to help champion the use of data in product decision-making. In this role you will work closely with our Engineering, Product, Ops, and Design teams to evaluate product opportunities, track product metrics, develop and analyze experiments, and drive deep-dive studies to identify new opportunities.
You will:
Apply data & analytical skills to help understand how our customers use our products
Partner closely with product leadership to define, measure and report on core product and feature metrics
Design customer-facing experiments (A/B tests) and distill their results into actionable outcomes
Execute cohort studies and drive analyses to understand customer behavior and identify opportunities for improving our product(s)
Collaborate with data and business intelligence teams to develop reports and visualization dashboards
Build financial models to project key business metrics - Traffic, conversion, Engagement - and develop KPIs to measure initiative performanceYou have:
Strong quantitative background with Product analytics experience. Proven track record in solving business problems through fact based and scientific analytics
Excellent technical skills - including the ability to query databases (SQL, Hive etc.), leveraging R/Python to analyze complex data, and using Tableau (or other visualization tools) to deliver insights at scale
Deep understanding of statistics, experimental design, and causal inference
The ability to translate analytical insights into clear recommendations and effectively deliver it to technical and non-technical stakeholders
Worked in cross-functional and cross-cultural teams, and are able to communicate technically intricate concepts/results in business terms
Passion for technology and consumer productsWhy StubHub?
StubHub is the world's largest ticket marketplace, enabling fans to buy and sell tickets to tens of thousands of sports, concert, theater and other live entertainment events. StubHub reinvented the ticket resale market in 2000 and continues to lead it through innovation. The company's unique online marketplace, dedicated solely to tickets, provides all fans the choice to buy or sell their tickets in a safe, convenient and highly reliable environment. All transactions are processed and delivered by StubHub and backed by the company's FanProtect Guarantee™ processing a ticket every second today with billions of ticket sales each year globally. Company partners MLB, AEG, ESPN and many leading teams such as the San Francisco Giants and University of Texas, along with over 60 other teams in MLB, NBA, NHL and NCAA.
Our Values
StubHub One – We act as one team in pursuit of connecting people through inspiring event experiences.
At StubHub, we are:
Driven – We strive for excellence – constantly improving our game
Courageous – We are bold & not afraid to challenge the status quo
Inventive – We see what others don’t & pioneer new paths
Richly Diverse – We recognize & respect everyone as a unique individual
Brand – We experience the world through StubHub.This website uses cookies to enhance your experience. By continuing to browse the site, you agree to our use of cookies
View our privacy policy
View our accessibility info
eBay Inc. is an equal opportunity employer. All qualified applicants will receive consideration for employment without regard to race, color, religion, national origin, sex, sexual orientation, gender identity, veteran status, and disability, or other legally protected status. If you are unable to submit an application because of incompatible assistive technology or a disability, please contact us at talent@ebay.com. We will make every effort to respond to your request for disability assistance as soon as possible.
For more information see:
EEO is the Law Poster
EEO is the Law Poster Supplement"	"2 days ago"	"character(0)"	2018-10-15	"San+Francisco%2C+CA"	40
