"url"	"title"	"company_name"	"company_score"	"description"	"time_posted"	"metadata"	"date_scraped"	"city"	"page"
"https://www.indeed.com/viewjob?jk=d11d9853c2d7ffde"	"Data Scientist - Inference"	"Airbnb"	"188 reviews"	"Note: Due to volume of applications we receive, we kindly ask that you only apply to a maximum of one Data Scientist role from among those posted. This does not preclude you from being considered for multiple roles. Thank you.

Airbnb has become a global platform that connects travelers and hosts from over 34,000 cities. As such, experimentation is core to our growing business. We want to take a scientific approach to decision-making through careful hypothesis generation and testing and drive actions/refine strategies through insights from experimental analysis.

Our inference data scientists are deep in understanding the complications of running experiments in a two-sided marketplace, power analysis and stopping criterions, and statistical models to improve power/significance. Another interesting problem space is understanding what to do when we are unable to conduct experiments. How do we understand the impact of something new?

We are looking for experienced Data Scientists to join our team and expand upon the work we have done. Here are some examples of projects we currently need help with:
Develop experiments to reduce friction in the listing creation process for hosts
Designing experiments to measure the lift when displaying hotel rooms on our platform
Create product experiments (on service fees, early demand, etc) and measure the impact on market dynamics (such as competitors).
Improve the statistical methodology behind our experimentation platform to ensure that our understanding of product changes is rigorous and accurate
To learn more, read about our Inference data science work:4 Principles for Making Experimentation Count ( https://medium.com/airbnb-engineering/4-principles-for-making-experimentation-count-7a5f1a5268a )
Scaling Airbnb's Experimentation Platform ( https://medium.com/airbnb-engineering/https-medium-com-jonathan-parks-scaling-erf-23fd17c91166 )

We have a strong team of Data Scientists, our work is highly sought-after, and our impact on the business is tremendous. If you have a proven background in this field and are excited to help build Airbnb's community, we want to hear from you.
Some examples of traits we value:A passion for Airbnb's mission of helping people Belong Anywhere
Ability to write clean and concise code, especially in R or Python
3+ years in industry experience and a Master's degree in a quantitative field or Economics; PhD is a plus
Solid understanding of statistics
Keen eye for detail and thoughtful investigation of data before relying upon it
Intuition for data science best practices, stemming from proven experience
Steadfast focus on creating impactful change
Ability to partner with cross-functional teams using strong written and verbal communication
"	"2 days ago"	"character(0)"	2018-10-15	"San+Francisco%2C+CA"	30
"https://www.indeed.com/viewjob?jk=51ba95e8f18ab7d8"	"Data Scientist, Forecasting"	"Geli"	"-"	"Job Summary
Geli is looking for an experienced Data Scientist with a strong software development background in Python to join a driven data analytics team. Your primary responsibility will be to lead the development of our time series forecasting models for solar and energy consumption using machine learning techniques. Our data analytics and cloud platforms use state-of-the-art technologies to set you up for success. As data science is at the core of Geli, you will have plenty of opportunities to contribute to the software development of our other energy storage products.
Role
You will work closely with software and analytics engineers focusing on these topics:
Lead the development of our time series forecasting algorithms, which includes:
Feature engineering
Prototyping new algorithms
Benchmarking performance across various load profiles
Integrating new forecasting algorithms into our production code base with robust test coverage
Collaborate with the rest of the team to assess how forecasts can be adjusted for various economic objectives.
Proactively identify opportunities within Geli that can benefit from data science analysis and present those findings.
Work collaboratively in a diverse environment. We commit to reaching better decisions by respecting opinions and working through disagreements.
Gain in depth experience in an exciting industry as you work with storage sizing, energy financial models, energy tariffs, storage controls & monitoring.
Growth Opportunity:
Geli’s engineering is a flat organization and you will directly report to the VP of Engineering.
There are opportunities to lead teams, projects and/or become a scrum master.
Your Profile
We are looking for a motivated self-starter that thrives in a dynamic start-up environment. A strong work ethic with excellent problem solving skills are equally important as being a team player who enjoys to learn and teach.
These skills will additionally help you to excel in the position:
BS or higher degree with 2+ years of relevant experience
Knowledge of machine learning algorithms (time series forecasting, clustering algorithms, probabilistic models, supervised and unsupervised learning)
Experience with time series analysis and forecasting (LSTM, ARIMA, GARCH)
Strong background in linear algebra and statistics
Advanced Python skills, as well as familiarity with pandas and scikit-learn
Software design experience and ability to write clean, maintainable and shippable production code
Bonus Points
Experience in some of these fields will give you a jump start:
PyTorch, Keras, Tensorflow
Training models on AWS
PostgreSQL, Redis
Slack, Bitbucket, Jira
Jenkins, Buildkite
Knowledge of Cloud, IoT technologies, and scalable platforms
As a member of the team you will have significant influence on the direction of our technology stack.
Benefits
Make a difference: join a group of people who are passionate about renewable energy
Have an impact: the company is still small enough that everyone’s contribution has a significant impact to the success of the company
Growth: leading international energy OEMs, developers and utilities trust us to modernize the trillion dollar energy industry with them and we need to grow to keep up with the demand
Casual working environment: there’s no need to dress up.
Competitive salary and equity compensation plan
401K with company matching
Medical, dental & vision insurance
Open vacation policy
Commuter reimbursement
Convenient SOMA location on Mission St in downtown San Francisco (short walk to Montgomery Street BART)
Diversity
We value the insights that a diverse team brings. We encourage applications from members of groups that have been traditionally underrepresented in tech. Geli is an equal opportunity employer. All qualified applicants will receive consideration for employment without regard to race, color, religion, sex, sexual orientation, gender identity, or national origin.
About Geli
Geli provides software and business solutions to design, automate, and manage energy storage systems. Geli’s suite of products creates an ecosystem where project developers, OEMs, financiers, and project operators can deploy advanced energy projects using a seamless hardware-agnostic platform.
Geli is a Series A company whose software actively manages megawatts of projects that are deployed around the world."	NA	"character(0)"	2018-10-15	"San+Francisco%2C+CA"	30
"https://www.indeed.com/viewjob?jk=283058ed6f693d8f"	"Data Scientist, Product analytics"	"eBay Inc."	"1,505 reviews"	"Position: Data Scientist, Product Analytics Organization: StubHub, www.stubhub.com (an eBay company NASDAQ: EBAY) The Opportunity We are looking for an experienced Data scientist with exceptional product sense to help champion the use of data in product decision-making . In this role you will work closely with our Engineering, Product, Ops, and Design teams to evaluate product opportunities, track product metrics, develop and analyze experiments, and drive deep-dive studies to identify new opportunities. You will: Apply data & analytical skills to help understand how our customers use our products Partner closely with product leadership to define, measure and report on core product and feature metrics Design customer-facing experiments (A/B tests) and distill their results into actionable outcomes Execute cohort studies and drive analyses to understand customer behavior and identify opportunities for improving our product(s) Collaborate with data and business intelligence teams to develop reports and visualization dashboards Build financial models to project key business metrics - Traffic, conversion, Engagement - and develop KPIs to measure initiative performance You have: Strong quantitative background with Product analytics experience. Proven track record in solving business problems through fact based and scientific analytics Excellent technical skills - including the ability to query databases (SQL, Hive etc.), leveraging R/Python to analyze complex data, and using Tableau (or other visualization tools) to deliver insights at scale Deep understanding of statistics, experimental design, and causal inference The ability to translate analytical insights into clear recommendations and effectively deliver it to technical and non-technical stakeholders Worked in cross-functional and cross-cultural teams, and are able to communicate technically intricate concepts/results in business terms Passion for technology and consumer products Why StubHub?

StubHub is the world's largest ticket marketplace, enabling fans to buy and sell tickets to tens of thousands of sports, concert, theater and other live entertainment events. StubHub reinvented the ticket resale market in 2000 and continues to lead it through innovation. The company's unique online marketplace, dedicated solely to tickets, provides all fans the choice to buy or sell their tickets in a safe, convenient and highly reliable environment. All transactions are processed and delivered by StubHub and backed by the company's FanProtect Guarantee™ processing a ticket every second today with billions of ticket sales each year globally.

Company partners MLB, AEG, ESPN and many leading teams such as the San Francisco Giants and University of Texas, along with over 60 other teams in MLB, NBA, NHL and NCAA. Our Values StubHub One – We act as one team in pursuit of connecting people through inspiring event experiences. At StubHub, we are: Driven – We strive for excellence – constantly improving our game Courageous – We are bold & not afraid to challenge the status quo Inventive – We see what others don’t & pioneer new paths Richly Diverse – We recognize & respect everyone as a unique individual Brand – We experience the world through StubHub. is a Subsidiary of eBay.

This website uses cookies to enhance your experience. By continuing to browse the site, you agree to our use of cookies View our privacy policy View our accessibility info eBay Inc. is an equal opportunity employer. All qualified applicants will receive consideration for employment without regard to race, color, religion, national origin, sex, sexual orientation, gender identity, veteran status, and disability, or other legally protected status.

If you are unable to submit an application because of incompatible assistive technology or a disability, please contact us at talent@ebay.com . We will make every effort to respond to your request for disability assistance as soon as possible. For more information see: EEO is the Law Poster EEO is the Law Poster Supplement"	"2 days ago"	"character(0)"	2018-10-15	"San+Francisco%2C+CA"	30
"https://www.indeed.com/viewjob?jk=a4ee028738a63544"	"Junior Data Analyst"	"ThirdLove"	"39 reviews"	"This is an exciting opportunity to work with a talented data team and continue growing a career in analytics. We are looking for a team player who wants to dig into raw data, learn new tools, and help drive the business forward through actionable insights. This role will have exposure to teams across the company including marketing, product management and engineering.

THE JOB
-------
Partner with data scientists, data engineers and analysts to validate accuracy and cleanliness of data
Use SQL to pull data from the database for analysis
Add additional data connections in Looker for company-wide use and answer ad hoc Looker questions

THE QUALIFICATIONS
------------------
1 year work experience using SQL
Highly analytical and quantitative, with strong attention to detail
Bachelor's degree in Mathematics, Statistics, Economics, Business or quantitative focused study
Experience with front-end database access tools and/or Business Intelligence tools preferred
Highly analytical and quantitative, with strong attention to detail

THE PERKS
---------
Comprehensive health benefits
Equity
401k plan
Subsidized lunches and fully stocked kitchen
Wellness benefits including in-office massage visits
Quarterly product allotment -- a package of the world's best bras every 3 months!

ThirdLove® is empowering women to feel comfortable and confident in their everyday lives. We make bras that fit perfectly, feel incredible, and look stellar.

We're a rapidly growing team (over 250 today and doubling in size this year) based in San Francisco with offices in Chico, CA and Argentina. We're funded by Tier 1 investors and are disrupting a $100 billion global market. We're one of the fastest growing consumer brands in the country, and known as 'the brand to catch Victoria's Secret'.

Our culture is collaborative, fast-paced, and data-driven with a strong focus on designing beautiful products and creating a seamless user experience. Instead of using standard industry molds, we developed proprietary half-cup sizes based on real women's measurements and created a Fit Finder® Quiz that removes the hassle in finding the best size. To date, over 9 million women have taken our easy-to-use Fit Finder® Quiz.
Five core values drive all of the work we do:Every Day is a New Day. Learn from the past but keep moving forward. Stay positive and optimistic.
Make it Happen. Be proactive. Be thoughtful about the how.
Defy Conventions. Question the status quo. Ask why. Be nimble and embrace change.
We're Stronger Together. Give your full attention, share information, and help others learn and develop.
Put Customers First. Make every interaction count. Listen to, respect, and delight customers.

If you want to impact millions of people each and every day, and you share these values, we'd love to connect.

ThirdLove is an equal opportunity employer and values diversity at the company. We do not discriminate on the basis of race, religion, color, national origin, gender, gender identity or expression, sexual orientation, age, genetics, marital status, veteran status, or disability status."	"24 days ago"	"character(0)"	2018-10-15	"San+Francisco%2C+CA"	30
"https://www.indeed.com/viewjob?jk=fd5cbb755e78b592"	"Data Scientist"	"6sense"	"-"	"Role: Data Scientist
--------------------

Role Description
----------------

6sense is a Predictive Intelligence Engine that is reimagining how B2B companies do sales and marketing. We work with big data at scale, advanced machine learning and predictive modeling to find buyers and predict what they will purchase, when and how much.

The data science team is the core of 6sense engineering. The drive of our visionary CEO and the quality of our work has lead to unprecedented partnerships with companies like Salesforce, Cisco, Dell and Lenovo. Salesforce was so happy with our results that they invested in us.

Our data scientists are not optimizing software; they are building models, big data manipulation techniques and APIs that are the core of the 6sense product. Our models inform smart-email campaigns, website personalization, ad optimization, inside sales call lists and go-to-market messaging. In all we influence how businesses spend millions in marketing and sales budgets.

We're growing quickly and want to expand our data science family. We are looking for outstanding minds and bright personalities. The bar is high, but our hiring process is simple:
Do well on a short take-home test
Work with us in our SoMa office to solve a real problem and communicate the results
Hang out and have fun with our team
As a data scientist at 6sense you'll have the opportunity to:Work with some of the largest data sets in enterprise business.
Lead the way in leveraging unstructured data for predictive modeling and decision-making.
Help build a predictive product and inform features at the ground level.

We are looking for someone with minimum of 2 years of work experience. Advanced degree is preferred.
If you join our small team you'll:Have the opportunity to advance quickly and build your career trajectory as one of the first 20 tech hires at a fast growing startup.
Enjoy equity and influence in a fast-growing and dynamic pre-IPO company
Work in a beautiful New York loft-style house in the heart of the SoMa (Hurry before we outgrow it!)
"	NA	"character(0)"	2018-10-15	"San+Francisco%2C+CA"	30
"https://www.indeed.com/viewjob?jk=24d374d5c72ddb42"	"Biostatistician"	"Buck Institute for Research on Aging"	"12 reviews"	"ABOUT US
The Buck Institute (www.buckinstitute.org) was the pioneer and is now the global leader in health span research. We are seeking a more comprehensive understanding of the biology of aging itself. Since 1999, the Buck Institute has succeeded in its mission by bringing the most capable and most passionate scientific minds together from a spectrum of disciplines. Located in Novato, California, the Buck Institute offers a rich scientific environment with renowned scientist in the field of aging research. We offer a competitive benefits package.
THE POSITION
Biostatistician, Scientist or Senior Postdoctoral Fellow. The Schilling and Campisi laboratories are seeking biostatistical support and help with data analysis as part of a translational ‘Biomarker of Aging Study’. Human study samples will be received from the ‘Baltimore Longitudinal Study of Aging’ (BLSA), and the ‘Heart and Soul’ study (UCSF).
RESPONSIBILITIES
Biostatistical support for study design, cohort size determination
Biostatistical analysis of data processing from big data sets
Data interpretation and presentation
Data analysis for biomarkers and multi-panel biomarker
Correlations of Biomarkers of Aging with disease phenotypes and clinical data
Epidemiological Studies
QUALIFICATIONS & EXPERIENCE
Advanced Experience in Biostatistical Methodology
Collaborative interactions with multiple Principal Investigators at the Buck Institute"	"12 days ago"	"character(0)"	2018-10-15	"San+Francisco%2C+CA"	30
"https://www.indeed.com/viewjob?jk=c9bdb952f06e70a5"	"Data Scientist, Product analytics"	"eBay Inc."	"1,505 reviews"	"Position: Data Scientist, Product Analytics
Organization: StubHub, www.stubhub.com (an eBay company NASDAQ: EBAY)
The Opportunity
We are looking for an experienced Data scientist with exceptional product sense to help champion the use of data in product decision-making. In this role you will work closely with our Engineering, Product, Ops, and Design teams to evaluate product opportunities, track product metrics, develop and analyze experiments, and drive deep-dive studies to identify new opportunities.
You will:
Apply data & analytical skills to help understand how our customers use our products
Partner closely with product leadership to define, measure and report on core product and feature metrics
Design customer-facing experiments (A/B tests) and distill their results into actionable outcomes
Execute cohort studies and drive analyses to understand customer behavior and identify opportunities for improving our product(s)
Collaborate with data and business intelligence teams to develop reports and visualization dashboards
Build financial models to project key business metrics - Traffic, conversion, Engagement - and develop KPIs to measure initiative performanceYou have:
Strong quantitative background with Product analytics experience. Proven track record in solving business problems through fact based and scientific analytics
Excellent technical skills - including the ability to query databases (SQL, Hive etc.), leveraging R/Python to analyze complex data, and using Tableau (or other visualization tools) to deliver insights at scale
Deep understanding of statistics, experimental design, and causal inference
The ability to translate analytical insights into clear recommendations and effectively deliver it to technical and non-technical stakeholders
Worked in cross-functional and cross-cultural teams, and are able to communicate technically intricate concepts/results in business terms
Passion for technology and consumer productsWhy StubHub?
StubHub is the world's largest ticket marketplace, enabling fans to buy and sell tickets to tens of thousands of sports, concert, theater and other live entertainment events. StubHub reinvented the ticket resale market in 2000 and continues to lead it through innovation. The company's unique online marketplace, dedicated solely to tickets, provides all fans the choice to buy or sell their tickets in a safe, convenient and highly reliable environment. All transactions are processed and delivered by StubHub and backed by the company's FanProtect Guarantee™ processing a ticket every second today with billions of ticket sales each year globally. Company partners MLB, AEG, ESPN and many leading teams such as the San Francisco Giants and University of Texas, along with over 60 other teams in MLB, NBA, NHL and NCAA.
Our Values
StubHub One – We act as one team in pursuit of connecting people through inspiring event experiences.
At StubHub, we are:
Driven – We strive for excellence – constantly improving our game
Courageous – We are bold & not afraid to challenge the status quo
Inventive – We see what others don’t & pioneer new paths
Richly Diverse – We recognize & respect everyone as a unique individual
Brand – We experience the world through StubHub.This website uses cookies to enhance your experience. By continuing to browse the site, you agree to our use of cookies
View our privacy policy
View our accessibility info
eBay Inc. is an equal opportunity employer. All qualified applicants will receive consideration for employment without regard to race, color, religion, national origin, sex, sexual orientation, gender identity, veteran status, and disability, or other legally protected status. If you are unable to submit an application because of incompatible assistive technology or a disability, please contact us at talent@ebay.com. We will make every effort to respond to your request for disability assistance as soon as possible.
For more information see:
EEO is the Law Poster
EEO is the Law Poster Supplement"	"2 days ago"	"character(0)"	2018-10-15	"San+Francisco%2C+CA"	30
"https://www.indeed.com/viewjob?jk=45754869d697e448"	"Data Scientist"	"FlowCommand Inc."	"-"	"$80,000 - $140,000 a yearFlowCommand is hiring a lead data scientist for our San Francisco office. We are a sensor company that aims to accurately capture the behavior of high throughput fluid systems. With this information we can help optimize allocations while reducing spills and theft. This technology could change the way the oil and gas industry, water municipalities, and anyone dealing with high volume fluid, operate. Our sensors send ultrasonic data directly to our server via cellular/satellite; we then use a mix of physics equations, signal processing, and anomaly detection to determine the behavior of fluid (volume and speed) in pipes.As the first data engineer at FlowCommand, you will work closely with our small team split across Houston, San Francisco and Mexico City. You’ll leverage our remotely controllable flow-loop test facility in Houston to generate training data from our sensors. As the owner of this process, you will be building the foundational models and algorithms that our future suite of products will run on.Responsibilities: Increase accuracy of our measurementsIncrease the accuracy of our confidence in our measurementsCollaborate with engineers to build models that enable a fundamentally new sensor technologyUnderstand, source and leverage tangential/contextual datasetsIncrease the use-cases of our products by identifying correlations with tangential/contextual datasetsRequirementsExperience building production grade Machine Learning modelsExperience building models with limited training dataStrong written and verbal communication skills.Expert knowledge and demonstrable experience with Python and SQL.Team oriented and able to take an idea from conception to launch.Preferencesdegree in Statistics or Computer Science with a Machine Learning focus.Note:If you have a very strong theoretical knowledge of building these models from a PhD or something similar but no experience, you should still apply for considerationFlowCommand is proud to be an equal opportunity employer. All qualified applicants will receive consideration for employment without regard to race, color, religion, gender, gender identity or expression, sexual orientation, national origin, genetics, disability, age, or veteran status.Job Type: Full-timeSalary: $80,000.00 to $140,000.00 /yearExperience:Data Science: 1 year (Required)Education:Bachelor's (Preferred)Location:San Francisco Bay Area, CA (Required)Work authorization:United States (Required)"	"4 days ago"	"$80,000 - $140,000 a year"	2018-10-15	"San+Francisco%2C+CA"	30
