"url"	"title"	"company_name"	"company_score"	"description"	"time_posted"	"metadata"	"date_scraped"	"city"	"page"
"https://www.indeed.com/viewjob?jk=82fc6316bf469991"	"Data Scientist"	"Optimizely"	"2 reviews"	"Job DescriptionAbout the Job As a Data Scientist at Optimizely, you’ll be responsible for translating developments from academia into tools that thousands of marketers, engineers, and data scientists use every day. You will join Optimizely’s Machine Learning/Statistics team, in charge of Stats Engine and machine learning methods that interface with Stats Engine such as Stats Accelerator, a novel multi-armed bandit algorithm for dynamic traffic allocation designed to deliver faster results. You will work with our product and engineering teams to build new statistics features for all of Optimizely’s products. You will get on customer calls to articulate how we maintain statistical accuracy in our products as well as triage questions around statistical inference. You will educate internal and external stakeholders about fundamental as well as cutting edge statistics concepts via webinars, speaking engagements, blog posts, and white papers. You will conduct original research and publish results in academic and industry conferences. Requirements PhD in Statistics or a closely related field, or 5+ years of equivalent industry experience in A/B testing and digital experimentation Strong research interest and experience with design of experiments, randomized control trials, and inference, particularly aspects of high throughput testing such as multiple hypothesis testing, sequential testing, robustness, data mining of experiments Experience with Python and/or Java preferred Some experience in math education such as teaching, teaching assistantships, consulting, or conference talks Some of our public work: Papers Stats Engine White Paper - http://pages.optimizely.com/rs/optimizely/images/stats_engine_technical_paper.pdf Stats Engine Academic Paper - https://arxiv.org/abs/1512.04922 Blog Posts Bayesian vs Frequentist Statistics https://blog.optimizely.com/2015/03/04/bayesian-vs-frequentist-statistics/ Optimizely’s Stats Engine https://blog.optimizely.com/2015/01/20/statistics-for-the-internet-age-the-story-behind-optimizelys-new-stats-engine/ Approximate Counting and Statistical Significance https://medium.com/engineers-optimizely/approximate-counting-and-statistical-significance-two-great-ideas-that-dont-play-nice-2bd643287644#.6uyxiytlr Conference Talks CODE @ MIT 2016: A/B Testing in a Changing World INFORMS 2015: Can I Take a Peek? Continuous Monitoring of A/B Tests CODE @ MIT 2014: Can I Take a Peek? Continuous Monitoring of A/B Tests Qualifications null Additional InformationAll your information will be kept confidential according to EEO guidelines."	"24 days ago"	"character(0)"	2018-10-15	"San+Francisco%2C+CA"	60
"https://www.indeed.com/viewjob?jk=fbd63f272d68d105"	"Data Scientist"	"BOLD"	"6 reviews"	"BOLD is an established and fast-growing technology company that transforms work lives. Since 2005, BOLD has delivered award-winning career services that have a meaningful and positive impact on job seekers and employers. BOLD's robust product line includes a professional resume and cover letter writing services, scientifically validated career tests, and employer tools that help companies hire, onboard, and communicate with their staff. Position Summary: In this critical role, you'll combine your analytical and data science skills to deliver key insights to our Product and Engineering teams. You will help develop data science and machine learning techniques that can be bundled as micro-services integral to Bold's data platform. You will work with teams whose domain experience include Big Data, Business Intelligence, and core product development. Required Responsibilities:Leverage our rich data sets of user data to perform research, develop models and create data products with our Development & Product teams Develop novel and scalable data systems that leverage Big Data sets and machine learning techniques to enhance user experience and engagement Build a better understanding of our user base through exploratory and confirmatory analysis to increase user retention and B2B opportunities Develop entity taxonomies, knowledge bases and graphing techniques to find deep insights and recommendations for users in career space Develop deep learning techniques to do user segmentation and cohort analysis Mentor and coach related team members Required Qualifications:Bachelors or Masters in a relevant technical field, such as Computer Science, Statistics, Data Science, Data Engineering, Machine Learning 3-4 years of relevant experience in Data Science and Machine Learning Deep understanding of data analysis, statistical techniques, natural language processing and knowledge base, graph systems Expertise in database querying (SQL, noSQL), search techniques, web services etc, Excellent problem-solving skills Domain expertise of data analysis tools (Python, R, Octave/MATLAB, or similar) Fluent in a programming language (Python, Ruby, PHP, Java or similar) Understanding of cloud computing (Amazon Web Services or Microsoft Azure) Familiarity with the Hadoop ecosystem, including HDFS, MapReduce, Hive, and Spark Write reusable, efficient code to automate analysis and data processes Ability to clearly communicate complex analytical methods and results to a non-technical audience Ability to map Data Science techniques to solve product and business problems to increase consumer and retention About BOLD: BOLD is a fast-paced, innovative company full of smart, committed people, who are passionate about our products and love helping people find the career of their dreams. We balance work and fun while continuing to build a successful, fast-growing company that is changing the way people get jobs. Our vision is to revolutionize the online career world by creating transformational products that help people find the careers they love and reach their full potential. BOLD is an equal opportunity employer. All persons will receive consideration for employment without regard to race, color, religion, gender, pregnancy, national origin, ancestry, citizenship, age, legally protected physical or mental disability, covered veteran status, status in the U.S. uniformed services, sexual orientation, gender identity or expression, marital status, genetic information or membership in any other legally protected category. Qualified applicants with arrest and conviction records will be considered for the position in accordance with San Francisco's Fair Chance Ordinance."	"3 days ago"	"character(0)"	2018-10-15	"San+Francisco%2C+CA"	60
"https://www.indeed.com/viewjob?jk=9faace4a54ccaf2f"	"Data Scientist - 1-800 Radiator"	"Driven Brands"	"34 reviews"	"Job Description: This is a key position within a rapidly growing enterprise. High performers in this role have an opportunity to quickly assume additional responsibilities, develop their knowledge and understanding of our business model, and have preferred access to promotional opportunities! The position is based at our corporate headquarters in Benicia, CA, less than one hour from 3 major airports and the Napa/Sonoma region of Northern California. Responsibilities: Work with stakeholders throughout the organization (Operations/Supply Chain, Sales/Marketing, Finance, etc.) to identify opportunities for leveraging company data to drive business solutions Develop scalable statistical, machine learning or mathematical solutions for complex business problems such as Pricing, Inventory Reordering, and Demand Forecasting Perform analytical studies and generate actionable recommendations. Use statistical techniques and hypothesis testing to validate your findings Qualifications Ideal Candidate: 2-5 years of experience in leveraging data for business impact A deep understanding of statistical analysis (e.g. hypothesis testing, experimentation, regressions) and machine learning algorithms (supervised and unsupervised models) Demonstrated programming experience with at least one analytic tool (R, Python, Scala, etc.). Ability to write and optimize complex SQL queries. Experience in building and deploying cloud-based data pipelines and applications (GCP, AWS) is a plus Ability to communicate clearly and effectively to cross-functional partners of varying technical levels Ability to work independently and proactively as well as collaborating in a team A good sense of humor is always a big plus! IND1"	"11 days ago"	"character(0)"	2018-10-15	"San+Francisco%2C+CA"	60
"https://www.indeed.com/viewjob?jk=d0d18093d324cca4"	"c(\"Data Scientist - Insurance\", \"Job requirements\", \"More details\")"	"Blue Owl"	"2 reviews"	"A million people a year die in car collisions around the world and we want that number to be zero. We invite you to help us build an InsurTech company that uses rich customer insights, advanced technology and data science to save lives by preventing car collisions before they happen. To this end, we recently helped launch our first product, hiroad.com, a cloud native insurance solution that rewards people for the act of driving well. With impressive funding, a compelling vision, and a world-class team, we're poised to re-engineer a trillion-dollar category from the ground up- and that's just where we're beginning. Longer term, we're out to change behavior and promote mindful living at a societal level. We're seeking someone to build and support critical backend systems and services that are core to our business. This includes the rewards system that will be used to increase driver safety, designing APIs, creating/managing databases, and writing automated test suites. General tools you build will be open sourced and will ideally be consumed by the greater community. Job requirements This role will require the candidate to be extremely hands on with building models and data driven tools. Past experience implementing complex data-driven solutions is required. Advanced Python skills. Should be familiar with Python’s scientific computing ecosystem. Advanced SAS skills. Should be familiar with SAS best practices. Deep experience with GLMs as well as modern machine learning methods. Actuarial science is a plus, but is not required. More details Salary: We invest in first-rate people and pay top-of-market salaries for most positions, factoring in experience and talent. We are unable to offer equity. Benefits: Full medical, dental, vision coverage, 401k, daily catered lunch, wellness reimbursement & on-site shower, four weeks of vacation, six weeks of parental leave, panoramic views, and more. Location: Near Montgomery Street BART station, San Francisco, California. Locals preferred, but relocation within the US considered for outstanding candidates. All are welcome at Blue Owl. We are an equal opportunity and affirmative action employer who values diversity and inclusion and looks for applicants who understand, embrace and thrive in a multicultural world. We do not discriminate on the basis of race, color, ancestry, religion, sex, national origin, sexual orientation, age, citizenship, marital status, disability, gender identity or Veteran status. Pursuant to the San Francisco Fair Chance Ordinance, we will consider for employment qualified applicants with arrest and conviction records."	NA	"character(0)"	2018-10-15	"San+Francisco%2C+CA"	60
"https://www.indeed.com/viewjob?jk=45754869d697e448"	"Data Scientist"	"FlowCommand Inc."	"-"	"$80,000 - $140,000 a yearFlowCommand is hiring a lead data scientist for our San Francisco office. We are a sensor company that aims to accurately capture the behavior of high throughput fluid systems. With this information we can help optimize allocations while reducing spills and theft. This technology could change the way the oil and gas industry, water municipalities, and anyone dealing with high volume fluid, operate. Our sensors send ultrasonic data directly to our server via cellular/satellite; we then use a mix of physics equations, signal processing, and anomaly detection to determine the behavior of fluid (volume and speed) in pipes.As the first data engineer at FlowCommand, you will work closely with our small team split across Houston, San Francisco and Mexico City. You’ll leverage our remotely controllable flow-loop test facility in Houston to generate training data from our sensors. As the owner of this process, you will be building the foundational models and algorithms that our future suite of products will run on.Responsibilities: Increase accuracy of our measurementsIncrease the accuracy of our confidence in our measurementsCollaborate with engineers to build models that enable a fundamentally new sensor technologyUnderstand, source and leverage tangential/contextual datasetsIncrease the use-cases of our products by identifying correlations with tangential/contextual datasetsRequirementsExperience building production grade Machine Learning modelsExperience building models with limited training dataStrong written and verbal communication skills.Expert knowledge and demonstrable experience with Python and SQL.Team oriented and able to take an idea from conception to launch.Preferencesdegree in Statistics or Computer Science with a Machine Learning focus.Note:If you have a very strong theoretical knowledge of building these models from a PhD or something similar but no experience, you should still apply for considerationFlowCommand is proud to be an equal opportunity employer. All qualified applicants will receive consideration for employment without regard to race, color, religion, gender, gender identity or expression, sexual orientation, national origin, genetics, disability, age, or veteran status.Job Type: Full-timeSalary: $80,000.00 to $140,000.00 /yearExperience:Data Science: 1 year (Required)Education:Bachelor's (Preferred)Location:San Francisco Bay Area, CA (Required)Work authorization:United States (Required)"	"4 days ago"	"$80,000 - $140,000 a year"	2018-10-15	"San+Francisco%2C+CA"	60
"https://www.indeed.com/viewjob?jk=7cf3ae88333ef82f"	"Data Scientist / Machine Learning Engineer - Classification Science"	"Rakuten Intelligence"	"-"	"Rakuten Intelligence is looking for a Data Scientist / Machine Learning Engineer to join our Classification Science team. To create one of the world's richest commerce data sets and help deliver never-been-seen insights on customer purchase behavior, the Classification Science team is responsible for building systems to semantically classify and normalize billions of products across thousands of retailers. This includes building highly accurate machine learning models, engineering scalable systems, and incorporating crowdsourcing to have continuously improving human-in-the-loop systems. We leverage existing open source technologies and established machine learning approaches, but also innovate and research new techniques. As a data scientist / machine learning engineer, you will spend a mix of your time researching new solutions for product classification as well as productionizing these solutions to make sure they work at scale. You will work with world-class data scientists who hold MS/PhD degrees from top global schools such as Stanford University, University of Washington, Carnegie Mellon University, and National Taiwan University, and veterans from companies such as Microsoft, AOL, Yahoo!, and Twitter. Rakuten Intelligence was founded by proven entrepreneurs and, as a Rakuten group company, offers the best of both worlds: a start­up environment with the backing of an established global enterprise that is revolutionizing the internet services landscape. This position will be located in San Mateo or New York. Responsibilities:Research and experiment with different machine learning algorithms and techniques for item classification, product recognition and matching, attribute extraction Conduct design and code reviews Productionize the developed Machine Learning solutions Work with engineers to make sure the engines scale well on high volumes of data Requirements:MS/PhD in Computer Science or a related field 3+ years of industry experience in data science and machine learning preferred Expertise in Machine Learning Strong CS fundamentals, such as algorithms and data structures Expertise in Python Proficiency with relational databases such as MySQL Experience with cloud computing stacks such as Amazon Web Services preferred Excellent written and verbal communication skills Enthusiasm for working hard and having fun in a dynamic environment Who we are: Rakuten Intelligence is online shopping, smarter. Rakuten Intelligence is transforming e-commerce by unveiling never-before-seen e-commerce insights via its market research products, which are powered by our popular consumer applications, Rakuten Slice and Unroll.Me. Rakuten Intelligence has developed a technology that extracts commerce data from emails to make it actionable for businesses and consumers. With the largest panel of online shoppers under measurement, Rakuten Intelligence provides the most detailed, accurate, and actionable e-commerce data available, and is the most cited source on e-commerce by the media. Learn more about Rakuten Intelligence at www.rakutenintelligence.com ( http://%C2%A0www.rakutenintelligence.com )and on twitter @RakutenIntel. Rakuten Intelligence was incubated as a research project at Stanford, where the best and brightest minds in machine learning set forth on how to extract business value from the vast amount of unstructured purchase data in inboxes. When we took that project out of the lab and to the market, we retained the culture of excellence and personal growth, with respect for a healthy work-life balance. Because we love what we do and care about the people we work with. Values:Start­Up Environment – Work is fun, roles are challenging. Always prioritize the company's success over egos. We innovate, take risks, move quickly and fail fast. Hire smart and develop talent – ­ We are entrepreneurial self-starters who ignite/inspire growth on an individual, team and company level. Say it like it is – We create a transparent, respectful environment within our company and for our users and partners. We give and receive prompt honest feedback. Get it done ­ – We measure our success based on results rather than activity. We use the 80/20 rule. ­Perfect is the enemy of good. Customer success is our own – We treat our customers and partners with respect. We are easy to do business with. Benefits & Perks:Competitive compensation package including base salary, bonus and Rakuten stock Medical, dental, vision and basic life insurance Flexible Spending Account (health care and dependent day care) 401K plan Unlimited Paid Time Off Paid Parental Leave: Maternity (up to 22 weeks off / 16 weeks paid) and Paternity (up to 8 paid weeks off) Free Caltrain Go Pass for unlimited train travel Onsite secured bike storage and $20/month bike reimbursement through WageWorks $10,000 / $5,000 employee referral program $2,000 towards professional development (annually) Healthy and Fun Work Environment at our San Mateo, CA headquarters: Daily catered breakfast and lunch Various drinks and snacks Ping-pong table, air hockey table, corn hole and board games Adjustable sit/stand desks Fully-equipped nursing mom rooms with hospital grade pumps and fridges Onsite gym with showers and lockers Partnership with YMCA for discounted membership. YMCA is 2 blocks from the office Company social and volunteer events"	NA	"character(0)"	2018-10-15	"San+Francisco%2C+CA"	60
"https://www.indeed.com/viewjob?jk=c9bdb952f06e70a5"	"Data Scientist, Product analytics"	"eBay Inc."	"1,505 reviews"	"Position: Data Scientist, Product Analytics Organization: StubHub, www.stubhub.com (an eBay company NASDAQ: EBAY) The Opportunity We are looking for an experienced Data scientist with exceptional product sense to help champion the use of data in product decision-making. In this role you will work closely with our Engineering, Product, Ops, and Design teams to evaluate product opportunities, track product metrics, develop and analyze experiments, and drive deep-dive studies to identify new opportunities. You will: Apply data & analytical skills to help understand how our customers use our products Partner closely with product leadership to define, measure and report on core product and feature metrics Design customer-facing experiments (A/B tests) and distill their results into actionable outcomes Execute cohort studies and drive analyses to understand customer behavior and identify opportunities for improving our product(s) Collaborate with data and business intelligence teams to develop reports and visualization dashboards Build financial models to project key business metrics - Traffic, conversion, Engagement - and develop KPIs to measure initiative performanceYou have: Strong quantitative background with Product analytics experience. Proven track record in solving business problems through fact based and scientific analytics Excellent technical skills - including the ability to query databases (SQL, Hive etc.), leveraging R/Python to analyze complex data, and using Tableau (or other visualization tools) to deliver insights at scale Deep understanding of statistics, experimental design, and causal inference The ability to translate analytical insights into clear recommendations and effectively deliver it to technical and non-technical stakeholders Worked in cross-functional and cross-cultural teams, and are able to communicate technically intricate concepts/results in business terms Passion for technology and consumer productsWhy StubHub? StubHub is the world's largest ticket marketplace, enabling fans to buy and sell tickets to tens of thousands of sports, concert, theater and other live entertainment events. StubHub reinvented the ticket resale market in 2000 and continues to lead it through innovation. The company's unique online marketplace, dedicated solely to tickets, provides all fans the choice to buy or sell their tickets in a safe, convenient and highly reliable environment. All transactions are processed and delivered by StubHub and backed by the company's FanProtect Guarantee™ processing a ticket every second today with billions of ticket sales each year globally. Company partners MLB, AEG, ESPN and many leading teams such as the San Francisco Giants and University of Texas, along with over 60 other teams in MLB, NBA, NHL and NCAA. Our Values StubHub One – We act as one team in pursuit of connecting people through inspiring event experiences. At StubHub, we are: Driven – We strive for excellence – constantly improving our game Courageous – We are bold & not afraid to challenge the status quo Inventive – We see what others don’t & pioneer new paths Richly Diverse – We recognize & respect everyone as a unique individual Brand – We experience the world through StubHub.This website uses cookies to enhance your experience. By continuing to browse the site, you agree to our use of cookies View our privacy policy View our accessibility info eBay Inc. is an equal opportunity employer. All qualified applicants will receive consideration for employment without regard to race, color, religion, national origin, sex, sexual orientation, gender identity, veteran status, and disability, or other legally protected status. If you are unable to submit an application because of incompatible assistive technology or a disability, please contact us at talent@ebay.com. We will make every effort to respond to your request for disability assistance as soon as possible. For more information see: EEO is the Law Poster EEO is the Law Poster Supplement"	"2 days ago"	"character(0)"	2018-10-15	"San+Francisco%2C+CA"	60
