"url"	"title"	"company_name"	"company_score"	"description"	"time_posted"	"metadata"	"date_scraped"	"city"	"page"
"https://www.indeed.com/viewjob?jk=c5984b14137d4c06"	"Data Scientist (Decision Science)"	"Zillow Group"	"77 reviews"	"About the team Zillow Group is currently seeking a Data Scientist to join the Decision Science team in our Seattle office. Our team is tasked with absorbing billions of rows of data from dozens of sources, organizing them, analyzing them, and visualizing them to help inform both short- and long-term decision-making. Our structure is very flat and you will soon find yourself communicating directly with Senior Leadership. Each team member focuses on a cross-section of the Zillow Group community. Below are some of the areas in which our Data Scientists focus their energy. Business - Build data-driven insights to fuel the future of each of Zillow Group’s businesses (e.g., Agent, Rentals, New Construction). Find opportunities for innovation and assess performance of current initiatives. Marketing - Develop strategies for B2C and B2B marketing efforts through a wide range of marketing channels and measure their performance. Product - Analyze how our consumers are interacting with our web and app products to ensure we are providing them with a delightful experience. Sales - Analyze the intersection of human behavior, incentive structures, and sales process to build a more efficient sales force. Pricing - Develop and implement pricing strategies that deliver the best value possible for our clients (Premier Agents, Lenders, Landlords, etc). Tools - Create data-focused information products from billions of data points we collect every single day for internal and external clients.About the role Once you're here, you'll work to make important, strategic decisions that influence the direction of the company. More specifically: Dive into Zillow's internal and third party data (think Hive, Presto, SQL Server, Redshift, Python, Mode Analytics, Tableau, R) to make strategic recommendations (e.g., personalized user flows, segmented marketing audiences, more accurate pricing forecasts). Assist in the scoping and development of new product features and business initiatives. Compile and analyze data describing the performance of those initiatives (e.g., AB tests, pilots, incrementality tests). Develop a common language and approach to analyzing and communicating information and insights across teams. Create, maintain, and document a robust set of metrics to monitor day-to-day bug detection and long-term performance tracking. Tell stories that describe analytical results and insights in meetings of all sizes with diverse audiences. Consult with business partners and provide analytics-oriented thought leadership across a variety of non-technical audiences to ensure that all levels of Zillow Group make data-driven decisions.Who you are You will not shy away from complexity or uncertainty. You will develop a deep understanding of our mission, business models, and personas. We want you to use that intuition you've developed (both in business and real life) to find opportunities for growth and cultivate insights from our massive data sets. We're looking for a seasoned data scientist who has: An undergraduate or Master's degree in a quantitative field (e.g. science, engineering, economics, finance, statistics, or similar) or demonstrable experience within data science and analytics. 2+ years of work experience involving quantitative data analysis and complex problem solving (preferably focused on consumer-facing internet products). Foundational analytical skills (demonstrated understanding of SQL, command of Excel, and experience using R and/or Python) and is a Tableau pro. Experience directly querying multi-terabyte-sized data sets (e.g. with Hive and Presto) including clickstream data and raw data ingested from non-standard platforms (e.g., homegrown systems). An understanding of concepts, terminology, and measurement issues related to web traffic. Strong written, verbal, and visual communication skills to concisely communicate in a way that provides context, offers insights, and minimizes misinterpretation. The skills to work cross-functionally and push business partners to focus on realistic goals and projects.Get to know usZillow Group is owned, fueled and grown by innovators who help people make better, smarter decisions around all things home. We encourage one another at every level, and our efforts are supported by employee-driven, world-class benefits that enable us to enjoy our lives outside the office while building fulfilling careers that impact millions of individuals every day. Zillow Group is an equal opportunity employer committed to fostering an inclusive, innovative environment with the best employees. Therefore, we provide employment opportunities without regard to age, race, color, ancestry, national origin, religion, disability, sex, gender identity or expression, sexual orientation, or any other protected status in accordance with applicable law. If there are preparations we can make to help ensure you have a comfortable and positive interview experience, please let us know."	NA	"character(0)"	2018-10-15	"Seattle%2C+WA"	20
"https://www.indeed.com/viewjob?jk=21d5f5102589531a"	"Applied Scientist, Economic Data - Intern"	"Zillow Group"	"77 reviews"	"InternshipAbout the team Join our industry-leading Economic Research team bringing innovative analysis, creativity and excellence to the U.S. housing market. Our mission is to leverage Zillow’s unique proprietary data on American housing – often in combination with other public or private data – to answer Americans’ questions about the housing market and, often, the American economy more broadly. You’ll work in an informal, fun, collaborative atmosphere with a sharp and dynamic team that loves all things data and all things economics, but also has a diverse range of interests and skillsAbout the role Zillow Group’s Economic Research team is looking for applied data science interns for the summer of 2019. Do you love answering questions using data? Do you have a knack for thinking through market dynamics? Have you waited your whole life to see “economic storytelling”, “statistical analysis”, and “production code” appear together in a single job description? Do you find that you both appreciate the power of machine learning methods and want to understand the “why” behind them? If so, then we have a job for you. You will directly contribute to the most innovative, authoritative, open, and comprehensive source of housing-related data and products, used not only across Zillow Group but also by academic researchers, government institutions, industry professionals, and real estate consumers around the world. You’ll have the opportunity to dig into Zillow Group’s unparalleled databases of proprietary housing market data to unearth market insights, build predictive models, and automate the production of economic indices used by millions every month. You will work in an informal, collaborative atmosphere with a team of strong, smart self-starters like yourself. You will collaborate with Zillow Group’s Chief Economist and our team of Applied Scientists, Economists, Analysts, Editors, and Engineers to tell the ever-evolving story of the housing market, from the nation to the neighborhood. Why Us ? Your work will be impactful. Our data and research routinely features in national publications, powers insights for businesses and institutions, and appears in public-facing tools used by Zillow Group’s millions of consumers. Your work will be stimulating. Our team has a tremendous range of analytical and technical skills that we are excited to share and teach. These span from cloud-based data engineering and machine learning to innovative data visualization, storytelling, and public speaking.Who you are A current graduate student (or recent grad) in economics, statistics, operations research, or any another quantitative field who plans to pursue full-time positions in 2019/2020 Experience with data science tools such as SQL, R, or Python, including the ability to process large, complex datasets using tidy data principles. Experience with cloud-based data processing tools (e.g. Hadoop, Hive, Presto, Spark) is a plus. Ability to compose well-written, well-documented, automatable code Experience designing and executing multifaceted research projects Knowledge of statistical methods, machine learning, and/or econometrics (e.g. tree-based methods, KNN, clustering, autoencoders, ARIMA) Strong verbal and written communication skills Candidates who are curious, detailed-oriented, analytical, and self-motivated Get to know us Zillow Group houses a portfolio of the largest and most vibrant real estate and home-related brands on the web and mobile. Our mission is to build the largest, most trusted and vibrant home-related marketplace in the world.Zillow Group is owned, fueled and grown by innovators who help people make better, smarter decisions around all things home. We encourage one another at every level, and our efforts are supported by employee-driven, world-class benefits that enable us to enjoy our lives outside the office while building fulfilling careers that impact millions of individuals every day. Zillow Group is an equal opportunity employer committed to fostering an inclusive, innovative environment with the best employees. Therefore, we provide employment opportunities without regard to age, race, color, ancestry, national origin, religion, disability, sex, gender identity or expression, sexual orientation, or any other protected status in accordance with applicable law. If there are preparations we can make to help ensure you have a comfortable and positive interview experience, please let us know."	NA	"Internship"	2018-10-15	"Seattle%2C+WA"	20
"https://www.indeed.com/viewjob?jk=fb1dfe94654e622a"	"Data Scientist, Analytics - Ads Foundations"	"Facebook"	"383 reviews"	"Facebook's mission is to give people the power to build community and bring the world closer together. Through our family of apps and services, we're building a different kind of company that connects billions of people around the world, gives them ways to share what matters most to them, and helps bring people closer together. Whether we're creating new products or helping a small business expand its reach, people at Facebook are builders at heart. Our global teams are constantly iterating, solving problems, and working together to empower people around the world to build community and connect in meaningful ways. Together, we can help people build stronger communities — we're just getting started. The Ads Foundations team builds the bedrock infrastructure that Facebook's Ads are built on to help us achieve this mission. We are responsible for building solutions for Facebooks largest advertisers and partners through our APIs as well as hundreds of Facebook engineers who rely on our work to build stable solutions. We are focused on building for the future of Facebook ads which includes things like building more transparent systems, building more intuitive ads creation and management, rethinking the infra Ads systems run on to increase efficiency, among many others. This role has a wide opportunity for impact across many of the Ads systems at Facebook, directing the future of our technology, and impacting teams that create products that drive tens of billions of dollars of ad spend. We are looking for a Data Scientist who loves a technical challenge and doesn't shy away from difficult problems and can drive data science initiatives across a team of at least 40 engineers. RESPONSIBILITIESProvide technical and thought leadership on designing, prototyping, implementing and automating complex analysesPartner with cross-functional teams to identify new opportunities requiring the use of modern analytical and modeling techniquesEffectively communicate insights and recommendations to management in support of strategic decision-makingPlan, and be able to conduct as needed, end-to-end analyses, from data requirement gathering, to data processing and modelingOwn ongoing deliverables and communicationsWork with data engineers to architect, develop, and optimize data and modeling pipelines MINIMUM QUALIFICATIONSMS degree in a quantitative discipline (e.g., statistics, operations research, econometrics), or BS in a quantitative discipline plus MBA with a quantitative concentration (operations management, supply chain, information technology, finance), or equivalent practical experience10+ years experience doing quantitative analysis or statistical modelingTrack-record driving product strategy through data analysis and product positioningExperience extracting and manipulating large datasetsWorking knowledge of at least one modeling framework (e.g., SciKit Learn, TensorFlow, SAS, R, MATLAB)Experience in a scripting language (PHP, Python, Perl, etc.)Communication experience PREFERRED QUALIFICATIONS5+ years experience leading cross-functional teams2+ years experience in software engineeringExperience with distributed computing (Hive/Hadoop)"	"3 days ago"	"character(0)"	2018-10-15	"Seattle%2C+WA"	20
"https://www.indeed.com/viewjob?jk=8eb2f3fba68c5b8c"	"Data Scientist (Zillow Offers)"	"Zillow Group"	"77 reviews"	"About the team Zillow is looking for extraordinary Data Scientist to join a growing team on a mission to give consumers certainty and control when selling their home with a broad mission - build data science and machine learning products that will power the next stage of Zillow’s growth. In particular Zillow is launching a new venture with a focus on using our unparalleled data and view into housing markets to help build a world-class platform for real estate marketplace optimization. In the Zillow Offers (formally Instant Offers) product, Zillow buys homes directly from interested homeowners, thereby sparing them the tremendous stress and effort of selling. Instead, we take that upon ourselves by quickly preparing these homes for the market and re-selling them. This is a key initiative at Zillow as we aim to define the future of real estate. Our team is tasked with absorbing dozens, sometimes billions, of rows of data from various sources, organizing them, analyzing them, and visualizing them to help inform both short- and long-term decision-making. Our structure is very flat and you will soon find yourself communicating directly with Senior Leadership. Each team member focuses on a cross-section of the Zillow Offers organization. This role will focus on asset management and risk.About the role Once you're here, you'll work to make important, strategic decisions that influence the direction of the company. More specifically: Dive into Zillow's internal and third party data (think Hive, Presto, SQL Server, Python, R, Tableau) to make strategic recommendations (e.g., improve underwriting assumptions, segmented home types, more accurate renovation forecasts). Assist in the scoping and development of new underwriting practices. Compile and analyze data describing the performance of those initiatives (e.g., AB tests, pilots, incrementality tests). Develop a common language and approach to analyzing and communicating information and insights across teams. Create, maintain, and document a robust set of metrics to monitor day-to-day bug detection and long-term performance tracking. Tell stories that describe analytical results and insights in meetings of all sizes with diverse audiences. Consult with business partners and provide analytics oriented thought leadership across a variety of non-technical audiences to ensure that all levels of Zillow Group make data driven decisions.Who you are You will not shy away from complexity or uncertainty. You will develop a deep understanding of our mission, business models, and personas. We want you to use that intuition you've developed (both in business and real life) to find opportunities for growth and cultivate insights from our massive data sets. We're looking for a seasoned data scientist who has: An undergraduate or Master's degree in a quantitative field (e.g. science, engineering, economics, quantitative finance, operations research, statistics, or similar) or demonstrable experience within data science and analytics. 2+ years of work experience involving quantitative data analysis and complex problem solving Foundational analytical skills (demonstrated understanding of SQL, command of Excel, and experience using Tableau and R/Python) A proficient understanding of real estate investment metrics 1-2 years experience in a highly analytical role in a financial services or technology setting with experience in financial modeling Strong written, verbal, and visual communication skills to concisely communicate in a way that provides context, offers insights, and minimizes misinterpretation. The skills to work cross-functionally and push business partners to focus on realistic goals and projects.Get to know us Zillow Group houses a portfolio of the largest and most vibrant real estate and home-related brands on the web and mobile. Our mission is to build the largest, most trusted and vibrant home-related marketplace in the world.Zillow Group is owned, fueled and grown by innovators who help people make better, smarter decisions around all things home. We encourage one another at every level, and our efforts are supported by employee-driven, world-class benefits that enable us to enjoy our lives outside the office while building fulfilling careers that impact millions of individuals every day. Zillow Group is an equal opportunity employer committed to fostering an inclusive, innovative environment with the best employees. Therefore, we provide employment opportunities without regard to age, race, color, ancestry, national origin, religion, disability, sex, gender identity or expression, sexual orientation, or any other protected status in accordance with applicable law. If there are preparations we can make to help ensure you have a comfortable and positive interview experience, please let us know."	NA	"character(0)"	2018-10-15	"Seattle%2C+WA"	20
"https://www.indeed.com/viewjob?jk=8fc2bb9aea118159"	"Data Scientist - Delphi"	"Amazon.com"	"27,834 reviews"	"Job Description The Amazon Demand Forecasting team seeks a Data Scientist with strong analytical and communication skills to join our team. We develop sophisticated algorithms that involve learning from large amounts of data, such as prices, promotions, similar products, and a product’s attributes, in order to forecast the demand of over 190 million products world-wide. These forecasts are used to automatically order more than $200 million worth of inventory weekly, establish labor plans for tens of thousands of employees, and predict the company’s financial performance. The work is complex and important to Amazon. With better forecasts we drive down supply chain costs, enabling the offer of lower prices and better in-stock selection for our customers. In a typical day, you will work closely with talented machine learning scientists, statisticians, software engineers, and business groups. Your work will include cutting edge technologies that enable implementation of sophisticated models on big data. As a successful data scientist in our Demand Forecasting team, you are an analytical problem solver who enjoys diving into data, is excited about investigations and algorithms, can multi-task, and can credibly interface between technical teams and business stakeholders. Your analytical abilities, business understanding, and technical savvy will be used to identify specific and actionable opportunities to solve existing business problems in Demand Forecasting, through collaboration with engineering, research, and business teams. Your expertise in synthesizing and communicating insights and recommendations to audiences of varying levels of technical sophistication will enable you to answer specific business questions and innovate for the future. Major responsibilities include:Translating Demand Forecasting business questions and concerns into specific analytical questions that can be answered with available data using statistical and machine learning methods; working with engineers to produce the required data when it is not availableProviding feedback to our science and engineering teams on the applicability of technical solutions from the business perspectivePresenting critical data in a format that is immediately useful to answer questions about the inputs and outputs of Demand Forecasting systems and improving their performanceCommunicating verbally and in writing to business customers with various levels of technical knowledge, educating them about our systems, as well as sharing insights and recommendationsImproving upon existing Demand Forecasting statistical or machine learning methodologies by developing new data sources, testing model enhancements, running computational experiments, and fine-tuning model parameters for new forecasting modelsSupporting decision making by providing requirements to develop analytic capabilities, platforms, pipelines and metrics then using them to analyze trends and find root causes of forecast inaccuracyFormalizing assumptions about how demand forecasts are expected to behave, creating definitions of outliers, developing methods to systematically identify these outliers, and explaining why they are reasonable or identifying fixes for themUtilizing code (Python, R, Scala, etc.) for analyzing data and building statistical and machine learning models and algorithms Amazon.com is an Equal Opportunity-Affirmative Action Employer – Minority / Female / Disability / Veteran / Gender Identity / Sexual OrientationBasic Qualifications Bachelor’s or Master’s degree in a quantitative field such as Statistics, Applied Mathematics, Physics, Engineering, Computer Science, or Economics2+ years of relevant working experience in an analytical role involving data extraction, analysis, and communication2+ years of experience with data querying languages (e.g. SQL, Hadoop/Hive) and statistical/mathematical software (e.g. R, Weka, Matlab, Stata)Preferred Qualifications Experience processing, filtering, and presenting large quantities (Millions to Billions of rows) of dataSuperior verbal and written communication skills with the ability to effectively advocate technical solutions to scientists, engineering teams and business audiencesProven ability to convey rigorous technical concepts and considerations to non-expertsNatural curiosity and desire to learnFluency in a scripting or computing language (e.g. Python, Scala, C++, Java, etc.)Depth and breadth in quantitative knowledge. Excellent quantitative modeling, statistical analysis skills and problem-solving skills. Sophisticated user of statistical tools.Combination of deep technical skills and business savvy to interface with all levels and disciplines within our and our customer’s organizationsDemonstrable track record of dealing well with ambiguity, prioritizing needs, and delivering results in a dynamic environmentExperience in forecasting and time series is a plus"	NA	"character(0)"	2018-10-15	"Seattle%2C+WA"	20
