"url"	"title"	"company_name"	"company_score"	"description"	"time_posted"	"metadata"	"date_scraped"	"city"	"page"
"https://www.indeed.com/viewjob?jk=ce9a1cbf356bd4dc"	"Data Scientist, Group Benefits and Middle Market P&C"	"The Hartford"	"-"	"Overview of the Position
The Hartford seeks energetic and passionate Data Scientists to focus on designing, developing and implementing solutions that will make an impact on our business. This role will focus on developing solutions in support of our Middle Market and Group Benefits business. In addition the Data Scientist will participate in a variety of ad hoc projects.
Our Data Scientists play a significant role by both leading and partnering with the business and data teams for a better understanding of the customer journey across multiple lines of business. As a Data Scientist you will focus on research for deliverables that support the long term plan to evolve the department’s capabilities to further develop and deliver impactful products to drive outcomes for both the business and clients.
Solutions that are developed will support a wide range of business areas which include underwriting, claims, operations, risk engineering, and digital analytics. As a Data Scientist you will focus on developing analytic and predictive modeling solutions that feature engineering assets, experimental design, as well as modeling techniques and abilities. Our Data Scientist toolbox consists of but not limited to predictive Modeling Techniques, Machine Learning, Cognitive Computing, Unsupervised learning, and Augmented intelligence. As a Data Scientist you will support and explore those assets overtime through customer adoption and establishing a rhythm within the data science community.
Responsibilities:
Collaborate and partner with business stakeholders in a way that supports the vision and sustains a culture that treats analytics as a corporate asset.
Participate in reviewing work with partners on an ongoing basis to calibrate deliverables against expectations
Help identify long term opportunities within the customer journey through the creation of algorithms and machine learning techniques to achieve financial objectives and solve problems.
Participate in the creation and deployment of long term tools to continually evolve the business.
Assist in identifying and assessing the value of new data sources and analytical techniques to ensure ongoing competitive advantage
Contribute to the successful implementation of strategies to achieve targeted business objectives.
Accountable for short term ownership and evolution of models developed
Support the processes used to develop and enhance our business needs
Support a high-performance collaborative culture
Develop knowledge of The Hartford's formal and informal structures, business processes, and data sources in your area of expertise
Remain current on research techniques and become familiar with state of the art tools applicable to your function
Present complex modeling to Senior Data Scientists that maximizes the bottom-line impact of modeling results
Provide economic, qualitative, and statistical support to ensure accuracy of characteristics and metrics being applied to business decisions.
Assist in estimating the economic impact of operational decisions
Promote analytics opportunities of the company with customers and business partners.
As requested, provide timely feedback and opportunities for your colleagues.
Suggest and participate in training opportunities for research staff and others in the organization
Qualifications
Experience & Skills
Master’s or Ph.D. in Statistics, Applied Mathematics, Actuarial Science, Quantitative Economics or other similar analytical field
2+ years of relevant experience in Research Function in Insurance or Financial Services or related field.
Experience in large scale operations environments (Claim Centers, Call Centers, Manufacturing) a plus.
Technical/Functional Skills
Experience modeling data and analytical capability.
Advanced coding skills in various languages e.g. R, Python etc.
Developed verbal/written communication skills.
Ability to translate complex technical topics into business solutions and strategies, including visualization.
Exposure to executing change to core business processes through the innovative use of quantitative techniques.
Competencies
Drive and commitment to what is necessary to get the job done efficiently, thoroughly, and professionally.
Innovative. Seeks new and creative ways to approach analytical exercises and development projects.
Results-oriented. Demonstrates a sense of urgency and accountability for business issues.
Customer focused. Builds effective relationships within the data science community
Equal Opportunity Employer/Females/Minorities/Veterans/Disability/Sexual Orientation/Gender Identity or Expression/Religion/Age
** NO AGENCIES PLEASE **Job Function
: Data Science
Primary Location
: United States-New York
Other Locations
: United States-Connecticut-Hartford
Schedule
: Full-time
Job Level
: Individual Contributor
Education Level
: Master's Degree (±18 years)
Job Type
: Standard
Shift
: Day Job
Employee Status
: Regular
Overtime Status
: Exempt
Travel
: No
Job Posting
: Oct 8, 2018, 7:37:49 PM
Remote Worker Option : No"	NA	"character(0)"	2018-10-15	"New+York%2C+NY"	60
"https://www.indeed.com/viewjob?jk=3f1d872cbc2ffbf0"	"Data Services Software Engineer - Data & Analytics Platform Team"	"Bloomberg"	"665 reviews"	"Engineering Data Services group is responsible for core data and analytics services that are used across Bloomberg's application teams. Our service stack currently runs on over 900 machines and serves over 120 billion requests a day. With ever increasing data volumes and growth of Bloomberg's Enterprise products this footprint has been growing at a rapid pace year over year. Our team also provides multiple foundational services such as meta data and id master for Bloomberg Query Language (BQL), the next generation analytics and screening engine for financial datasets.

We are building out a suite of tools that help developers support and optimize implementation of Bloomberg reference data and analytics. One such tool, the reference data integrity, is required to verify 50 billion unique data points daily to detect anomalies. This immense scale requires the use of Hadoop and Spark analytics framework. We are developing a set of brand new services for metadata, security & entity relationships and entitlement. Due to the large volume and explosive growth of underlying data we are looking to leverage Hadoop based storage for these services. We are also building new tools to manage our server farm more efficiently and leverage analytics to ensure high availability, efficient load balancing and fair scheduling.

We are looking for strong C++/Java software engineers who can design and develop low latency, high performance distributed systems. If you have strong programming skills, the ability to work collaboratively and a proven track record of delivering quality engineering solutions to real world problems, you'll fit right in.

Our team is comprised of a small group of technologists passionate about data and pushing the boundaries of technology to deliver innovative solutions. We expect you to be proactive, able to work independently and take ownership in driving the vision and execution of the product.
We'll trust you to:Design, implement and own critical applications and components of our services stack
Participate in the full SDLC (Software Development Life Cycle) of various components and systems that are required to be highly efficient, robust and scalable
Enhance our infrastructure to fulfill mission critical SLAs, whether low latency or high throughput data retrieval
Get to know development teams across Bloomberg, understand their application requirements and data access patterns
You need to have:3+ years of C++ or Java on UNIX/Linux environment
Solid understanding of algorithms and data structures, knowledge of object-oriented design and multi-threading
Excellent problem solving and communication skills, and ability to thrive in a highly collaborative and dynamic work environment
Experience with high volume, high availability distributed systems
Experience working in a test-driven development and agile environment
BA, BS, MS, PhD in Computer Science, Engineering or related technology field
We'd love to see:Knowledge of low-level Linux, UNIX networking and C system calls for high performance computing and debugging
Experience with systems level Java or Scala
Experience with Hadoop and/or using a distributed analytics infrastructure like Apache Spark

Explore the diversity of experiences, backgrounds and perspectives on our team that made it possible to create our deep learning-based platform:

https://www.techatbloomberg.com/blog/female-engineers-data-scientists-drive-innovation-bloomberg-title-change/

If this sounds like you, apply and we'll get in touch to arrange a technical phone interview if we think you're a match.

Apply Now

Data Services Software Engineer - Data & Analytics Platform TeamNew York, NY

Posted Sep 18, 2018 - Requisition No. 67233

Apply Now

Engineering Data Services group is responsible for core data and analytics services that are used across Bloomberg's application teams. Our service stack currently runs on over 900 machines and serves over 120 billion requests a day. With ever increasing data volumes and growth of Bloomberg's Enterprise products this footprint has been growing at a rapid pace year over year. Our team also provides multiple foundational services such as meta data and id master for Bloomberg Query Language (BQL), the next generation analytics and screening engine for financial datasets.

We are building out a suite of tools that help developers support and optimize implementation of Bloomberg reference data and analytics. One such tool, the reference data integrity, is required to verify 50 billion unique data points daily to detect anomalies. This immense scale requires the use of Hadoop and Spark analytics framework. We are developing a set of brand new services for metadata, security & entity relationships and entitlement. Due to the large volume and explosive growth of underlying data we are looking to leverage Hadoop based storage for these services. We are also building new tools to manage our server farm more efficiently and leverage analytics to ensure high availability, efficient load balancing and fair scheduling.

We are looking for strong C++/Java software engineers who can design and develop low latency, high performance distributed systems. If you have strong programming skills, the ability to work collaboratively and a proven track record of delivering quality engineering solutions to real world problems, you'll fit right in.

Our team is comprised of a small group of technologists passionate about data and pushing the boundaries of technology to deliver innovative solutions. We expect you to be proactive, able to work independently and take ownership in driving the vision and execution of the product.
We'll trust you to:Design, implement and own critical applications and components of our services stack
Participate in the full SDLC (Software Development Life Cycle) of various components and systems that are required to be highly efficient, robust and scalable
Enhance our infrastructure to fulfill mission critical SLAs, whether low latency or high throughput data retrieval
Get to know development teams across Bloomberg, understand their application requirements and data access patterns
You need to have:3+ years of C++ or Java on UNIX/Linux environment
Solid understanding of algorithms and data structures, knowledge of object-oriented design and multi-threading
Excellent problem solving and communication skills, and ability to thrive in a highly collaborative and dynamic work environment
Experience with high volume, high availability distributed systems
Experience working in a test-driven development and agile environment
BA, BS, MS, PhD in Computer Science, Engineering or related technology field
We'd love to see:Knowledge of low-level Linux, UNIX networking and C system calls for high performance computing and debugging
Experience with systems level Java or Scala
Experience with Hadoop and/or using a distributed analytics infrastructure like Apache Spark

Explore the diversity of experiences, backgrounds and perspectives on our team that made it possible to create our deep learning-based platform:

https://www.techatbloomberg.com/blog/female-engineers-data-scientists-drive-innovation-bloomberg-title-change/

If this sounds like you, apply and we'll get in touch to arrange a technical phone interview if we think you're a match."	NA	"character(0)"	2018-10-15	"New+York%2C+NY"	60
