"url"	"title"	"company_name"	"company_score"	"description"	"time_posted"	"metadata"	"date_scraped"	"city"	"page"
"https://www.indeed.com/viewjob?jk=9e82a077147c7d5e"	"Data Scientist with Polygraph"	"Deloitte"	"7,146 reviews"	"Do you want to build your brand by working for a leading consulting firm that drives eminence in the marketplace? Are you interested in leveraging your analytical skills and strategic ideas to improve mission execution? If so, Deloitte could be the place for you! Our GPS Strategy and Analytics teams bring deep industry expertise, rigorous analytical capabilities and a pragmatic mindset to help solve our client’s most complex business problems. Join our team, and play a key role in helping to design our clients’ roadmap to the future and help transform the marketplace.
Work you’ll do
As a Sr. Consultant within our S&A team, you will:
Perform project tasks independently, and may direct the efforts of others

Participate in and/or lead the development of deliverable content that meets the needs of the client and contract

Anticipate client needs and formulate solutions to client issues

Review deliverables for accuracy and quality

Provides coaching to junior staff

Contribute to new business proposals and proposal development

Manages own personal and professional development; seeks opportunities for professional growth and expansion of consulting skills and experiencesThe Team
Transparency, innovation, collaboration, sustainability: these are the hallmark issues shaping government initiatives today. Deloitte’s GPS practice is passionate about making an impact with lasting change. Carrying out missions in the GPS practice requires fresh thinking and a creative approach. We collaborate with teams from across our organization in order to bring the full breadth of Deloitte, its commercial and public sector expertise, to best support our clients. Our aspiration is to be the premier integrated solutions provider in helping to transform the marketplace.
By offering client-tailored services and deep industry insight, the Analytics team helps clients to seize new growth opportunities, maximize operational effectiveness, elevate their quality of service delivery, and stay ahead of customer demand. Consider a career where you’ll thrive on helping government clients to execute on their strategic visions and improve mission performance.
Qualifications
Required:
Bachelor's degree in Computer Science, Engineering, Mathematics or other business-related field

3+ years of relevant consulting or industry experience

Experience working independently with minimal guidance

Strong problem solving and troubleshooting skills with experience exercising mature judgment

Proven experience effectively prioritizing workload to meet deadlines and work objectives

Demonstrated ability to write clearly, succinctly, and in a manner that appeals to a wide audience

Proficiency in word processing, spreadsheet, and presentation creation tools, as well as Internet research tools

Active TS/SCI Security Clearance with Polygraph is requiredPreferred:
Prior professional services or federal consulting experience

Experience with: SQL; Python; R; VBA, HadoopHow you’ll grow
At Deloitte, our professional development plan focuses on helping people at every level of their career to identify and use their strengths to do their best work every day. From entry-level employees to senior leaders, we believe there’s always room to learn. We offer opportunities to help sharpen skills in addition to hands-on experience in the global, fast-changing business world. From on-the-job learning experiences to formal development programs at Deloitte University, our professionals have a variety of opportunities to continue to grow throughout their career. Explore Deloitte University, The Leadership Center.Benefits
At Deloitte, we know that great people make a great organization. We value our people and offer employees a broad range of benefits. Learn more about what working at Deloitte can mean for you.Deloitte’s culture
Our positive and supportive culture encourages our people to do their best work every day. We celebrate individuals by recognizing their uniqueness and offering them the flexibility to make daily choices that can help them to be healthy, centered, confident, and aware. We offer well-being programs and are continuously looking for new ways to maintain a culture where our people excel and lead healthy, happy lives. Learn more about Life at Deloitte.
Corporate citizenship
Deloitte is led by a purpose: to make an impact that matters. This purpose defines who we are and extends to relationships with our clients, our people and our communities. We believe that business has the power to inspire and transform. We focus on education, giving, skill-based volunteerism, and leadership to help drive positive social impact in our communities. Learn more about Deloitte’s impact on the world.
Recruiter tips
We want job seekers exploring opportunities at Deloitte to feel prepared and confident. To help you with your interview, we suggest that you do your research: know some background about the organization and the business area you’re applying to. Check out recruiting tips from Deloitte professionals.

#LI:PTY
#IND:PTYAs used in this posting, “Deloitte” means Deloitte Consulting LLP, a subsidiary of Deloitte LLP. Please see www.deloitte.com/us/about for a detailed description of the legal structure of Deloitte LLP and its subsidiaries. Certain services may not be available to attest clients under the rules and regulations of public accounting.All qualified applicants will receive consideration for employment without regard to race, color, religion, sex, sexual orientation, gender identity, national origin, age, disability or protected veteran status, or any other legally protected basis, in accordance with applicable law."	"10 days ago"	"character(0)"	2018-10-15	"Washington%2C+DC"	80
"https://www.indeed.com/viewjob?jk=82371ed22d8a1538"	"Data Scientist"	"Unisys"	"1,897 reviews"	"We are currently seeking a motivated, career and customer-oriented Data Scientist to join our team in Northern Virginia and begin an exciting and challenging career with Unisys Federal Systems. The ideal candidate is an individual with broad understanding of the Department of Homeland Security (DHS) based on experience gained from supporting several components. Applicants should have the functional knowledge and ability to support our client's data challenges by providing data solution architecture, data engineering, data science, and data analysis support that analyzes, synthesizes, and integrates large quantities of structured and unstructured data that will be used to enhance the tools and features of the client information technology applications.
Working with our DHS clients, you will use your knowledge of DHS's data collection and management capabilities, end-to-end data and work flows, and data warehouses and lakes to enhance mission performance and improve Departmental and Component efficiency. You will implement data analysis using machine learning, predictive analytics, data mining, pattern recognition, data modeling, and statistical methods to solve large scale optimization problems and identify meaning derived from large data sets. You will perform data analytics at on-premise data centers and in cloud environments, including AWS and Azure. You will develop architectures and approaches for addressing information siloes and systems of records that do not facilitate data sharing and reuse. You will apply your expertise on multiple complex work assignments which are broad in nature, requiring originality and innovation in determining how to accomplish tasks. You will apply your comprehensive knowledge across key tasks and high impact assignments, evaluate performance results and recommend changes as necessary to achieve project success. Your primary responsibility will be working with teams designing, testing and building applications to meet DHS customer requirements and goals, which may include using Big Data Analytics and a Continuous Integration/Continuous Delivery (CI/CD) approach to optimize data flows and provide meaningful and actionable information. You will support our customers and enhance the experience of their clients and users by designing, developing, and deploying tools for public users of many types. Potential tasks include expanding existing client models to present relevant information to users including: developing and deploying personalized processing models; adding integration points for the intelligent automated help agents to connect with external applications or data sources to increase its effectiveness and accuracy; creating and implementing scrubbing strategies to ensure unstructured data is appropriate to present to the end user; analyzing customer data and biometrics to identify key data points for confirming a customer's identity; and analyzing, validating, and creating process to transition from a transaction based model to a customer centric model. You will also prepare technical papers and playbooks, responses to acqusitions, and conduct white board sessions within Unisys and with customers.
Requirements
Must have experience working for or supporting the Department of Homeland Security and its components. You must be familiar with Agile methodology and be able to work collaboratively in a team environment. Excellent written and oral communications skills are essential. Other requirements include:Expert in enterprise data tranformation including data warehouse and data lake rationalization.Proven expertise in using combinations of supervised and unsupervised machine learning algorithms, predictive models, and statistical algorithms to provide insights into client datasets.Must be familiar with current link analysis and risk analysis tools.Deep knowledge of Data Science including Google Analytics and metrics, statistical analysis, machine learning and natural language processing, and data science, analytics, modeling and integration.Experience planning, organizing, facilitating, and collecting data from focus group and research/usability testing sessions.Data segmentation and data flow modeling.Knowledge of and experience working with Hadoop and Cloudera.Executing descriptive analyses, ranging from identifying product opportunities to understanding user behaviorExperience/expertise with Natural Language Processing (NLP), graph theory, Scala, and machine learning.Demonstrated ability building innovative data products (e.g., Artificial Intelligence, real-time services, such as personalization and commerce graphing using Big Data platforms with real-time data ingestion and processing).Establishing big data reporting and enterprise analytics platforms to analyze increasingly larger and more complex data sets.Skills at Identifying and correcting data quality issues and establishing a data governance framework to enforce data standards and improve accuracy using integrated internal and external disparate data sources.
Familiarity and experience with the following is highly desirable:Developing machine-learning algorithms to improve predictions.Develop highly optimized, scalable automatic case matching logic on microservice/container technology.
U.S. CITIZENSHIP REQUIRED
Master’s Degree in Computer Science, Computational Mathematics, Statistics, Engineering or related field degree or higher and a minimum of 15 years of related experience. Applicable advance certifications and education and specific skills can be substituted for Master's degree or years of experience. Current DHS Clearance is a bonus.
Local candidates only. Work location: Northern Virginia
About Unisys
Do you have what it takes to be mission critical?
Your skills and experience could be mission critical for our Unisys team supporting the Federal Government in their mission to protect and defend our nation, and transform the way government agencies manage information and improve responsiveness to their customers. As a member of our diverse team, you’ll gain valuable career-enhancing experience as we support the design, development, testing, implementation, training, and maintenance of our federal government’s critical systems.
Apply today to become mission critical and help our nation meet the growing need for IT security, improved infrastructure, big data, and advanced analytics.
Unisys is a global information technology company that solves complex IT challenges at the intersection of modern and mission critical. We work with many of the world's largest companies and government organizations to secure and keep their mission-critical operations running at peak performance; streamline and transform their data centers; enhance support to their end users and constituents; and modernize their enterprise applications. We do this while protecting and building on their legacy IT investments. Our offerings include outsourcing and managed services, systems integration and consulting services, high-end server technology, cybersecurity and cloud management software, and maintenance and support services. Unisys has more than 23,000 employees serving clients around the world.
Unisys offers a very competitive benefits package including health insurance coverage from first day of employment, a 401k with an immediately vested company match, vacation and educational benefits. To learn more about Unisys visit us at www.Unisys.com.
Unisys is an Equal Opportunity Employer (EOE) - Minorities, Females, Disabled Persons, and Veterans.
#FED#"	NA	"character(0)"	2018-10-15	"Washington%2C+DC"	80
"https://www.indeed.com/viewjob?jk=5901fbd81e3119f4"	"Senior Data Scientist"	"American Nurses Association, Inc"	"45 reviews"	"Business Unit: American Nurses Credentialing Center

Department: Measurement Services

Salary Grade: 14

Employee Referral Bonus Amount: $500.00

TO APPLY: Apply online or email resume to chet.reisler@ana.orgKey technical expert, accountable for exam performance and psychometrics, resolution of data issues, and research addressing ANCC strategic goals. Leads efforts and provides consultation for MS staff to resolve data problems and establish data quality standards; develops presentations and publications for departments, Board of Directors, Commission on Certification, and other stakeholders; and proposes resources to support MS research activity. Serves as an expert in test development, scoring, research, and quantitative analyses. Develops software applications, programming, and syntax for report generation, statistical analyses, and graphic representations. Conducts quality assurance on scores, item functioning, and psychometric properties of exams. Drafts research reports. Ensures validity, reliability, and psychometric soundness of certification exams, using established industry and best practices.DUTIES:Conduct ongoing analysis of data systems. Review data management plans, revisions, and specifications and provide feedback. Plan and lead research (e.g., job analysis, validation, survey sampling, speededness and readability, test security, calibration, equating) to enhance exam performance, customer services, and product line as well as inform strategic planning. Monitor and evaluate item performance, differential item functioning, item drift, and exam psychometrics.
Program for advanced statistical analyses using software programs (e.g., SAS, SPSS, Winsteps, R, SQL). Create and implement report generation, data collection, and sampling plans; develop conceptual frameworks for research and analyses; and recommend and adapt analytical and statistical methods. Identify strategies to generate useful feedback for examinees. Draw conclusions from research and make recommendations. Provide results, conclusions, and visuals and present to internal and external stakeholders (e.g., Executive Leadership, Boards of Directors, Commissions/Councils, program staff, governmental agencies, members of credentialed organizations). Travel as needed to deliver presentations at various venues or to meet with potential or current stakeholders.
Plan and lead test development activities (e.g., standard setting, item and exam performance, exam field testing, form building). Facilitate focus groups, prepare meeting materials, review materials created by colleagues, analyze data, and write technical research reports and summaries. Coordinate with colleagues, subject matter experts, and vendors.
Ensure compliance with industry best practice and accreditation requirements of ANCC certification programs. Maintain all necessary documentation in support of accreditation requirements. Establish data quality standards in collaboration with program staff. Troubleshoot issues and data errors. Consult with program staff on data preparation and data coding problems and assist in developing means for correcting the problems. Propose tools and resources to support research activity and enhance data system operations. Collaborate with ANA IT staff to evaluate and implement potential enhancements, to resolve quality assurance issues, and to ensure data systems are operational. Perform functional, cost-benefit, and risk analysis to support design changes. Assess risks and recommend mitigation strategies.
Perform other duties as assigned to support the department’s objectives and strategic goals.QUALIFICATIONS REQUIREDEducationMaster’s degree (Ph.D. preferred) in industrial-organizational (I/O) psychology, testing and measurement, psychometrics, mathematics, research and statistics, or related field, with emphasis on quantitative analyses.Related Work ExperienceFive years of professional experience. Two years of assessment development, psychometrics, data management and analyses, and technical report writing.SkillsResearch design and completion
Data collection, utilization, validation, security
Data management and visualization
Advanced data analysis (e.g., scaling and equating [CTT or IRT], simulation, sampling)
Choosing and applying appropriate analysis techniques
Test construction, development of alternative items, and test validation
Meeting facilitation
Oral and written communication
Advanced use of office computer software (e.g., Microsoft Word, Excel, PowerPoint) and database and statistical software (e.g., SAS, SPSS, R, SQL)
Analytical thinking
Technical documentation and report writing
Producing concise, high-level summaries and briefings to non-technical audiences
Identifying and using emerging technologies"	NA	"character(0)"	2018-10-15	"Washington%2C+DC"	80
