"url"	"title"	"company_name"	"company_score"	"description"	"time_posted"	"metadata"	"date_scraped"	"city"	"page"
"https://www.indeed.com/viewjob?jk=9e82a077147c7d5e"	"Data Scientist with Polygraph"	"Deloitte"	"7,146 reviews"	"Do you want to build your brand by working for a leading consulting firm that drives eminence in the marketplace? Are you interested in leveraging your analytical skills and strategic ideas to improve mission execution? If so, Deloitte could be the place for you! Our GPS Strategy and Analytics teams bring deep industry expertise, rigorous analytical capabilities and a pragmatic mindset to help solve our client’s most complex business problems. Join our team, and play a key role in helping to design our clients’ roadmap to the future and help transform the marketplace. Work you’ll do As a Sr. Consultant within our S&A team, you will: Perform project tasks independently, and may direct the efforts of others Participate in and/or lead the development of deliverable content that meets the needs of the client and contract Anticipate client needs and formulate solutions to client issues Review deliverables for accuracy and quality Provides coaching to junior staff Contribute to new business proposals and proposal development Manages own personal and professional development; seeks opportunities for professional growth and expansion of consulting skills and experiencesThe Team Transparency, innovation, collaboration, sustainability: these are the hallmark issues shaping government initiatives today. Deloitte’s GPS practice is passionate about making an impact with lasting change. Carrying out missions in the GPS practice requires fresh thinking and a creative approach. We collaborate with teams from across our organization in order to bring the full breadth of Deloitte, its commercial and public sector expertise, to best support our clients. Our aspiration is to be the premier integrated solutions provider in helping to transform the marketplace. By offering client-tailored services and deep industry insight, the Analytics team helps clients to seize new growth opportunities, maximize operational effectiveness, elevate their quality of service delivery, and stay ahead of customer demand. Consider a career where you’ll thrive on helping government clients to execute on their strategic visions and improve mission performance. Qualifications Required: Bachelor's degree in Computer Science, Engineering, Mathematics or other business-related field 3+ years of relevant consulting or industry experience Experience working independently with minimal guidance Strong problem solving and troubleshooting skills with experience exercising mature judgment Proven experience effectively prioritizing workload to meet deadlines and work objectives Demonstrated ability to write clearly, succinctly, and in a manner that appeals to a wide audience Proficiency in word processing, spreadsheet, and presentation creation tools, as well as Internet research tools Active TS/SCI Security Clearance with Polygraph is requiredPreferred: Prior professional services or federal consulting experience Experience with: SQL; Python; R; VBA, HadoopHow you’ll grow At Deloitte, our professional development plan focuses on helping people at every level of their career to identify and use their strengths to do their best work every day. From entry-level employees to senior leaders, we believe there’s always room to learn. We offer opportunities to help sharpen skills in addition to hands-on experience in the global, fast-changing business world. From on-the-job learning experiences to formal development programs at Deloitte University, our professionals have a variety of opportunities to continue to grow throughout their career. Explore Deloitte University, The Leadership Center.Benefits At Deloitte, we know that great people make a great organization. We value our people and offer employees a broad range of benefits. Learn more about what working at Deloitte can mean for you.Deloitte’s culture Our positive and supportive culture encourages our people to do their best work every day. We celebrate individuals by recognizing their uniqueness and offering them the flexibility to make daily choices that can help them to be healthy, centered, confident, and aware. We offer well-being programs and are continuously looking for new ways to maintain a culture where our people excel and lead healthy, happy lives. Learn more about Life at Deloitte. Corporate citizenship Deloitte is led by a purpose: to make an impact that matters. This purpose defines who we are and extends to relationships with our clients, our people and our communities. We believe that business has the power to inspire and transform. We focus on education, giving, skill-based volunteerism, and leadership to help drive positive social impact in our communities. Learn more about Deloitte’s impact on the world. Recruiter tips We want job seekers exploring opportunities at Deloitte to feel prepared and confident. To help you with your interview, we suggest that you do your research: know some background about the organization and the business area you’re applying to. Check out recruiting tips from Deloitte professionals.As used in this posting, “Deloitte” means Deloitte Consulting LLP, a subsidiary of Deloitte LLP. Please see www.deloitte.com/us/about for a detailed description of the legal structure of Deloitte LLP and its subsidiaries. Certain services may not be available to attest clients under the rules and regulations of public accounting. All qualified applicants will receive consideration for employment without regard to race, color, religion, sex, sexual orientation, gender identity, national origin, age, disability or protected veteran status, or any other legally protected basis, in accordance with applicable law."	"10 days ago"	"character(0)"	2018-10-15	"Washington%2C+DC"	60
"https://www.indeed.com/viewjob?jk=5901fbd81e3119f4"	"Senior Data Scientist"	"American Nurses Association, Inc"	"45 reviews"	"$90,000 - $134,000 a year (Indeed Est.) Business Unit: American Nurses Credentialing Center Department: Measurement Services Salary Grade: 14 Employee Referral Bonus Amount: $500.00 TO APPLY: Apply online or email resume to chet.reisler@ana.orgKey technical expert, accountable for exam performance and psychometrics, resolution of data issues, and research addressing ANCC strategic goals. Leads efforts and provides consultation for MS staff to resolve data problems and establish data quality standards; develops presentations and publications for departments, Board of Directors, Commission on Certification, and other stakeholders; and proposes resources to support MS research activity. Serves as an expert in test development, scoring, research, and quantitative analyses. Develops software applications, programming, and syntax for report generation, statistical analyses, and graphic representations. Conducts quality assurance on scores, item functioning, and psychometric properties of exams. Drafts research reports. Ensures validity, reliability, and psychometric soundness of certification exams, using established industry and best practices.DUTIES:Conduct ongoing analysis of data systems. Review data management plans, revisions, and specifications and provide feedback. Plan and lead research (e.g., job analysis, validation, survey sampling, speededness and readability, test security, calibration, equating) to enhance exam performance, customer services, and product line as well as inform strategic planning. Monitor and evaluate item performance, differential item functioning, item drift, and exam psychometrics. Program for advanced statistical analyses using software programs (e.g., SAS, SPSS, Winsteps, R, SQL). Create and implement report generation, data collection, and sampling plans; develop conceptual frameworks for research and analyses; and recommend and adapt analytical and statistical methods. Identify strategies to generate useful feedback for examinees. Draw conclusions from research and make recommendations. Provide results, conclusions, and visuals and present to internal and external stakeholders (e.g., Executive Leadership, Boards of Directors, Commissions/Councils, program staff, governmental agencies, members of credentialed organizations). Travel as needed to deliver presentations at various venues or to meet with potential or current stakeholders. Plan and lead test development activities (e.g., standard setting, item and exam performance, exam field testing, form building). Facilitate focus groups, prepare meeting materials, review materials created by colleagues, analyze data, and write technical research reports and summaries. Coordinate with colleagues, subject matter experts, and vendors. Ensure compliance with industry best practice and accreditation requirements of ANCC certification programs. Maintain all necessary documentation in support of accreditation requirements. Establish data quality standards in collaboration with program staff. Troubleshoot issues and data errors. Consult with program staff on data preparation and data coding problems and assist in developing means for correcting the problems. Propose tools and resources to support research activity and enhance data system operations. Collaborate with ANA IT staff to evaluate and implement potential enhancements, to resolve quality assurance issues, and to ensure data systems are operational. Perform functional, cost-benefit, and risk analysis to support design changes. Assess risks and recommend mitigation strategies. Perform other duties as assigned to support the department’s objectives and strategic goals.QUALIFICATIONS REQUIREDEducationMaster’s degree (Ph.D. preferred) in industrial-organizational (I/O) psychology, testing and measurement, psychometrics, mathematics, research and statistics, or related field, with emphasis on quantitative analyses.Related Work ExperienceFive years of professional experience. Two years of assessment development, psychometrics, data management and analyses, and technical report writing.SkillsResearch design and completion Data collection, utilization, validation, security Data management and visualization Advanced data analysis (e.g., scaling and equating [CTT or IRT], simulation, sampling) Choosing and applying appropriate analysis techniques Test construction, development of alternative items, and test validation Meeting facilitation Oral and written communication Advanced use of office computer software (e.g., Microsoft Word, Excel, PowerPoint) and database and statistical software (e.g., SAS, SPSS, R, SQL) Analytical thinking Technical documentation and report writing Producing concise, high-level summaries and briefings to non-technical audiences Identifying and using emerging technologies"	NA	"$90,000 - $134,000 a year (Indeed Est.) "	2018-10-15	"Washington%2C+DC"	60
"https://www.indeed.com/viewjob?jk=d85de6a45ca9f5b7"	"Data Analytics Specialist"	"PCAOB"	"15 reviews"	"PCAOB oversees the audit of public companies and SEC registered brokers and dealers in order to protect investors and further public interest in the preparation of informative, accurate and independent audit reports.Play a significant role in PCAOB's increasing focus on data analytics, using predictive data analytics to improve the effectiveness and efficiency of our inspection process and continuous monitoring. The individual in this role will work closely with other divisions, inspection teams, data scientists, key management and collaborate with the IT Division.Qualifications for this role:Eligible to work in the US without sponsorship now or in the futureBachelor's Degree in Math, Computer Science, Information Management, Statistics or related fieldMinimum of 7 years experience in a relevant role, understanding of relational databases and associated query/extraction languagesKnowledge of Python and/or R, SAS and SQLStrong organizational, time management skills, a team playerAbility to build credibility, solve problems quickly and communicate clearlyDemonstrated ability to think strategically, including the ability to translate long-term goals and objectives into short-term tactical plans and operational activitiesJob Type: Full-timeExperience:data analysis, quantitative: 7 years (Required)Python, and/or R, SAS and SQL: 5 years (Required)Education:Bachelor's (Required)Location:Washington, DC (Required)Work authorization:United States (Required)"	"11 days ago"	"character(0)"	2018-10-15	"Washington%2C+DC"	60
"https://www.indeed.com/viewjob?jk=cd1a2c83ec95023e"	"Systems Analyst/Data Scientist"	"Radiant Solutions"	"24 reviews"	"Responsibilities Got a head for numbers? Like turning real world problems into mathematical representations and checking to see if you did it right? If you like that, you’ll love developing algorithms with us! Our customers have some of the most interesting needs and hardest challenges to resolve. Our solutions require integrated models based on large and varied datasets. Our simulations feed analytic applications so that we can extract patterns and behaviors obscured within the data. We need systems analysts/data scientists of all experience levels to staff positions supporting the defense and intelligence communities. Radiant Solutions is currently staffing multiple projects with analysts who have diverse backgrounds and experiences from the open source, defense and intelligence communities, and commercial industry. Note: US citizenship and an active TS/SCI clearance is mandatory for this position and required for consideration. Why us?We build advanced algorithms to gain analytic insights from imagery and geospatial data.We enable machine learning systems, automate workflow, and design and develop custom applications for unique national-security missionsWe provide training to expand your skills and challenges to develop themOur client’s missions are vital to national security, so we’re mission-first alwaysOur work environment is relaxed business casualBecause at our core we believe and practice social responsibility. Qualifications You have to have these: - US citizenship and an active TS/SCI clearance - if you have a current polygraph, even betterBachelor's degree, or higher in Engineering, Math, Physics, Computer Science, or equivalentDevelopment experience in a Linux/Unix/Windows environmentExperience in at least one of these languages: R, VBA, Java, C++, SQL, PythonExperience developing and testing modelsCapability to work effectively in a geographically distributed development team We’d really like it if you had:Master’s degree, or higher in Engineering, Math, Physics, Computer Science, or equivalentGraduate experience working with probabilistic and stochastic statistical analysis or computational intelligenceExperience conducting model feasibility research and algorithm development for machine learningExperience with distributed datasets and experience analyzing both relational and NoSQL data structuresLeading and mentoring small teams from project inception through deploymentExperience working in an Agile environment, especially SAFe #cjpost Overview Join our company whose purpose is to help national security and commercial organizations understand and navigate our changing planet. Radiant Solutions provides multi-source data collection, enrichment, and analytic capabilities that reveal unique geospatial information and insights where and when it matters most. No other company has such strong roots in geospatial with our level of scale and a strong commercial mindset. We are well known for delivering innovative capabilities across the entire geospatial intelligence value chain. Our combined team of over 1,000 aerospace engineers, geospatial analysts, weather and ocean experts, software developers, data scientists, and DevOps engineers apply disruptive technologies and our unique intellectual property to both national security and commercial problems. We offer an excellent comprehensive benefits package including medical, dental, life, and short/long-term disability insurance, vacation and sick leave, 401(k) retirement plan, flexible spending account, and tuition assistance. Radiant Solutions values diversity in the workplace and is an equal opportunity/affirmative action employer. All qualified applicants will receive consideration for employment without regard to sex, gender identity, sexual orientation, race, color, religion, national origin, disability, protected veteran status, age, or any other characteristic protected by law."	NA	"character(0)"	2018-10-15	"Washington%2C+DC"	60
"https://www.indeed.com/viewjob?jk=cce2551bd3997441"	"Data Scientist"	"Radiant Solutions"	"24 reviews"	"Responsibilities Radiant Solutions is growing and we are looking for motivated data evangelists who are passionate about delivering new and innovative solutions for our customers. The ideal candidate needs limited direction, is passionate about technology and is curious about earth sensing and the new space economy. We are seeking a data scientist for our applied modeling team. You will be applying the latest machine learning techniques to extract insights from geospatial data. You will have access to an enormous corpus of training data and will work to build the best models through bake-offs, hyperparameter searching, and incremental learning techniques. You will quantitatively assess model performance and document the overall life-cycle. You will work with other members of the data science and engineering teams to improve data science products and experiences. Additionally, you will be developing rapid prototype solutions as needed for the focused collection, parsing, managing, analyzing, and visualizing large sets of disparate data to extract meaningful insights.Qualifications 2-5 years experience designing, implementing, training, evaluating, and optimizing algorithms based on state-of-the-art machine learning techniques Experience with applying deep learning for computer vision and natural language processing. Experience with major deep learning framework such as Caffe, CNTK, Theano, Torch, and Tensorflow. TS/SCI with active poly #cjpost Overview Join our company whose purpose is to help national security and commercial organizations understand and navigate our changing planet. Radiant Solutions provides multi-source data collection, enrichment, and analytic capabilities that reveal unique geospatial information and insights where and when it matters most. We are a new organization but no company has such strong roots in geospatial with our level of scale and a strong commercial mindset. Our heritage companies, MDA Information Systems, RadiantBlue, DigitalGlobe Intelligence Solutions, and HumanGeo are well known for delivering innovative capabilities across the entire geospatial intelligence value chain. Our combined team of over 1,000 aerospace engineers, geospatial analysts, weather and ocean experts, software developers, data scientists, and DevOps engineers apply disruptive technology and our unique intellectual property to both national security and commercial problems. We offer an excellent comprehensive benefits package including medical, dental, life, and short/long-term disability insurance, vacation and sick leave, 401(k) retirement plan, flexible spending account, and tuition assistance. Radiant Solutions values diversity in the work place and is an Equal Opportunity Employer."	NA	"character(0)"	2018-10-15	"Washington%2C+DC"	60
