"url"	"title"	"company_name"	"company_score"	"description"	"time_posted"	"metadata"	"date_scraped"	"city"	"page"
"https://www.indeed.com/viewjob?jk=51013d1cd86d68ad"	"Senior Data Scientist"	"Indeed"	"354 reviews"	"Our mission:
As the world’s number 1 job site, our mission is to help people get jobs. We need talented, passionate people working together to make this happen. We are looking to grow our teams with people who share our energy and enthusiasm for creating the best experience for job seekers.
The team:
We are a rapidly growing and highly capable engineering team building the most popular job site on the planet. Every month, over 200 million people count on us to help them find jobs, publish their resumes, process their job applications, and connect them to qualified candidates for their job openings. With engineering hubs in Seattle, San Francisco, Austin, Tokyo and Hyderabad, we are improving people's lives all around the world, one job at a time.
Your job:
As a Data Scientist at Indeed your role is to follow the data. Analyze, visualize, and model job search related data. You will build and implement machine learning models to make timely decisions. You will have access to unparalleled resources within Indeed to grow and develop both personally and professionally. We are looking for a mixture between a statistician, scientist, machine learning expert and engineer: someone who has passion for building and improving Internet-scale products informed by data. The ideal candidate understands human behavior and knows what to look for in the data.
About you:
Requirements

*

Ph.D. or M.S. in a quantitative field such as Computer Science, Operations Research, Statistics, Econometrics or Mathematics
*

Expertise in machine learning and statistical modeling
*

5+ years professional or research experience in data science
*

Passion to answer Product/Engineering questions with data
*

Demonstrated mentorship experience

We get excited about candidates who

*

Have full stack experience in data collection, aggregation, analysis, visualization, productionization, and monitoring of data science products
*
Can do small data modeling work: R, Python, Julia, Octave
*
Can do big data modeling work: Hadoop, Pig, Scala, Spark
*
Can fish for data: SQL, Pandas, MongoDB
*
Can deploy data science solutions: Java, Python, C++

Indeed provides a variety of benefits that help us focus on our mission of helping people get jobs.
View our bounty of perks: [1] http://indeedhi.re/IndeedBenefits"	"8 days ago"	"character(0)"	2018-10-15	"San+Francisco%2C+CA"	40
"https://www.indeed.com/viewjob?jk=a873f3de5a57c49d"	"Director of Analytics and Data Science"	"MasterClass"	"4 reviews"	"$119,000 - $152,000 a year (Indeed Est.) Who we are:
MasterClass is transforming online education by enabling anyone in the world to learn from the very best. We are deconstructing what makes an actor able to cry on demand, how an athlete defies gravity, and what it takes to write a bestseller. Our online learning content is available to students anywhere anytime, which supports our mission to democratize education.

We are a quickly growing VC-funded startup based in San Francisco and have created online classes taught by famous masters—Serena Williams, James Patterson, Annie Leibovitz, Usher, Christina Aguilera and many more to come.

Since launching in 2015, we are growing our team. Apply now to find out more about what we are doing behind the scenes.
What we are looking for:
MasterClass is seeking a Director of Analytics and Data Science to build and lead a new Analytics & Data Science team. As the founding member of the team, you will have the opportunity to establish how we process and analyze data throughout the company. You will build your team of analysts and data scientists from the ground up. You will own all recurring reporting and business intelligence systems and work with leaders throughout the company. This is a strategic role for MasterClass as data is at the center of our operations and decisions.
Responsibilities of the role:You will be responsible for all recurring reporting across the business
You will be responsible for driving data insights for various teams
You will be responsible for driving our data science strategy, including creating recommendation engines, predictive churn models, and other high leverage models
You will partner with other leaders across the company, including product, engineering, marketing, strategy & insights, operations, and content to understand their analytical needs and then develop the reports/dashboards that meet those needs
You will build-out a team of analysts and data scientists who will partner with various organizations on their specific needs
You will be selecting and implementing the visualization and reporting tools for the organization & defining the processes from the ground up
You will drive ad-hoc analysis and reporting when needed
Requirements:You have 7+ years of experience in analytics with increasing responsibility and strong track record of managing teams
You have previous experience in SQL and R or Python skills
You are excited to join a fast growing team where data is at the center of what we do
You are as comfortable talking deeply about data/statistics as you are with describing the results to executives
You thrive on empowering your team and view the team's success as your own
Experience in e-commerce and/or subscription media businesses is a major plus

At MasterClass, we believe we put our best work forward when our employees bring together ideas that are diverse in thought. We are proud to be an equal opportunity workplace and are committed to equal employment opportunity regardless of race, color, religion, national origin, age, sex, marital status, ancestry, physical or mental disability, genetic information, veteran status, gender identity or expression, sexual orientation, or any other characteristic protected by applicable federal, state or local law. In addition, MasterClass will provide reasonable accommodations for qualified individuals with disabilities. If you have a disability or special need, we would like to know how we can better accommodate you."	NA	"$119,000 - $152,000 a year (Indeed Est.) "	2018-10-15	"San+Francisco%2C+CA"	40
