"url"	"title"	"company_name"	"company_score"	"description"	"time_posted"	"metadata"	"date_scraped"	"city"	"page"
"https://www.indeed.com/viewjob?jk=ce9a1cbf356bd4dc"	"Data Scientist, Group Benefits and Middle Market P&C"	"The Hartford"	"1,449 reviews"	"Overview of the Position The Hartford seeks energetic and passionate Data Scientists to focus on designing, developing and implementing solutions that will make an impact on our business. This role will focus on developing solutions in support of our Middle Market and Group Benefits business. In addition the Data Scientist will participate in a variety of ad hoc projects. Our Data Scientists play a significant role by both leading and partnering with the business and data teams for a better understanding of the customer journey across multiple lines of business. As a Data Scientist you will focus on research for deliverables that support the long term plan to evolve the department’s capabilities to further develop and deliver impactful products to drive outcomes for both the business and clients. Solutions that are developed will support a wide range of business areas which include underwriting, claims, operations, risk engineering, and digital analytics. As a Data Scientist you will focus on developing analytic and predictive modeling solutions that feature engineering assets, experimental design, as well as modeling techniques and abilities. Our Data Scientist toolbox consists of but not limited to predictive Modeling Techniques, Machine Learning, Cognitive Computing, Unsupervised learning, and Augmented intelligence. As a Data Scientist you will support and explore those assets overtime through customer adoption and establishing a rhythm within the data science community. Responsibilities: Collaborate and partner with business stakeholders in a way that supports the vision and sustains a culture that treats analytics as a corporate asset. Participate in reviewing work with partners on an ongoing basis to calibrate deliverables against expectations Help identify long term opportunities within the customer journey through the creation of algorithms and machine learning techniques to achieve financial objectives and solve problems. Participate in the creation and deployment of long term tools to continually evolve the business. Assist in identifying and assessing the value of new data sources and analytical techniques to ensure ongoing competitive advantage Contribute to the successful implementation of strategies to achieve targeted business objectives. Accountable for short term ownership and evolution of models developed Support the processes used to develop and enhance our business needs Support a high-performance collaborative culture Develop knowledge of The Hartford's formal and informal structures, business processes, and data sources in your area of expertise Remain current on research techniques and become familiar with state of the art tools applicable to your function Present complex modeling to Senior Data Scientists that maximizes the bottom-line impact of modeling results Provide economic, qualitative, and statistical support to ensure accuracy of characteristics and metrics being applied to business decisions. Assist in estimating the economic impact of operational decisions Promote analytics opportunities of the company with customers and business partners. As requested, provide timely feedback and opportunities for your colleagues. Suggest and participate in training opportunities for research staff and others in the organization Qualifications Experience & Skills Master’s or Ph.D. in Statistics, Applied Mathematics, Actuarial Science, Quantitative Economics or other similar analytical field 2+ years of relevant experience in Research Function in Insurance or Financial Services or related field. Experience in large scale operations environments (Claim Centers, Call Centers, Manufacturing) a plus. Technical/Functional Skills Experience modeling data and analytical capability. Advanced coding skills in various languages e.g. R, Python etc. Developed verbal/written communication skills. Ability to translate complex technical topics into business solutions and strategies, including visualization. Exposure to executing change to core business processes through the innovative use of quantitative techniques. Competencies Drive and commitment to what is necessary to get the job done efficiently, thoroughly, and professionally. Innovative. Seeks new and creative ways to approach analytical exercises and development projects. Results-oriented. Demonstrates a sense of urgency and accountability for business issues. Customer focused. Builds effective relationships within the data science community Equal Opportunity Employer/Females/Minorities/Veterans/Disability/Sexual Orientation/Gender Identity or Expression/Religion/Age ** NO AGENCIES PLEASE **Job Function : Data Science Primary Location : United States-New York Other Locations : United States-Connecticut-Hartford Schedule : Full-time Job Level : Individual Contributor Education Level : Master's Degree (±18 years) Job Type : Standard Shift : Day Job Employee Status : Regular Overtime Status : Exempt Travel : No Job Posting : Oct 8, 2018, 7:37:49 PM Remote Worker Option : No"	NA	"character(0)"	2018-10-15	"New+York%2C+NY"	10
"https://www.indeed.com/viewjob?jk=761eb2ae63b51480"	"Data Scientist"	"Biz2Credit Inc."	"-"	"$50,000 - $65,000 a yearAbout the Role: This is a rare opportunity to join a small but fast-growing team, where you will play a major role in shaping Biz2Credit’s future. We’re looking for an exceptional candidate that is excited about the opportunity to build a next-generation financial services business. We believe that there is a tremendous opportunity to leverage cutting-edge data science to inform smarter, faster decision making.As a Biz2Credit Data Scientist, you will shape the company’s data-centric culture, work closely with our engineering team to develop our analytics infrastructure, and collaborate closely with our Chief Data Officer on developing, validating, and automating our customer conversion and underwriting models. While a background in financial services is not required, you must be passionate about tackling complex data challenges for the benefit of small and medium businesses everywhere.YOU WILL:Drive the ongoing advancement and refinement of Biz2Credit’s credit decisioning & pricing model - optimizing risk and return while dramatically reducing decision cycle times.Continuously evaluate alternative data sources and structures to document and improve the efficacy of our customer conversion models and processes.Harness the power of Biz2Credit’s technology to proactively identify emerging risks as well as opportunities with our customers.Play a leadership role in the design and implementation of ongoing operational and risk reporting and analytics.Work on data projects and proposals involving Biz2Credit’s financial services partners worldwide (banks, non-banks, debt investors, equity investors and others) to analyze, classify and visualize credit-related dataWE'RE LOOKING FOR SOMEONE WITH:Degree in Statistics, Applied Mathematics, Engineering, Computer Science or other quantitative fields from leading university; Advanced degree preferred2- 4 years experience performing quantitative analysis within self-directed roles.Practical hands-on experience in the development and implementation of new predictive models and comfortable in learning new statistical tools and techniques.Ability to visualize and communicate sophisticated data and models to all audiences.Specific demonstrated experience, knowledge, accuracy and speed of execution in Powerpoint, Excel, Excel VBA and R (knowledge of other programming knowledge and/or Stata is a plus) Highly motivated, versatile, capable of working independently with demonstrated initiativeJob Type: Full-timeSalary: $50,000.00 to $65,000.00 /yearExperience:STATA: 1 year (Preferred)Quantitative Analysis: 1 year (Preferred)Excel: 1 year (Preferred)Microsoft Powerpoint: 1 year (Preferred)R: 1 year (Preferred)Education:Bachelor's (Preferred)Work authorization:United States (Required)"	"19 days ago"	"$50,000 - $65,000 a year"	2018-10-15	"New+York%2C+NY"	10
"https://www.indeed.com/viewjob?jk=ff5e722fe93fc117"	"Replenishment Manager"	"Macy's"	"26,659 reviews"	"Job Overview: Manage a multi-million dollar business and make critical decisions that maximize sales and margin. With responsibilities for both brick-and-mortar stores, e-commerce and our omnichannel single view of inventory (SVI), you’ll take an innovative and holistic approach to planning. You’ll also be part of our groundbreaking My Macy’s strategy, customizing assortments based on location and customer preference. The Replenishment Manager role requires the ability to collaborate with Merchants and translate market, customer and financial data into strategies that will allow Macy’s to maximize sales, inventory and bottom line profitability to compete differently in a changing retail environment. The position requires a high level strategic thought process, exceptional business acumen, strong understanding of Merchandising and Planning, and the ability to own his/her business. A fundamental requirement is to be able to build trust with their teams and key collaborators. Perform other duties as assigned. IDEAL CANDIDATE PROFILE The Replenishment Manager will be known as a trusted, collaborative and results-oriented business partner who can lead through influence and who possesses professional maturity and ability to build strong partnerships. The ideal candidate needs to be comfortable and effective at optimizing system usage that maximizes sales, inventory, and bottom line profitability. Candidates must be comfortable with quickly evaluating and sun-setting legacy approaches that no longer align to the strategy. The ideal candidate will be known for both vision and an equally strong orientation for speed.Essential Functions:Understanding of many functions including: Buying, Planning, Private Brands, Stores, Online, and Marketing.Understanding of financial performance metrics and assortment planning.Highly proficient in leveraging customer and trend data to inform both strategy and decision making.Identify exceptions and update systems within strategic guardrails.Build seasonal replenishment profiles to comprehend customer preferences.Operate systems within inventory guidelines to develop orders and financial planning inputs.Develop sales forecasts for replenishment products.Manage risk optimization, demand forecasting and service level in support of inventory strategy.Run and interpret reports.Maintain products and marketing understanding for respective Family of Business.Partner with Data Scientists to inform replenishment strategies across division.Define automation criteria and work with the business to manage exceptions.Set parameters in forecast systems.Collaborate with the Merchandising and Planning organizations to develop replenishment inventory strategy.Maintain ongoing relationships with key stakeholders in Merchandising and Planning to account for changes in marketing strategies, calendar/even shifts, product introductions, discontinuations through weekly, monthly, and seasonal meetings.Partner with the key stakeholders regarding strategic system changes that will have financial impact on the business.Regular, dependable attendance and punctuality. Qualifications: Education/Experience:Bachelor's Degree (Business, Finance or equivalent.3-plus years of experience in complex, best-in-class consumer and lifestyle oriented companies. Advanced Proficiency with MS Excel, including advanced formulas and pivot tables.Previous experience with a Forecasting and Replenishment Planning system. Experience working across multiple organizational boundaries.Track record of driving growth, fostering the respect of key business partners.Preferences: Experience with Teradata DCM (Demand Chain Management). Knowledge of SQL Programming. Experience with Tableau. Macros and VBA coding. Communication Skills:Excellent written and verbal communication skills with the ability to influence. Mathematical Skills:Basic math functions such as addition, subtraction, multiplication, division, and analytical skills.Strong analytical and excel skills. Reasoning Ability:Must be able to work independently with minimal supervision and make sound decisions. Physical Demands:This position involves regular walking, standing, sitting for extended periods of time, hearing, and talking. May occasionally involve stooping, kneeling, or crouching. May involve close vision, color vision, depth perception, focus adjustment, and viewing computer monitor for extended periods of time. Involves manual dexterity for using keyboard, mouse, and other office equipment. May involve moving or lifting items under 10 pounds. Other Skills: LEADERSHIP PROFILE: Inspires, motivates, and influences the behavior of others to drive high performance.Engages team to examine current practices and encourages creative thinking about how things could be more effective and efficient.Asserts own ideas and persuades others in a clear, confident, and composed manner. Tailors message for the audience and is able to gain support and commitment from others.Comfortable with taking risks and celebrating risk taking regardless of outcome.Collaborative, consultative style with a strong ability to establish trust and build relationships across all levels and functions of the organization. Resilient, tenacious, high energy. Able to rapidly bounce back from adversity.Embraces change with realistic optimism and persists through challenges and setbacks caused by change. Work Hours:Ability to work a flexible schedule based on department and company needs. This job description is not all inclusive. Macy’s Inc. reserves the right to amend this job description at any time. Macy's Inc. is an Equal Opportunity Employer, committed to a diverse and inclusive work environment."	"23 days ago"	"character(0)"	2018-10-15	"New+York%2C+NY"	10
"https://www.indeed.com/viewjob?jk=0e7e36fccde84f3b"	"Data Scientist, Marketing Effectiveness"	"Harnham"	"6 reviews"	"$110,000 - $130,000 a yearData Scientist, Marketing EffectivenesseCommerce Buying & SellingNew York City$110,000 - $130,000 Do you want to join a rapidly growing eCommerce Buying & Selling company who have had over 75 million unique downloads of their app across the globe in the last 2 years alone? Described as one of the hottest start-ups to work for in NYC with features in the New York Times and The Today Show among many, this company is revolutionizing the way people buy and sell products online. As a result, they have had a huge amount of investment and are looking for a highly skilled Data Scientist with a background in marketing effectiveness and forecasting in open source technologies, including Python, SQL and R to optimize their marketing spend to achieve key business goals? If you're looking for a new challenge and have experience in the end-to-end marketing analytics cycle, specifically in the offline space, then this could be the next step for you. THE ROLE: As a Data Scientist, Marketing Effectiveness, you will be proactively involved in managing all the marketing channels, performing highly statistical analysis to understand how effective each channel of communication is for the business to optimize marketing spend and ROI. You will be part of a team of 4 Data Scientists, but be the sole person focusing on all marketing effectiveness capabilities for this growing business. You will focus on: Understanding all of the company's marketing constraints across all channels of engagement building Marketing Mix and multi-touch attribution models in R to understand how effective their TV, Radio, Newspaper and Social channels are Making recommendations on how to increase their marketing efficiency, effectiveness, and ROI by which clients they partner with, as well as where and when they advertise across the diverse channel base Working with diverse teams across the business including Marketing, Sales and BI teams, as well as the wider Data Science team across the glove to ensure that the quality of the data and models are of the highest standard Delivering insights and recommendations to diverse stakeholders on how to improve their marketing performance and increase customer engagement YOUR SKILLS AND EXPERIENCE: Degree educated in a numerical discipline such as Math, Stats, Computer Science or similar Experienced in building market mix and multi-touch attribution models in R as well as strong SQL coding/python background Proven experience in building and maintaining relationships, as well as delivering insights and recommendations to C-Level stakeholders Project management capabilities, with a strong business acumen are essential BENEFITS: As a Data Scientist, Marketing Effectiveness, you can expect to earn up to $130,000 (depending on experience), plus competitive benefits."	NA	"$110,000 - $130,000 a year"	2018-10-15	"New+York%2C+NY"	10
"https://www.indeed.com/viewjob?jk=62b565a5dbd73cc4"	"Data Scientist"	"Datadog"	"7 reviews"	"At Datadog, we're on a mission to build the best monitoring platform in the world. We operate at high scale—trillions of data points per day—and high availability, providing always-on alerting, visualization, and tracing for our customers' infrastructure and applications around the globe. Our engineering culture values pragmatism, honesty, and simplicity to solve hard problems the right way. We need you to design and build machine learning-powered products that help our customers learn from their data and make better decisions in real-time. You will have a fantastic team of data engineers to support you, a collaborative environment to encourage your work, and the best technologies for performing data science at high scale in your toolkit. Join us to build powerful, intelligent data systems. In a typical week as a Data Scientist, you might: Present the latest academic research papers to your team. Research and benchmark the latest algorithms that can be used for our particular use-cases. Apply machine learning algorithms and statistical techniques to build new product features. Deploy a new feature to production, instantly affecting customers with your work. Mentor other data scientists on your team. Explore and find meaning in extremely high volumes of data. Investigate and fix a production issue from a service your team owns. Requirements You have 2 + years professional experience You are fluent with SQL / relational algebra. You have mastered working with data in a language such as Python, R, or Julia. You've done data science at high scale with tools like Hadoop and Spark. You have backend programming experience in one or more languages. You have significant experience applying machine learning to real business problems. You want to work in a fast, high-growth startup environment and thrive on autonomy. You care about code simplicity and performance. You have a BS/MS/PhD in a scientific field or equivalent experience. You can explain complex ideas and algorithms in understandable ways. Bonus points You've written production data pipelines. You're familiar with time series analysis."	NA	"character(0)"	2018-10-15	"New+York%2C+NY"	10
"https://www.indeed.com/viewjob?jk=df5d102963fa0151"	"Junior Data Scientist"	"Interactive Brokers"	"27 reviews"	"Job Description and Responsibilities Interactive Brokers Group (IBG) is looking for a junior data scientist. The successful candidate will execute analytical tasks on large data sets to support decision makers and provide insight and reports about our platforms. The junior data scientist role will use data to help us better understand who our clients are, how they engage with our products and services and how we can better serve them by identifying interesting and useful trends in our data. You will make an impact by using your passion for data and analysis to generate actionable insights that we will use to improve the experience for our clients. The position responsibilities include but are not limited to: Collect and analyze various telemetry and behavioral data Produce daily metrics and reports Clean and prepare data for Machine Learning and AI Assist with designing and running A/B tests Automate frequently used reporting and data analysis workflows Work closely with software engineers and architects to extract, transform and standardize data for optimal use for analytic toolsQualifications Bachelors in Computer Science, Mathematics, Statistics; Masters strongly preferred 2+ years' experience in a data science or data analysis role 2+ years Java coding exprience 2+ years mining and analyzing data sets to extract meaningful trends, producing meaningful and actionable reports Experience using statistical programming languages, machine learning and other toolkits and techniques for analyzing large, complex datasets Technical proficiency with transforming structured and unstructured data sets Strong analytical skills, attention to detail and accuracy Expert problem solving skills and creative thinking ability This is not a position for which non-US work visa sponsorship will be provided. Company Overview Interactive Brokers Group, Inc. (NASDAQ GS: IBKR); is a direct access electronic broker catering to the needs of professional and frequent traders, institutional investors, financial advisors, and introducing brokers. Our clients have access to more than 120 market centers in 26 countries from a single account. We are the lowest cost provider of brokerage services and the largest U.S. electronic broker based on daily average revenue trades executing 797,000 trades per day.¹ Our employees are part of a dynamic, multinational, fast-paced, results-oriented team working to provide our customers with state-of-the-art trading technology, superior execution capabilities, worldwide electronic access, and sophisticated risk management tools. ¹Figures as of June 30, 2018."	"26 days ago"	"character(0)"	2018-10-15	"New+York%2C+NY"	10
"https://www.indeed.com/viewjob?jk=b37eddff17c9d421"	"Data Scientist"	"Capgemini"	"5,866 reviews"	"Short Description About Capgemini A global leader in consulting, technology services and digital transformation, Capgemini is at the forefront of innovation to address the entire breadth of clients’ opportunities in the evolving world of cloud, digital and platforms. Building on its strong 50-year heritage and deep industry-specific expertise, Capgemini enables organizations to realize their business ambitions through an array of services from strategy to operations. Capgemini is driven by the conviction that the business value of technology comes from and through people. It is a multicultural company of 200,000 team members in over 40 countries. The Group reported 2017 global revenues of EUR 12.8 billion. Visit us at www.capgemini.com. People matter, results count. Job Title: Data Scientist Position Type: Permanent/Fulltime Natural Language Processing (NLP). Deep Reinforcement Learning, Unsupervised Learning, and Generative models. Computer Vision. Recurrent Neural Networks, Sequence Learning and Sequence Analysis Employ the best of Machine Learning research for solving business problems in Banking and Capital Market. Build and refine machine Learning/deep learning algorithms that can find “useful” patterns in large multi-modal data (particularly, images, text, conversations, and transactional data). Communicate (both oral and written) with clients For more senior candidates: Lead, inspire and mentor junior scientists and research assistants / interns Employ the best of Machine Learning research for solving business problems in Banking and Capital Market. Build and refine machine Learning/deep learning algorithms that can find “useful” patterns in large multi-modal data (particularly, images, text, conversations, and transactional data). Communicate (both oral and written) with clients For more senior candidates: Lead, inspire and mentor junior scientists and research assistants / interns An advanced degree in a numeric discipline (e.g., Statistics, Machine Learning, Computer Science, Engineering, and Physics). Scientific expertise, strong track record, and real-world experience in Machine Learning and Deep Learning, especially with hands-on experience in hyper-parameter tuning and deep construction / distribution (e.g., architecture design in DNN/CNN/RNN, parameter initialization, activation, normalization, and optimization). Expertise in programming (e.g., Python and C++) and computing technologies (high-performance computing, e.g., CUDA). Ability to use existing deep / machine learning libraries (e.g., Python, TensorFlow, Torch, Theano, Caffe, and scikit-learn). Experience with the data and platform aspects of the projects. Review, direct, guide, inspire the research of the more junior scientists in the team (especially applicable to more Disclaimer: Capgemini America Inc and its U.S. affiliates are EEO/AA employers. Capgemini conducts all employment-related activities without regard to race, religion, color, national origin, age, sex, marital status, sexual orientation, gender identity/expression, disability, citizenship status, genetics, or status as a Vietnam-era, special disabled and other covered veteran status. Click the following link for more information on your rights as an Applicant: http://www.capgemini.com/resources/equal"	NA	"character(0)"	2018-10-15	"New+York%2C+NY"	10
