"url"	"title"	"company_name"	"company_score"	"description"	"time_posted"	"metadata"	"date_scraped"	"city"	"page"
"https://www.indeed.com/viewjob?jk=0be51df787f069fa"	"Intern: Yield Analytics - Grower Data Modeling"	"The Climate Corporation"	"11 reviews"	"InternshipPosition Overview:
As the industry leader in connected acres, The Climate Corporation has a unique opportunity to help growers understand what factors most influence yield outcome by analyzing data across many thousands of fields and farm operations. From exploratory data analysis aimed at identifying and describing patterns of yield at various scales, to building models for diagnosing and predicting yield outcomes, the opportunity to leverage these datasets for advanced insights is at the core to our business.
We are looking for a intern to join a cross-functional group of data scientists and researchers to help drive analyses and build models that advance our understanding of crop performance at various scales of observation by leveraging on-farm data that include grower experiments, to better understand the value of agricultural input decisions at scale. This position will involve working with diverse datasets and a broad range of modeling approaches, ranging from simple statistical models to advanced machine learning approaches about economics/econometrics, along with other science disciplines, for their course of study.
What You Will Do:
Explore, munge, and model large and diverse datasets to solve business problems that deal with improving crop performance.
Research new methods of analyzing large and highly complicated data sets.
Combine traditional econometric tools with cutting edge machine learning techniques.
Implement and test algorithms and techniques relevant to achieving project objectives.
Summarize findings, make recommendations and effectively communicate the results of the analysis and the impact of the results on for the business.
Basic Qualifications:
Enrolled in a PhD or Masters Program in Statistics, Computer Science, Mathematics, or other physical science involving computationally intensive research during the duration of the internship
Skilled in the use of Python or R for research
Experience with exploratory data analysis and modeling using technologies such as Hadoop, MapReduce, or Spark
Understanding of basic econometrics and machine learning algorithms and their proper application to big data.
Preferred Qualifications:
Experience with agriculture or agricultural data.
Strong analytical, written and verbal communication skills.
What We Offer:
Our environment is extremely engaging and fast-paced, with a diverse set of top engineers, agronomists, and statisticians working together to provide the best possible products and experiences for our customers.
We offer competitive pay and perks.
We provide meals and a large assortment of snacks and drinks to get you through the day.
You’ll get 1:1 mentoring from a talented and motivated employee on your team.
You’ll have the opportunity to work on real projects with experienced employees and have a direct impact on the company. (Our internships are not summer camp!)
You’ll have the amazing opportunity to participate in one of our Biotechnology Tours where you get out of the office and into the field (literally) with agents and farmers.
You’ll work in an award-winning office with smart designs, large common areas and open floor plans that fuel collaboration.
You’ll attend various events, activities, and off-sites - we make sure interns are having fun!
We regularly host meet-up groups and tech-talks and encourage participation in relevant workshops and conferences
You’ll have the opportunity to interact with key executives and leaders.
Learn more about our team and our mission:
The Climate Corporation - The Technology Behind Making A Difference
https://youtu.be/c5TgbpE9UBI
#LI-DNP"	NA	"Internship"	2018-10-15	"Seattle%2C+WA"	90
"https://www.indeed.com/viewjob?jk=3854d5f4ef6e3149"	"Data Scientist, Fire TV Product Management"	"Amazon.com"	"27,831 reviews"	"Job Description
Fire TV is the #1 best-selling streaming media player in the U.S. As we grow our product selection, we are looking for a Senior Data Scientist to work in a data-driven product management team, helping define the user experience for our new Amazon Fire TV product line. In this role, you will have the opportunity to drive our user behavior analysis to help develop better methods for measuring business success and steering product vision. You will study user behavior in depth to validate critical features and user experiences. The role is inherently cross-functional: You will work closely with a high-energy team consisting of software engineering, data analytics, user experience, device marketing, customer service, and executive team members. This role is a good fit for someone who is creative yet highly data-driven and who has strong customer focus and ‘product sense’, combined with an established track record in user behavior analysis.
Key Responsibilities:Define and implement our user behavior analysis methodology and roadmapDevelop a reporting workflow for our product innovationInform our AB testing experimentation for product innovationBasic Qualifications
5+ years of work experience in deep data analysis and/or data science in consumer behavior at scale5+ years experience in consumer Internet technologies
- Deep statistical skills - ideally utilized in A/B testingExperience with distributed processing analytics tools (such as Hadoop, Hive, MapReduce, Spark)Experience working with product teams to inform product choicesExperience in user behavior analysisCustomer obsessed and highly curiousPreferred Qualifications
Experience in media entertainment user behaviorStrong strategic aptitude; ability to define and measure success of a product or feature based on user behavior analysis on large data setsExcellent customer experience intuition; demonstrated success in inventing innovative and user-friendly productsAt your best in a dynamic and rapidly changing environmentStrong programming skillsPassion for home entertainment
Amazon.com is an Equal Opportunity-Affirmative Action Employer – Minority / Female / Disability / Veteran / Gender Identity / Sexual Orientation"	NA	"character(0)"	2018-10-15	"Seattle%2C+WA"	90
"https://www.indeed.com/viewjob?jk=3a9e6d662a59e2e6"	"Data Scientist (Neural Networks)"	"Neal Analytics"	"-"	"ContractJob SummaryData ScientistDo you like working with amazing people and cutting-edge technology? Do you want to work on the frontier of Data Analysis, Neural Networks, Machine/deep learning, and image, audio, and textual analytics? Then we have the perfect project for you!Responsibilities and DutiesNeal Analytics is a Gold partner to Microsoft and a leading Data Science and Analytics firm in the Northwest seeking a Data Scientist who has commercial client experience with voice, image, and video analytics.The ideal candidate will have a strong data science background and follow established processes to develop models and statistical analysis while effectively working in a collaborative team environment.Required Experience, Skills and QualificationsQualification Requirements:* Building models using first principals, e.g., CNN, RNN, NN* Training models with terabit (or larger) size data sets* Experience with TensorFlow and CNTK* Worked with digital signal processing approaches* Solid experience with text analytics, OCR, elastic search* Work with Software Development Engineers, Data Engineers, and Application developers to execute tasks/projectsEducation:* PhD level competency in math, stats, or computer science* Proven track record developing advanced analytical tools* Work experience in a consulting setting is a plusJob Type: ContractExperience:TensorFlow: 6 years (Required)Microsoft Cognitive Toolkit (CNTK): 6 years (Required)Artificial neural network: 6 years (Required)recurrent neural networks (RNN or RecNet): 5 years (Required)neural network frameworks: 6 years (Required)convolutional neural network (CNN, or ConvNet): 5 years (Required)Location:Redmond, WA (Required)Work authorization:United States (Required)"	NA	"Contract"	2018-10-15	"Seattle%2C+WA"	90
"https://www.indeed.com/viewjob?jk=83bd1bf148eb5e0f"	"Data Analyst"	"RedCloud Consulting"	"-"	"RedCloud is looking for a Data Analyst to join our team! The scope of this role includes understanding, monitoring and reporting key metrics and ongoing analyses, to inform overall strategy for acquisition, usage, and retention of users. It also includes stakeholder engagement and close collaboration with and leveraging efforts of data scientists, data engineers and other data analysts on the team.
RedCloud Consulting is a business and IT consulting company with local Puget Sound Enterprise and Mid-sized clients. We were recently recognized by Seattle Business Magazine as #1 “Best Companies to Work for in Washington” for Mid-Sized Businesses, awarded #1 Fastest Growing Company on the Washington by Puget Sound Business Journal and named on the Inc. 500/5000 list.
Responsibilities:Partner with specific functions / domains of the campaigns teams and develop a deep understanding of those areasProvide actionable insights on acquisition and engagement efforts for the areas supportedConnect findings and recommendations to business initiatives and collaborate with key stakeholders at various management levels to drive actions maximizing revenueDeliver in depth analysis on business performance (trends, funnels) and drivers, as well as forecasts and targetsDefine, track and report key metrics to assess overall business health and support monthly reporting for campaigns and solution monthly business reviewsAutomate reporting through refreshable excel templates, power point slides, and Power BI dashboardsPartner with analytics, data science, and data engineering partners for data structures, data availability, and model developmentRequired Education & Experience:3-6 years of hands on experience as a Data AnalystMaster’s or bachelors’ degree in Statistics/Math/Computer Science/Economics/Business or EngineeringAdvanced working knowledge of large data manipulation and data miningDemonstrated experience using Weighted ModelsCan leverage SQL to pull together any conformed data and add business logic to create measures or answer questions at hand.Can use SQL to build out the data foundation for any non-cube reportingPower User experience with ExcelAttention to detail and quality assuranceDefine appropriate formats for the necessary outcomes
We are considering local candidates, currently residing in the Seattle, WA market area, who are US citizens or permanent residents, available & eligible to work for any employer. We are not offering Visa sponsorship.
About Us:
RedCloud is a boutique Management Consulting firm founded in 1995, based in Bellevue, WA with a primary goal of empowering businesses to realize their potential and reach peak performance. Everything we do is executed with a complete and unwavering focus on accountability, dependability and results. We can achieve this by providing a broad array of both Business and IT consulting in addition to staffing solutions to Enterprise clients. Our professional services include Strategic Planning, Process Improvement, Project and IT Product Management, Sales and Marketing, and Business Intelligence Services.
Learn more about us at redcloudconsulting.com"	"11 days ago"	"character(0)"	2018-10-15	"Seattle%2C+WA"	90
