"url"	"title"	"company_name"	"company_score"	"description"	"time_posted"	"metadata"	"date_scraped"	"city"	"page"
"https://www.indeed.com/viewjob?jk=ec93065dfa5d8aff"	"Principal Data Scientist"	"Big Fish Games"	"16 reviews"	"COME PLAY!
Since its founding in 2002, Big Fish has been the world’s largest producer and distributor of casual games. Our titles continuously land us at the top of app store charts. We’re bounding into the mid-core space, exploring new and exciting forms of gameplay, and producing more fun than ever! Big Fish is home to six individual studios, each with its unique style of gameplay. We’re united under a common goal: to produce and develop the very best in mobile gaming, and bring fun and entertainment to our millions of customers across the globe!
THE MISSION

We are looking for flexible individuals who have a strategic viewpoint and can grow as we grow our Data Science and Insights team in Seattle. You will work with our data scientists and game data analysts who are dedicated to making our games fun and enjoyable for our players. Your team's analytical capabilities provide valuable insights needed to make business decisions on a variety of topics including user acquisition, segmentation, engagement, monetization, network analysis, churn prediction, campaign analysis, fraud and game analytics. You will interact with our game analytics teams and business stakeholders regularly to understand their strategic goals and enable the team to work on the most valuable analytical problems.
The Data Scientists are responsible for applying a wide variety of statistical and analytical techniques to business problems to glean valuable insights in support of key strategic business initiatives. They apply analytical rigor and statistical methods to data and are comfortable manipulating and analyzing complex, high-volume, and high-dimensionality data from varying sources. Incumbents are effective communicators capable of independently driving issues to resolution and communicating insights to non-technical audiences.
YOU WILL…
Provide thought leadership on the practical application of machine learning and advanced analytical methods and cultivate a data driven culture across the company
Collaborate with key business leaders to understand business problems and formulate analytical solutions for problem solving
Construct recommendations and strategic/tactical plans based on business data and market knowledge.
Oversee methodology and problem definition, guide analytic deep dives and problem solving, share learning from projects.
Translate ambiguous business problems into measurable analytical components.
Lead or collaborate with a team of data scientists, game data analysts or big data engineers on analytical projects, proving benefits of solutions and helping with execution and measurement.
Work with cross functional teams to enable the right set of tools and technology to implement end to end solutions.
Perform statistical analysis on experimental or business data to validate and quantify trends or patterns.
Design and implement:
Online experiments and experimental frameworks, including A/A, A/B, A/B/n and multivariate testing
End-to-end cloud based machine learning production pipelines
Scalable and efficient modeling algorithms that can work in production systems
Write advanced SQL for exploratory analysis, and translate computational solutions/statistical models to implementable code
Work with unstructured/semi structured data to extract useful analytic measures.
Mentor junior data analysts and data scientists.
REQUIRED ABILITIES, ACHIEVEMENTS, AND XP
Graduate or Post graduate work in a relevant technical field, or 10+ years of experience in a relevant role.
Extensive experience solving analytical problems using quantitative and qualitative approaches
A flexible analytic approach that allows for results at varying levels of precision
A strong passion for empirical research and for answering tough questions with data.
Demonstrated practical experience in building end to end data science solutions and applying machine learning methods to real world problems.
Deep understanding of and experience with machine learning models and data analysis approaches.
Experience with state-of-the-art techniques in machine learning algorithms, including deep neural networks, NLP, dimensionality reduction, ensemble methods, graph algorithms.
Comfort manipulating and analyzing complex, high-volume, high-dimensionality data from varying sources
Solid data structures & algorithms background.
Exceptional technical skills:
Strong programming skills in at least one language such as Python, Java, Scala or R.
Demonstrated proficiency in SQL and relational databases.
Experience working with semi structured data/unstructured data and turning them into actionable insights
Experience using visualization techniques to record and communicate findings
Experience in strategies for experimental analytics in complex scenarios.
PREFERRED EXPERIENCE
Big data experience (Hive, Spark, HDFS) a big plus!
Experience in GCP, AWS, Azure or other cloud ecosystems.
Published work in academic conferences or journals.
YOU ARE
Driven by curiosity and have a desire to go beneath the surface of a problem to ask the right business questions and identify potential answers that can be tested and proven
LET’S GO!
We’ve come a long way, and continue to grow! Since our founding in 2002, Big Fish has been an industry leader in mobile, free-to-play casual games, and are now embarking on our latest adventure in the mid-core space! With just over 700 employees across our Seattle headquarters and Oakland studio, the Big Fish Pond includes six studios, each with a unique personality and set of goals. We are where gamers, artists, and executives alike come together to collaborate and grow, while also enjoying the opportunities and benefits of a larger company. We’ve got you covered with great benefits including medical, dental and vision insurance, retirement options, transportation and fitness discounts, and great work-life balance!
Want to discover more about life at Big Fish? Check us out on TheMuse.com!
Come be the next Big Fish in the Pond!"	NA	"character(0)"	2018-10-15	"Seattle%2C+WA"	60
"https://www.indeed.com/viewjob?jk=22c9b05bc087f9c7"	"Data Scientist, Distribution Insights - Global Retail Markets"	"Liberty Mutual"	"2,868 reviews"	"$92,000 - $120,000 a yearAdvance your career at Liberty Mutual - A Fortune 100 Company!
The Distribution & Service Performance Insights team is seeking a highly motivated data scientist to join the model development & engineering team. In this role, you will apply analytic techniques to improve the effectiveness and efficiency of our sales distribution and service organization.
You will collaborate with business partners to develop predictive analytic solutions that enable data-driven strategic decision-making.You will utilize data science techniques to manipulate large structured and unstructured data sets, identify patterns in raw data, and develop models to predict the likelihood of a future outcome and/or to optimize business solutions.
Responsibilities:
Solve business problems using advanced statistical techniques including but not limited to regression/logistic regression, bootstrapping, decision trees, gradient boosting, neural network, clustering & binning, time series forecasting, and market basket analysis
Creatively identify and pursue predictive analytics opportunities to solve business problems and drive value to the Distribution & Service organization
Develop and deliver presentations succinctly and effectively, communicating technical ideas to non-technical audiences, to influence and enable strategic and operational decision making
Proactively identify and develop expertise in new technologies, methodologies, and techniques
Design and manage market experiments and pilots to test hypotheses
Lead cross-functional projects from ideation/conception through implementation
Partner and coordinate with Product, Marketing, Operations, and Information Management to operationalize analytical tools and decision support models
Mines large data sets using sophisticated analytical techniques to generate insights and inform business decisions.
Qualifications:
Competencies typically acquired through a Ph.D. degree (in Statistics, Mathematics, Economics, Actuarial Science or other scientific field of study) and 0-1 year of relevant experience, a Master’s degree (scientific field of study) and 1-3 years of relevant experience or may be acquired through a Bachelor’s degree(scientific field of study) and 3+ years of relevant experience.
Broad knowledge of predictive analytic techniques and statistical diagnostics of models. Experience in model building required. Experience working with large datasets required.
Expert skills in statistical and data management software programs (e.g. R, Python, SAS, SQL)
Ability to communicate with both technical and non-technical audiences including effective presentation skills, building a business case, translating analytic results to usable learnings and actions, and give training to peers and less senior team members
Ability to operate independently, Strong organizational skills, Time management skills, and decision-making skillsBenefits:We value your hard work, integrity and commitment to positive change. In return for your service, it’s our privilege to offer you benefits and rewards that support your life and well-being. To learn more about our benefit offerings please visit: https://LMI.co/Benefits
Overview:
At Liberty Mutual, we give motivated, accomplished professionals the opportunity to help us redefine what insurance means; to work for a global leader with a deep sense of humanity and a focus on improving and protecting everyday lives. We create an inspired, collaborative environment, where people can take ownership of their work; push breakthrough ideas; and feel confident that their contributions will be valued and their growth championed.
We’re dedicated to doing the right thing for our employees, because we know that their fulfillment and success leads us to great places. Life. Happiness. Innovation. Impact. Advancement. Whatever their pursuit, talented people find their path at Liberty Mutual.
Job: Analytics
Primary Location: United States-Washington-SeattleSchedule: Full-timeSalary: $92,000-$120,000Education Level: Bachelor's Degree (±16 years)Travel: Yes, 10 % of the Time"	NA	"$92,000 - $120,000 a year"	2018-10-15	"Seattle%2C+WA"	60
"https://www.indeed.com/viewjob?jk=1a69da42fa2b752a"	"Machine Learning Engineer"	"zulily in partnership with Indeed Prime"	"364 reviews"	"zulily is a retailer obsessed with bringing our customers something special every day. Unique products from up-and-coming brands are featured alongside favorites from top brands, including clothing, home decor, accessories, toys and gifts, giving customers something new to discover each morning at an incredible price. We are fast-paced, innovative and metric-driven, with a team passionate for delighting our customers. Whether you want to work with incredible product selection, develop smart marketing plans, help us in our pursuit of faster fulfillment, or do something else awesome in between, we have a place for you. With locations in Seattle, Reno, Columbus and Bethlehem, our team is excited to be changing the way people shop every day - and we are just getting started. As a Software Engineer at zulily, you are chartered with building the technology that powers the second fastest growing online retailer in history. Our incredible growth means we face new challenges on a consistent basis. In this position, you must explore new technologies and collaborate with other engineers to design and build world-class technical services. Your team deploys production code rapidly to keep pace with zulily’s changing business, you are mindful of avoiding technical debt, and you take ownership of your team's roadmap and everything you do. Essential Job Functions Collaborate across business teams (stakeholders) Operate and provide 24/7 services to internal and external customers (mom and zuteams) Research new technologies to support build vs. buy and rapid growth of the business (build vs. buy) Design in a mindset of reducing technical debt Consistently delivers work with started timelines QUALIFICATIONS Bachelors Degree in Computer Science or related field required. A combination of education plus equivalent work experience may be considered. Exposure to software development experience building and operating high traffic web services and platforms Familiarity with frameworks such as MLlib, scikit-learn, H2O, Torch, TensorFlow, Theano, Caffe Experience with Spark, Hadoop, Pig, MapReduce technologies Past history with Amazon Web Services a plus Ability to work in a fast paced, evolving, growing and dynamic environment Excellent written and verbal communication skills Demonstrated personal initiative and strong ownership of deliverables Ability to explore new ideas and have a passion to make them happen zulily is an Equal Opportunity Employer zulily participates in E-Verify. zulily will provide the Social Security Administration (SSA) and, if necessary, the Department of Homeland Security (DHS) with information from each new employee's I-9 to confirm work authorization. Federal law requires employers to provide reasonable accommodation to qualified individuals with disabilities. Please tell us if you require a reasonable accommodation to apply for a job. Examples of reasonable accommodation include making a change to the application process, providing documents in an alternate format, using a sign language interpreter, or using specialized equipment. You may reach us at (206) 388-0920."	NA	"character(0)"	2018-10-15	"Seattle%2C+WA"	60
