"url"	"title"	"company_name"	"company_score"	"description"	"time_posted"	"metadata"	"date_scraped"	"city"	"page"
"https://www.indeed.com/viewjob?jk=8b1d190f4536fa9f"	"SAP Machine Learning Consultant / Data Scientist - Chicago, Newtown Square, or Palo Alto"	"SAP"	"1,745 reviews"	"Requisition ID: 197036Work Area: Consulting and Professional ServicesExpected Travel: 0 - 100%Career Status: ProfessionalEmployment Type: Regular Full Time COMPANY DESCRIPTION SAP started in 1972 as a team of five colleagues with a desire to do something new. Together, they changed enterprise software and reinvented how business was done. Today, as a market leader in enterprise application software, we remain true to our roots. That’s why we engineer solutions to fuel innovation, foster equality and spread opportunity for our employees and customers across borders and cultures. SAP values the entrepreneurial spirit, fostering creativity and building lasting relationships with our employees. We know that a diverse and inclusive workforce keeps us competitive and provides opportunities for all. We believe that together we can transform industries, grow economics, lift up societies and sustain our environment. Because it’s the best-run businesses that make the world run better and improve people’s lives. LOCATION: Palo Alto (USA) or Philadelphia (USA) or Chicago (USA) TRAVEL: Up to 100% travel is required SUMMARY: Do you combine knowledge of business innovation and next-generation technologies to help companies run their businesses better? Do you dream of changing what businesses can achieve and the impact they can have through the intelligent use of these technologies? SAP Leonardo Services is a dynamic new incubator entity within SAP Digital Business Services that combines business innovation, next-gen technology, thought leadership and an entrepreneurial spirit to create impact at scale for SAP customers. “Together, we make it happen” and the unique position of being able to work on our trust in the intelligent enterprise of tomorrow using the technologies of Blockchain, Machine Learning, Artificial Intelligence, IoT and Advanced Analytics thrills us and opens opportunities like nowhere else. At SAP, we believe in the power of collaboration and empower our employees to perform at their best in an environment that encourages free and open expression of ideas. Here, you work alongside creative thinkers and deep experts who share your interests, while turning big ideas into reality for our customers. With innovative job training, mentors to help you grow, and the flexibility to balance your work and personal life, you’re able to build your career. It’s no wonder that some of the sharpest minds from around the world are working for a company that is consistently recognized as a global top employer. THE ROLE: SAP is currently expanding a team that provides latest machine learning technology services to customers, helping them to improve their business results based on scientific analysis of large amounts of business data and apply existing or create new machine learning models to build the intelligent enterprise. In this role, the machine learning expert works directly with industry experts and technology experts to translate our customers’ business needs into mathematical models or provides a creative approach based on SAP Cloud offerings and will then present and deliver the solution approach to the client. This position requires the ability to work and communicate as a part of a high-performance team in an international environment. You will bring in your customer expertise to the relevant development units to enhance the coverage of our portfolio. As a thought leader in Machine Learning you know that learning and personal development is a must and therefore ensure that you keep track of the latest developments and share your knowledge actively with others. This is part of our obligation to help to scale the responsible delivery units after we prepared the ground for scaling. ROLE REQUIREMENTS: For the Machine Learning / Data Scientist position we are seeking professionals with ideally 3-5 years’ work experience, with high analytical problem-solving skills. Master’s degree or Ph.D. in Mathematics, Physics, Computer Science, Data Science Strong in mathematics and statistics Software development experience and application of software development frameworks Capture customer requirements and translate them into applicable machine learning models or applications Ability to deliver clear, concise presentations to non-scientific audiences Willingness to participate in the sales process as a subject matter expert High energy, clear goal orientation and strong work ethic; “can do” attitude A natural collaborator comfortable working with a diverse range of people across geographies and organizational borders. #SAPDBS #TogetherWeMakeItHappen WHAT YOU GET FROM US Success is what you make it. At SAP, we help you make it your own. A career at SAP can open many doors for you. If you’re searching for a company that’s dedicated to your ideas and individual growth, recognizes you for your unique contributions, fills you with a strong sense of purpose, and provides a fun, flexible and inclusive work environment – apply now. SAP'S DIVERSITY COMMITMENT To harness the power of innovation, SAP invests in the development of its diverse employees. We aspire to leverage the qualities and appreciate the unique competencies that each person brings to the company. SAP is committed to the principles of Equal Employment Opportunity and to providing reasonable accommodations to applicants with physical and/or mental disabilities. If you are interested in applying for employment with SAP and are in need of accommodation or special assistance to navigate our website or to complete your application, please send an e-mail with your request to Recruiting Operations Team. (Americas:Careers.NorthAmerica@sap.com or Careers.LatinAmerica@sap.com, APJ: Careers.APJ@sap.com, EMEA: Careers@sap.com). Requests for reasonable accommodation will be considered on a case-by-case basis. Successful candidates might be required to undergo a background verification with an external vendor. EOE AA M/F/Vet/Disability: Qualified applicants will receive consideration for employment without regard to their age, race, religion, national origin, gender, sexual orientation, gender identity, protected veteran status or disability. Successful candidates might be required to undergo a background verification with an external vendor.Additional Locations:"	"18 days ago"	"character(0)"	2018-10-15	"Chicago%2C+IL"	50
"https://www.indeed.com/viewjob?jk=51537188848f9a02"	"Data Scientist"	"Precima"	"-"	"Location: Toronto / Chicago Why work with us?Are you passionate about analytics? Are you a data enthusiast who likes to work with people and solve problems? At Precima, we are problem solvers who love the challenge of the riddle. We help find solutions without being asked. We have an ingrained streak of determination and don’t settle for good enough. We are passionate about shaping shopper behavior and we care deeply about giving back to the communities around us. About the role... The Data Scientist will provide process execution support for client projects. The person will be accessing, analyzing and interpreting point-of-sale, merchandising and marketing data on behalf of Precima clients to implement advanced predictive models leveraging statistics, mathematics and econometrics to support business objectives in merchandising and marketing such as price optimization, assortment optimization, target audience selection, marketing campaign design and execution, and marketing mix optimization. This role is an integral part of the Research and Development Team. The successful candidate will have relevant B2B and retail industry experience and demonstrated capabilities in statistical and econometric modeling in advanced analytics applications. The candidate will understand the business needs of a B2B, retailer or CPG client as well as the appropriate analytical approaches to merchandising and marketing problems encountered by these clients.What you'll do... Support the implementation of advanced statistical and econometric models of pricing, assortment and targeted marketing Interpret, document and present/communicate analytical results to multiple business disciplines, providing conclusions and recommendations based on customer-centric data Take analytical objectives and define data requirements. Extract, clean, and transform customer and item-level data for purposes of analysis, modeling/segmentation and reporting Identify, develop and make recommendations for process improvements and best practices; own implementation of recommendations required Execute on Precima’s engagement with Clients, delivering on our commitments and assisting the client to understand and derive the most value out of Precima-provided initiatives and tools Who you are... Master Degree (PhD preferred) in Statistics, Operations Research, Mathematics, Economics, Econometrics, Industrial Engineering, Computer Science Minimum of 5 years of directly related work experience in Econometric Modeling or Marketing Analytics Expert proficiency in developing original statistical and econometric models in pricing, assortment and marketing mix to support clients in B2B, Retail and CPG areas. Expert proficiency in implementing models using SAS, R or Python. Working knowledge of C++/C# and SQL Advanced knowledge of Microsoft Word, Excel, PowerPoint Nice to have:Retail / merchandising industry experience a definite advantage About Precima Precima is a global retail strategy and analytics company that provides tailored, data-driven solutions that drive sales, boost profitability and build customer loyalty. Leveraging our deep analytics expertise, Precima helps organizations improve their competitive position across all facets of planning and operations from assortment optimization, price optimization, promotional optimization, targeted marketing, and supplier collaboration. Precima’s credentials include solutions for Fortune 1000 brands and grocery retailers, including global market leaders. Together with LoyaltyOne, LoyaltyOne Consulting, BrandLoyalty, AIR MILES, and IceMobile, Precima is a part of Alliance Data―a Fortune 500 Company and the global leader in data-driven loyalty solutions. Precima's head office is located in Toronto, Canada, with global offices in Den Bosch, The Netherlands, Chicago, USA, and London, UK. Precima is a LoyaltyOne company. www.precima.com About LoyaltyOneToday, there are more ways than ever to engage shoppers. At LoyaltyOne, we believe that understanding the people behind the purchase is key to winning their hearts – and their wallets. For over two decades and from more than fifty locations around the globe, we have paired expertise in shopper behavior with advanced analytics to uncover the data-driven insights that drive successful loyalty, marketing and merchandising solutions.Across AIR MILES, BrandLoyalty, Precima and Global Solutions, our businesses help some of the world's leading retailers connect with consumers and deliver more value in every visit. Regardless of their role or geographic location, our people are always supported by one of the best teams around.At LoyaltyOne, we know that in coming together we are at our strongest – and that together we can help shape the future for our clients, their shoppers and our communities. LoyaltyOne is an Alliance Data company. For more information, visit www.loyalty.comAbout ADSAlliance Data® (NYSE: ADS) is a leading global provider of data-driven marketing and loyalty solutions serving large, consumer-based industries. The Company creates and deploys customized solutions, enhancing the critical customer marketing experience; the result is measurably changing consumer behavior while driving business growth and profitability for some of today's most recognizable brands. Alliance Data helps its clients create and increase customer loyalty through solutions that engage millions of customers each day across multiple touch points using traditional, digital, mobile and emerging technologies. An S&P 500 and Fortune 500 company headquartered in Plano, Texas, Alliance Data consists of three businesses that together employ more than 16,000 associates at approximately 100 locations worldwide. http://www.alliancedata.comAlliance Data is an Equal Employment Opportunity employer. Accordingly, we will make reasonable accommodations to respond to the needs of people with disabilities in accordance with legislation. Alliance Data participates in E-Verify.Check us out – LoyaltyOne on Stack Overflow | LinkedIn | Glassdoor | Facebook |Twitter | Blog | Instagram Primary Location: USA - United States-3090 - Illinois-50082 - Chicago-P2-Chicago IL- LoyaltyOne Work Locations: P2-Chicago IL- LoyaltyOne Chicago 60631 Job: Analytics Organization: LoyaltyOne Schedule: Regular Job Type: Full-time Job Posting: Sep 10, 2018, 2:02:00 PM Division: Precima"	NA	"character(0)"	2018-10-15	"Chicago%2C+IL"	50
"https://www.indeed.com/viewjob?jk=e9ccb8c1fdf5c84a"	"Data Scientist / Quantitative Researcher, Systematic Trading"	"DRW"	"-"	"DRW is a technology-driven, diversified principal trading firm. We trade our own capital at our own risk, across a broad range of asset classes, instruments and strategies, in financial markets around the world. As the markets have evolved over the past 25 years, so has DRW – maximizing opportunities to include real estate, cryptoassets and venture capital. With nearly 900 employees at our Chicago headquarters and offices around the world, we work together to solve complex problems, challenge consensus and deliver meaningful results. It's a place of high expectations, deep curiosity and thoughtful collaboration. The Team: You will join a quantitative trading team managing systematic equity strategies. The team focuses on non-latency sensitive investment opportunities across geographies. The team is responsible for the complete lifecycle of quantitative investment process; research, development, and trading of systematic strategies. The team strongly emphasizes cutting-edge innovative scientific research, and is looking to add an individual who is enthusiastic about contributing within a team environment. Responsibilities: The main responsibility of the role will be to research, design and implement new quantitative trading strategies. This will entail generating alphas from a variety of traditional and alternative datasets using rigorous statistical methods. To be successful in this role, the ideal candidate will need to build a deep understanding of the underlying datasets and be able to apply the latest scientific algorithms for statistical model development. The candidate will use the team's custom research infrastructure for simulation, back-testing, and validation of the proposed models. Qualifications:The ideal candidate will be excited about working in a collaborative team environment, with an emphasis on team performance. We also require the following: MS/PhD in a technical discipline with a focus on Statistics, Optimization, Machine Learning, Artificial Intelligence, Quantitative Finance or related fields Exposure to High-Performance Computing and/or Natural Language Processing is a plus Publications in top-tier Journals focusing on any of the above topics is a plus Strong programming skills with the ability to explore large datasets required Excellent written and verbal communication skills to report research results/methodologies required Preferred:The preferred candidate should have at least 2-3 years of working experience within a quantitative trading/research role Experience with quantitative investment research in Medium Frequency Trading and/or Equity Markets is required"	"10 days ago"	"character(0)"	2018-10-15	"Chicago%2C+IL"	50
"https://www.indeed.com/viewjob?jk=f0b9ee3133a74b70"	"District Data Scientist"	"Cicero Public School District 99"	"-"	"Position Type: TechnologyDate Posted: 7/17/2018Location: DistrictDate Available: August 2018Closing Date: Once Filled Attachment(s): CICD 99 Data Scientist.docx"	"24 days ago"	"character(0)"	2018-10-15	"Chicago%2C+IL"	50
"https://www.indeed.com/viewjob?jk=e11bd7834462ac08"	"Data Scientist"	"Robert Half Technology"	"410 reviews"	"$86,000 - $127,000 a year (Indeed Est.) The Data Analyst will conduct full lifecycle analysis of raw information and data to include requirements, activities and design. The Data Analyst will develop analysis and reporting capabilities that will improve operational and financial efficiencies. This position will be called upon to build small to large datasets, provide analytical support as well as extract and communicate data as needed. This role will identify opportunities for process improvements and work with cross-function teams to ensure improvements are made company-wide ? Collaborate and work closely with cross-functional business partners to identify gaps and structure problems ? Identify valuable data sources and automate collection processes ? Undertake pre-processing of structured and unstructured data ? Interpreting data, analyzing results using statistical techniques and providing ongoing reports ? Developing and implementing databases, data collection systems, data analytics and other strategies that optimize statistical efficiency and quality ? Acquiring data from primary or secondary data sources and maintaining databases/data analysis systems ? Analyze large amounts of information to discover trends and patterns; present findings and recommendations as needed ? Build predictive models and machine-learning algorithms ? Present information using data visualization techniques ? Propose solutions and strategies to ever-changing business challenges Data or Gap Analysis, Tableau, Hadoop, Python"	"13 days ago"	"$86,000 - $127,000 a year (Indeed Est.) "	2018-10-15	"Chicago%2C+IL"	50
"https://www.indeed.com/viewjob?jk=7c003940763b48e9"	"DATA SCIENTIST"	"Trading Technologies"	"12 reviews"	"We are seeking a strong Data Scientist with a background in computer science as well as either applied math or statistics to join our Chicago team of artificial intelligence system developers. In this role, you can expect to participate in the full lifecycle of data science, including everything from project ideation and data collection through modeling, results presentation and model refinement. Responsibilities: Program daily in Java and other data science languages, such as R and Scala Read and process data from test files or REST endpoints Write JUnit tests Work in Python, pandas, scikit-learn and utilize data visualization libraries Process large CSV and JSON datasets within a platform that uses map-reduce processing pattern, such as Spark, Hadoop, H2O, dask, etc. Work with various model types, such as classifier, regression, unsupervised and time-series models Test for Gaussian distribution and stationarity, and detect outliers Explain and communicate the math and logic of the work to non-technical audiences Qualifications: Java programming experience is a must, and experience developing multithreaded distributed systems is preferred Multi-variable calculus experience and basic linear algebra knowledge including matrix math and solving systems of linear equations Familiarity with Markov processes and models Experience with Github, Linux and SSH, as well as network analysis and signal processing Experience with the H2O.ai platform a plus Basic understanding of the trading industry, data security and privacy practices Ability to take ownership over work and ask questions as needed Strong communication skills with the ability to translate technical explanations to non-technical audiences who may include C-level executives and/or lawyers"	"2 days ago"	"character(0)"	2018-10-15	"Chicago%2C+IL"	50
"https://www.indeed.com/viewjob?jk=2fabf12f15279824"	"Senior Data Scientist"	"Trunk Club"	"89 reviews"	"Working for Trunk Club ---------------------- When you join Trunk Club, you join the Nordstrom family. Our fast-paced and entrepreneurial environment is paired with the strong history and experience of a retail legacy. We have access to some of the greatest minds in retail and technology and are constantly creating innovative strategies to develop the ultimate apparel solutions. We welcome your adaptability, your curiosity, and your passion to contribute to our unparalleled shopping experience! Who We Are ---------- At Trunk Club, we develop models that enable the business to make data-driven decisions, from whom marketing targets for re-engagement credits to which merchandise should be shoppable for a given customer. Our stack makes it easy and painless to turn an algorithm into an API and run follow-up A/B tests using a range of multivariate models at your disposal. Every team relies not only on the data we collect, but more importantly in the clever ways that present it to every in our experience. Data Science helps drive Trunk Club. Every member helps inform the company on the best ways to grow and change. You will have autonomy to collaborate with every team and be directly connected to decision makers without bureaucracy. What You'll Do -------------- Developing and maintaining Machine Learning infrastructure that powers our ranking models, member apps, inventory classification, etc. Our preferred language is Python and you'll regularly be working with real-time information from Kafka streaming systems. Researching, developing, and implementing predictive algorithms using various regression techniques, deploying them as real-time APIs in our micro-service infrastructure. Utilizing Natural Language Processing to understand text content across products, including reviews and interactions between users, stylists, and products. Using Computer Vision (OpenCV) for image content analysis of novel and existing clothing items: classification, quality, attractiveness, similarity, extraction of features for ranking models. Identifying suspicious transactions and malicious users for Fraud. Can you beat SaaS fraud platforms? We're betting so. Determining the optimal inventory levels to help us effectively manage inventory needs while meeting revenue goals. Using a range of clustering techniques to identify latent clusters of customers based on purchases, demographics, styles, etc. Brainstorming new tools to help minimize the risk of experimenting with new algorithms. What Your Background May Look Like ---------------------------------- Graduate degree in quantitative discipline with 2-3 years of relevant industry experience Experience building and deploying Machine Learning models, and providing vision within a team environment. Strong programming ability in Python with Jupyter, Pandas, and sklearn. Proven track record working hands-on with data end-to-end. Demonstrated success visualizing data and explaining complex concepts through expressive communication. Who You Are ----------- An evangelist. You love what you do and have a knack for communicating technical jargon to any audience. A learner. You have an insatiable thirst for knowledge and greater understanding. A pragmatist. Your goal is to create useful products, not build technology for technology's sake. An entrepreneur. You're truly invested in the success of the business. How We Work ----------- With others. We collaborate cross-functionally to solve problems and deliver the best products for our customers. With transparency. We have an open team room. No cubicles, no private offices. With agility. We don't believe in following a process for process's sake. We ship frequently and focus on delivering incremental value. With open minds. We are committed to building a diverse team of people with unique perspectives. This encourages a healthy and inclusive environment that builds a more sustainable, successful company. With pride. We value our people most of all. We invest in ourselves by applying our own strengths and interests to company needs. A Few of Our Perks ------------------ Lunch-and learns Annual stipend for continuous education Tech all-hands lunches every other Friday Hack days Team outings Nordstrom discount Flexible work environment Social environment with built-in bars #LI-LF1"	"15 days ago"	"character(0)"	2018-10-15	"Chicago%2C+IL"	50
"https://www.indeed.com/viewjob?jk=f5968277b9e13498"	"Data Scientist"	"Crowe"	"181 reviews"	"Given substantial growth and impact at Crowe, the machine learning team has formed into an official unit, Advanced Data Science (ADS), which is responsible for all machine learning and artificial intelligence throughout the firm. This team works on a wide variety of projects utilizing numerous areas of machine learning, including: supervised regression/classification, unsupervised learning, anomaly detection, NLP, reinforcement learning, deep learning, forecasting, etc. Leverage large sets of structured and unstructured data to develop tactical and strategic insights. Collaborate with analytic and data teams to set objectives, approaches, and work plans. Research and evaluate new analytical methodologies, approaches, and solutions. Develop and validate statistical forecasting models and tools. Interpret and communicate analytic results to analytical and non-analytical business partners and executive decision makers."	NA	"character(0)"	2018-10-15	"Chicago%2C+IL"	50
