"url"	"title"	"company_name"	"company_score"	"description"	"time_posted"	"metadata"	"date_scraped"	"city"	"page"
"https://www.indeed.com/viewjob?jk=889fc9aaaf2ce816"	"c(\"Data Scientist\", \"Position Description:\", \"Qualifications:\", \"To Apply:\")"	"US Agency for International Development"	"15 reviews"	"Position Description:As a Data Scientist, you will work on a variety of exciting projects in a mission-driven government agency with a lot of opportunities to solve complex problems. You will bring together different datasets from across USAID to develop creative solutions and analytical models. You will collaborate with a variety of teams from USAID’s Global Development Lab and the Bureau for Global Health to address pressing operational challenges.
The Global Development Lab serves as an innovation hub for USAID and the foreign assistance community in the U.S. Government. We take smart risks to test new ideas and harness the power of innovative approaches to improve USAID’s operations and make people’s lives better around the world. You will be a member of the Lab’s Operational Innovations team. The Data Scientist position will form a partnership with USAID’s Bureau for Global Health to analyze massive amounts of unstructured data to strengthen health and other international development programs globally.
Note: This is a 2-year funded position with an optional extension period contingent on funding. Some international travel to USAID missions may be required.
Responsibilities

Apply advanced statistical methods and work with a variety of datasets related to the management and execution of international development programs. Solve difficult, non-routine problems in natural language processing and machine learning. Derive insights from unstructured data in USAID’s financial, procurement and performance systems. Provide inputs to future programs and strategies in Global Health and other international development sectors.
Provide analytical decision making support on key projects. Proactively research new ways of modeling data to unlock actionable insights or improve processes.
Use predictive analytics and/or machine learning to facilitate forecasting for a complex, global operation.
Partner with non-technical stakeholders to understand their needs, help frame problems by asking the right questions, and prioritize requirements. Ensure that new approaches help solve worthwhile problems.
Qualifications:
Master’s degree and 5+ years relevant experience or equivalent combination of education and experience. Degree with a quantitative focus (economics, computer science, physics, mathematics, engineering, statistics or related).
Experience as an analyst or in an analytical role. PhD work can be substituted for experience. Experience in public health is a plus but not necessary.
Experience designing data models and using natural language processing algorithms (sentiment analysis, topic segmentation, automatic summarization, etc.).
Experience working with SQL and advanced statistical analysis (regression, machine learning, predictive analytics, hypothesis testing)
US citizenship required. ability to obtain and maintain, at a minimum, secret clearance.
This is an opportunity for employment or a contract, but we reserve the right to make no selection or award.To Apply:
Please visit here to apply for this job online."	NA	"character(0)"	2018-10-15	"Washington%2C+DC"	80
"https://www.indeed.com/viewjob?jk=b2a4ffe926fd6105"	"Aviation Safety Data Scientist"	"Mitre Corporation"	"196 reviews"	"Aviation Safety Data Scientist - (00050719)
Description
Why choose between doing meaningful work and having a fulfilling life? At MITRE, you can have both. That's because MITRE people are committed to tackling our nation's toughest challenges—and we're committed to the long-term well-being of our employees. MITRE is different from most technology companies. We are a not-for-profit corporation chartered to work for the public interest, with no commercial conflicts to influence what we do. The R&D centers we operate for the government create lasting impact in fields as diverse as cybersecurity, healthcare, aviation, defense, and enterprise transformation. We're making a difference every day—working for a safer, healthier, and more secure nation and world. Our workplace reflects our values. We offer competitive benefits, exceptional professional development opportunities, and a culture of innovation that embraces diversity, inclusion, flexibility, collaboration, and career growth. If this sounds like the choice you want to make, then choose MITRE—and make a difference with us.The MITRE Corporation’s Center for Advanced Aviation System Development (CAASD) has an immediate opening for a Senior Aviation Safety Systems Engineer to be part of a dynamic team of professionals working to improve the safety of the United States (US) National Airspace System (NAS) working closely with both US and International Airlines. We are looking to expand our team with someone with demonstrated technical excellence involving analysis of digital flight data or narrative safety reporting data for aviation safety plus excellent written and verbal communication skills.
Key Functions:
The successful candidate will be part of a team establishing requirements for and conducting analyses of multiple integrated databases of aviation safety data and other aviation and weather data to identify potential factors that may lead to aviation accidents or incidents. In addition, the candidate will help develop and apply analytical models to analyze the data in order to identify trends and to assess known risks. The successful candidate will also contribute to various projects applying innovative analysis techniques to uncover anomalous characteristics and precursors to new and emerging aviation safety risks.
Qualifications
Required Qualifications:
These skills and abilities are highly desired:Experience using tools such as R or Python to prepare and analyze time series data; applications of these skills in an aviation context is desirable.Coding, data modeling, simulation, and data visualization experience.Excellent statistical and mathematical skills.Ability to work and communicate in a team environment.Excellent written and verbal communications skills.Experience with machine learning techniques and algorithm development.Ability to adapt to changing requirements.
Preferred Qualifications:
These technical skills are used often in our work:Experience with data visualization software (eg. Tableau, D3)Knowledge of data processing capabilities (eg. Hadoop, Pig, Spark, SQL)Past experience working in the aviation domain: airport operation, air traffic control, airlines. Skill is desired, but not required.Knowledge of digital flight data (e.g. Flight Operational Quality Assurance) or narrative safety reporting data (e.g. Aviation Safety Action Program). Skill is desired, but not required.
Minimum Qualifications:
BS and 3 years related experience.
Primary Location: United States-Virginia-McLean
Work Locations: Washington 22102
Job: Systems Engineering
This requisition requires a clearance of: Suitability - FAA
Travel: Yes, 5 % of the Time
Job Posting: Jul 16, 2018, 11:00:00 PM"	NA	"character(0)"	2018-10-15	"Washington%2C+DC"	80
"https://www.indeed.com/viewjob?jk=e939a7843bf57e95"	"Data Scientist / Sr. Data Scientist"	"Visa"	"642 reviews"	"$102,000 - $130,000 a year (Indeed Est.) Job DescriptionTo ensure that Visa’s payment technology is truly available to everyone, everywhere requires the success of our key bank or merchant partners and internal business units. The Global Data Science group supports these partners by using our extraordinarily rich data set that spans more than 3 billion cards globally and captures more than 100 billion transactions in a single year. Our focus lies on building creative solutions that have an immediate impact on the business of our highly analytical partners. We work in complementary teams comprising members from Data Science and various groups at Visa. To support our rapidly growing group we are looking for Data Scientists who are equally passionate about the opportunity to use Visa’s rich data to tackle meaningful business problems. You will join one of the Data Science focus areas (e.g., banks, merchants & retailers, digital products, marketing) with an opportunity for rotation within Data Science to gain broad exposure to Visa’s business.
The position is based at our office in the Washington, DC Metro Area (Ashburn, VA)
Responsibilities
Be an out-of-the-box thinker who is passionate about brainstorming innovative ways to use our unique data to answer business problems
Communicate with clients to understand the challenges they face and convince them with data
Extract and understand data to form an opinion on how to best help our clients and derive relevant insights
Develop visualizations to make your complex analyses accessible to a broad audience
Partner with a variety of Visa teams to provide comprehensive solutions
Find opportunities to craft products out of analyses that are suitable for multiple clients QualificationsCan you take on the responsibilities described above? Then please apply! Independent of years of experience or educational background, successful candidates frequently have a mix of the following qualifications:
2-4 years experience in data-based decision-making or quantitative analysis
Bachelor’s degree in an analytical field such as statistics, operations research, economics, computer science or many others (graduate degree is a plus)
Experience with extracting and aggregating data from large data sets using SQL or other tools
Competence in Excel, PowerPoint and Tableau
Experience in understanding and analyzing data using statistical software (e.g., Python, SAS, R, Stata or others)
Previous exposure to financial services, credit cards or merchant analytics is a plus, but not required
Additional InformationVisa will consider for employment qualified applicants with criminal histories in a manner consistent with the requirements of Article 49 of the San Francisco Police Code.
All your information will be kept confidential according to EEO guidelines."	"26 days ago"	"$102,000 - $130,000 a year (Indeed Est.) "	2018-10-15	"Washington%2C+DC"	80
"https://www.indeed.com/viewjob?jk=cd1a2c83ec95023e"	"Systems Analyst/Data Scientist"	"Radiant Solutions"	"24 reviews"	"Responsibilities
Got a head for numbers? Like turning real world problems into mathematical representations and checking to see if you did it right? If you like that, you’ll love developing algorithms with us! Our customers have some of the most interesting needs and hardest challenges to resolve. Our solutions require integrated models based on large and varied datasets. Our simulations feed analytic applications so that we can extract patterns and behaviors obscured within the data. We need systems analysts/data scientists of all experience levels to staff positions supporting the defense and intelligence communities.
Radiant Solutions is currently staffing multiple projects with analysts who have diverse backgrounds and experiences from the open source, defense and intelligence communities, and commercial industry.
Note: US citizenship and an active TS/SCI clearance is mandatory for this position and required for consideration.
Why us?We build advanced algorithms to gain analytic insights from imagery and geospatial data.We enable machine learning systems, automate workflow, and design and develop custom applications for unique national-security missionsWe provide training to expand your skills and challenges to develop themOur client’s missions are vital to national security, so we’re mission-first alwaysOur work environment is relaxed business casualBecause at our core we believe and practice social responsibility.

Qualifications
You have to have these:
- US citizenship and an active TS/SCI clearance - if you have a current polygraph, even betterBachelor's degree, or higher in Engineering, Math, Physics, Computer Science, or equivalentDevelopment experience in a Linux/Unix/Windows environmentExperience in at least one of these languages: R, VBA, Java, C++, SQL, PythonExperience developing and testing modelsCapability to work effectively in a geographically distributed development team
We’d really like it if you had:Master’s degree, or higher in Engineering, Math, Physics, Computer Science, or equivalentGraduate experience working with probabilistic and stochastic statistical analysis or computational intelligenceExperience conducting model feasibility research and algorithm development for machine learningExperience with distributed datasets and experience analyzing both relational and NoSQL data structuresLeading and mentoring small teams from project inception through deploymentExperience working in an Agile environment, especially SAFe
#cjpost
Overview
Join our company whose purpose is to help national security and commercial organizations understand and navigate our changing planet. Radiant Solutions provides multi-source data collection, enrichment, and analytic capabilities that reveal unique geospatial information and insights where and when it matters most.
No other company has such strong roots in geospatial with our level of scale and a strong commercial mindset. We are well known for delivering innovative capabilities across the entire geospatial intelligence value chain. Our combined team of over 1,000 aerospace engineers, geospatial analysts, weather and ocean experts, software developers, data scientists, and DevOps engineers apply disruptive technologies and our unique intellectual property to both national security and commercial problems.
We offer an excellent comprehensive benefits package including medical, dental, life, and short/long-term disability insurance, vacation and sick leave, 401(k) retirement plan, flexible spending account, and tuition assistance.
Radiant Solutions values diversity in the workplace and is an equal opportunity/affirmative action employer. All qualified applicants will receive consideration for employment without regard to sex, gender identity, sexual orientation, race, color, religion, national origin, disability, protected veteran status, age, or any other characteristic protected by law."	NA	"character(0)"	2018-10-15	"Washington%2C+DC"	80
"https://www.indeed.com/viewjob?jk=736360e793529a0f"	"Data Scientist/Data Engineer"	"General Dynamics Mission Systems"	"262 reviews"	"$103,000 - $131,000 a year (Indeed Est.) Basic Qualifications
KNOWLEDGE SKILLS AND ABILITIES:
Experience with software development (i.e., Integrated Development Environments (IDE), build automation, version control, dependency management, application lifecycle management, integrated testing, unit testing, software development methodologies, and operating systems) (e.g., Eclipse, IntelliJ IDEA, Maven, Git, Spring Boot, JIRA, Jenkins, Junit, Scrum, Windows, or Red Hat Linux)
Experience with data management/flow (e.g., NiFi or Logstash)
Experience with Programming Paradigms (i.e., Functional and Object-Oriented) (e.g., Scala, Java, or R)
Experience with visualization (e.g., Kibana)
Experience in Signals Intelligence (SIGINT)
Experience with databases systems (i.e., NoSQL column and document-oriented) (e.g., Accumulo, MongoDB, or Elasticsearch)
Experience in machine learning (i.e., Linear Discriminant Analysis, Classification and Regression Trees, K-Nearest Neighbors, Support Vector Machines, and Random Forest) (e.g., R or MapReduce)
Education Requirements:
Bachelor's degree in software engineering or a related technical field is required (or equivalent experience), plus a minimum of 10 years of relevant experience; or Master's degree plus a minimum of 8 years of relevant experience. Agile experience preferred.
Clearance Requirements:
Department of Defense TS/SCI with Polygraph security clearance is required at time of hire. Applicants selected will be subject to a U.S. Government security investigation and must meet eligibility requirements for access to classified information. Due to the nature of work performed within our facilities, U.S. citizenship is required.
Responsibilities for this Position
General Dynamics Mission Systems has an immediate opening for a Data Scientist/Data Engineer. This position provides an opportunity to further advance the cutting-edge technology that supports some of our nation’s core defense/intelligence services and systems. General Dynamics Mission Systems employees work closely with esteemed customers to develop solutions that allow them to carry out high-stakes national security missions.
REPRESENTATIVE DUTIES AND TASKS:
The Data Scientist will be part of a team, forward deployed within the customer space in support of the system. The candidate will have hybrid experience in software development and data science, ideally with subject matter expertise in Signals Intelligence (SIGINT).
Must have experience in design, development, and troubleshooting of analytics. Various mission areas require assistance in determining the value of their products and workflow. The candidate will forward deploy to work with mission subject matter experts and create analytics that will feed the application, a data-driven tool that enriches and visualizes outcomes.
Tasking will include developing and evolving analytics for situational awareness, trending, and change detection. The work will involve identifying source data, combination methods, and visualization needs.
The candidate will work mostly independently on site, but must also be able to work with software engineer(s) in getting the data to the application and participate in incorporating code into the application’s codebase.
#CJ3
Company Overview
General Dynamics Mission Systems (GDMS) engineers a diverse portfolio of high technology solutions, products and services that enable customers to successfully execute missions across all domains of operation. With a global team of 13,000+ top professionals, we partner with the best in industry to expand the bounds of innovation in the defense and scientific arenas. Given the nature of our work and who we are, we value trust, honesty, alignment and transparency. We offer highly competitive benefits and pride ourselves in being a great place to work with a shared sense of purpose. You will also enjoy a flexible work environment where contributions are recognized and rewarded. If who we are and what we do resonates with you, we invite you to join our high performance team!"	NA	"$103,000 - $131,000 a year (Indeed Est.) "	2018-10-15	"Washington%2C+DC"	80
"https://www.indeed.com/viewjob?jk=cce2551bd3997441"	"Data Scientist"	"Radiant Solutions"	"24 reviews"	"Responsibilities
Radiant Solutions is growing and we are looking for motivated data evangelists who are passionate about delivering new and innovative solutions for our customers. The ideal candidate needs limited direction, is passionate about technology and is curious about earth sensing and the new space economy.
We are seeking a data scientist for our applied modeling team.
You will be applying the latest machine learning techniques to extract insights from geospatial data.
You will have access to an enormous corpus of training data and will work to build the best models through bake-offs, hyperparameter searching, and incremental learning techniques.
You will quantitatively assess model performance and document the overall life-cycle.
You will work with other members of the data science and engineering teams to improve data science products and experiences.
Additionally, you will be developing rapid prototype solutions as needed for the focused collection, parsing, managing, analyzing, and visualizing large sets of disparate data to extract meaningful insights.Qualifications
2-5 years experience designing, implementing, training, evaluating, and optimizing algorithms based on state-of-the-art machine learning techniques
Experience with applying deep learning for computer vision and natural language processing.
Experience with major deep learning framework such as Caffe, CNTK, Theano, Torch, and Tensorflow.
TS/SCI with active poly
#cjpost
Overview
Join our company whose purpose is to help national security and commercial organizations understand and navigate our changing planet. Radiant Solutions provides multi-source data collection, enrichment, and analytic capabilities that reveal unique geospatial information and insights where and when it matters most.
We are a new organization but no company has such strong roots in geospatial with our level of scale and a strong commercial mindset. Our heritage companies, MDA Information Systems, RadiantBlue, DigitalGlobe Intelligence Solutions, and HumanGeo are well known for delivering innovative capabilities across the entire geospatial intelligence value chain. Our combined team of over 1,000 aerospace engineers, geospatial analysts, weather and ocean experts, software developers, data scientists, and DevOps engineers apply disruptive technology and our unique intellectual property to both national security and commercial problems.
We offer an excellent comprehensive benefits package including medical, dental, life, and short/long-term disability insurance, vacation and sick leave, 401(k) retirement plan, flexible spending account, and tuition assistance. Radiant Solutions values diversity in the work place and is an Equal Opportunity Employer."	NA	"character(0)"	2018-10-15	"Washington%2C+DC"	80
