"url"	"title"	"company_name"	"company_score"	"description"	"time_posted"	"metadata"	"date_scraped"	"city"	"page"
"https://www.indeed.com/viewjob?jk=NA"	"NA"	"NA"	"NA"	"NA"	"NA"	"NA"	2018-10-15	"San+Francisco%2C+CA"	40
"https://www.indeed.com/viewjob?jk=54fab4417a2cbf79"	"Data Scientist - Styling Algorithms"	"Stitch Fix"	"157 reviews"	"About the Team
--------------

At Stitch Fix, our data science team leverages machines together with expert-human judgment to generate innovative recommendations and insights that innovate the way the company functions and helps our clients look and be their best selves. The Styling data science team is a core team to our service - we develop capabilities that allow stylists to help our clients find what they love while building meaningful relationships with them.

About the Role
--------------

This role will be focused on quantifying behavior of stylists (humans in the loop) and building tools that augment their day-to-day tasks. Together with the data science and styling strategy and field teams, you will drive end-to-end deep analyses of styling behavior by partnering across the organization to frame problems and establish hypotheses. You will have an opportunity to turn your findings into algorithms and/or product features to assist stylists in helping clients find what they love.

You're excited about this opportunity because you will…
--------------------------------------------------------------
Work with business partners to frame problems and come up with the plausible hypotheses.
Complete end to end analyses to validate established hypotheses
Communicate complicated concepts to the wider audience - both data scientists and broader business partners
Implement and deploy new algorithms to power the styling process at Stitch Fix.

We're excited about you because…
---------------------------------------------
You have 2+ years of experience in a crossfuncitonal data science role
You have practical experience with Python,working knowledge of SQL, and experience building end-to-end solutions
You have experience using causal inference in business context
You have examples of projects where you were able to drive impact
You have experience using data visualization to communicate your findings, including to influence broader decisions

Why you'll love working at Stitch Fix...
----------------------------------------
We are a group of bright, kind and goal oriented people. You can be your authentic self here, and are empowered to encourage others to do the same!
We are a successful, fast-growing company at the forefront of tech and fashion, redefining retail for the next generation
We are a technologically and data-driven business
We are committed to our clients and connected through our vision of \"Transforming the way people find what they love\"
We love solving problems, thinking creatively and trying new things
We believe in autonomy & taking initiative
We are challenged, developed and have meaningful impact
We take what we do seriously. We don't take ourselves seriously
We have a smart, experienced leadership team that wants to do it right & is open to new ideas
We offer competitive compensation packages and comprehensive health benefits
You will be proud to say that you work for Stitch Fix and will know that the work you do brings joy to our clients every day

About Stitch Fix

Stitch Fix is an online personal style service for men and women combining art and science to disrupt and redefine the retail industry. We're the first fashion retailer to blend expert styling, proprietary technology and unique product to deliver a refined and deeply personalized shopping experience. We leverage vast amounts of client data to make decisions throughout the company. All of this results in a simple, powerful offering to our customers and a successful, growing business. We believe we are only scratching the surface of our opportunity; and we're looking for incredible people to contribute! We'd love for you to help us carry on the trend.
---------------------------------------------------------------------------------------------------------------------------------------------------------------------------------------------------------------------------------------------------------------------------------------------------------------------------------------------------------------------------------------------------------------------------------------------------------------------------------------------------------------------------------------------------------------------------------------------------------------------------------------------------------------------------------------------------"	NA	"character(0)"	2018-10-15	"San+Francisco%2C+CA"	40
"https://www.indeed.com/viewjob?jk=d754b481701e591b"	"Data Scientist"	"Arable Labs, Inc."	"-"	"What we’re looking for:
Arable is looking for a data scientist to join our community of scientists. This person would provide expertise and vision to contribute to a data-driven culture and inspire the adoption of new technologies to enhance an integrated weather and plant monitoring system. This person will be working with a team of scientists and data scientists to prototype, improve, and collaborate with end to end engineers to provide customers with actionable information based on the highest-quality data. If you’re motivated by working on the complex technical problems that can have a real positive impact on the world, we’d love to talk!
What we do:
At Arable, our goal is to connect all the world’s farms and provide the highest-quality data to power predictive analytics that will help optimize the global food system. This is an ambitious goal, but the need has never been greater to rethink how we will feed an ever-growing population and reduce our impact on natural resources. We believe the heart of the solution is digitizing the analog world with high-fidelity data to help food producers optimize their operations. If successful, we hope the impact of our work will improve the lives of farmers everywhere and be a major contribution to securing the global food supply for decades to come.
A few examples of the work we’re doing today:Helping farmers in India get what they need most: insurance in tough years.
Giving produce growers in California the tools to optimize yields and minimize waste
Helping irrigated farmers in Nebraska manage water more efficiently and sustainably to protect our water supply
What you will do:Perform deep dive analyses to understand and optimize environmental measurements
Provide expertise on statistical and mathematical concepts in a production environment
Develop and implement state-of-the-art analytical algorithms for time series segmentation, classification, and recognition
Research, develop, and prototype measurements for real-time crop monitoring and decision agriculture
Collaborate with team members from prototyping through production to rolling out big data capabilities, analytic frameworks, and best practices inside of data science
What you bring - basic qualifications:Advanced degree in a relevant computer or physical science or engineering discipline using any of these technologies
Substantial experience working on strategy and full-life cycle data science in Python, as well as experience working with data mining tools with Python and/or R
Experience with machine learning libraries such as xgboost, sklearn, Tensorflow, Keras, etc
An understanding of large datasets, the application of calibrations and analytics in a wide range of environments, and the implications of scalability across the globe
Team experience, specifically in cross-group collaborations with outstanding communication skills
Ability to obtain work authorization in the United States in 2018

Preferred Qualifications
Experience in digital sound processing
What We Offer:
At Arable you will be joining a company of dedicated team players who bring together diverse expertise and a passion for building a more sustainable future. You’ll find no shortage of lively conversation around the lunch table about the food we eat and how it is produced. We are a fast-moving startup committed to providing a rewarding employee experience through the work we do, the team, compensation, and benefits including:
Excellent medical, dental, vision, life, disability benefits, and a 401k program
Ability to work closely with customers who are hungry for our product, and where can make a positive impact on their livelihood and the world
A focus on community involvement and career development
We are an equal opportunity employer and value diversity at our company. We are committed to creating an inclusive environment for all employees.
"	"1 day ago"	"character(0)"	2018-10-15	"San+Francisco%2C+CA"	40
"https://www.indeed.com/viewjob?jk=567a682ebd49b5c1"	"Data Scientist / Engineer"	"Trifacta"	"2 reviews"	"About Us:
Trifacta is the best software platform for data transformation and preparation. We help businesses unlock the value of their data by enabling users to easily transform raw, complex data into clean and structured inputs for analysis. We are powering Google Dataprep, wrangling the world’s largest data sets, and have been used by analysts at over 10,000 companies in 143 countries.

With all this data, we’re looking for talented data scientists to join the Data Science team to help us better understand our users and build better products. If you are data curious, excited about deriving insights from data, and motivated by having impact on the business, we want to hear from you.
Responsibilities:Work closely with product and business teams to identify important questions and answer them with data
Apply statistical models on large datasets to: i) measure results and outcomes, ii) identify causal impact and attribution, iii) predict future performance of users
Drive the collection of new data and refinement of existing data sources
Identify the shared data needs across Trifacta and build efficient data pipelines to meet these needs. Operationalize and maintain key derived data sets for the business. Enable data driven decisions across the organization.
Design, analyze, and interpret the results of experiments.
Requirements:3+ years experience working with and analyzing large data sets to solve problems
BS, MS, or PhD. in a quantitative field (eg. EECS, Physics, Math, or Statistics)
Expert knowledge of a scientific computing language (such as Python or R) and SQL
Solid understanding of statistics, machine learning, and experimental design
Expertise in building and maintaining reliable ETL jobs
The ability to communicate results clearly and a focus on driving impact
"	"8 days ago"	"character(0)"	2018-10-15	"San+Francisco%2C+CA"	40
"https://www.indeed.com/viewjob?jk=aca646f111f8fc47"	"Data Scientist"	"TaskRabbit"	"27 reviews"	"$107,000 - $136,000 a year (Indeed Est.) ----------------
About TaskRabbit
----------------

Each day brings more chores and less time to accomplish them. Whether someone needs a handyman, house cleaner, moving help, or delivery person, TaskRabbit delights clients by matching the right skilled person in minutes. With our support, our clients can accomplish it all, not only today, but also on-demand to be their most productive self. On the other side of the marketplace we help our Taskers earn a living by setting their own prices, defining their working hours, and giving them control to help people, when and how they want in the most supportive marketplace.

We're a mission-driven company. Our culture is collaborative, pragmatic, and fast-paced. We're looking for talented, entrepreneurially minded and data-driven people who also have a passion for helping people do what they love - and have a ton of fun while they're at it. With the backing of IKEA, we are growing our entire marketplace, including furniture assembly, globally and entering additional markets as we scale. It's an exciting time at TaskRabbit!

Join us in creating a better everyday life for everyday people.

-------------
About the job
-------------
Conceiving, building and implementing predictive models of behavior for both sides of our marketplace
Developing and deploying data products into production environment
Finding and creating opportunities for business growth through data analysis and modeling
Testing and optimizing market parameters for optimal experiences for Clients, Taskers and the marketplace as a whole

Technology, tools and toys
--------------------------

The Data Science team's primary toolkit/stack is built on the industry standard scientific and numeric packages in Python. We use the Jupyter Notebook system for exploration, analysis, visualization, collaboration, and prototyping. We have a Python-based production environment, which allows us to quickly move code from \"the laboratory\" to production deployment.

We are heavily invested in AWS for both experimentation, development, testing and deployment and are looking to \"lean-in\" even further by utilizing more AWS products and services.

Qualifications
--------------------
We are looking for candidates with:Advanced degree in computer science/engineering/sciences, with a background in machine learning, predictive models, classification, data mining
Minimum 2 years working professionally as a Data Scientist
Being responsible for production data products and models
Knowledge and experience with
Jupyter notebook environment
Pandas, numpy, scipy, scikit-learn
Flask or similar web-based micro-services
Spark
AWS environment

We need someone who is interested and capable to dive into implementation, not a theoretician. There will be ample opportunity to learn on the job, but we need someone who already has some experience working with our technology and tools stack

We also need someone who is looking for a broad, changing set of problems. Someone who is scrappy, motivated, and willing to hack ideas, models, and code equally. Also, someone who can communicate findings and insights clearly and coherently.

---------------------------------------
You'll love working here because:
---------------------------------------
The People. You will be surrounded by some of the most talented, supportive, smart, and kind leaders and teams -- people you can be proud to work with!
The Values.
Care Deeply. We take time to be present and partner with our team and communities.
Level Up. We navigate through ambiguity and go the extra mile.
Be A Better Neighbor. We build a diverse and sustainable community and encourage all voices.
Lead The Future Together. We value entrepreneurship and inspire by action.
The diverse culture. We believe that we make better decisions when our workforce reflects the diversity of the communities in which we operate. Women make up more than half of our team and leadership, and we strive to recruit and retain employees from all over the world.
The perks. TaskRabbit offers comprehensive medical benefits, generous vacation and holiday time off, commuter benefits, learning and development opportunities, career development trainings, monthly TaskRabbit product stipends, IKEA discounts, free lunch, weekly meditations, charity events, and a dog-friendly office.

-----------------
Company Overview:
-----------------

TaskRabbit was founded in 2008 and acquired by the IKEA Group, the world's biggest furniture retailer, in 2017. TaskRabbit now offers furniture assembly in every IKEA store across the United States, and is expanding its global reach rapidly. TaskRabbit is currently in more than 45 cities in three countries: the United States, the United Kingdom, and our newest country, Canada, where we launched in September 2018.

There are more than 140,000 Taskers on the network. 60% are Millennials. Taskers consistently report that flexibility and the opportunity to earn a meaningful income are the top reasons they task on our network. In the past 10 years, people have saved more than 4 million hours of time by hiring Taskers through TaskRabbit.

In 2017, TaskRabbit launched TaskRabbit for Good (TR4G), which connects neighbors to build sustainable and compassionate communities. TaskRabbit for Good was created to make it easier for neighbors to give back locally and make a positive impact in communities around the world. TaskRabbit donates a portion of its service fee from all TR4G initiatives to best-in-class local non-profit organizations tackling social and environmental challenges.

TaskRabbit's headquarters is located in the heart of San Francisco, with three other offices in New York City, Austin, and London.

--------------------------
Equal Opportunity Employer
--------------------------

TaskRabbit is an equal opportunity employer and values diversity at our company. We do not discriminate on the basis of race, religion, color, national origin, ancestry, citizenship, gender, gender identity, sexual orientation, age, marital status, military/veteran status, or disability status. TaskRabbit is committed to working with and providing reasonable accommodation to applicants with physical and mental disabilities.

TaskRabbit will consider for employment all qualified applicants with criminal histories in a manner consistent with applicable law."	"11 days ago"	"$107,000 - $136,000 a year (Indeed Est.) "	2018-10-15	"San+Francisco%2C+CA"	40
"https://www.indeed.com/viewjob?jk=927bb9da0d0c1d8e"	"Data Science Summer 2019 Intern"	"Slack"	"7 reviews"	"Temporary, InternshipSlack is looking for interns to work alongside our data scientists for the summer of 2019. These internships are a unique opportunity for those that wish to gain hands-on experience working with data at a fast growing company. You will have the opportunity to join a collaborative group of data scientist who partner closely with Sales, Marketing, and Product to provide visibility into our data, craft narratives, find insights, and provide recommendations.Requirements:
Currently pursuing a degree in a quantitative field.
Preferred candidates are pursuing advanced degrees in statistics, math, economics, or computer science.
Experience using R, Python, or SQL.
Excellent communication skills and the ability to tell a complete narrative using data.
Ability to connect data analysis to real business problems, in order to impact business performance.
Must be graduating December 2019 or later.
Slack is the collaboration hub of choice for companies of all sizes, all across the world. By using Slack, they ensure that the right people are always in the loop, that key information is always at their fingertips, and new team members can get up to speed easily. With Slack, teams are better connected.
Launched in February 2014, Slack is the fastest growing business application ever and is used by thousands of teams and millions of users every day. We currently have nine offices worldwide, in San Francisco, Vancouver, Dublin, Melbourne, New York, London, Tokyo, Toronto and Denver.
Ensuring a diverse and inclusive workplace where we learn from each other is core to Slack's values. We welcome people of different backgrounds, experiences, abilities and perspectives. We are an equal opportunity employer and a pleasant and supportive place to work. Pursuant to the San Francisco Fair Chance Ordinance, we will consider for employment qualified applicants with arrest and conviction records.
Come do the best work of your life here at Slack."	"30 days ago"	"Temporary, Internship"	2018-10-15	"San+Francisco%2C+CA"	40
"https://www.indeed.com/viewjob?jk=e3e5e638fd551d60"	"Data Scientist"	"Aktana"	"-"	"POSITION SUMMARY
Aktana is looking for an experienced Data Scientist to join our Data Science team in San Francisco. The Data Science team builds mathematical and behavioral economics models underpinning Aktana’s core solutions for actionable analytics and behavioral intelligence. The set of problems that we tackle is incredibly diverse and complex. They cut across optimization, prediction, modeling, inference, and behavioral science. We research and develop the algorithms and models that make our solution intelligent, as well as implementing, scaling and maintaining the code that powers our production systems.

The ideal candidate is a critical thinker with experience and background in commercial life science domain, passionate about solving mathematical and behavioral problems with data, and is excited about working in a fast-paced, innovative and collaborative environment.

LOCATION
San Francisco, CA

REPORT TO
Chief Science Officer

RESPONSIBILITIES
Work with Data Scientists, Product Managers, Customer Success and Services teams to frame a problem, both mathematically and within the business context
Write production-level code; collaborate with Engineering team to implement algorithms in production and productize common solutions
Perform exploratory data analysis to gain a deeper understanding of the problem
Construct and fit statistical, machine learning and optimization models
Utilize commonly used computing and database environments to get the data that you need and implement a working prototype of the formulated model.
Learn and apply new methodologies in the intersection of applied math/ probability/statistics/machine learning/computer science.
Make intelligent approximations to the model if required to make it scalable.
Analyze experimental and observational data; communicate findings; facilitate launch decisions
Identify data sources that could be used to test assumptions
REQUIRED SKILLS/EXPERIENCES
Proven track record of developing algorithms for production-ready recommendation or prediction systems using languages and big data platforms such as Scala, Python, R, Java, Spark, Cassandra, and Hadoop
Experience working in an agile software development environment
Passion for solving unstructured and non-standard mathematical and behavioral problems
End-to-end experience with data, including querying, aggregation, analysis, and visualization
Experience implementing machine learning algorithms
Experience with analytics for commercial life science and pharma-specific analyses a big plus
Excellent communication and presentation skills, being able to explain complex problems and the solutions applied, feeling comfortable in being part of the sales process, supporting the sales team, engaging with customers and presenting technical solutions to a nontechnical audience
Experience in data science and data analytics for life science industry especially in GTM strategy and execution a big plus
High-energy self-starter with a passion for your work, attention to detail, and a positive attitude
Great team player, willingness to collaborate and communicate with others to solve a problem.
EDUCATION
M.S. or Ph.D. in Statistics, Operations Research, Mathematics, Computer Science, or other quantitative disciplines with at least 2 years of experience

ABOUT AKTANA
Committed to customer success and innovation, Aktana is at the forefront of transforming how life sciences companies share information with healthcare providers (HCPs). Our proprietary platform harnesses machine learning algorithms to enable marketing and sales teams to seamlessly coordinate and optimize multichannel engagement with HCPs. Today 10 of the top 20 global biopharmaceutical companies are using Aktana to go to market smarter.

Aktana is growing fast and looking for exceptional talent to join our team. We value hard work, transparency, and collaboration – and we like to have fun too! Headquartered in San Francisco, we have offices around the world, including Philadelphia, New York, London, Barcelona, Tokyo, Osaka, and Shanghai."	NA	"character(0)"	2018-10-15	"San+Francisco%2C+CA"	40
