"url"	"title"	"company_name"	"company_score"	"description"	"time_posted"	"metadata"	"date_scraped"	"city"	"page"
"https://www.indeed.com/viewjob?jk=7b579db6e6c4411b"	"Data Scientist- Enterprise Product Analytics"	"App Info"	"-"	"ContractThe role is largely operational and supports product and pricing analytics activities in Product and Analytics team.
Work with segment managers to deep dive on biz performance; deliver presentations/ assessments of these areas.
Create and maintain various tools and models in order to report and facilitate decision making on biz performance.
Prepares and presents executive decks, project updates, and ad-hoc analysis Partner with regional counterpart in all aspects of pricing/costing and profitability
Create automated processes for delivery of any regular reporting work.
Provide Adhoc analysis and any data pulls required to support the segment.
Own customer interface (communication, delivery, quality, value proposition, escalations); Takes ownership for quality of work deliverables and process adherence with guidance.
Learns and applies basic knowledge in given functional area
Technical Skill Set
Is an expert in Data access and analysis, has developed analytical models and solutions, and is exposed to analytical tools like Excel, SQL, Teradata, Tableau, SAS, Statistica, R, Python etc."	"16 days ago"	"Contract"	2018-10-15	"New+York%2C+NY"	70
"https://www.indeed.com/viewjob?jk=4af75957ef47fda9"	"Sr. Data Scientist"	"Amazon.com"	"27,831 reviews"	"Job Description
Machine learning (ML) has been strategic to Amazon from the early years. We are pioneers in areas such as recommendation engines, product search, eCommerce fraud detection, and large-scale optimization of fulfillment center operations.
The ML team within AWS provides opportunities to innovate in a fast-paced organization that contributes to game-changing projects and technologies that get deployed on devices and the cloud. As an ML solutions architect/data scientist in the AWS-ML team, you'll partner with technology and business teams to build new services that surprise and delight our customers. You will be working with terabytes of text, images, and other types of data to solve real-world problems. You'll design and run experiments, research new algorithms, and find new ways of optimizing risk, profitability, and customer experience.
We’re looking for top ML solutions architects/data scientists capable of using ML and other techniques to design, evangelize, and implement state-of-the-art solutions for never-before-solved problems.
The primary responsibilities of this role are to:Use deep learning, machine learning and analytical techniques to create scalable solutions for business problems
Design, development and evaluation of highly innovative models for predictive learning, content ranking, and anomaly detection
Interact with customer directly to understand the business problem, help and aid them in implementation of DL/ML algorithms to solve problems
Analyze and extract relevant information from large amounts of historical data to help automate and optimize key processes
Work closely with account team, research scientist teams and product engineering teams to drive model implementations and new algorithms
This position requires travel of up to 50%.Basic Qualifications
BS and Masters degrees in computer science, or related technical, math, or scientific field
5+ years of professional experience in a business environment
3+ years of relevant experience in building large scale machine learning or deep learning models and/or systems
1+ year of experience specifically with deep learning (e.g., CNN, RNN, LSTM)Preferred Qualifications
PhD degree in computer science, or related technical, math, or scientific field
Strong working knowledge of deep learning, machine learning and statistics.
Hands on experience building models with deep learning frameworks like MXNet, Tensorflow, Caffe, Torch, Theano or similar.
Experience in using Python, R or Matlab or other statistical/machine learning software
Strong communication and data presentation skills
The motivation to achieve results in a fast-paced environment.
Experience with statistical modelling / machine learning
Strong attention to detail
Comfortable working in a fast paced, highly collaborative, dynamic work environmentAbility to think creatively and solve problems"	NA	"character(0)"	2018-10-15	"New+York%2C+NY"	70
"https://www.indeed.com/viewjob?jk=7d4403b3248ed396"	"AI Research Scientist"	"Bloomberg"	"665 reviews"	"News and social media move financial markets. Bloomberg is one of the largest producers of news in the world and ingests over 70,000 external news feeds and social media like Twitter each day. This data keeps our clients informed, and our team's insights help make sense of it for our customers.
Who are we? Bloomberg's Artificial Intelligence (AI) group: researchers and engineers who have a passion for solving complex problems. Our charter: to extract relevant, meaningful, tradable, and actionable information (pricings, earnings, recommendations and major events) from data (news, web, social media, and structured data) in real-time. Since our customers rely on this information to make swift financial decisions, we guarantee precision, accuracy and latency beyond most academic and industry standards.

We aren't just building products. The infrastructure and algorithms we develop are used across the company by data scientists. We publish papers, attend conferences and contribute back to the larger data science community whenever we can (bloomberg.com/company/d4gx/).

Who are you? A research scientist who wants to work in the areas of machine learning, natural language processing, information extraction, reinforcement learning, graphical models, recommender systems and knowledge graphs. You want to join a close-knit group and make a big impact.
We'll trust you to:Work with researchers in our Engineering AI group on live systems
Publish research findings in leading academic venues and represent Bloomberg at industry conferences
Write, test and maintain production-quality code
Design, experiment and evaluate models
You'll need to have:A PhD in AI, NLP, ML, Optimization, or equivalent experience in related fields
5+ years of experience programming in C++, Python or Java
3+ publications in top-tier conferences or journals (such as ACL, AAAI, SIGIR, KDD, EMNLP, ICML, NIPS or equivalent)
We'd love to see:A quantitative background (Probability, Statistics, Linear Algebra, etc.)
Experience with distributed computational frameworks (YARN, Spark, Hadoop)

If this sounds like you, apply! We are hiring for our NYC and London offices.

Check out our blog, TechAtBloomberg.com, to learn more about our publications and projects in data science. We just got back from NAACL! Read about a paper our team presented here: https://www.techatbloomberg.com/blog/bloombergs-advances-natural-language-processing-allow-improved-tagging-tweets-news/

Apply Now

AI Research ScientistNew York, NY

Posted Oct 5, 2017 - Requisition No. 62503

Apply Now

News and social media move financial markets. Bloomberg is one of the largest producers of news in the world and ingests over 70,000 external news feeds and social media like Twitter each day. This data keeps our clients informed, and our team's insights help make sense of it for our customers.
Who are we? Bloomberg's Artificial Intelligence (AI) group: researchers and engineers who have a passion for solving complex problems. Our charter: to extract relevant, meaningful, tradable, and actionable information (pricings, earnings, recommendations and major events) from data (news, web, social media, and structured data) in real-time. Since our customers rely on this information to make swift financial decisions, we guarantee precision, accuracy and latency beyond most academic and industry standards.

We aren't just building products. The infrastructure and algorithms we develop are used across the company by data scientists. We publish papers, attend conferences and contribute back to the larger data science community whenever we can (bloomberg.com/company/d4gx/).

Who are you? A research scientist who wants to work in the areas of machine learning, natural language processing, information extraction, reinforcement learning, graphical models, recommender systems and knowledge graphs. You want to join a close-knit group and make a big impact.
We'll trust you to:Work with researchers in our Engineering AI group on live systems
Publish research findings in leading academic venues and represent Bloomberg at industry conferences
Write, test and maintain production-quality code
Design, experiment and evaluate models
You'll need to have:A PhD in AI, NLP, ML, Optimization, or equivalent experience in related fields
5+ years of experience programming in C++, Python or Java
3+ publications in top-tier conferences or journals (such as ACL, AAAI, SIGIR, KDD, EMNLP, ICML, NIPS or equivalent)
We'd love to see:A quantitative background (Probability, Statistics, Linear Algebra, etc.)
Experience with distributed computational frameworks (YARN, Spark, Hadoop)

If this sounds like you, apply! We are hiring for our NYC and London offices.

Check out our blog, TechAtBloomberg.com, to learn more about our publications and projects in data science. We just got back from NAACL! Read about a paper our team presented here: https://www.techatbloomberg.com/blog/bloombergs-advances-natural-language-processing-allow-improved-tagging-tweets-news/"	NA	"character(0)"	2018-10-15	"New+York%2C+NY"	70
"https://www.indeed.com/viewjob?jk=0f28dc0aafb427e0"	"Data Scientist"	"National Debt Relief"	"99 reviews"	"We are seeking an innovative and passionate Data Scientist to join our growing team to help promote our analytical culture, while leveraging data to maximize marketing performance and deliver a best-in-class experience for the clients we serve.
The ideal candidate will apply analytical rigor and data driven reasoning to guide the development and execution of marketing strategies and experiential initiatives across the organization. This individual will bring a sense of curiosity to seek out opportunities for improvement through internally and externally sourced data. This person will play a critical role in providing thought leadership, building statistical models to understand consumer behavior and intent, and identifying optimization opportunities across programs.
This is an opportunity to grow with a diverse team and have a measurable impact on a rapidly growing organization. It is a great fit for an entrepreneurial professional with a strong background in statistical modeling and a passion for translating data into actionable insight. Principle Duties and Responsibilities:Develop and implement advanced statistical models to guide business strategy and deliver incremental growth and value throughout the company.
Perform analysis of structured and unstructured data to solve complex business problems.
Use statistical techniques to build marketing segments, evaluate scenarios, predict future outcomes, and optimize performance.
Lead complex research and analytics projects across teams.
Research, test, and validate new modeling techniques as appropriate for specific solutions.
Present and depict recommendations so that stakeholders can make data-informed decisions.
Qualifications:
5+ years of experience as a data scientist conducting data mining and building and implementing complex models in a fast-paced, marketing-driven environment.
Experience working with large internal and external data sets covering new and existing client programs to include direct mail, TV, radio, search engine marketing and email preferred.
Undergraduate degree in a quantitative discipline (i.e. Statistics, Mathematics, Computer Science or equivalent quantitative discipline), advanced degree is preferred.
Expert knowledge of SAS, R/Python and SQL or similar industry standard tools use for large-scale data analysis and modeling.
Experience linking multiple data platforms with data visualization tools is a plus.
In-depth knowledge and experience in data mining and statistical modeling techniques (regression, decision tree, time series, etc. Knowledge of optimization theory and statistical model application are also preferred.
Strong analytical and problem-solving skills with the ability to interpret large amounts of data with business insight to support growth.
Strong consultative acumen with responsibility for analytical project design, management, and presentation of results to internal and external stakeholders.
Ability to clearly present statistical solutions to non-statistical people, articulating value and insights to the business.
Strong project management skills with a proven ability to set clear goals and design detailed plan against tight timelines. Evidence of self-motivated initiatives, high productivity, and good team work is desired.
What We Offer:
We believe in a team-first culture, full of rewards and recognition for our employees. We are dedicated to our employees’ success and growth within the company, through our employee mentorship and leadership programs.
Our extensive benefits package includes:
Medical, Dental, and Vision Benefits
401(k) Match
Paid Holidays, Sick Days, and Vacation
6 Weeks Paid Parental Leave
Pre-tax Transit Benefits
Discounted Gym Membership
No-cost Life Insurance Benefits"	"24 days ago"	"character(0)"	2018-10-15	"New+York%2C+NY"	70
"https://www.indeed.com/viewjob?jk=aea9fe0330576ef8"	"Data Scientist"	"Fora Financial LLC"	"20 reviews"	"Fora Financial, located in NYC, is a leading financial services company providing working capital to small and mid-size businesses nationwide.
Established in 2008, we support small businesses in need of financing to sustain or grow their enterprise by providing innovative, customized, and flexible working capital solutions. We operate through a consultative approach, listening to customers and providing what best meets their needs in an ever-changing financial market. To date, Fora Financial has funded over 22,000 individual transactions to more than 15,000 unique customers. The company has funded over $750 million in working capital solutions for small businesses since its inception.
A Day in the Life of a Data Scientist:
Build predictive models including but not limited to credit risk. fraud, response, and offer acceptance propensity
Perform through testing and validation of models and support various aspects of the business with data analytics
Identify new data sources/patterns that add significant lift to predictive modeling capabilities
Conduct analysis and turn insights into actionable changes for predictive models or policies
Develop analytics and advanced visualization to assist with portfolio surveillance. Typical functions are loss forecasting, mix management, risk appetite management, collections strategy, and reporting related to KPIs that affect portfolio surveillance such as non-performance, loss rates and loss severity
Partner with IT to integrate and productionize new data sources for modeling use
What You Have:
B.S. degree or higher in Statistics, Applied Math, Computer Science, Engineering or other quantitative program
3 years minimum experience with credit risk modeling; 5 years minimum preferred
Proven track record of building new models and improving existing models
Deep understanding of consumer credit report variables/attributes at both summary and tradeline level
Experience with small business lending and portfolio management is a plus
Passionate about solving problems with data and high level of intellectual curiosity
Thorough understanding of statistical modeling techniques
Proficiency in at least one of the following languages: R, SAS, SQL, Python
Highly motivated to work on multiple projects in parallel and team player with a start up spirit
Solid written and oral communication skills and ability to share findings with non-technical audienceThe Benefits of Working for Fora Financial:
A good work/life balance
Medical, Dental, Vision Coverage
401K Match
Life Insurance at No Cost to Employees
Generous Time Off Plan Including Rollover Vacation Days
Commuter Benefits
Health Care and Dependent Care Flexible Spending"	"27 days ago"	"character(0)"	2018-10-15	"New+York%2C+NY"	70
"https://www.indeed.com/viewjob?jk=ce9a1cbf356bd4dc"	"Data Scientist, Group Benefits and Middle Market P&C"	"The Hartford"	"1,449 reviews"	"Overview of the Position
The Hartford seeks energetic and passionate Data Scientists to focus on designing, developing and implementing solutions that will make an impact on our business. This role will focus on developing solutions in support of our Middle Market and Group Benefits business. In addition the Data Scientist will participate in a variety of ad hoc projects.
Our Data Scientists play a significant role by both leading and partnering with the business and data teams for a better understanding of the customer journey across multiple lines of business. As a Data Scientist you will focus on research for deliverables that support the long term plan to evolve the department’s capabilities to further develop and deliver impactful products to drive outcomes for both the business and clients.
Solutions that are developed will support a wide range of business areas which include underwriting, claims, operations, risk engineering, and digital analytics. As a Data Scientist you will focus on developing analytic and predictive modeling solutions that feature engineering assets, experimental design, as well as modeling techniques and abilities. Our Data Scientist toolbox consists of but not limited to predictive Modeling Techniques, Machine Learning, Cognitive Computing, Unsupervised learning, and Augmented intelligence. As a Data Scientist you will support and explore those assets overtime through customer adoption and establishing a rhythm within the data science community.
Responsibilities:
Collaborate and partner with business stakeholders in a way that supports the vision and sustains a culture that treats analytics as a corporate asset.
Participate in reviewing work with partners on an ongoing basis to calibrate deliverables against expectations
Help identify long term opportunities within the customer journey through the creation of algorithms and machine learning techniques to achieve financial objectives and solve problems.
Participate in the creation and deployment of long term tools to continually evolve the business.
Assist in identifying and assessing the value of new data sources and analytical techniques to ensure ongoing competitive advantage
Contribute to the successful implementation of strategies to achieve targeted business objectives.
Accountable for short term ownership and evolution of models developed
Support the processes used to develop and enhance our business needs
Support a high-performance collaborative culture
Develop knowledge of The Hartford's formal and informal structures, business processes, and data sources in your area of expertise
Remain current on research techniques and become familiar with state of the art tools applicable to your function
Present complex modeling to Senior Data Scientists that maximizes the bottom-line impact of modeling results
Provide economic, qualitative, and statistical support to ensure accuracy of characteristics and metrics being applied to business decisions.
Assist in estimating the economic impact of operational decisions
Promote analytics opportunities of the company with customers and business partners.
As requested, provide timely feedback and opportunities for your colleagues.
Suggest and participate in training opportunities for research staff and others in the organization
Qualifications
Experience & Skills
Master’s or Ph.D. in Statistics, Applied Mathematics, Actuarial Science, Quantitative Economics or other similar analytical field
2+ years of relevant experience in Research Function in Insurance or Financial Services or related field.
Experience in large scale operations environments (Claim Centers, Call Centers, Manufacturing) a plus.
Technical/Functional Skills
Experience modeling data and analytical capability.
Advanced coding skills in various languages e.g. R, Python etc.
Developed verbal/written communication skills.
Ability to translate complex technical topics into business solutions and strategies, including visualization.
Exposure to executing change to core business processes through the innovative use of quantitative techniques.
Competencies
Drive and commitment to what is necessary to get the job done efficiently, thoroughly, and professionally.
Innovative. Seeks new and creative ways to approach analytical exercises and development projects.
Results-oriented. Demonstrates a sense of urgency and accountability for business issues.
Customer focused. Builds effective relationships within the data science community
Equal Opportunity Employer/Females/Minorities/Veterans/Disability/Sexual Orientation/Gender Identity or Expression/Religion/Age
** NO AGENCIES PLEASE **Job Function
: Data Science
Primary Location
: United States-New York
Other Locations
: United States-Connecticut-Hartford
Schedule
: Full-time
Job Level
: Individual Contributor
Education Level
: Master's Degree (±18 years)
Job Type
: Standard
Shift
: Day Job
Employee Status
: Regular
Overtime Status
: Exempt
Travel
: No
Job Posting
: Oct 8, 2018, 7:37:49 PM
Remote Worker Option : No"	NA	"character(0)"	2018-10-15	"New+York%2C+NY"	70
