"url"	"title"	"company_name"	"company_score"	"description"	"time_posted"	"metadata"	"date_scraped"	"city"	"page"
"https://www.indeed.com/viewjob?jk=711724ce933bc986"	"Data Scientist, Engineering"	"Google"	"2,617 reviews"	"Note: By applying to this position your application is automatically submitted to the following locations: Mountain View, CA, USA; New York, NY, USA; San Bruno, CA, USA; Seattle, WA, USA; San Francisco, CA, USA As a Data Scientist, you will evaluate and improve Google's products. You will collaborate with a multi-disciplinary team of engineers and analysts on a wide range of problems. This position will bring analytical rigor and statistical methods to the challenges of measuring quality, improving consumer products, and understanding the behavior of end-users, advertisers, and publishers. Google is and always will be an engineering company. We hire people with a broad set of technical skills who are ready to take on some of technology's greatest challenges and make an impact on millions, if not billions, of users. At Google, data scientists not only revolutionize search, they routinely work on massive scalability and storage solutions, large-scale applications and entirely new platforms for developers around the world. From Google Ads to Chrome, Android to YouTube, Social to Local, Google engineers are changing the world one technological achievement after another. Responsibilities Work with large, complex data sets. Solve difficult, non-routine analysis problems, applying advanced analytical methods as needed. Conduct end-to-end analysis that includes data gathering and requirements specification, processing, analysis, ongoing deliverables, and presentations. Build and prototype analysis pipelines iteratively to provide insights at scale. Develop comprehensive understanding of Google data structures and metrics, advocating for changes where needed for both products development and sales activity. Interact cross-functionally with a wide variety of people and teams. Work closely with engineers to identify opportunities for, design, and assess improvements to google products. Make business recommendations (e.g. cost-benefit, forecasting, experiment analysis) with effective presentations of findings at multiple levels of stakeholders through visual displays of quantitative information. Research and develop analysis, forecasting, and optimization methods to improve the quality of Google's user facing products; example application areas include ads quality, search quality, end-user behavioral modeling, and live experiments. Qualifications Minimum qualifications:MS degree in a quantitative discipline (e.g., statistics, operations research, bioinformatics, economics, computational biology, computer science, mathematics, physics, electrical engineering, industrial engineering). 2 years of relevant work experience in data analysis or related field. (e.g., as a statistician / data scientist / computational biologist / bioinformatician). Experience with statistical software (e.g., R, Python, Julia, MATLAB, pandas) and database languages (e.g., SQL). Preferred qualifications:PhD degree in a quantitative discipline as listed in Minimum Qualifications. 4 years of relevant work experience (e.g., as a statistician / computational biologist / bioinformatician / data scientist), including deep expertise and experience with statistical data analysis such as linear models, multivariate analysis, stochastic models, sampling methods. Analytical engagements outside class work while at school can be included. Applied experience with machine learning on large datasets. Experience articulating business questions and using mathematical techniques to arrive at an answer using available data. Experience translating analysis results into business recommendations. Demonstrated skills in selecting the right statistical tools given a data analysis problem. Demonstrated effective written and verbal communication skills. Demonstrated leadership and self-direction. Demonstrated willingness to both teach others and learn new techniques. At Google, we don’t just accept difference - we celebrate it, we support it, and we thrive on it for the benefit of our employees, our products and our community. Google is proud to be an equal opportunity workplace and is an affirmative action employer. We are committed to equal employment opportunity regardless of race, color, ancestry, religion, sex, national origin, sexual orientation, age, citizenship, marital status, disability, gender identity or Veteran status. We also consider qualified applicants regardless of criminal histories, consistent with legal requirements. If you have a disability or special need that requires accommodation, please let us know. To all recruitment agencies: Google does not accept agency resumes. Please do not forward resumes to our jobs alias, Google employees or any other company location. Google is not responsible for any fees related to unsolicited resumes."	NA	"character(0)"	2018-10-15	"New+York%2C+NY"	10
"https://www.indeed.com/viewjob?jk=53d760b7b8278adc"	"Senior Data Scientist"	"Octane Lending"	"-"	"$140,000 - $180,000 a yearFounded in 2014, Octane Lending is a fintech startup with the vision of making consumer financing as painless as cash. Serving the $60B consumer powersports and agricultural vehicle spaces (motorcycle, ATV, tractor, mower etc.), our technology powers transactions in over 2000 dealerships across the country. Less than two years after launch, our platform has generated over $1bn in loan requests and enabled thousands of customers to buy their dream products. We have raised $42M in venture capital from leading investors such as IA Ventures, Valar Ventures, and Contour Venture Partners and closed $145M in debt capital. We are seeking a talented data scientist to lead projects related to credit risk analytics and model development. You will be working with a versatile team of data scientists and financial professionals to implement live loan models underlying core functions of Octane's lending business and loan portfolios. Responsibilities: Bridge the disciplines of data analytics and risk management to formulate evidence-based credit strategies that responsibly grow originations within the organization’s risk management appetite Lead and manage the development of machine learning powered predictive models for Octane Lending’s real-time credit and fraud detection systems Manage and mine large data sets of proprietary and third-party data to draw insights and recommendations for policy and strategy decisions Champion data analytics and help advance our culture of data-driven decision-making Design and implement customer-facing experiments that improve our user experience and grow loan originations RequirementsA track record of taking initiative and driving results, and a passion to build, design and transform a young organization Deep understanding of end-to-end development of machine learning systems, especially feature engineering and feature selection Experience with both model development and systems integration Strong communication skills and experience working across teams Hands-on experience with SQL and Python or similar languages is required 5+ years of industry experience with 2+ years of managing data science projects or teams BenefitsCompetitive base salary and equity Rich health, vision and dental benefits Life and disability insurance policies Transit reimbursement FSA account Flexible work hours and remote friendly environment 15 days PTO"	"10 days ago"	"$140,000 - $180,000 a year"	2018-10-15	"New+York%2C+NY"	10
"https://www.indeed.com/viewjob?jk=291e4f993f99e999"	"c(\"Data Scientist\", \"WITHIN 30 DAYS, YOU WILL:\", \"WITHIN 60 DAYS, YOU WILL:\", \"WITHIN 90 DAYS, YOU WILL:\", \"WHAT YOU'LL NEED TO BE SUCCESSFUL IN THIS ROLE:\", \"WHAT YOU'LL GET FROM US:\")"	"HotelTonight"	"6 reviews"	"$94,000 - $138,000 a year (Indeed Est.) HotelTonight makes it remarkably easy to book great hotels at amazing rates on your mobile device, for tonight, tomorrow and beyond. Our goal is to be the premier and most loved way to book a place to stay and we’re looking for a Data Scientist to help do just that. If hotel rooms are the fuel that powers HotelTonight, data is the oil that makes it fire on all cylinders. Leveraging this data in the right way is what will differentiate HotelTonight and make it the leading hotel booking app on the planet. As one of the first Data Scientists on the Data & Strategy team, you will drive business decisions across the company using data and be responsible for implementing and fostering an environment that thrives on advanced analysis. You'll work closely with teams across Marketing, Supply and Finance on projects around customer segmentation, forecasting user quality and forecasting business performance - just to name a few! Check out this post to learn more about how the D&S team empowers the company to make smarter decisions based on data. WITHIN 30 DAYS, YOU WILL: Become familiar with our datasets and the analysis tools that we work with Learn about the business and the problems (short-term and long-term) that we face Start to fill holes in our analysis platform and identify the areas of our business that are most important to focus on WITHIN 60 DAYS, YOU WILL: Deliver your first detailed analysis, which includes a strategic plan for how to act upon your findings Improve the team’s access to advanced analysis tools and begin teaching them how to most effectively use them Increase your knowledge of the business and the teams involved, and prioritize the most impactful projects WITHIN 90 DAYS, YOU WILL: Establish a roadmap for advanced analysis projects for the next few months Implement your first strategic initiatives and begin measuring the impact on key metrics associated with the initiative Empower the rest of the team to apply advanced analysis to their own projects using your analysis tools WHAT YOU'LL NEED TO BE SUCCESSFUL IN THIS ROLE: Professional experience using advanced analysis to guide strategic decisions at the company level You know how to use the right tool for the job, whether that's a programming language (like R or Python) or just plain old SQL Experience working with statistics and supervised/unsupervised models Communication: you love to talk about your work and findings, and can clearly explain the details Familiarity with Amazon Web Services, Apache Spark, Tensorflow, etc Ability to move quickly by making smart assumptions Experience working with e-commerce marketplaces is a big plus A love for travel, especially the hotel part! WHAT YOU'LL GET FROM US: An official Best Places to Work (we're in the top 10!) The opportunity to define mobile commerce and change the way people book travel A people-focused organization dedicated to making sure you're challenged, learning, growing, and recognized for all the great work you do The camaraderie of a driven, agile team that is building something disruptive Excellent health, dental, vision and 401k plans, and stock options too Fun stuff - quarterly travel stipend, flexible time off, subsidized cell phone plans and fitness memberships, and the opportunity to spin the HT Roulette wheel to win a spontaneous weekend getaway! We are on a mission to radically transform hotel bookings. Doing this requires us to think differently and to question conventional approaches, therefore it’s essential to have a diverse team of the very best people with all types of backgrounds and experiences to bring the best ideas to life. We are committed to maintaining an environment where all of our team members have the opportunity to be heard, to make an impact and to do the best work of their lives."	"19 days ago"	"$94,000 - $138,000 a year (Indeed Est.) "	2018-10-15	"New+York%2C+NY"	10
"https://www.indeed.com/viewjob?jk=768d52de1235cc75"	"Data Scientist"	"Northwell Health"	"888 reviews"	"Works directly with the Program Director for Data Science to advance data science strategy and programs within Northwell. Works collaboratively with both Information Technology members and the clinical community to evaluate and implement data science projects, systems and initiatives at both the department and the enterprise level. Ensures that these projects and their outputs enhance clinical quality, patient safety, and institutional efficiency, focusing on all aspects of data science, including data gathering and wrangling, exploratory data analysis, data modeling and machine learning, and model implementation and evaluation. Provides expertise on mathematical concepts for the broader applied analytics team. 1. Works collaboratively to design, implement and maintain data science models and applications. 2. Works on programs to apply data science methodologies, including predictive modeling and machine learning, data analytics and visualization, and usability and design, to departmental, service line, and enterprise applications and functions. 3. Synthesizes complex data-related problems into actionable business and/or clinical strategy, and communicate findings to appropriate end-users and stakeholders. 4. Assists with the development of specifications to support the design of new or modified data science projects, with a focus on data-driven optimization, enhancement, and development. 5. Assists in the evaluation of projects, systems, and initiatives at the department, service line, and enterprise level. Ensures projects and their outputs enhance clinical quality, patient safety, and institutional efficiency, focusing on all aspects of data science, including data gathering and wrangling, exploratory data analysis, data modeling and machine learning, and model implementation and evaluation. Ensures high quality execution of all proposed projects. 6. Knowledgeable in present and planned data science projects and maintains voice of the customer in all project initiatives. 7. Serves as the link between the clinical staff (customer) requirements and IS capabilities. 8. Assists in ensuring that systems are implemented to support Health System initiatives and goals to improve the quality of patient care, to maximize patient safety, and to provide operational efficiencies. 9. Serves as a resource to the Director of Quality Informatics and Program Director of Data Science. 10. Demonstrates familiarity with current hospital information systems. 11. Performs other duties as assigned. Qualifications Bachelor’s Degree in Computer Science, Informatics, Statistics, Engineering, Data Science, or related field, required. Master’s Degree, preferred. Minimum of two (2) years of post-graduate training or experience involving quantitative data analysis, required and working with clinical data, data science, and machine learning, preferred. Working familiarity with basic medical and health information technology concepts, including standardized terminologies and ontologies and electronic health records, as well as Data Warehousing and Business Intelligence tools, required. Expertise in working with SQL relational databases and statistical or general programming languages (e.g., Python, R), required. Deep understanding of statistical and predictive modeling concepts, machine-learning approaches, clustering and classification techniques, and recommendation and optimization algorithms. Strong interpersonal skills, capable of working collaboratively with clinicians and administrators."	"6 days ago"	"character(0)"	2018-10-15	"New+York%2C+NY"	10
"https://www.indeed.com/viewjob?jk=e6fd721f45b005b8"	"Data Analyst / Data Scientist"	"Defined Clarity"	"-"	"$65 - $75 an hourWe have a client that is looking for a data scientist to add to its team. This position is for a Fortune 50 company that is based in Philadelphia. This is not a remote position. Expertise in SQL Development.Call Center or Customer care data experience a plus.Must be able to write SQL queries and must have experience with data extraction and ETL.Experience with Teradata and SQL Server DatabasesR Studio and Python scripting is a plus.Communication and presentation skills are a must as you will have to present to key stakeholders.Tableau analysis and dashboard development is required. A minimum of three years professional-level SQL programming experience in a Windows and Linux environment.A Computer Science or Mathematics degree.Outstanding problem-solving skills.Ability to develop and deliver power point presentations.Knowledge of shell scripts and other languages including Java, Python or Perl is a plus."	NA	"$65 - $75 an hour"	2018-10-15	"New+York%2C+NY"	10
"https://www.indeed.com/viewjob?jk=9e0a92dbc518508e"	"Data Scientist"	"Qloo"	"-"	"OtherFunded downtown startup with competitive salary is seeking a data scientist from experienced to senior and above.We're a small company with outsized output. There will be endless opportunity for an array of technologies, but you should know the idiosyncrasies of the Spark ecosystem.The following would be nice but is not necessary:- Advanced degree (MEng, MSc or PhD) in one of the following disciplines: math, physics, engineering, computer science.- At least four years of experience in quantitative analysis with real data in a product or research role.- Strong familiarity with programming concepts (data structures, computational analysis).Reply with relevant experience in your cover. We have a ton of data to wade through, so any large scale projects you've worked on are worth leading with.We have a sunlit, dog-friendly office in a great SoHo location.Health insurance, flexible hours and partial telecommute for the right candidate.Job Type: Full-timeExperience:Spark: 2 years (Required)Location:NYC, NY (Required)"	"6 days ago"	"Other"	2018-10-15	"New+York%2C+NY"	10
"https://www.indeed.com/viewjob?jk=02d9d47dd94e3997"	"PMC: Data Scientist"	"Penske Media Corp."	"3 reviews"	"PMC: Data Scientist PMC is searching for a passionate Data Scientist to join our Audience Marketing team. This is a new role with the responsibility to own and lead some of our key data science cross-functional initiatives that can re-shape the business. The role will also include using applied data science techniques (prospect and affinity modelling, campaign optimization etc.) to grow our subscription business. In this challenging role, the Data Scientist will ensure that we are maximizing our opportunity to leverage machine learning and artificial intelligence approaches to help solve difficult and complex business problems. The Data Scientist will report to the VP of Audience Marketing. Responsibilities will include the following: Take Women’s Wear Daily (WWD) existing Paywall to the next level by developing a new methodology to manage users’ access to WWD exclusive content Work closely with the Optimization team to test and validate the rules behind the Content Wall Expand the developed new Content Wall methodology to other brands within Penske Media Corporation. Build tools to parse and analyze high volume data across all PMC properties Work with Engineering team to determine best methods to collect useful data to support subscription goals Identify, develop, and pull useful information into our internal analytics dashboard Get subscriptions-based models into production Use data and the scientific method to answer questions about our content and content productionRequirements: You're not expected to know all these, but familiarity with them is a plus. Linux Machine Learning toolkits such as Scikit Learn, H2O, Tensorflow Scripting languages such as Python, R, PHP (WordPress, Laravel/Symfony2) ETL orchestration frameworks such as Apache AIrflow, Oozie, Luigi etc. Build tools such as Jenkins, Ant, Grunt, Phing Unit Testing (PHPUnit) Vagrant and VirtualBox Deployment and provisioning (Capistrano, Puppet, Chef) Web Servers (Apache, Nginx) GCP or AWS (EC2, Lambda, EMR, Kinesis) Data warehousing and analytics (Hadoop, Hive, MapReduce) SQL & NoSQL (Cassandra, Riak) About PMC: Penske Media Corporation (PMC) is a leading digital media and information services company whose award-winning content attracts a monthly audience of more than 180 million and empowers more than 1 million global CEOs and business thought-leaders in markets that impact the world. Our dynamic events, data services, and rich content entertain and educate today’s fashion, retail, beauty, entertainment and lifestyle sectors. Headquartered in New York and Los Angeles with additional offices in 11 countries worldwide, Penske Media is the way global influencers are informed, connected, and inspired. To learn more about PMC and its iconic brands, visit www.pmc.com."	"15 days ago"	"character(0)"	2018-10-15	"New+York%2C+NY"	10
"https://www.indeed.com/viewjob?jk=0f28dc0aafb427e0"	"Data Scientist"	"National Debt Relief"	"99 reviews"	"We are seeking an innovative and passionate Data Scientist to join our growing team to help promote our analytical culture, while leveraging data to maximize marketing performance and deliver a best-in-class experience for the clients we serve. The ideal candidate will apply analytical rigor and data driven reasoning to guide the development and execution of marketing strategies and experiential initiatives across the organization. This individual will bring a sense of curiosity to seek out opportunities for improvement through internally and externally sourced data. This person will play a critical role in providing thought leadership, building statistical models to understand consumer behavior and intent, and identifying optimization opportunities across programs. This is an opportunity to grow with a diverse team and have a measurable impact on a rapidly growing organization. It is a great fit for an entrepreneurial professional with a strong background in statistical modeling and a passion for translating data into actionable insight. Principle Duties and Responsibilities:Develop and implement advanced statistical models to guide business strategy and deliver incremental growth and value throughout the company. Perform analysis of structured and unstructured data to solve complex business problems. Use statistical techniques to build marketing segments, evaluate scenarios, predict future outcomes, and optimize performance. Lead complex research and analytics projects across teams. Research, test, and validate new modeling techniques as appropriate for specific solutions. Present and depict recommendations so that stakeholders can make data-informed decisions. Qualifications: 5+ years of experience as a data scientist conducting data mining and building and implementing complex models in a fast-paced, marketing-driven environment. Experience working with large internal and external data sets covering new and existing client programs to include direct mail, TV, radio, search engine marketing and email preferred. Undergraduate degree in a quantitative discipline (i.e. Statistics, Mathematics, Computer Science or equivalent quantitative discipline), advanced degree is preferred. Expert knowledge of SAS, R/Python and SQL or similar industry standard tools use for large-scale data analysis and modeling. Experience linking multiple data platforms with data visualization tools is a plus. In-depth knowledge and experience in data mining and statistical modeling techniques (regression, decision tree, time series, etc. Knowledge of optimization theory and statistical model application are also preferred. Strong analytical and problem-solving skills with the ability to interpret large amounts of data with business insight to support growth. Strong consultative acumen with responsibility for analytical project design, management, and presentation of results to internal and external stakeholders. Ability to clearly present statistical solutions to non-statistical people, articulating value and insights to the business. Strong project management skills with a proven ability to set clear goals and design detailed plan against tight timelines. Evidence of self-motivated initiatives, high productivity, and good team work is desired. What We Offer: We believe in a team-first culture, full of rewards and recognition for our employees. We are dedicated to our employees’ success and growth within the company, through our employee mentorship and leadership programs. Our extensive benefits package includes: Medical, Dental, and Vision Benefits 401(k) Match Paid Holidays, Sick Days, and Vacation 6 Weeks Paid Parental Leave Pre-tax Transit Benefits Discounted Gym Membership No-cost Life Insurance Benefits"	"24 days ago"	"character(0)"	2018-10-15	"New+York%2C+NY"	10
