"url"	"title"	"company_name"	"company_score"	"description"	"time_posted"	"metadata"	"date_scraped"	"city"	"page"
"https://www.indeed.com/viewjob?jk=NA"	"NA"	"NA"	"NA"	"NA"	"NA"	"NA"	2018-10-15	"New+York%2C+NY"	70
"https://www.indeed.com/viewjob?jk=cd3674a350b56f71"	"Data Scientist"	"Two Sigma Investments, LLC."	"7 reviews"	"Two Sigma is looking for Data Scientists from a variety of backgrounds to help propel and enhance its data-driven investment initiatives. As a Two Sigma Data Scientist, you will explore a breadth of challenges: identifying timely and unique data sets, diving deep into a diverse set of data domains, visualizing and exploring underlying data drivers, and developing data set features and forecasts.
Responsibilities:
Apply statistical analysis & modeling techniques with finance intuition to datasets large and small, advance existing initiatives and open opportunities to pursue new and previously unexplored research topics across a wide variety of industries and domains
Operate and extend the data science platform to deliver production-grade data curation and analysis services
Own end-to-end data workflows and develop deep domain expertise on the underlying actors and behaviors manifested through data
Visualize and explore data sets to enable the ideation and generation of new, predictive feature
Qualifications and Experience:
Advanced degree in Computer Science is preferred
3+ years of experience in data analysis or similar role
Experience applying statistical methods (distribution analysis, classification, clustering, etc.)
Strong coding skills with data-frames are a prerequisite, example platforms include Pandas, R, Matlab, and Apache Spark Demonstrated experience highlighting innovation, creativity, and intuition, e.g the ability to laterally identify other sources of useful information and think 'outside the box'
Prior Experience in finance is not required"	NA	"character(0)"	2018-10-15	"New+York%2C+NY"	70
"https://www.indeed.com/viewjob?jk=bc9044b6db25ffcb"	"Data Scientist"	"Custoria"	"-"	"Data science is the core around which Custora is built. The central value proposition of our product is that we provide e-commerce businesses the ability to:
organize the overwhelming amount of data they deal with
analyze it for patterns and predictions
deliver these insights in a readily accessible, freely explorable way
and do it again, repeatedly and reliably, as more data comes in the door
The data science team at Custora can be found hard at work at each step above. Our projects range from the development and refinement of statistical models, to the design and implementation of scalable back-end infrastructure that powers our analyses, to collaboration with other teams at Custora to make sure customers get the most out of our analyses.

We place particular emphasis on providing a robust system of statistical insights. Our goal is not to deliver a single paper or presentation’s worth of material, but to give our customers a powerful analytical toolbox. We can help them use it, but we also want them to be able to take it and run with it, exploring their data on their own and finding uses for our models that we hadn’t even thought of.

On top of that, we have an expanding customer base and a growing interest in developing analyses and statistical modeling pipelines that extend beyond e-commerce. With more customers, richer data sets, and new domains of exploration, we’ll face bigger and bigger challenges, but we think we’re up for it, and we are looking for people who want to join us for the ride.
Specifically, we are looking for:
A solid foundation in statistics, either demonstrated through academic study or work experience.
Experience with at least two programming languages and one general-purpose statistical package or programming library. The data science team mainly uses R, Scala, and Ruby, but that’s not set in stone, and we value the ability to learn new libraries and ecosystems.
Friendly and ready to work with others, both technical and non-technical. We don’t work in isolation and regularly interact with each other and members of other teams.
At least some familiarity with: Unix-like operating systems, SQL databases, and web application programming. Strong experience in any is a plus.
Other pluses: experience with distributed-computing ecosystems like Spark; experience with Amazon Web Services; experience teaching statistics or programming
What it’s like to work here:
On Monday we eat and meet as a team to chat projects and progress.
We’re 45 genuinely nice people. We work together and experiment with how to do things. It’s an amazing environment to both explore your professional interests and shape your career trajectory.
We move quickly. You build something and the next day it comes to life. You see and feel an immediate impact with the collective efforts of the team.
We’re building a company and a team we love. We’re in it for the long run.
Read more about what makes us, us here.
Find out more here or here.
The perks
We’re a flexible work environment
Competitive salary and meaningful equity
Health, dental and vision insurance (100% covered)
Free lunch every day, plus free water — hot and cold!
Unlimited vacation: take as much time as you need (we recommend at least 3 weeks)
Monthly unlimited MetroCard
Custora is an equal opportunity employer. We value diversity. We don’t discriminate on the basis of race, religion, color, national origin, gender, sexual orientation, marital status, veteran status, disability status, or socioeconomic status."	NA	"character(0)"	2018-10-15	"New+York%2C+NY"	70
"https://www.indeed.com/viewjob?jk=b4506c2f62b989f2"	"Data Scientist"	"Ipsos North America"	"353 reviews"	"Data Scientist
Ipsos is the global market research leader with over 16,000 employees spread across offices in 88 countries, who help our clients – governments, Fortune 500 companies, and major international NGOs shape the world around us.
We are currently seeking a recent/future graduate with experience in Data Science to join the U.S. group and support our Risk Analytics Division. You will become a part of the team, which – among other interesting projects – works on real time political risk analytics, including global election and public opinion forecasting.
A great candidate will have deep interest in data and analytics and the dedication to apply that passion. We need someone that possesses the technical ability and the communication skills to implement data science methods for a diverse set of client needs, uncover insights, and relate them concisely and clearly to stakeholders at varying levels of technical sophistication. The role also requires conscientious attention to detail, an ability to work well on a small team, and a self-starter approach to debugging and problem solving. Bonus points for that unique mix of intelligence and laziness.
As a Data Scientist, you will:Work closely with team members on design and execution of large-scale modeling efforts, including programming, statistical analysis, and reporting.
Collaborate on programming new data science products by translating needs identified with clients into analytic frameworks that can be developed into polished applications.
Maintain and enhance large codebases underlying existing key applications.
Support other marketing science analyses for clients as required.
Communicate with and provide consulting for internal teams and external clients on data models, analysis findings, process efficiency, and marketing science best practices.Requirements:Proficiency in advanced Python programming, including the ability to produce and maintain reusable and modular codebases.
Bachelor’s degree.
Comfortable working in a highly collaborative, consensus-oriented environment.
Experience in analytics, extracting and surfacing value from quantitative data.
Strong eye for detail, ability to communicate scientific concepts both in written form and verbally, and excellent time-management skills.Pluses:Professional or academic experience with modern techniques and algorithms in machine learning and statistical computing such as neural networks, genetic algorithms, Bayesian modeling, data fusion, drivers analysis, clustering/segmentation, predictive analytics, network analysis, Monte Carlo, and agent-based models.
Working knowledge of SQL and experience with database design and administration.
Experience with version control systems (e.g. Git).
Large dataset manipulation. Experience in distributed storage and computing.
Experience with JavaScript, esp. visualization libraries (e.g. d3.js).
Experience creating and deploying web applications.
Advanced degree (M.S., Ph.D.), but by no means required.
Experience in the field of Market Research.This position can be located in our Chicago, NYC, San Francisco or Washington DC, office
Required Skills
Required Experience"	"13 days ago"	"character(0)"	2018-10-15	"New+York%2C+NY"	70
"https://www.indeed.com/viewjob?jk=5e889e7a8684a9ed"	"Data Scientist, Product"	"Squarespace"	"21 reviews"	"$81,000 - $120,000 a year (Indeed Est.) We're looking for Data Scientists who are passionate about generating actionable insights to drive product decisions across the business. You will enjoy working with cutting edge technology and the ability to see your insights applied to real products on a regular basis.

You are focused on impact, a self-starter, and have demonstrated success in using data science to understand users and drive growth of a product or business. In approaching new problems, you demonstrate sharp critical thinking, intellectual curiosity, data fluency, and a collaborative work ethic. These roles are within the greater Strategy department and report to the Consumer Analytics team lead in New York.

Depending on your area of focus, questions you may tackle in a typical day include:
What are the drivers of the growth of our Commerce product? How can we provide small businesses with tools to be more successful?
What paths do users take through our product and how should that influence our product development roadmap?
How should we define \"success\" of the launch of a new product and why?
What product experiences should we design and test to evaluate lift in key business metrics from product offering, pricing, and core design changes?

RESPONSIBILITIES
Empower data-driven decision-making across the org by defining analytical frameworks to guide key product decisions
Surface insights from terabytes of user, product, and marketing data; communicate and work closely with product teams to implement compelling recommendations
Formulate innovative hypotheses; and design and implement A/B tests to evaluate and launch features based on them
Own relationships with product teams and identify opportunities for impactful analyses
Provide mentorship to junior members of the Analytics team
Utilize cutting-edge modeling techniques to further the org's understanding of consumer behavior
Continuously seek out opportunities to further develop your analytical, communication, statistical, programming, etc. toolkits
Collaborate with Data Engineering to identify and build tools and infrastructure that helps us make better data driven decisions, faster (e.g. event pipeline, synthetic events, Python packages)

QUALIFICATIONS
4+ years of relevant analytical experience working with data or MS in a relevant technical field and 2+ years of analytical work experience (experience working with product organizations a plus)
Strong critical thinking and problem solving skills
Comfort and expertise communicating effectively with a wide-range of audiences (including product managers, engineers, business development managers, occasionally executives)
Strong ability to devise data-driven solutions to business problems
Ability to drive impact by thoughtfully tackling open-ended problems
Strong data intuition and deep understanding of and experience with statistical and/or ML modeling techniques
Strong competency with SQL
Fluency in a scripting language (Python preferred)
A plus: Experience with large scale data processing tools (Apache Spark) or implementing systems in production at scale

ABOUT SQUARESPACE

Squarespace makes beautiful products to help people with creative ideas succeed. By blending elegant design and sophisticated engineering, we empower millions of people — from individuals and local artists to entrepreneurs shaping the world's most iconic businesses — to share their stories with the world. Squarespace's team of more than 800 is headquartered in downtown New York City, with offices in Dublin and Portland. For more information, visit www.squarespace.com/about ( https://www.squarespace.com/about ).

PERKS
Health insurance with 100% premium covered
Flexible vacation & paid time off
Equity plan
401(k) plan with employer match
Free lunch and snacks
Dog-friendly workplace
And more ( https://squarespace.com/about/careers )

Today, more than a million people around the globe use Squarespace to share different perspectives and experiences with the world. Not only do we embrace and celebrate the diversity of our customer base, but we also strive for the same in our employees. At Squarespace, we are committed to equal employment opportunity regardless of race, color, ancestry, religion, sex, national origin, sexual orientation, age, citizenship, marital status, disability, gender, gender identity or expression, or veteran status. We are proud to be an equal opportunity workplace."	NA	"$81,000 - $120,000 a year (Indeed Est.) "	2018-10-15	"New+York%2C+NY"	70
"https://www.indeed.com/viewjob?jk=472703c77759c8fa"	"Data Scientist"	"Daily Harvest"	"-"	"*******************************
Data Scientist at Daily Harvest
*******************************

Daily Harvest is a direct to consumer brand reimagining frozen food to solve a modern eating dilemma: the desire for convenience without nutritional compromise. We deliver single-serve cups of frozen ingredients (organic, whole ingredients and superfoods, with no preservatives or added sweeteners) that can be turned into crave-worthy eats in just seconds.

We are looking for a data expert who is passionate about furthering this mission. As a member of the Data Team at Daily Harvest, you will help empower critical business decisions and build sophisticated machine learning products. You'll work in a modern data science stack including GCP/Bigquery, Python, and Looker that sits on top of our rich dataset. You'll find and explain insights to the rest of the company, and help plan, build, and put data products into production. All while enjoying tasty smoothies, soups, and bowls!

This role works closely with every part of the company, including marketing, operations, finance, and the culinary team. Examples of upcoming projects are contextual product recommendations, demand modeling, and churn/LTV prediction. This is a highly visible role that has the opportunity to make a big impact on the business.
Requirements:There is no minimum experience or education, but this role will require a firm grasp of software engineering and analytics/statistics.
Strong Python and SQL background.
Experience digging deep into data, creating expressive easy-to-understand visualizations.
Experience building machine learning models and putting them into production.
Understanding of CS fundamentals (data structures, algorithms), and how software scales.
Understanding of basic statistics, experimental design.
Excellent communication skills.
Ability to thrive in an unstructured, fast-moving and constantly evolving high-growth environment
Good to Have:E-commerce experience, especially within a subscription company
"	NA	"character(0)"	2018-10-15	"New+York%2C+NY"	70
"https://www.indeed.com/viewjob?jk=8b9576216ee8bdec"	"Data Scientist"	"Gencove, Inc."	"-"	"Gencove is taking low-pass sequencing to population-scale and is hiring a Data Scientist to be a key member of this effort.
At Gencove, we develop software and algorithms for processing genomic data at scale. We use Python/R for research, and deploy to production with Python/C++ on the AWS ecosystem.
The role entails developing statistical models for low-pass sequencing data and owning the deployment of resulting products to production.
Successful candidates must be able to work effectively both in a collaborative setting and independently, and possess outstanding communications skills.
The candidate will have an opportunity to work in a dynamic environment of an early stage startup company.
Requirements
Minimum qualificationsMasters degree or higher in a quantitative field (computer science, statistics, physics, computational biology, etc.), PhD preferred
Demonstrated strong programming skills in Python, C++, or similar
Experience with algorithms, data structures, and complexity analysis
Proficiency working in a *nix environment
Systematic problem-solving approach, coupled with strong communication skills and a sense of ownership and drive.Preferred qualifications
3-5 years of experience in genomics"	NA	"character(0)"	2018-10-15	"New+York%2C+NY"	70
"https://www.indeed.com/viewjob?jk=ac7f155bf7ec1e75"	"Data Scientist"	"Phreesia"	"16 reviews"	"Job Title: Data Scientist
Location: New York, Raleigh or Ottawa
Salary Range: We provide competitive compensation packages, including equity for all employees.

Phreesia is looking for an experienced and hands-on Data Scientist to join our growing Data Science Team; someone with extraordinary analytical and technical skills who is familiar with the entire lifecycle of a data science project, from data modeling, exploration, model selection, evaluation, and deployment.

You will be joining a team of especially smart, humorous, quick-witted, and dedicated coworkers, all passionate about data and improving patient access to healthcare. You will be responsible for building data products for internal consumption, near real-time business intelligence tools, and predictive models. We are looking for someone with years of experience partnering with business stakeholders, translating their needs into technical solutions and answers, and then building and delivering those solutions.
What You Will Do:Leverage Phreesia's massive and ever-growing dataset to build data products that provide actionable business insights
Propose new Machine Learning models to improve our existing products, as well as devise and build models for new opportunities
Navigate and use diverse machine learning stacks in (e.g. Python, R, Keras) and make good decisions about which to use to solve a problem.
Use NLP techniques to parse, process and structure textual data
Quickly prototype ideas and solve complex problems by adapting creative approaches.
Build customized dashboards for internal and external clients.
Ensure new projects are tracked properly throughout their life cycle.
Write clean, well-tested, code that will stand the test of time.
Be an expert communicator: You could summarize your daily progress in a tweet.
What You Bring:2+ years of experience in an operational Data Science role.
Demonstrable professional command of Machine Learning and Data Science toolsets such as Python (Numpy, Scipy, Pandas, Scikit-learn), R (dplyr, tidyverse, ggplot).
M.Sc. or Ph.D in computer science, engineering, statistics, computational linguistics, or other quantitative field or relevant equivalent professional experience
Understanding of and demonstrable experience using statistical principles to communicate results (experimental design, a/b testing and other frameworks).
Ability to collaborate with Data Scientists and Data Engineers to propose, test, validate, evaluate, and deploy Machine Learning Models.
Hands on experience using Apache Spark in a professional context
Strong SQL skills
Hands-on experience and understanding of Graph and/or search Databases (e.g. neo4j, elasticsearch) is a plus
Healthcare experience and a basic understanding of clinical terms is a plus
Experience building knowledge graphs and representations is a plus
Who We Are:
At Phreesia, we're committed to helping healthcare organizations succeed in a fast-changing landscape—and we need smart, passionate people to help us do it. Our innovative SaaS platform offers our clients a suite of applications to manage the intake process, giving them the tools to engage patients, improve efficiency, optimize staffing and enhance clinical care. Our solutions are in all 50 states, and we check in 70 million patients a year!

Basically, what you are doing here matters and hard work does not go unnoticed. Not only does Phreesia care about our clients we also care about our employees. We are proud to say that we have grown 40% each year and consistently continue to do so. If you crave working with driven and engaged colleagues, a structured sales process, consistent recognition, defined career path, and enjoy working in revamped new areas, this may be the right opportunity for you.
Benefits and Perks:Variety of health plan options, dental/vision coverage, and short/long-term and life insurance plan
401(k) savings plan
Flexible working hours
Unlimited vacation
Unlimited snacks and drinks in our offices
Mobile phone stipends, monthly subway pass reimbursement and internet reimbursement
100% paid maternity leave to our U.S. employees, as well as a generous maternity benefit to our employees in Canada
Tuition and certification reimbursement as well as other professional development opportunities

We strive to provide a diverse and inclusive environment and are an equal opportunity employer."	NA	"character(0)"	2018-10-15	"New+York%2C+NY"	70
"https://www.indeed.com/viewjob?jk=1bfa162e16419f10"	"c(\"Customer Data Scientist\", \"As Customer Data Scientist you will\", \"What we are looking for\", \"Benefits\")"	"Smartly"	"-"	"Smartly.io is a fast-growing company aiming to be the best and nicest place for the most talented people to work and learn. We are building an automation and optimisation tool for the largest advertisers globally, including eBay, Skyscanner, Zalora, Nelly, Boozt and Foodpanda. Based in Helsinki, Berlin, San Francisco, New York, Singapore and Buenos Aires, we're looking for individuals with hunger for learning and life to join our world-class team!
We are looking for a customer-facing data scientist who enjoys analyzing complex systems and can communicate findings to customers and partners clearly and concisely. Your role is essential in making sure we can systematically improve optimization across customers.
At Smartly.io, you would work with our global team of Customer Data Scientists based in our major offices (Helsinki, New York, San Francisco and Singapore) to analyze, validate, and test digital marketing best practices. You will meet the most advanced and technical marketers in the industry, and help them take their marketing – and the whole industry – to the next level. In addition, you will teach everyone around you about how online marketing works and elevate the whole company as a thought leader within the market. You will be working closely together with both software developers and sales.
As Customer Data Scientist you will
Analyze data to figure out what works and, more importantly, why it works
Drive to be the best in the world at optimizing digital advertising (beginning with Facebook, but across channels later)
Have close collaboration with product development and bring your learnings directly to our product
Help with innovating, testing and prototyping new optimization features
Be part in making Smartly.io the thought leader within the market. You will be blogging about your analysis, creating benchmark reports and speaking at events
What we are looking for
Mathematical-analytical mindset
Ability and willingness to become a digital marketing optimization expert
Ability to collect and join data from various APIs and databases
Scripting skills to create and share your tools for data analysis
Ability and willingness to work in a client-facing role.
Previous experience in account management, sales, project management or technical copywriting is a plus
Benefits
Work with the nicest and brightest teammates in a flat organisation
Have a competitive salary + option plan
Recharge yourself with full 5 weeks of paid annual leave
Enjoy weekly breakfasts, Friday demos with beer and monthly sports with the team
Who we are
Smartly.io is a fast-growing team of 250+ Humble Hungry Hunters. We are building a B2B SaaS product to fully automate and optimize online marketing at scale for the largest advertisers across the globe. We are a global company with 36 nationalities and footholds in 17 cities, serving 650+ brands across the globe, including eBay, Uber and TechStyle.
We are on a mission to make online advertising easy, efficient, and enjoyable across all major platforms. Easy as in automated, efficient as in constantly driving performance, and enjoyable through the best user experience and service in the market. We do this by combining creative automation, ad operations, and outstanding customer service to help brands scale their results – not headcount.
Great people choose us and stay with us because they like our company culture and how we tackle challenges of huge scale at speed. Learn more about how we work at smartly.io/culturehandbook.
Some things we're proud of:94% of Smartlies recommend the company as a great place to work.4.8/5 stars on Glassdoor.2017 Digiday WorkLife Awards: Tech Platform with the Most Innovative Culture."	NA	"character(0)"	2018-10-15	"New+York%2C+NY"	70
