"url"	"title"	"company_name"	"company_score"	"description"	"time_posted"	"metadata"	"date_scraped"	"city"	"page"
"https://www.indeed.com/viewjob?jk=3650dd9732a128f5"	"Data Scientist, Applied Machine Learning"	"Tempus"	"18 reviews"	"With the advent of genomic sequencing, we can finally measure and process our genetic makeup. We now have more data than ever before, but providers often don't have the infrastructure or expertise required to easily extract the valuable insights that exist within this data. Here at Tempus we believe the greatest promise for the detection and treatment of cancer & other diseases lies in building a deep understanding of the interaction between molecular attributes and clinical treatment. We're on a mission to redefine how genomic data is used in a clinical setting. We are looking for data scientists who are passionate about applying state of the art techniques to the processing and analysis of vast amounts of clinical, molecular, and imaging data. What You'll Do Collaborate with product, science, engineering, and business development teams to build the most advanced data platform in precision medicine Design and prototype novel data visualization and analysis tools and algorithms Wrangle and analyze large diverse sparse datasets, extract insights, and drive further research opportunities Interrogate analytical results for robustness, validity, and out of sample stability Document, summarize, and present your findings to a group of peers and stakeholders Qualifications Degree in computer science, software engineering, statistics, machine learning, bioinformatics or related technical field 2+ years full time employment experience building and validating predictive models on structured or unstructured data Proficient in Python, and SQL Experience with the following: Pandas, NumPy, SciPy, Scikit-learn, Jupyter Notebooks Experience with supervised and unsupervised machine learning algorithms, and ensemble methods, such as: K-Means, PCA, Regression, Neural Networks, Decision Trees, Gradient Boosting Experience working in a Linux / Mac environment Outstanding programming and problem solving skills Self-driven and work well in an interdisciplinary team with minimal direction A strong desire to understand why things work the way they do Thrive in a fast-paced environment and willing to shift priorities seamlessly Experience with communicating insights and presenting concepts to diverse audiences Nice to Haves Kaggle.com competitions and/or kernels track record Experience working with clinical and/or genomic data Experience with AWS architecture Experience with: Git, matplotlib, seaborn, HTML5, CSS3, JavaScript, D3, Plot.ly, Flask, Dask Experience in agile environments and comfort with quick iterations"	NA	"character(0)"	2018-10-15	"Chicago%2C+IL"	50
"https://www.indeed.com/viewjob?jk=47f0ea8ef308e82c"	"Health Care Data Analyst"	"NORC at the University of Chicago"	"388 reviews"	"The Health Care Research department at NORC at the University of Chicago is seeking a Data Analyst to support our health care data science team in our Chicago Loop office. At NORC, Data Analysts work with our Data Scientists, and play a strategic role in supporting our research teams to produce valuable insights for our clients. They work collaboratively and help break down silos and barriers across the company to help drive innovative work. A person in this position, under the leadership of Data Scientists, contributes to the design and implementation of algorithms, models, and work flows to discover valuable information in large volumes of data from various sources; organizes, harmonizes, and analyzes data sets; uses various technologies to enable data visualization; and creates applications of general value to the company’s business. DEPARTMENT: Health Care NORC’s expertise and ongoing work in health care delivery and financing — including access to insurance, payment and delivery-system reform, benefit design, and quality measurement — advance stakeholders’ understanding of policies and programs, facilitate implementation, and contribute to important improvements in cost and quality. NORC’s expert staff has extensive knowledge of all aspects of health care delivery, from private marketplaces and employer-sponsored insurance to Medicare and Medicaid; from large health care systems to small clinics; and from the needs of children to those of older adults, people with disabilities, and ethnic and racial minorities. Our expert team includes social scientists that acquire, collect, and analyze data from health care organizations and patients; evaluators; health services researchers; health-policy analysts; and professionals with first-hand experience running and supporting health care programs. RESPONSIBILITIES: Responsibilities of a person in this position would include but not be limited to: Supporting analytics, evaluation and technical assistance projects working with data from multiple sources Interpreting data from multiple sources; Developing programs and scripts for data transformation, integration, or reduction; Enhancing previously developed in-house applications such as those for data coding; And performing various types of analysis involving multiple data sets. REQUIRED SKILLS: The successful candidate should have at least a Bachelor’s degree in one of the following fields: math, statistics, computer science, data science, or a social science or public policy related field. He/she should have a strong foundation in areas of statistics, mathematics, and computer programming with a strong interest in applying these skills in health care evaluation and program implementation Preference will be given to those with additional expertise in areas of data mining such as topic modeling, natural language processing, and machine learning. Strong skills in problem solving and quantitative/qualitative analysis are required. The candidate should be able to organize and prioritize work assignments to meet project needs. 0 - 2 years’ experience in positions working with large datasets and conducting statistical and quantitative modeling, melding analytics with basic programming, data mining, clustering and segmentation. Domain expertise preferred. Some familiarity with the social science domain is also preferred. The qualified candidate should have strong communication skills; able to quickly comprehend requirements and assignments and then explain his/her solutions in both writing and speech."	"17 days ago"	"character(0)"	2018-10-15	"Chicago%2C+IL"	50
"https://www.indeed.com/viewjob?jk=69a0181c0de5e223"	"Data Scientist"	"eQHealth Solutions"	"30 reviews"	"Under general direction and minimal supervision perform data extraction and query data for ad hoc analyses and reports. Present concise reports and data visualizations for diverse audiences. Proficient in technical writing skills. Create and update automated processes. Triage coding problems and data-related issues. Identify patterns, trends, and relationships within data Research alternative development methodologies and make recommendations for team improvement. Provide ad hoc reporting, predictive modeling and risk stratification reporting as requested by staff. Ensure the integrity of data used for Analytics."	NA	"character(0)"	2018-10-15	"Chicago%2C+IL"	50
"https://www.indeed.com/viewjob?jk=5fdce7ab3be35c27"	"Data Scientist, Data Science"	"E*TRADE FINANCIAL"	"331 reviews"	"Who We Are More than 30 years ago, E*TRADE pioneered the online brokerage industry by executing the first-ever electronic individual investor trade. While the landscape of our industry has changed dramatically, our culture of innovation and drive to make online trading accessible to everyone continues to drive us forward. We believe in challenging the status quo, fostering an environment of curiosity and learning, and, above all, putting our customers first. About the Role Leaders in Data Science can see different angles of a product or business opportunity, and you know how to connect the dots and interact with people in various roles and functions. You have substantial experience with analytical tools and techniques, and bring a solid skill-set in analyzing data and communicating recommendations. You will deepen your skill-set by working with analytical thought leaders across the company. Data Scientists are changing the world one technological achievement after another. Experimentation is at the core of what you do. In this role, you will work to effectively turn business questions into data analysis, and provide meaningful recommendations on strategy. This is a unique hybrid role that will focus on your knowledge of data infrastructure and your ability to drive insights. As a Data Scientist, you will evaluate and improve E*TRADEs products. You will collaborate with a multi-disciplinary team of engineers and analysts on a wide range of problems. This position will bring analytical rigor and statistical methods to the challenges of measuring quality, improving customer products, and understanding the behavior of end-users, advertisers, and publishers. Responsibilities Work with complex data sets. Solve difficult, non-routine analysis problems, applying advanced analytical methods as needed. Conduct end-to-end analysis that includes data gathering and requirements specification, processing, analysis, ongoing deliverables, and presentations. Build and prototype analysis pipelines iteratively to provide insights at scale. Develop comprehensive understanding of E*TRADE data structure and metrics, advocating for changes where needed for both products development and strategy. Interact cross-functionally with a wide variety of people and teams. Make business recommendations with effective presentations of findings at multiple levels of stakeholders through visual displays of quantitative information. Research and develop analysis, forecasting, and optimization methods to improve the quality of E*TRADE’s user facing products; example application areas include end-user behavioral modeling and customer segmentation.Qualifications Minimum qualifications: BA/BS degree in quantitative discipline (e.g., statistics, operations research, economics, computer science, mathematics, physics, electrical engineering, inducstrial engineering). At least 2 years of professional work experience in data analysis or related field. (e.g., as a statistician, data scientist, or economist) Experience with statistical software (e.g., R, MATLAB, pandas) and data base languages (e.g., SQL). Preferred qualifications: Masters or PhD degree in quantitative discipline as listed in Minimum Qualifications. Experience programming in Python. 4 years of relevant work experience, including deep expertise and experience with statistical data analysis such as linear models, multivariate analysis, stochastic models, sampling methods. Applied experience with machine learning on large datasets. Demonstrated leadership and self-direction. Demonstrated willingness to both teach others and learn new techniques. We offer a competitive and comprehensive benefits package. Please visit https://www.etradecareers.com/why-work-at-etrade/employee-benefits/ to learn more about the opportunities. E*TRADE Financial is an Equal Opportunity Employer who encourages diversity in the workplace. All qualified applicants will receive consideration for employment without regard to race, color, national origin, religion, sex, age, disability, citizenship, marital status, sexual orientation, gender identity, military or protected veteran status, or any other characteristic protected by applicable law."	NA	"character(0)"	2018-10-15	"Chicago%2C+IL"	50
"https://www.indeed.com/viewjob?jk=a41b96c5ef94b16c"	"Data Scientist II"	"Zurich North America"	"684 reviews"	"Zurich is currently looking for a Data Scientist II to work out of the Predictive Analytics Center of Excellence in our North American headquarters in Schaumburg, Illinois or Jersey City, New Jersey.The Data Scientist II role is critical to the success of Zurich and the Data Scientist team as the role blends analytical problem solving, project management, and leadership: Leads predictive analytics projects - this means leading a team of data scientists and collaborating with our stakeholders to solve business challenges Conducts exploratory data analysis, model development, model monitoring, and benefit estimation Partners with business stakeholders to translate business objectives into clearly defined analytical projects Works with the business to develop and implement a strategy on how to use the predictive model for most impact Establishes and maintains collaborative relationships throughout the organization Demonstrates commitment to continuous education and personal development on areas of technical expertise and share knowledge with team members and business partners. Job QualificationsBasic Qualifications: High School Diploma or Equivalent with 7 or more years of experience in Computer Science, Statistics or Mathematics and experience transforming data in the business analysis area OR Zurich Certified Insurance Apprentice including an Associate Degree in Computer Science, Statistics or Mathematics and 5 or more years of experience transforming data in the business analysis area OR Bachelor’s Degree in Computer Science, Statistics or Mathematics and 5 or more years of experience transforming data in the business analysis area OR Master’s Degree in Computer Science, Statistics or Mathematics and 3 or more years of experience transforming data in the business analysis area OR Ph.D. in Computer Science, Statistics or Mathematics and 0 or more years of experience transforming data in the business analysis area Preferred Qualifications: Advanced analytical and problem solving skills Ability to develop actionable solutions to business challenges Advanced knowledge of statistical and predictive modeling techniques such as machine learning, decision trees, ensemble learning, probability networks, association rules, regularized models, clustering, regression, GLMs, and neural networks and their application to business decisions Demonstrated experience in one or more of the above mentioned statistical and/or machine learning techniques Experience applying data transformation techniques such as exact and probabilistic matching methods; fuzzy matching, text mining, and data reduction Experience applying data transformation techniques such as exact and probabilistic matching methods; fuzzy matching, text mining, and data reduction Experience with programming and data mining tools such as R, Python, SAS, SQL, Hadoop, Hive, or Pig Excellent verbal and written communication skills, particularly possessing the ability to share technical results and recommendations to audiences at varying levels of analytic understanding Ability to perform high-level work both independently and collaboratively as a project member or leader on multiple projects. Coach and provide technical advice and counsel within and outside operating unit. Additional Information Imagine working for a company that truly cares about their employees, customers, stakeholders, and communities they serve. Imagine working for a values-driven organization that has the ambition and desire to be the best global insurance provider in the world. Zurich is that place where 55,000 employees across approximately 200 countries and territories are all focused on helping people and helping companies protect what is truly most important to them. We are a values-driven organization that takes pride in the work that we do every day and we have the ambition to be the best global insurer in the world.EOE disability/vetsZurich does not accept unsolicited resumes from search firms or employment agencies. Any unsolicited resume will become the property of Zurich American Insurance. If you are a preferred vendor, please use our Recruiting Agency Portal for resume submission.Primary Location : United States-Illinois-Schaumburg Other Locations : United States-New Jersey-Jersey City Schedule : Full-time Travel : Yes, 15 % of the Time Relocation Available : Yes Job Posting : 09/07/18 Unposting Date : Ongoing"	"24 days ago"	"character(0)"	2018-10-15	"Chicago%2C+IL"	50
"https://www.indeed.com/viewjob?jk=f6108dd3d34a7fca"	"Data Scientist - Artificial Intelligence"	"Ulta Beauty"	"3,828 reviews"	"The Data Scientist is an integral part of the Marketing Analytics team that utilizes the power of Artificial Intelligence to drive customer personalization and marketing effectiveness. This position will build machine learning applications, conduct statistical analyses and construct large scale prediction systems in a fast-paced, data-focused retail environment. The Data Scientist will also act as a subject matter expert, communicating the value and application of artificial intelligence across multiple internal business groups. PRINCIPAL JOB DUTIES & RESPONSIBILITIES 1. Design and develop autonomous programs that optimize marketing tactics and generate efficiencies across the organization. 2. Develop a strong partnership and collaboration with the internal Ulta Beauty teams, performing as a team member who consults on how to attain the business goals by leveraging artificial intelligence and machine learning. 3. Select features, construct and enhance classifiers using machine learning techniques 4. Solve business problems by leveraging advanced artificial intelligence and machine learning approaches 5. Explain and present complex approaches in a concise manner to garner buy in from business partners 6. Assess and understand the cost/benefit relationship of developing and deploying learned models based on business needs 7. Ensure data integrity by leveraging proven methodologies, including data reconciliation, data integration and data audits. 8. Mentor less experienced team members on AI/machine learning methodology and techniques 5+ years experience in artificial intelligence with a focus on machine learning and neural networks Masters degree in Computer Science, Data Science, Mathematics, or Statistics or related degree. Experience in cloud computing platforms such as Google Cloud Platform Experience with deep learning framework (ex: Tensorflow, Torch, etc) Proven command of R or Python or Java Excellent interpersonal, verbal, and written communication skills - must be able to communicate complex ideas in both technical and user-friendly language. Excellent understanding of machine learning techniques and algorithms Experience using statistical computer languages to manipulate data and draw insights from large data sets. Capable of working in a dynamic environment, handling multiple projects, meeting deadlines, prioritizing appropriately and responding to issues quickly and creatively with an open and positive attitude. Advanced knowledge of statistical techniques and concepts (regression, statistical tests and proper usage, etc.) and experience with their application Energetic and self-motivated - must be extremely organized and detail oriented with an ability to make proactive recommendations.PREFERRED OR SPECIAL POSITION REQUIREMENTS Experience building and deploying autonomous/AI programs Cloud/Big Data platforms Tensorflow or similar tool R, Python, Java Must be able to see the “big picture” and drive towards business results Strong sense of curiosity. Strong attention to detail. WORKING CONDITIONS Dynamic, fast-paced office environment and remote stakeholders. Occasional training/conference travel possible."	NA	"character(0)"	2018-10-15	"Chicago%2C+IL"	50
