"url"	"title"	"company_name"	"company_score"	"description"	"time_posted"	"metadata"	"date_scraped"	"city"	"page"
"https://www.indeed.com/viewjob?jk=NA"	"NA"	"NA"	"NA"	"NA"	"NA"	"NA"	2018-10-15	"New+York%2C+NY"	60
"https://www.indeed.com/viewjob?jk=cddbdc70a46df75d"	"2019 PhD Data Scientist Internship - UberEverything - New York"	"Uber"	"548 reviews"	"InternshipAt Uber, we ignite opportunity by setting the world in motion. We take on big problems to help drivers, riders, delivery partners, and eaters get moving in more than 600 cities around the world.
We welcome people from all backgrounds who seek the opportunity to help build a future where everyone and everything can move independently. If you have the curiosity, passion, and collaborative spirit, work with us, and let’s move the world forward, together.
About the Role
Are you interested in working at the intersection of applied quantitative research, engineering development, and data science? Do you have interest in applying quantitative solutions to the uniquely challenging problems related to Uber’s on-demand delivery marketplace? If so, then this is the opportunity for you.
What You’ll Do
Develop models for user behavior and marketplace dynamics
Design optimization algorithms to improve marketplace efficiency
Apply machine learning for recommendation, prediction, and forecasting
Conduct experiments to inform product decisions
What You’ll Need
Strong quantitative background
Research, data science modeling, or engineering experience
Familiarity with technical tools for analysis - Python (with Pandas, etc.), R, SQL, etc.
Research mindset with bias towards action - able to structure a project from idea to experimentation to prototype to implementation
Independence, great communication, and amazing follow-through - you aggressively tackle your work and love the responsibility of being individually empowered
Bonus Points For
Background in Machine Learning, Statistics, Operations Research, Operations Management, Econometrics, or similar
Experience in software engineering
About the Team
Uber Everything Data Scientists help solve the most challenging problems related to Uber's ambitious and rapidly expanding on-demand delivery businesses, such as Uber Eats. These fascinating and challenging problems include: demand prediction, menu ranking and recommendation, delivery time estimation, batching, scheduling, routing, dynamic pricing, supply positioning, and much more."	"24 days ago"	"Internship"	2018-10-15	"New+York%2C+NY"	60
"https://www.indeed.com/viewjob?jk=5bbb0e5e08de5ecd"	"Data Scientist"	"Hearts and Science"	"-"	"Description:
Hearts & Science has been inspired by confident marketers seeking business advantage in a world of personalized digital marketing, where CRM and addressable channels converge, and decisions must be made in real time to aggregate effective reach and deliver the right message at the right time.
Designed to inform brand strategies with real-time insights, Hearts & Science is a data-driven marketing agency with expert media planning and buying capabilities, among other services that include shopper marketing, marketing innovation and content activation.
As every CMO knows, employing technology, data and analytics to business challenges is the cost of entry, not a nice-to-have. Unlocking the value of consumer data can deliver growth, revenue and ROI, and create differentiation to stay on top. Real-time action is instrumental in driving results within a highly fragmented marketplace. Hearts & Science’s Marketing Science solutions are built to deliver insightful results with speed, accuracy and a single version of the truth. In leveraging the DNA of a marketing agency with a talent pool of developers, data scientists and Ph.Ds, we hold a unique position in the increasingly crowded ad tech and consulting space. As a Data Scientist on our Marketing Science team, you will:
Explore experiment with a large number of datasets to draw insights and search for stories
Model and build algorithms on top of our vast number of datasets
Assist in designing tech infrastructure and data pipelines (ETL, data automation, data querying, etc.)
Build tools to process, visualize, and analyze data
Design and build data-driven software products
Deploy scalable solutions to a cloud-based infrastructure
Desired Qualifications
1-3 years developing analytics projects
Strong written and verbal communication skills; thrive in a rapidly-evolving environment
Industry experience with predictive modeling, databases, computational simulation, clustering, machine learning, and remote computing, e.g., Amazon AWS
Experience with Python (numpy, scikit, matplotlib, and pandas packages), SQL, bash, R, and other similar statistical computational environments
Exposure to Javascript, HTML/CSS, XML, Hadoop, and parallel processing
Masters degree in quantitative, computation-focused research, or equivalent work experience
Good understanding of advertising technology and landscape, including external data providers and data management platforms"	NA	"character(0)"	2018-10-15	"New+York%2C+NY"	60
"https://www.indeed.com/viewjob?jk=f3b2bab7bba76688"	"Machine Learning Data Scientist"	"Murmuration"	"-"	"Machine Learning Data Scientist

Who We Are

Murmuration is an organization dedicated to sustainable policy change in the U.S., and we believe that the path to real change in America’s education system is through political activism and participation. Together with our partners, we develop shared infrastructure and coordinated support for organizations on the ground to massively improve outcomes for all children. We do this by working directly with local schools and organizations to amplify the voices of parents and families as key stakeholders in setting education policy.

As part of our work, Murmuration has developed a technology product called “m{insights” that seeks to aggregate data from a combination of sources including member data from partner organizations, publicly available data, consumer data, voter file data, and more. The compiled data are then used to build a variety of analytic models and tools that enable Murmuration’s partner organizations to activate, expand, and mobilize their supporter bases effectively for sustained political change.

About the Position

We are looking for a creative and endlessly inquisitive Data Scientist, with a machine learning emphasis, to join our team. You will be working hand-in-hand with our Senior Data Engineer and Senior Data Scientist to develop highly optimized predictive models from a large volume of regularly updated data. In addition, you will be a key contributor to our Python analytics code base to build and automate custom analytics to help analyze our partners’ work in the political and advocacy spheres. You will be working in a small but dedicated, detail-oriented team that is committed to our mission. The Murmuration work environment is friendly, driven, and non-corporate but professional.

The Machine Learning Data Scientist will:
Create predictive analytics using the latest machine learning algorithms on relatively “big” data (hundreds of features on > 100 million records)
Provide analytic insights for partners throughout the lifecycle of their campaign(s); build, review, and recommend custom models; provide real-time visualizations and analysis of campaign work; and produce post-campaign analytics to help our partners constantly learn from their efforts
Work with Senior Data Engineer to help build and optimize our predictive analytics pipeline to perform well on large datasets stored in Amazon Web Services (AWS)
Help develop and maintain Python analytics code base to build and automate custom analytic products
Analyze the performance of our production machine-learning models
Work closely with the data engineering team to analyze and augment our data
Candidate Profile

Murmuration attracts employees with distinctive and diverse backgrounds and accomplishments. Integrity, creativity, flexibility, and drive are key attributes of competitive candidates. The Data and Analytics teams are highly collaborative, friendly and hard-working, and we are looking for a Machine Learning Data Scientist who embodies those values.
The ideal candidate will have:
PhD in political science, sociology, mathematics, statistics or other related field or 4-5 years of experience building production level machine learning models on large datasets
Excellent general data science skills (data cleaning, munging, data visualization)
Excellent Python skills (with additional experience in R desired)
Experience with Amazon Web Services, in particular applying analytics in that setting
Experience identifying appropriate statistical techniques and applying them to a variety of real-world datasets
Strong problem-solving skills as well as the ability to manage several tasks/projects concurrently and prioritize work effectively
Experience with databases and knowledge of SQL preferred
Interest in politics and/or educational policy
Location

This position will be based in New York, NY, and requires occasional travel.

Compensation

The Machine Learning Data Scientist position is a full-time, salaried position with a comprehensive benefits package. Compensation for this position is commensurate with experience.

An Equal-Opportunity Employer with a Commitment to Diversity

Murmuration is proud to be an equal opportunity employer, and as an organization committed to diversity and the perspective of all voices, we consider applicants equally of race, gender, color, sexual orientation, religion, marital status, disability, political affiliation and national origin. We reasonably accommodate staff members and/or applicants with disabilities, provided they are otherwise able to perform the essential functions of the job."	NA	"character(0)"	2018-10-15	"New+York%2C+NY"	60
"https://www.indeed.com/viewjob?jk=553df36b7ebc646c"	"Data Scientist (NYC)"	"DonorsChoose.org"	"5 reviews"	"DonorsChoose.org engages the public in public schools by giving people a simple, accountable, and personal way to address educational inequity. In this clip, board member Stephen Colbert tells the organization's story.
Since its launch in 2000, more than 3 million \"citizen philanthropists\" have donated to classroom projects on DonorsChoose.org, channeling books, field trips, technology, and other resources to more than 28 million students in public schools, overwhelmingly from low-income households. Along the way, the organization helped to pioneer the field of crowdfunding and is now making an impact beyond school supplies.
Thanks to its dedicated team and culture, DonorsChoose.org earned recognition as the #1 \"Best Nonprofit to Work For\" by the Nonprofit Times.
The Team
This role is on the Data Science & Analytics Team in our Product & Engineering group. The Data team supports DonorsChoose.org’s data-driven philosophy by building and maintaining an analytics-centric data warehouse that holds the single source of truth for all areas of the business. Using this structured data, we combine business analytics with data science to understand user behavior, build machine learning products, and inform business strategy across marketing, operations, and product. We are also dedicated to using our data to understand classroom trends across the nation and to engage the public with our insights.
The Role
DonorsChoose.org is a technology non-profit that is serious about data. We are seeking a Data Scientist who is eager to play a key technical role on a results-oriented two-person team that delivers critical work for teams across the organization. A typical week may involve writing a custom data transformation script, creating a new reporting dashboard, and building a machine learning model.
You will:
Lead the end-to-end development and deployment of machine learning products (think user-facing recommendation engines, back-end automations, etc.); from deeply understanding the data, to building and tuning the model, to scaling it in production, you’re in charge
Perform analyses on large sets of data to extract actionable insights that will help drive business decisions across our marketing, operations, and product teams
Continuously test and improve our current machine learning products
Mine our rich data for insights about evolving classroom needs
Help maintain and continuously improve our existing business intelligence (BI) tools and underlying data infrastructure
Support ad hoc reporting needs
This position is right for you if you:
Have 1-2 years of experience working on data analysis and modeling in a professional or academic setting
Have a strong ability to code in Python
Have a strong grasp of SQL and database concepts (we use Redshift and Postgres)
Have experience utilizing applied statistics or machine learning on large, complex, noisy datasets to solve real-world challenges and business problems
Love data munging (or at the very least have a love-hate relationship with it)
Are eager to expand your data science toolbox; you’re comfortable learning new tools and experimenting with new methods
Have the ability to distill ill-defined problems into clear and tractable ones
Operate with a high sense of urgency and enjoy working in a fast-paced environment
Bonus points if you have experience with any of the following:
AWS infrastructure (specifically Redshift, EC2, and Lambda)
Scaling and turning models into production-ready applications, such as recommender systems
Web analytics and event data
BI and reporting platforms (we use Looker)
A/B testing
Natural language processing
Compensation and Benefits
DonorsChoose.org offers a competitive salary and benefits package that includes 100% employer paid health, dental, and vision coverage; a matching 401k plan (up to 5% of your salary); an annual professional development stipend; and 5 weeks paid vacation plus national holidays. To learn more about what it's like to work for DonorsChoose.org, visit the careers page.
To Apply
Please submit your application online. In your cover letter, tell us a little bit about your favorite teacher! Applications will be accepted on a rolling basis until this position is filled.
A Final Note
The DonorsChoose.org team works toward a nation where students in every community have the resources needed for an excellent education. To do this, we hire and support a diverse team of the best and the brightest talent available.
We are an organization increasingly representative of the varied races and ethnicities, genders and sexual orientations, religious and political beliefs, and abilities that comprise our nation. DonorsChoose.org focuses on attracting, retaining, and advancing diverse talent because it makes us more effective, high-performing, creative, and resilient.
If you are passionate about our mission, highly skilled in your field, and looking for a place where you can bring all of yourself to work, we want you."	NA	"character(0)"	2018-10-15	"New+York%2C+NY"	60
"https://www.indeed.com/viewjob?jk=6ec986ea957fb091"	"Data Analyst"	"Cota"	"66 reviews"	"POSITION: DATA ANALYST

OVERVIEW
Cota is seeking an early-career data scientist who is naturally curious, has familiarity with various analytic tools, and enjoys solving new problems. In addition, you should be able to continually unearth and present interesting trends that have clinical and business importance for our customers and oncology patients at large. You will be joining a friendly, high performing and diverse data science team with backgrounds in finance, health economics, biology, and statistics.

RESPONSIBILITIES
Develop real-world-data analytic products for the oncology space
Partner with the operations, engineering, and clinical teams to define analytic requirements, enhance data quality, and deliver publication-caliber analysis
Ramp-up on oncology domain knowledge and healthcare analytic techniques within the first 3 months of the job
Become an expert on our data model; confidently representing our data capabilities to other teams as well as external partners. In time, suggest & implement improvements to our data model based on business needs and client feedback

QUALIFICATIONS
Masters degree in computer science, statistics, applied math, econometrics or similar quantitative field with prior research/internship experience
Bachelor degree in computer science, statistics, applied math, econometrics or similar quantitative field with 2 years of analytic work experience in a rigorous environment
Must be curious and intellectually humble. “Know what you don’t know” and ask for help from others with more domain expertise
Solid foundational knowledge of descriptive and predictive statistics
Working knowledge of statistical programming (we primarily use R but are open to training Python users), SQL, version control, data maintenance, and other relevant computational techniques and processes
Passionate about data quality and able to clearly communicate and evangelize its importance to internal and external partners
Collaborative self-starter. Cota is a startup environment and you will be working cross-functionally daily with data scientists, engineers, medical professionals, and business professionals.

BONUS POINTS
Medical school student with demonstrated data science interest seeking a career change
Research experience with oncology, genomics or bioinformatics
"	"5 days ago"	"character(0)"	2018-10-15	"New+York%2C+NY"	60
"https://www.indeed.com/viewjob?jk=3457cfd45aee0e4b"	"Data Scientist"	"Discovery Communications, LLC"	"318 reviews"	"$145,000 - $185,000 a year (Indeed Est.) Position Summary
This leadership role involves close collaboration with the Digital team, Data Science community, key decision makers within the product offerings, ad sales research teams and maintaining relationships with Global Technology Group’s engineering and data team.
This role ranges from deep science thought leader / mentor, consultative business facilitator, leading discussions, to research experimentalist to technology innovator. The individual must be comfortable partnering with core data infrastructure teams such as big data infrastructure, software, and data warehousing, as well as product and engineering management driving the business.
Responsibilities
1. Lead and create a small team of data scientists
2. Applies machine learning techniques to solve complex questions or fuel new business opportunities
3. Delivers breakthrough benefits to Discovery users/customers across small business & consumer products using individual, enriched, and aggregated data
4. Provides leadership in advanced engineering, data science and analytics in the development of current or future products or technologies
5. Provides technical leadership across multiple teams, by understanding a key technology space deeply enough to help guide strategy
6. Provide/inspire data science innovations that fuel the growth of Intuit as a whole
7. Understands and teaches proven methods and hacking skills in working with divergent data types at scale, to explore and extrapolate data-driven insights using advanced, predictive statistical modeling and testing applied to data acquired and cleansed from a range of sources
8. Provides to business stakeholders the entrepreneurial guidance essential for appropriately interpreting and building on findings, and fully exploiting the insights revealed through the research
9. Other duties as assigned
Requirements
BS, MS, or PhD in an appropriate technology field (Computer Science, Statistics, Applied Math, Econometrics, Operations Research, etc.)5+ years experience leading data science and/or software engineering teamsAble to effectively communicate a vision and inspire others to innovateInnovative and disruptive technology leader solving long term strategic outcomesExpert command of machine learning, statistical modeling, state-of-the-art tools, and engineering best practicesExperience in leading teams who have expertise in data mining algorithms and statistical modeling techniques such as clustering, classification, regression, decision trees, neural nets, support vector machines, genetic algorithms, anomaly detection, recommender systems, and natural language processing.Knowledge and understanding of the media/digital media industry a plusImpeccable attention to detail and strong ability to convert complex data into insights and action plansStrategic thinker, flexible problem solver, great listener and team orientationMust have Legal right to work in the United States
New York, New York City, NYC, NY"	NA	"$145,000 - $185,000 a year (Indeed Est.) "	2018-10-15	"New+York%2C+NY"	60
"https://www.indeed.com/viewjob?jk=241e369bcf72e28c"	"Data Scientist (EFT Analytics)"	"KOCH MINERALS"	"5 reviews"	"Learn more by visiting our website here!

EFT Analytics, Inc. is looking for a Data Scientist to join our team in New York City! The Data Scientist will have the opportunity to work with a dynamic team to optimize and expand our advanced analytics platform. The successful candidate will be able to enhance and expand machine learning capabilities in the platform.
Strong written and verbal communication skills are required.
A Day In The Life Typically Includes:
Root Cause Analysis for process control and manufacturing environments
Application of advanced analytics and optimization data and software tool sets
Consulting with internal customers and team (process engineers, production leaders, operators, and reliability/energy optimization roles)
Process model development - replication of customer process controls in simulation environments
Use industry technologies, tools, and data mining frameworks for data analytics including data visualization for analyzing, optimizing, developing hypotheses, and drawing conclusionsWhat You Will Need:
Basic Qualifications:
Knowledge of Bayesian statistics, SVM, and deep learning
Deep understanding of Bayesian belief network inference, back propagation and other algorithms appropriate to Bayesian statistics, SVM, and deep learning
Knowledge of supervised and unsupervised algorithms
Experience with statistical analysis
Bachelor's degree from an accredited institutionWhat Will Put You Ahead?
Preferred Qualifications:Bachelor's or Master's degree in Data Science, Mathematics, or Statistics from an accredited institution
C#, VB.Net, or Java coding experienceAdditional Information:
Ability to travel for work up to 15% of the time, by plane, car, etc.Want to learn more about EFT Analytics?
Twenty years ago, EFT Analytics set out to deliver real-time, data-driven insights. Today, Industry 4.0 is the advent of Internet of Things, smart manufacturing and industrial stewardship. Insights and results earn your data a seat in the boardroom. EFT is a subsidiary of Koch Industries, one of the largest private companies in the U.S. Koch has delivered results using its unique management philosophy across dozens of industries and hundreds of sites for decades. EFT strives daily to bring those time-tested fundamentals to how we operate and what we deliver.
Our people and culture are just like you, totally unique. We come from vastly diverse backgrounds. We’ve taken our own paths. When there wasn’t a path, we blazed trails. Trails that led us here. Where we find ourselves unified around one mission: to be the best data analytics company on the planet. And we won’t stop until we get there.
Salary and benefits commensurate with experience.This role is not eligible for work visa sponsorship.

We are an equal opportunity employer. Minority/Female/Disabled/VeteranExcept where prohibited by state law, all offers of employment are conditioned upon successfully passing a drug test."	NA	"character(0)"	2018-10-15	"New+York%2C+NY"	60
