"url"	"title"	"company_name"	"company_score"	"description"	"time_posted"	"metadata"	"date_scraped"	"city"	"page"
"https://www.indeed.com/viewjob?jk=43e0b2c0a9b2fb89"	"Data Scientist"	"Clarivate Analytics"	"32 reviews"	"Clarivate Analytics clients are the trailblazers and risk takers who come up with life-changing ideas. We’re looking for our own trailblazers to help us keep providing clients some of the world’s most trusted brands, spanning scientific and academic research, patent analytics, pharmaceutical and biotech intelligence and IP management. We’re an independent owned company with a rich heritage and a bold entrepreneurial mission. If you’re excited by the thought of helping people and organizations go from new ideas to life-changing innovations faster, we’re excited to consider you for a position at Clarivate. Responsibilities: Researches and identifies Machine Learning (ML) and Natural Language Processing (NLP) methods and algorithms to solve specific problems to improve user experience on Clarivate Analytics data and websites Implements methods and devises appropriate test plans to validate and compare the different approaches Identifies new applications of ML and NLP in the context of Clarivate Analytics extensive sets of content and data Explores existing data for insights and recommends additional sources of data for improvements Qualifications: Bachelor's degree in Computer Science, Statistics, Technology, or Engineering, strongly preferred, or equivalent work experience Excellent understanding of ML, NLP and statistical methodologies Excellent programming skills (Java/Scala) Ability to test ideas and adapt methods quickly end to end from data extraction to implementation and validation It is the policy of Clarivate to provide equal employment opportunity (EEO) to all persons regardless of age, color, national origin, citizenship status, physical or mental disability, race, religion, creed, gender, pregnancy, sex, sexual orientation, gender identity and/or expression, genetic information, marital status, status with regard to public assistance, veteran status, or any other characteristic protected by federal, state or local law. In addition, Clarivate will provide reasonable accommodations for qualified individuals with disabilities."	NA	"character(0)"	2018-10-15	"San+Francisco%2C+CA"	50
"https://www.indeed.com/viewjob?jk=da963ec6cb499dcf"	"2019 PhD Data Scientist Internship - UberEverything"	"Uber"	"548 reviews"	"InternshipAt Uber, we ignite opportunity by setting the world in motion. We take on big problems to help drivers, riders, delivery partners, and eaters get moving in more than 600 cities around the world. We welcome people from all backgrounds who seek the opportunity to help build a future where everyone and everything can move independently. If you have the curiosity, passion, and collaborative spirit, work with us, and let’s move the world forward, together. About the Role Are you interested in working at the intersection of applied quantitative research, engineering development, and data science? Do you have interest in applying quantitative solutions to the uniquely challenging problems related to Uber’s on-demand delivery marketplace? If so, then this is the opportunity for you. What You’ll Do Develop models for user behavior and marketplace dynamics Design optimization algorithms to improve marketplace efficiency Apply machine learning for recommendation, prediction, and forecasting Conduct experiments to inform product decisions What You’ll Need Strong quantitative background Research, data science modeling, or engineering experience Familiarity with technical tools for analysis - Python (with Pandas, etc.), R, SQL, etc. Research mindset with bias towards action - able to structure a project from idea to experimentation to prototype to implementation Independence, great communication, and amazing follow-through - you aggressively tackle your work and love the responsibility of being individually empowered Bonus Points For Background in Machine Learning, Statistics, Operations Research, Operations Management, Econometrics, or similar Experience in software engineering About the Team Uber Everything Data Scientists help solve the most challenging problems related to Uber's ambitious and rapidly expanding on-demand delivery businesses, such as Uber Eats. These fascinating and challenging problems include: demand prediction, menu ranking and recommendation, delivery time estimation, batching, scheduling, routing, dynamic pricing, supply positioning, and much more."	"24 days ago"	"Internship"	2018-10-15	"San+Francisco%2C+CA"	50
"https://www.indeed.com/viewjob?jk=e82a251ad0b77472"	"Data Scientist, Risk"	"Square"	"63 reviews"	"Job DescriptionAs a Senior Data Scientist at Square working on Risk, you will lead projects that derive value from our unique, rich, and rapidly growing data. Specifically, you will lead the development of fraud detection algorithms and systems that protect Square and its customers from fraud and financial loss. You will: Creatively leverage both new and existing data to increase the effectiveness and efficiency of our risk infrastructure Work with engineers to design machine learning solutions that operate effectively at scale Partner with operatives to quickly respond to rapidly evolving threats Apply good software development practices and actively contribute to production code Help build the next generation of data products at Square QualificationsYou have: 2-4 years of relevant industry experience A graduate degree in statistics, applied mathematics, computer science, physical sciences, or a similar technical field Experience developing and deploying machine learning / deep learning solutions The versatility to communicate clearly with both technical and non-technical audiences A willingness to solve problems using whichever tool is most appropriate for the situation Technologies we use and teach: Python (numpy, pandas, sklearn, xgboost, TensorFlow) MySQL, Hive Java Google Cloud Platform Tableau, Looker Additional InformationAt Square, our purpose is to empower – within and outside of our walls. In order to build the best tools for the businesses and customers we support all over the world, we have to start at home with a workforce as diverse and empowered as our sellers. To this end, we take great care to evaluate all employees and job applicants equally, based on merit, competence, and qualifications. We do not discriminate on the basis of race, religion, color, national origin, gender, sexual orientation, age, marital status, veteran status, disability status, or any other characteristic protected by law. We encourage candidates from all backgrounds to apply and always consider qualified applicants with arrest and conviction records, in accordance with the San Francisco Fair Chance Ordinance. Applicants in need of special assistance or accommodation during the interview process or in accessing our website may contact us by sending an email to assistance(at)squareup.com. We will treat your request as confidentially as possible. In your email, please include your name and preferred method of contact, and we will respond as soon as possible."	"12 days ago"	"character(0)"	2018-10-15	"San+Francisco%2C+CA"	50
"https://www.indeed.com/viewjob?jk=e243ef110b33bc02"	"Image Reconstruction"	"openwater (openwater.cc)"	"-"	"Job Summary:Openwater is creating a next-generation imaging technology that can enable us to see inside our bodies in great detail. With this advancement comes the promise of new abilities to diagnose and treat disease as well as the possibility for breakthroughs in BCI, such as communication by thought alone.We are seeking a self-motivated, enthusiastic and experienced scientist or engineer with a proven record and excellent communication skills to help realize this vision. In this role you will work with teams across functional groups on the acquisition, processing, and analysis of imaging data, developing state-of-the-art 2D and 3D reconstruction techniques and helping to evaluate, test and design scanning methods and systems.Responsibilities and Duties:Apply mathematical (geometry, linear algebra, statistics, numerical methods, error analysis), machine learning, data mining, computer vision, and pattern recognition methods to prototype and develop algorithms for converting raw sensor data into 2D and 3D representations and visualizations, and perform tracking, registration, classification and semantic annotation.Develop and maintain comprehensive clinical and technical biomedical instrumentation documentation.Participate in defining product requirements, quality metrics, schedule, assignments, etc.Optimize code for running on embedded and non-embedded platforms.Qualifications and Skills:Ph.D. or M.S./M.E. in Computer Science, EE, Physics, or related discipline is required. Ph.D. preferred.5+ years of experience in the following:Proven experience implementing algorithms for computer tomography.Image reconstruction from projection of objects.3D Image representation and visualization. Conversion of CT scans into animations.Solid experience developing and debugging image processing algorithms in a variety of languages, e.g. Matlab, Python and C++ or equivalent.Experience using software for CT visualization.Experience with existing computer vision libraries.5+ years of experience in at least 3 of the following:Video and image processing. Image enhancement in the spatial and digital domain: smoothing and sharpening filters, linear and nonlinear pixel transformations, histogram equalization.Image restoration in the presence of noise.Multiresolution and image compression.Image segmentation, detection and pattern recognition.Desired:Knowledge of medical data privacy laws and regulations.Experience in developing algorithms for embedded platforms.Familiarity with AI and deep learning methods.Familiarity with big data methods a plus.US Work authorization required.Job Type: Full-timeExperience:image reconstruction and visualization: 5 years (Preferred)Education:Master's (Required)"	NA	"character(0)"	2018-10-15	"San+Francisco%2C+CA"	50
"https://www.indeed.com/viewjob?jk=75659356a039c994"	"Senior Data Scientist, Recommendation Technology"	"OpenTable"	"34 reviews"	"Senior Data Scientist, Recommendation Technology (OpenTable, Inc., San Francisco, CA) Develop personalized Recommendation Technology to power user discovery and exploration of restaurants (including idea-generation, problem formulation, design, implementation, iteration, testing, deployment and continued improvement). Proactively perform data exploration to understand diner behavior and restaurant characteristics and identify opportunities for improving Recommendation Technology. Extract insights from data points to improve the user experience. Build sophisticated supervised and unsupervised Machine Learning and statistical models for data analysis, classification and regression. Integrate data ingestion, extraction, and transformation into formats for modeling and analysis. Optimize the performance of Recommendation Technology prototypes for deployment in real-time systems. A/B test recommender systems to demonstrate direct, measurable impact to user engagement, conversion, reservation frequency, and new user growth. Design, analyze and interpret experiment results. Use excellent oral and written communication skills to interact with colleagues across all levels of the organization, motivating and reporting on all aspects of Recommendation Technology with appropriate level of abstraction, and to partner with management in assisting with decision making and information interpretation. MINIMUM REQUIREMENTS: Master’s degrees or U.S. equivalent in Artificial Intelligence, Machine Learning, Computer Science, Applied Statistics, Applied Mathematics, Electrical Engineering, or a related field plus 3 years of professional experience in designing, developing, testing, deploying, maintaining and improving large-scale Machine Learning systems. Must also have the following: 1 year of professional experience in building and evaluating Machine Learning and statistical models (including Boosting or Ensemble methods, and Regression, Linear Models, Support Vector Machines, Matrix Factorization, Factorization Machines, Hidden Markov Models, Graphical Models, Mixture Models, Markov Decision Processes, Clustering Techniques, Time Series, Deep Learning/Neural Networks, and Bayesian Optimization); 1 year of professional experience in designing, prototyping, implementing, testing, deploying, and maintaining high-volume, production-level recommendation systems; 1 year of professional experience in implementing and deploying data ingestion, data transformation, data mining, and data cleansing systems; 1 year of professional experience in designing A/B test frameworks and A/B test experiments; 1 year of professional experience in implementing data introspection and monitoring/alerting tools in the context of Recommendation Technology; 1 year of professional experience in building robust, real-time software systems in distributed environments; 1 year of professional experience in developing software using Java, Scala, Python, C++, SQL, and Unix scripting; 1 year of professional experience in presenting complex scientific topics. CONTACT: Please submit resume online at:https://www.opentable.com/careers/technology/?p=job%2FooO87fwb. Please specify ad code XAKP. EOE. MFDV."	NA	"character(0)"	2018-10-15	"San+Francisco%2C+CA"	50
"https://www.indeed.com/viewjob?jk=c9bdb952f06e70a5"	"Data Scientist, Product analytics"	"eBay Inc."	"1,505 reviews"	"Position: Data Scientist, Product Analytics Organization: StubHub, www.stubhub.com (an eBay company NASDAQ: EBAY) The Opportunity We are looking for an experienced Data scientist with exceptional product sense to help champion the use of data in product decision-making. In this role you will work closely with our Engineering, Product, Ops, and Design teams to evaluate product opportunities, track product metrics, develop and analyze experiments, and drive deep-dive studies to identify new opportunities. You will: Apply data & analytical skills to help understand how our customers use our products Partner closely with product leadership to define, measure and report on core product and feature metrics Design customer-facing experiments (A/B tests) and distill their results into actionable outcomes Execute cohort studies and drive analyses to understand customer behavior and identify opportunities for improving our product(s) Collaborate with data and business intelligence teams to develop reports and visualization dashboards Build financial models to project key business metrics - Traffic, conversion, Engagement - and develop KPIs to measure initiative performanceYou have: Strong quantitative background with Product analytics experience. Proven track record in solving business problems through fact based and scientific analytics Excellent technical skills - including the ability to query databases (SQL, Hive etc.), leveraging R/Python to analyze complex data, and using Tableau (or other visualization tools) to deliver insights at scale Deep understanding of statistics, experimental design, and causal inference The ability to translate analytical insights into clear recommendations and effectively deliver it to technical and non-technical stakeholders Worked in cross-functional and cross-cultural teams, and are able to communicate technically intricate concepts/results in business terms Passion for technology and consumer productsWhy StubHub? StubHub is the world's largest ticket marketplace, enabling fans to buy and sell tickets to tens of thousands of sports, concert, theater and other live entertainment events. StubHub reinvented the ticket resale market in 2000 and continues to lead it through innovation. The company's unique online marketplace, dedicated solely to tickets, provides all fans the choice to buy or sell their tickets in a safe, convenient and highly reliable environment. All transactions are processed and delivered by StubHub and backed by the company's FanProtect Guarantee™ processing a ticket every second today with billions of ticket sales each year globally. Company partners MLB, AEG, ESPN and many leading teams such as the San Francisco Giants and University of Texas, along with over 60 other teams in MLB, NBA, NHL and NCAA. Our Values StubHub One – We act as one team in pursuit of connecting people through inspiring event experiences. At StubHub, we are: Driven – We strive for excellence – constantly improving our game Courageous – We are bold & not afraid to challenge the status quo Inventive – We see what others don’t & pioneer new paths Richly Diverse – We recognize & respect everyone as a unique individual Brand – We experience the world through StubHub.This website uses cookies to enhance your experience. By continuing to browse the site, you agree to our use of cookies View our privacy policy View our accessibility info eBay Inc. is an equal opportunity employer. All qualified applicants will receive consideration for employment without regard to race, color, religion, national origin, sex, sexual orientation, gender identity, veteran status, and disability, or other legally protected status. If you are unable to submit an application because of incompatible assistive technology or a disability, please contact us at talent@ebay.com. We will make every effort to respond to your request for disability assistance as soon as possible. For more information see: EEO is the Law Poster EEO is the Law Poster Supplement"	"2 days ago"	"character(0)"	2018-10-15	"San+Francisco%2C+CA"	50
"https://www.indeed.com/viewjob?jk=51013d1cd86d68ad"	"Senior Data Scientist"	"Indeed"	"354 reviews"	"Our mission: As the world’s number 1 job site, our mission is to help people get jobs. We need talented, passionate people working together to make this happen. We are looking to grow our teams with people who share our energy and enthusiasm for creating the best experience for job seekers. The team: We are a rapidly growing and highly capable engineering team building the most popular job site on the planet. Every month, over 200 million people count on us to help them find jobs, publish their resumes, process their job applications, and connect them to qualified candidates for their job openings. With engineering hubs in Seattle, San Francisco, Austin, Tokyo and Hyderabad, we are improving people's lives all around the world, one job at a time. Your job: As a Data Scientist at Indeed your role is to follow the data. Analyze, visualize, and model job search related data. You will build and implement machine learning models to make timely decisions. You will have access to unparalleled resources within Indeed to grow and develop both personally and professionally. We are looking for a mixture between a statistician, scientist, machine learning expert and engineer: someone who has passion for building and improving Internet-scale products informed by data. The ideal candidate understands human behavior and knows what to look for in the data. About you: Requirements * Ph.D. or M.S. in a quantitative field such as Computer Science, Operations Research, Statistics, Econometrics or Mathematics * Expertise in machine learning and statistical modeling * 5+ years professional or research experience in data science * Passion to answer Product/Engineering questions with data * Demonstrated mentorship experience We get excited about candidates who * Have full stack experience in data collection, aggregation, analysis, visualization, productionization, and monitoring of data science products * Can do small data modeling work: R, Python, Julia, Octave * Can do big data modeling work: Hadoop, Pig, Scala, Spark * Can fish for data: SQL, Pandas, MongoDB * Can deploy data science solutions: Java, Python, C++ Indeed provides a variety of benefits that help us focus on our mission of helping people get jobs. View our bounty of perks: [1] http://indeedhi.re/IndeedBenefits"	"8 days ago"	"character(0)"	2018-10-15	"San+Francisco%2C+CA"	50
"https://www.indeed.com/viewjob?jk=7cf3ae88333ef82f"	"Data Scientist / Machine Learning Engineer - Classification Science"	"Rakuten Intelligence"	"-"	"Rakuten Intelligence is looking for a Data Scientist / Machine Learning Engineer to join our Classification Science team. To create one of the world's richest commerce data sets and help deliver never-been-seen insights on customer purchase behavior, the Classification Science team is responsible for building systems to semantically classify and normalize billions of products across thousands of retailers. This includes building highly accurate machine learning models, engineering scalable systems, and incorporating crowdsourcing to have continuously improving human-in-the-loop systems. We leverage existing open source technologies and established machine learning approaches, but also innovate and research new techniques. As a data scientist / machine learning engineer, you will spend a mix of your time researching new solutions for product classification as well as productionizing these solutions to make sure they work at scale. You will work with world-class data scientists who hold MS/PhD degrees from top global schools such as Stanford University, University of Washington, Carnegie Mellon University, and National Taiwan University, and veterans from companies such as Microsoft, AOL, Yahoo!, and Twitter. Rakuten Intelligence was founded by proven entrepreneurs and, as a Rakuten group company, offers the best of both worlds: a start­up environment with the backing of an established global enterprise that is revolutionizing the internet services landscape. This position will be located in San Mateo or New York. Responsibilities:Research and experiment with different machine learning algorithms and techniques for item classification, product recognition and matching, attribute extraction Conduct design and code reviews Productionize the developed Machine Learning solutions Work with engineers to make sure the engines scale well on high volumes of data Requirements:MS/PhD in Computer Science or a related field 3+ years of industry experience in data science and machine learning preferred Expertise in Machine Learning Strong CS fundamentals, such as algorithms and data structures Expertise in Python Proficiency with relational databases such as MySQL Experience with cloud computing stacks such as Amazon Web Services preferred Excellent written and verbal communication skills Enthusiasm for working hard and having fun in a dynamic environment Who we are: Rakuten Intelligence is online shopping, smarter. Rakuten Intelligence is transforming e-commerce by unveiling never-before-seen e-commerce insights via its market research products, which are powered by our popular consumer applications, Rakuten Slice and Unroll.Me. Rakuten Intelligence has developed a technology that extracts commerce data from emails to make it actionable for businesses and consumers. With the largest panel of online shoppers under measurement, Rakuten Intelligence provides the most detailed, accurate, and actionable e-commerce data available, and is the most cited source on e-commerce by the media. Learn more about Rakuten Intelligence at www.rakutenintelligence.com ( http://%C2%A0www.rakutenintelligence.com )and on twitter @RakutenIntel. Rakuten Intelligence was incubated as a research project at Stanford, where the best and brightest minds in machine learning set forth on how to extract business value from the vast amount of unstructured purchase data in inboxes. When we took that project out of the lab and to the market, we retained the culture of excellence and personal growth, with respect for a healthy work-life balance. Because we love what we do and care about the people we work with. Values:Start­Up Environment – Work is fun, roles are challenging. Always prioritize the company's success over egos. We innovate, take risks, move quickly and fail fast. Hire smart and develop talent – ­ We are entrepreneurial self-starters who ignite/inspire growth on an individual, team and company level. Say it like it is – We create a transparent, respectful environment within our company and for our users and partners. We give and receive prompt honest feedback. Get it done ­ – We measure our success based on results rather than activity. We use the 80/20 rule. ­Perfect is the enemy of good. Customer success is our own – We treat our customers and partners with respect. We are easy to do business with. Benefits & Perks:Competitive compensation package including base salary, bonus and Rakuten stock Medical, dental, vision and basic life insurance Flexible Spending Account (health care and dependent day care) 401K plan Unlimited Paid Time Off Paid Parental Leave: Maternity (up to 22 weeks off / 16 weeks paid) and Paternity (up to 8 paid weeks off) Free Caltrain Go Pass for unlimited train travel Onsite secured bike storage and $20/month bike reimbursement through WageWorks $10,000 / $5,000 employee referral program $2,000 towards professional development (annually) Healthy and Fun Work Environment at our San Mateo, CA headquarters: Daily catered breakfast and lunch Various drinks and snacks Ping-pong table, air hockey table, corn hole and board games Adjustable sit/stand desks Fully-equipped nursing mom rooms with hospital grade pumps and fridges Onsite gym with showers and lockers Partnership with YMCA for discounted membership. YMCA is 2 blocks from the office Company social and volunteer events"	NA	"character(0)"	2018-10-15	"San+Francisco%2C+CA"	50
