"url"	"title"	"company_name"	"company_score"	"description"	"time_posted"	"metadata"	"date_scraped"	"city"	"page"
"https://www.indeed.com/viewjob?jk=0df13800ce0c7445"	"Human Capital Data Scientist"	"LOCKHEED MARTIN CORPORATION"	"6,327 reviews"	"Workforce Solutions & Intelligence – Global Strategic Workforce Planning, Intelligence, Analytics and HRIS organization is actively seeking Human Capital Data Science professionals to provide data-driven insights to answer Lockheed Martin's most critical human capital challenges. The analyst will conduct advanced analytics and modeling on a variety of HR data. If you are you a skilled in this area, this is the right opportunity for you! The successful candidate will be a member of the Enterprise Wide Reporting and Analytics for Lockheed Martin. The team is responsible for providing HR advanced analytics and reporting for HR professionals and business leaders, interfacing with a broader group of Business Area teams on analytics, reporting and HR systems. This position will be focused on providing advanced analytics and modeling. The Analyst will support a wide range of activities and projects:Lead or support development, collection, analysis and transformation of workforce data using databases, spreadsheets, queries, statistical tools and programs.Lead or contributes to development of models, forecasts, simulations, reports and analysis/insights.Applies extensive technical experience and has full knowledge of related discipline to complex problems requiring use of ingenuity and creativity.Translate findings into meaningful visualizations.Provide analysis and interpretation of external and internal human resource trends and insights.Lead or support technical requirement development, testing implementation of workforce solutions, dashboards and visualizations.Maintains excellent working relationships with Human Resources colleagues, including Working HR Business Partners, Labor Relations, Compensation, Global Diversity & Inclusion, Talent Acquisition, and Legal as needed.Drives lateral connectivity and collaboration within Human Resources and across the enterprise.Delivers data driven solutions that are efficient, effective, and flexible.Performs other duties as assigned. Basic Qualifications:Bachelor’s degree in Statistics, Economics, Engineering, Mathematics, Industrial/Organizational Psychology, or other discipline with substantial scientific and quantitative training.Minimum of 6 years of experience working with databases, spreadsheets, queries, and data visualization tools/techniques to translate data into meaningful insightsMinimum of 3 years of experience working on statistical analysis, predictive modeling, forecasting, simulation, segmentation, or other advanced data analysis techniques.Proficiency with statistics tools (e.g. SAS, R, Python/Pandas, SPSS, MATLAB).Proficiency with SQL or similar language.Experience designing, developing, and automating complex analytical processes (data gathering, cleanup, aggregation, transformations, analysis, modeling, testing, reporting, visualization, and delivery of data products, output files, etc.).Demonstrated experience applying statistics and higher order analytics (for example, retrospective / trend analysis, regression, predictive analysis/modeling) within a business context.Proficient in data visualization with software such as Tableau.Use of Microsoft Excel, Macros and/or Access to analyze data.Strong analytical skills and problem-solving skills.Guides successful completion of major initiatives working either independently or in a team environment, depending on the task.Demonstrated experience extracting, cleansing, and analyzing data for a large company (10,000 or more employees).Demonstrated experience presenting analyses and recommendations to non-technical audiences.Demonstrated experience managing projects and initiatives, including developing project plans, identifying stakeholders, preparing corresponding communication plans, identifying of milestones, deadlines, and metrics to assess outcomes/results. Desired Skills:Strong presentation development and writing skills (e.g., proficient in Microsoft PowerPoint and Word).Demonstrated ability to translate data analysis and research findings into easy to understand, actionable recommendations for people at different levels of the organization.Experience working in an HR function.Experience with text analytics.Experience with longitudinal analysis and cohort/panel studies.Experience with time-to-event models (e.g. survival analysis).Experience collecting and parsing data from various sources to feed analysis (e.g. relational databases, no-SQL databases, files, XML, HTML/web, etc.).Experience in developing reports using any major BI Package (Tableau, MicroStrategy, Business Objects, Cognos, Oracle BIEE or similar).Demonstrated ability to influence stakeholders using multiple methods based on context. BASIC QUALIFICATIONS:Bachelor’s degree in Statistics, Economics, Engineering, Mathematics, Industrial/Organizational Psychology, or other discipline with substantial scientific and quantitative training.Minimum of 6 years of experience working with databases, spreadsheets, queries, and data visualization tools/techniques to translate data into meaningful insightsMinimum of 3 years of experience working on statistical analysis, predictive modeling, forecasting, simulation, segmentation, or other advanced data analysis techniques.Proficiency with statistics tools (e.g. SAS, R, Python/Pandas, SPSS, MATLAB).Proficiency with SQL or similar language.Experience designing, developing, and automating complex analytical processes (data gathering, cleanup, aggregation, transformations, analysis, modeling, testing, reporting, visualization, and delivery of data products, output files, etc.).Demonstrated experience applying statistics and higher order analytics (for example, retrospective / trend analysis, regression, predictive analysis/modeling) within a business context.Proficient in data visualization with software such as Tableau.Use of Microsoft Excel, Macros and/or Access to analyze data.Strong analytical skills and problem-solving skills.Guides successful completion of major initiatives working either independently or in a team environment, depending on the task.Demonstrated experience extracting, cleansing, and analyzing data for a large company (10,000 or more employees).Demonstrated experience presenting analyses and recommendations to non-technical audiences.Demonstrated experience managing projects and initiatives, including developing project plans, identifying stakeholders, preparing corresponding communication plans, identifying of milestones, deadlines, and metrics to assess outcomes/results. Lockheed Martin is an Equal Opportunity/Affirmative Action Employer. All qualified applicants will receive consideration for employment without regard to race, color, religion, sex, pregnancy, sexual orientation, gender identity, national origin, age, protected veteran status, or disability status. Join us at Lockheed Martin, where your mission is ours. Our customers tackle the hardest missions. Those that demand extraordinary amounts of courage, resilience and precision. They’re dangerous. Critical. Sometimes they even provide an opportunity to change the world and save lives. Those are the missions we care about. As a leading technology innovation company, Lockheed Martin’s vast team works with partners around the world to bring proven performance to our customers’ toughest challenges. Lockheed Martin has employees based in many states throughout the U.S., and Internationally, with business locations in many nations and territories."	"6 days ago"	"character(0)"	2018-10-15	"Washington%2C+DC"	60
"https://www.indeed.com/viewjob?jk=ee713cc2f3581d8c"	"Public Health Security Surveillance Data Scientist"	"The Cadmus Group, Inc."	"-"	"At Cadmus, our Homeland Security Sector provides clients with pragmatic solutions to their most important analytical and policy challenges. We bring together teams of outstanding professionals who have earned a reputation of responsive and client-focused support for a wide range of homeland security and emergency preparedness agencies at all levels of government. Our client-oriented approach, coupled with our profound and relevant subject-matter expertise, enables us to bring an incisive edge to solving the most critical homeland security problems. Cadmus seeks qualified candidates to aid in the development of systems for public health surveillance. Successful candidates will have at least 3 years of experience in a scientific field, with 2 years providing expert support for the development of systems for public health monitoring, identifying and using novel data sources, or conducting risk analysis. Candidates must have a Bachelor’s degree from an accredited institution. The ideal candidate will have experience working in a professional services firm and/or a government agency with public health responsibilities. Please note: This position will be located at a client site and qualified applicants must be able to pass a DHS Suitability check Valid in scope DoD Secret Clearance is a plusResponsibilities Contribute to the development of public health monitoring systems Oversee delivery by external partners by establishing timelines, budgets, and milestones Provide subject-matter expertise on data analytics and data visualization Work with external partners on topics related to data sharing Represent client on interagency development teams Qualifications Bachelor’s degree from an accredited institution in a scientific, engineering, medical, veterinary, or public health field At least 3 years of experience, or a Master’s Degree and 2 years of specialized experience providing scientific or technical support to major programs or system development efforts related to biosurveillance, epidemiology, or microbiology Excellent analytical, communications, and presentation skills Proficiency in relevant software programs including Microsoft Word, PowerPoint, and Excel. Familiarity with R and/or GIS preferred Command of the English language in both written and spoken format As a representative of Cadmus, possess the ability to demonstrate professionalism and sound judgment in interactions with clients and colleagues Candidates selected may be subject to a security investigation and, if required, should be able to meet eligibility requirements for access to classified information Experience working with a professional services consulting firm, DHS, Public Health, and/or the Federal Government is highly preferred"	"14 days ago"	"character(0)"	2018-10-15	"Washington%2C+DC"	60
"https://www.indeed.com/viewjob?jk=d65146fcaffafee0"	"Data Scientist"	"ANALYTICA"	"7 reviews"	"$101,000 - $149,000 a year (Indeed Est.) Analytica is seeking a Data Scientist to perform in-depth evaluation and analysis of potential fraud cases and requests for information using claims information and other sources of data. The Data Scientist utilizes SAS, R, or Python to support the development of complex cases that involve high dollar amounts, sensitive issues, or that otherwise meet criteria for referral to law enforcement, recoupment of overpayment, and/or administrative action based on reactive and proactive data analysis.Primary Responsibilities Include (But Are Not Necessarily Limited To): Provide regulatory and compliance analysis, implementation, data analysis, and evaluation to identify potential fraud. Works with local management, investigators, and analysts to provide reactive and proactive case development support and to fulfill law enforcement data requests. Analyzes data to identify and compare norms, trends, and patterns Applies tools to detect potential fraud and support fraud investigations, organizing case files, research violations and accurately and document all steps taken in project development Maintains chain of custody on documents and follow all confidentiality and security guidelines. Validates data analysis results and analytically identifies potential fraud, waste and/or abuse situations in violation of Medicare/Medicaid laws, guidelines, policies, and regulations. Conducts self-directed research to uncover problems and provides data analysis support to the fraud investigation team in support of their investigation leads Supports management requests for CMS reporting requirements. Develops quality leads so that new case development can occur to meet contract requirements to identify new problems proactively Utilizes data analysis techniques to detect aberrancies in Medicare/Medicaid claims data and proactively seeks out and develops leads and cases received from a variety of sources including CMS and OIG, fraud alerts, and referrals from government and private sources. Works with Statisticians and Sr. Data Analysts to provide proactive data analysis results with statistically high probabilities of producing case referrals to law enforcement, overpayments, and/or administrative actions Responds in a timely and complete manner to data requests from internal and external customers Prepares, develops and participates in provider, beneficiary, law enforcement, or staff training as related to Medicare fraud, waste and/or abuse data analysis.so that contract requirements are met for case development access to data and innovative approaches to fraud Required skills, abilities, and certifications: Bachelor degree in statistics or related discipline with preference given to candidates with relevant work experience in healthcare claims analysis Have high proficiency level with MS Access and MS Excel. Requires 5+ years professional experience working with SAS, R, or Python to perform various types of data analysis. Knowledge of Medicare and Medicaid rules and regulation is a plus Demonstrated knowledge of various database management systems in order to input, extract or manipulate information. Demonstrated experience and knowledge of health care information (health claims data specifically Medicare and Medicaid , ICD-9-CM codes, physician specialty codes, pharmaceutical data including NCPDP file formats and codes, provider identifiers, etc) is preferred.Additional Preferences: Demonstrated knowledge in Machine Learning and AI with techniques such as: machine learning and decision trees Worked with data visualization tools such as:ggplot, d3.js and Matplottlib, and Tableau Exposure to working with unstructured data that may include videos, blog posts, customer reviews, social media posts, video feeds, audio etc. Ability to write technical documents that can describes handling and functionality of various data architectures and solutions. About ANALYTICA: Analytica is a leading consulting and information technology solutions provider to public sector organizations supporting health, civilian, and national security missions. Founded in 2009 and headquartered in Washington D.C., the company is an established SBA certified HUBZone and 8(a) small business that has been recognized by Inc. Magazine each of the past three years as one of the 250 fastest-growing companies in the U.S. Analytica specializes in providing software and systems engineering, information management, analytics & visualization, agile project management, and management consulting services. The company is appraised by the Software Engineering Institute (SEI) at CMMI® Maturity Level 3 and is an ISO 9001:2008 certified provider."	"19 days ago"	"$101,000 - $149,000 a year (Indeed Est.) "	2018-10-15	"Washington%2C+DC"	60
"https://www.indeed.com/viewjob?jk=21aa5f8d6a022e0d"	"Data Scientist"	"Boost Labs"	"-"	"ContractBoost Labs is currently seeking a Data Scientist with experience in the travel and hospitality industry. We are looking for an energetic team member with a desire to explore, innovate and drive industry disruptive change through next level insights of data analytics using modern deep learning techniques and tools.. You’ll be wrangling huge data sets and communicating the key insights to our team of talented designers and engineers to create industry leading products for our clients. The ideal candidate will understand a range of programming languages, statistical methodologies, databases, and data science tools. There’s no data set too difficult to organize because you’re a meticulous data expert. As a company, Boost Labs is made up of a passionate group of devoted teammates who push for improving data-centric applications. Our culture is devoted to helping one another bring out the best through camaraderie, mentorship, training/learning, and of course, challenging projects. We focus on a fine balance between beauty and function without letting one compromise the other. What would you be doing? Work closely with our clients to create a strategy that extracts the maximum possible value from their available data Be integrated throughout client interactions from discovery to final deployment Critically assess the type and quality of customer data and work with them to match the appropriate methodology to solve their toughest problems Work with our team to develop modeling strategies Creating new Machine Learning and AI models Here’s what you’ll need: Bachelor’s degree required. Master’s degree in relevant fields such as Statistics, Mathematics, Machine Learning, Computer Science with Artificial Intelligence focus. PHD in Statistics, Sociology, or Data Science a plus Past experience/performance with travel or hospitality data Pragmatic coding ability – with fluency in at least one relevant programming language and the openness to learn and adapt to a variety of languages and tools (Python, R, Jupyter, scikit-learn, SPSS, etc.) Extensive experience with SQL and NoSQL databases Strong background in delivery of technical, data-rich projects, ideally for external clients Be organized and thorough, learn quickly like a cyborg Experienced Machine learning and AI practitioner with expertise in common ML frameworks. Be able to manage stress and multitask Have good communication skills — both written and spoken Have the ability to collaborate as part of a team and be a team player Possess a strong sense of responsibility and drive Be able to get shit done no matter what Be able to to take constructive criticism Cross functional product development team experience Be self-motivated, we don’t believe in micromanaging! Brownie Points: Musical Background — +50 Love of Video Games — +50 Love of Sushi — +1,000 Sense of Humor — +10,000 Does this sound like something you’d be interested in? Please provide a résumé, samples of work, and rate. This position is open for LOCAL candidates, freelance or contract-to-hire. (We are in Gaithersburg, MD and Atlanta, GA)"	NA	"Contract"	2018-10-15	"Washington%2C+DC"	60
"https://www.indeed.com/viewjob?jk=804bbb0f041d1994"	"Data Scientist III"	"Carney"	"5 reviews"	"Data Scientist III Scientist/Research Washington, District Of Columbia Position Overview The Data Scientist will provide hands on advanced data analytics and project management as well as apply innovative techniques to large claims datasets to analyze a wide array of training-related issues and challenges. This position is located on-site with the client at Joint-Base Anacostia-Bolling in Washington, DC. Responsibilities Develop and maintain spreadsheets, tracking databases, reports, and presentations Communicate finding and conclusions to lay audiences Analyze data to identify trends, issues, and opportunities to improve Recommend solutions based on finding/conclusions Act as subject-matter expert in data science May serve as team lead and assist with administrative functions Demonstrate superior oral and written communication skills Be self-directed, highly professional, and collaborative Minimum Requirements High School diploma and specialized training Ten (10) years of experience Bachelor's degree in related field can be included for up to 4 years of experience Master's degree in related field can be included for an additional two years of experience TS/SCI clearance Excellent problem-solving skills Desired Qualification Military experience Favorable DoD Polygraph Benefits **New Benefit: Beginning January 2018, Carney will offer a student loan repayment benefit to help employees reduce their student debt Carney offers a full suite of benefits to its employees. These include common benefits, such as: Multiple medical options (CareFirst), dental (Lincoln Financial), and vision insurance (EyeMed) Carney-paid life and disability (life/AD&D are two times salary) 401k with match (20% of the first 10% contributed) Flexible Spending Accounts and Health Spending Accounts Paid time off starting at 15 days per year plus 10 paid holidays Education Assistance Aflac plans (seven options) Employee Assistance Program (EAP) Carney also offers additional benefits as part of our commitment to valuing employees and these include: Parental leave (six weeks) Student loan repayment Legal services plan Get Out and Learn (up to $200 annually to learn almost anything!) Get Out and Run (up to $200 annually to participate in fitness events!) Ad hoc training/professional development access"	"12 days ago"	"character(0)"	2018-10-15	"Washington%2C+DC"	60
