"url"	"title"	"company_name"	"company_score"	"description"	"time_posted"	"metadata"	"date_scraped"	"city"	"page"
"https://www.indeed.com/viewjob?jk=224e47e18681205a"	"Research Analyst - Part-Time"	"Office of the Chief Judge, Circuit Court of Cook County, Illinois"	"-"	"$31.96 an hourPart-time, TemporaryThe job description and application instructions for the position of Part-Time Research Analyst, MacArthur Safety & Justice Challenge Grant are available on the website of the Circuit Court of Cook County, Illinois, at http://www.cookcountycourt.org/HOME/ApplicationSJC.aspx.Minimum Qualifications:1 year of experience in statistical programming using SPSS or R, preferably with criminal justice dataEquivalent to a Master’s degree in criminology, statistics, or a related field.Job Types: Part-time, TemporarySalary: up to $49,858 /year (up to 30 hours/week)Job Type: Part-timeSalary: $31.96 /hour"	"3 days ago"	"c(\"$31.96 an hour\", \"Part-time, Temporary\")"	2018-10-15	"Chicago%2C+IL"	60
"https://www.indeed.com/viewjob?jk=feafd916cfb43263"	"Lead Data Scientist with Python"	"Inficare Technologies"	"-"	"ContractJob SummaryTitle: Data ScientistLocation: Chicago ILDuration: Long Term ContractNote : Passport NO Mandatory for H1B consultantsJob Description :Master's Degree in Business / Statistics / Computer Science with courses on Mathematics, Statistics (preferred)Minimum 8+ years of relevant corporate experience in the field of Data Science and implementations in PythonShould have solved Time Series Analysis problems. Proficient in python and using libraries -- nltk, sklearn, numpy, scipy, pandasShould have at least 5 end to end Development Project experience to build and deploy Machine Learning solutionsComfortable in implementing Distance algorithms, Association Rules, XGBoost, Random Forest, Regressions and other techniquesShould have experience handling large datasets (structured and unstructured)Should have experience with ETL and Big Data PlatformsShould have SQL knowledgeHaving good understanding of design principles.Job Type: ContractEducation:Bachelor's (Required)"	"6 days ago"	"Contract"	2018-10-15	"Chicago%2C+IL"	60
"https://www.indeed.com/viewjob?jk=f6404d261e57b2ca"	"Data Scientist"	"Pegasus Knowledge Solutions"	"-"	"ContractData Scientist Role
Required Skills : Python, Model development
experience, Supply Chain forecasting, Machine Learning
Nice to have : JDA Software
Description: Client is is looking to update how
its does supply chain forecasting. Developing a forecast system that can be
used for quick service restaurants. Looking at making the current model more
granular so that it works at the restaurant level, faster to calculate so that
is reacts to changes faster and with less manual overrides.
We are sourcing for a Data Scientists with
experience in supply chain planning methodologies to work on how they should
model, this either using based on revenue, unit sales, or menu items. Candidate
should be able to assess how many models would be needed."	NA	"Contract"	2018-10-15	"Chicago%2C+IL"	60
"https://www.indeed.com/viewjob?jk=7c003940763b48e9"	"DATA SCIENTIST"	"Trading Technologies"	"12 reviews"	"We are seeking a strong Data Scientist with a background in computer science as well as either applied math or statistics to join our Chicago team of artificial intelligence system developers. In this role, you can expect to participate in the full lifecycle of data science, including everything from project ideation and data collection through modeling, results presentation and model refinement.
Responsibilities:
Program daily in Java and other data science languages, such as R and Scala
Read and process data from test files or REST endpoints
Write JUnit tests
Work in Python, pandas, scikit-learn and utilize data visualization libraries
Process large CSV and JSON datasets within a platform that uses map-reduce processing pattern, such as Spark, Hadoop, H2O, dask, etc.
Work with various model types, such as classifier, regression, unsupervised and time-series models
Test for Gaussian distribution and stationarity, and detect outliers
Explain and communicate the math and logic of the work to non-technical audiences
Qualifications:
Java programming experience is a must, and experience developing multithreaded distributed systems is preferred
Multi-variable calculus experience and basic linear algebra knowledge including matrix math and solving systems of linear equations
Familiarity with Markov processes and models
Experience with Github, Linux and SSH, as well as network analysis and signal processing
Experience with the H2O.ai platform a plus
Basic understanding of the trading industry, data security and privacy practices
Ability to take ownership over work and ask questions as needed
Strong communication skills with the ability to translate technical explanations to non-technical audiences who may include C-level executives and/or lawyers"	"2 days ago"	"character(0)"	2018-10-15	"Chicago%2C+IL"	60
"https://www.indeed.com/viewjob?jk=2fabf12f15279824"	"Senior Data Scientist"	"Trunk Club"	"89 reviews"	"Working for Trunk Club
----------------------

When you join Trunk Club, you join the Nordstrom family. Our fast-paced and entrepreneurial environment is paired with the strong history and experience of a retail legacy. We have access to some of the greatest minds in retail and technology and are constantly creating innovative strategies to develop the ultimate apparel solutions. We welcome your adaptability, your curiosity, and your passion to contribute to our unparalleled shopping experience!

Who We Are
----------

At Trunk Club, we develop models that enable the business to make data-driven decisions, from whom marketing targets for re-engagement credits to which merchandise should be shoppable for a given customer. Our stack makes it easy and painless to turn an algorithm into an API and run follow-up A/B tests using a range of multivariate models at your disposal. Every team relies not only on the data we collect, but more importantly in the clever ways that present it to every in our experience.

Data Science helps drive Trunk Club. Every member helps inform the company on the best ways to grow and change. You will have autonomy to collaborate with every team and be directly connected to decision makers without bureaucracy.

What You'll Do
--------------
Developing and maintaining Machine Learning infrastructure that powers our ranking models, member apps, inventory classification, etc. Our preferred language is Python and you'll regularly be working with real-time information from Kafka streaming systems.
Researching, developing, and implementing predictive algorithms using various regression techniques, deploying them as real-time APIs in our micro-service infrastructure.
Utilizing Natural Language Processing to understand text content across products, including reviews and interactions between users, stylists, and products.
Using Computer Vision (OpenCV) for image content analysis of novel and existing clothing items: classification, quality, attractiveness, similarity, extraction of features for ranking models.
Identifying suspicious transactions and malicious users for Fraud. Can you beat SaaS fraud platforms? We're betting so.
Determining the optimal inventory levels to help us effectively manage inventory needs while meeting revenue goals.
Using a range of clustering techniques to identify latent clusters of customers based on purchases, demographics, styles, etc.
Brainstorming new tools to help minimize the risk of experimenting with new algorithms.

What Your Background May Look Like
----------------------------------
Graduate degree in quantitative discipline with 2-3 years of relevant industry experience
Experience building and deploying Machine Learning models, and providing vision within a team environment.
Strong programming ability in Python with Jupyter, Pandas, and sklearn.
Proven track record working hands-on with data end-to-end.
Demonstrated success visualizing data and explaining complex concepts through expressive communication.

Who You Are
-----------
An evangelist. You love what you do and have a knack for communicating technical jargon to any audience.
A learner. You have an insatiable thirst for knowledge and greater understanding.
A pragmatist. Your goal is to create useful products, not build technology for technology's sake.
An entrepreneur. You're truly invested in the success of the business.

How We Work
-----------
With others. We collaborate cross-functionally to solve problems and deliver the best products for our customers.
With transparency. We have an open team room. No cubicles, no private offices.
With agility. We don't believe in following a process for process's sake. We ship frequently and focus on delivering incremental value.
With open minds. We are committed to building a diverse team of people with unique perspectives. This encourages a healthy and inclusive environment that builds a more sustainable, successful company.
With pride. We value our people most of all. We invest in ourselves by applying our own strengths and interests to company needs.

A Few of Our Perks
------------------
Lunch-and learns
Annual stipend for continuous education
Tech all-hands lunches every other Friday
Hack days
Team outings
Nordstrom discount
Flexible work environment
Social environment with built-in bars

#LI-LF1"	"15 days ago"	"character(0)"	2018-10-15	"Chicago%2C+IL"	60
"https://www.indeed.com/viewjob?jk=49adcb479d6a010a"	"Data Scientist (944)"	"ABC Supply Co. Inc"	"450 reviews"	"Data ScientistSummaryWe are aiming to transform our business with data science, and as a Data Scientist you will be part of a newly created, executive sponsored advanced analytics and data science center of excellence team at ABC Supply that is leading this transformation.You will be responsible for the full lifecycle of data science projects, from analytic question definition, through data gathering, modeling, reporting/visualizationdevelopment, testing, and operational deployment and support iterations in close collaboration with the data science team and broader IT organization. This includes working with business stakeholders to gather objectives and outline project scope, translate into technical designs, finding the right data, and then develop the end user friendly reporting and analytics platform of standard reports and self-service analytics interfaces with agile approach. This role requires a detail oriented, creative data scientist, comfortable working in a collaborative environment and ability to strive in the face of ambiguity and ever-changing priorities.ResponsibilitiesCollaborate on data collection efforts (external API’s, public data sources, etc.) and assist with the data and analytics infrastructure design and maintenance (MS Azure based solutions).Conduct Extensive descriptive analytics on the newly collected data, including visualization development.Connect the dots and use the data to solve real business problems using the right machine learning or statistical modeling techniques.Maintain and development of existing models into production (error handling, testing, etc.)Share your knowledge with the team, and learn more along the way.Skills and QualificationsBS/BA in a quantitative discipline, MS preferred. PHD’s more than welcome.4+ relevant professional analytics/data science experienceDeep understanding and practical experience with a wide range of Machine Learning and Statistical Modeling algorithms/techniques.Practical experience delivering exploratory and long term insights leveraging data visualization tools outside of statistical packages. I.E. Tableau, Power BI, D3.jsExpertise in writing clean efficient, and reproducible R and/or Python code for data cleansing and modelingAbility and passion to learn any new tool/language/algorithmon the fly (this is what you do for fun anyways).Ability to convey complex solutions\models and the value of the information to all levels of the organizationDeep understanding of RDMS and SQL, and meaningful exposure to cloud solutions. Experience with Microsoft Azure cloud solutions preferred.Experience with writing production code and model management concepts preferred.ABC Supply is a 12 time Gallup Great Workplace Award Winner and offers a competitive wage and a great benefit package to eligible associates. If you are seeking a new and exciting opportunity and have the required skills and experience, we may have just the position for you!Equal Opportunity Employer / Drug Free WorkplaceJob Type: Full-time"	"18 days ago"	"character(0)"	2018-10-15	"Chicago%2C+IL"	60
"https://www.indeed.com/viewjob?jk=f5968277b9e13498"	"Data Scientist"	"Crowe"	"181 reviews"	"Given substantial growth and impact at Crowe, the machine learning team has formed into an official unit, Advanced Data Science (ADS), which is responsible for all machine learning and artificial intelligence throughout the firm. This team works on a wide variety of projects utilizing numerous areas of machine learning, including: supervised regression/classification, unsupervised learning, anomaly detection, NLP, reinforcement learning, deep learning, forecasting, etc.

Leverage large sets of structured and unstructured data to develop tactical and strategic insights. Collaborate with analytic and data teams to set objectives, approaches, and work plans. Research and evaluate new analytical methodologies, approaches, and solutions. Develop and validate statistical forecasting models and tools. Interpret and communicate analytic results to analytical and non-analytical business partners and executive decision makers."	NA	"character(0)"	2018-10-15	"Chicago%2C+IL"	60
