"url"	"title"	"company_name"	"company_score"	"description"	"time_posted"	"metadata"	"date_scraped"	"city"	"page"
"https://www.indeed.com/viewjob?jk=7c3c7e0c559d984f"	"Data Science Intern"	"Zillow Group"	"77 reviews"	"InternshipAbout the team
Zillow Group's Decision Science team helps solve problems and derive insights for organizations across the company. Each team member focuses on a cross-section of the Zillow Group community. Our team structure is very flat and you will soon find yourself communicating directly with Senior Leadership. You'll work with them to make important, strategic decisions that influence the future of the company.
Below are some of the areas in which our Data Science Interns focus their energy.Business. Create data-driven insights to fuel the future of each of Zillow Group’s businesses
(e.g., Agent, Rentals, New Construction) by identifying opportunities for innovation and
assessing performance of current initiatives.Marketing. Develop data-driven strategies for B2C and B2B marketing efforts through a wide
range of marketing channels and measure their performance.Product. Analyze how our consumers are interacting with our web and app products to insure
we are providing them with a delightful experience for all things home.Sales. Analyze the intersection of human behavior, incentive structures, and sales process to
create a more efficient sales force that scales with Zillow Group’s ambition.Pricing. Develop and implement pricing strategies that deliver the best value possible for our
clients (Premier Agents, Lenders, Landlords, etc).Tools. Create data-focused information products from billions of data points we collect each
day for internal and external clients.About the role
Once you are here you'll help architect, analyze, and report on data to improve our understanding of our marketplaces from multiple perspectives (e.g., product development, consumer behavior, monetization). More specifically:
Dive into Zillow's internal and third party data (think Hive, Presto, SQL Server, Redshift, Python, Mode Analytics, Tableau, R) to identify opportunities for improvement (e.g., personalized user flows, segmented marketing audiences, more accurate pricing forecasts).
Assist in the scoping and development of new product features and business initiatives, and compile and analyze data describing the performance of those initiatives (e.g., AB tests, pilots, incrementality tests).
Coordinate with others on the team as well as engineers, product developers, and marketers to develop a common language and approach to analyzing and communicating information and insights.
Work directly with teams across Zillow Group to develop, maintain, and document a robust set of important metrics to monitor day-to-day bug detection and long-term performance tracking.
Tell stories that describe analytical results and insights in meetings of all sizes with diverse audiences.
Consult with stakeholders and provide analytics-oriented thought leadership across a variety of non-technical audiences to ensure that all levels of Zillow Group make data-driven, rational decisions.
Who you are
You will not shy away from complexity or uncertainty. You will develop a solid understanding of our mission, business models, and personas. We want you to use that intuition you've developed (both in business and real life) to find opportunities for growth and develop insights from our massive data sets. These opportunities and insights allow the broader organization to meet its goals, improve its performance, and positively impact how our users navigate our marketplaces.
We're looking for a seasoned data scientist that has:
Problem solving expertise gained while working towards an undergraduate or Master's degree in a quantitative field (e.g. science, engineering, economics, finance, statistics, or similar) or demonstrable experience within data science and analytics.
Experience involving quantitative data analysis and complex problem solving (preferably focused on consumer-facing internet products).
Foundational analytical skills (solid understanding of SQL, total command of Excel, and experience using R and/or Python) and are a Tableau pro.
Interest in working with multi-terabyte-sized data sets and are comfortable accessing those data (even if they're in JSON format) with Hive and Presto.
An understanding of concepts, terminology, and issues related to web traffic.
Strong written and verbal communication skills, and work well on teams of all sizes with representatives from a diverse set of technical backgrounds.
The skill to ask the right questions, can push stakeholders to focus on realistic goals and projects, and concisely communicate in written, verbal, and visual formats in a way that provides context, offers insights, and minimizes misinterpretation.
Get to know us
Zillow Group houses a portfolio of the largest and most vibrant real estate and home-related brands on the web and mobile. Our mission is to build the largest, most trusted and vibrant home-related marketplace in the world.Zillow Group is owned, fueled and grown by innovators who help people make better, smarter decisions around all things home. We encourage one another at every level, and our efforts are supported by employee-driven, world-class benefits that enable us to enjoy our lives outside the office while building fulfilling careers that impact millions of individuals every day.
Zillow Group is an equal opportunity employer committed to fostering an inclusive, innovative environment with the best employees. Therefore, we provide employment opportunities without regard to age, race, color, ancestry, national origin, religion, disability, sex, gender identity or expression, sexual orientation, or any other protected status in accordance with applicable law. If there are preparations we can make to help ensure you have a comfortable and positive interview experience, please let us know."	NA	"Internship"	2018-10-15	"Seattle%2C+WA"	90
"https://www.indeed.com/viewjob?jk=6666ed0efe8a18c7"	"Applied Scientist - Selection Monitoring Team"	"Amazon.com"	"27,831 reviews"	"Job Description
Selection Monitoring team sits at the core of Amazon’s retail business, and our systems help Amazon stay ahead of the curve by providing the broadest set of products to satisfy our customers’ shopping needs.
We build platforms, systems and tools for the retail business, create and take advantage of datasets that contains billions of records, use the latest data processing technologies land machine learning techniques All aiming to keep Amazon’s catalog comprehensive and competitively priced in order to maintain our position as the most customer-obsessed and innovative company in the world.
As an experienced machine learning scientist you will lead investigations and set the direction for the team by applying techniques from machine learning, information retrieval and data mining to solve some challenging problems using the data from the Amazon catalog and other big data systems. We work on classifying problems and determining potential of new brands and products in the Amazon platform using the billions of items that are available in the Amazon catalog. The data we handle is sparse and there are large number of features to explore. You will get opportunity to determine the selection that is carried by Amazon and to impact the bottom line of the retail business.
Basic Qualifications
Advanced degree in Machine Learning, Computer Science, Statistics, Applied Mathematics, Physics or in another highly quantitative field
3+ years of relevant experience
Proficiency in object oriented programming in Java, Python or Scala programming in a Unix environment.
Familiarity with Spark, MapReduce.Preferred Qualifications
Experience in a highly scalable, distributed environment preferred.
Results oriented person with a delivery focus.
Ability to handle multiple competing priorities in a fast-paced environment.
Domain expertise in ONE OR MORE of the following fields:Big data and Distributed processing (Spark, MapReduce)
Information Retrieval
Data Mining
Machine Learning
Ranking and ForecastingAmazon is an Equal Opportunity-Affirmative Action Employer – Minority / Female / Disability / Veteran / Gender Identity / Sexual Orientation"	NA	"character(0)"	2018-10-15	"Seattle%2C+WA"	90
"https://www.indeed.com/viewjob?jk=096d3caf30fa3aeb"	"Senior Data Scientist"	"Microsoft"	"5,068 reviews"	"Are you someone with a passion for data, analytics, insights and technology? Do you want to work on one of the largest data science teams at Microsoft, lighting up actionable insights that drive the key business decisions for the entire Office365 organization?
The Microsoft 365 Insights, Data Engineering & Analytics team (IDEAs), is the newly formed central data science team for Office365 engineering and marketing. The team is looking for a passionate, creative, analytical and experienced data scientist who loves big data, are curious to explore and that wants to impact business decisions.
Our team plays a key role in providing data and analytics for Office365 and owns the end to end decision sciences charter that includes:
Bringing the relevant data into a central system to create the single version of truth
Creating key metrics, reports and dashboards to support business health
Opportunity analysis and hypothesis generation for stages throughout the end-to-end user lifecycle
Building advanced analytical models (behavior segmentation, churn prediction, purchase propensity, recommendation engine, etc.) that spans engineering, marketing, partners and finance
User centric ML models that drive new experiences in the Office applications and services
To be successful in this role, you must be driven, self-directed, entrepreneurial and focused on delivering the right results. You also need to have strong skills in written and oral communications, a can-do attitude and the willingness to tackle hard problems in innovative ways. You also thrive in a team environment that values cross team collaboration and building on the success of others.
Responsibilities
Design, prototype, implement and test descriptive and predictive analytics models
Work with data engineers to architect and develop operational models that run at scale
Partner with teams to identify and explore opportunities for the application of machine learning and predictive analysis
Communicates well with technical and non-technical audiences, and contributing modeling expertise as a team player
Qualifications
Master’s degree or higher in Statistics/Math/Computer Science or related field
5+ years of industry work experience in SQL, R, Python to implement statistical models, machine learning, and analysis (Recommenders, Prediction, Classification, Clustering, etc.) in big data environment
Experience on large scale computing systems like COSMOS, Hadoop, MapReduce and/or similar systems preferred
Experience with programming skills, e.g. Java, C# is a plus
Familiarity with deep learning toolkits, e.g. CNTK, TensorFlow, etc. is a plus
Exceptional written and verbal communication to educate and work with cross functional teams
Be self-driven, and show ability to deliver on ambiguous projects with incomplete or dirty data
Microsoft is an equal opportunity employer. All qualified applicants will receive consideration for employment without regard to age, ancestry, color, family or medical care leave, gender identity or expression, genetic information, marital status, medical condition, national origin, physical or mental disability, political affiliation, protected veteran status, race, religion, sex (including pregnancy), sexual orientation, or any other characteristic protected by applicable laws, regulations and ordinances. We also consider qualified applicants regardless of criminal histories, consistent with legal requirements. If you need assistance and/or a reasonable accommodation due to a disability during the application or the recruiting process, please send a request via the Accommodation request form.
Benefits/perks listed below may vary depending on the nature of your employment with Microsoft and the country where you work."	"3 days ago"	"character(0)"	2018-10-15	"Seattle%2C+WA"	90
"https://www.indeed.com/viewjob?jk=1fac0691d423749c"	"Data Scientist"	"Harman International"	"469 reviews"	"TECHNICAL SKILLS
Overall 08– 10 years of professional experience;
Able to create / develop a compelling story to answer business questions using analytics outcomes;
Hands on programming experience in R (Mandatory); Python and PySpark (Desirable);
Should have worked on data heavy projects on Natural Language Processing(NLP), risk scoring, Propensity / Classification Modeling, Segmentation, Promotion Analytics, Campaign Optimization, recommender engines, fraud analytics, etc.
Great analytical skills, with expertise in Deep Learning, Machine Learning methods such as CNN, RNN, Autoencoder, SVM, Naïve Bayes Classifier, Decision Trees, Random Forest, PCA etc. is MUST;
Experience in Artificial Intelligence / Cognitive Computing / OpenCV highly desirable.CLIENT MANAGEMENT SKILLS
Must possess good client facing experience with the ability to facilitate requirements sessions and lead teams and present analysis in business terms;
Must have led / managed / executed Machine Learning driven project through the complete life-cycle of the project;
Any demonstrable experience in cross-selling / up-selling / farming existing clients will be a big plus;DESIRED EDUCATIONAL BACKGROUND
Masters or Ph.D. in Statistics / Econometrics / Operations Research / Artificial Intelligence;OTHER DESIRED ATTRIBUTES
Confident and self-starter;
Must possess a detail-oriented approach;
Ability to adapt and thrive in the fast-paced environment;
Good written and oral/ presentation skills;
Willing to travel and adapt to different client environment"	"27 days ago"	"character(0)"	2018-10-15	"Seattle%2C+WA"	90
"https://www.indeed.com/viewjob?jk=d345d7352f88e2d3"	"Event and Logistics Specialist, Customer Relations"	"BOEING"	"5,793 reviews"	"Seattle,Washington,United States KADSN2
The Boeing Company is looking for an Event and Logistics Customer Relations Specialist to join our team. We have two positions available, one based in Renton (Longacres) and the other out of the Seattle Delivery Center.
With guidance this position is responsible for integrating and fulfilling all logistical requirements on behalf of customers moving through the airplane delivery process. You may also create the Boeing Commercial Airplanes (BCA) Sales customer visit agendas in coordination with a senior Customer Relations Specialist and Sales hosts.
In addition, this role will perform (but not be limited to) the following duties:Makes recommendations and revisions during agenda preparation and maintenance process (i.e., venues and timing), in order to suit the guest and event requirements.Prepares the agenda drafts and final versions.Executes agenda logistics including guest badging, transportation arrangements, catering, restaurant, car rental, hotel reservations, and tours.Ensures that the administrative tasks associated with coordinating these visits, including posting all the invoice-related information is completed.Assisting with logistics for off-site and on-site business meetings and customer events.May be requested to track reservation data for these activities and provide status reports.Partners with BCA Customer Relations team members at the Everett, Seattle and Charleston delivery centers to fulfill customer-associated logistics.Provides account coverage for peers who are out of the office for various lengths of time.Monitors accounts when a senior Customer Relations Specialist requests assistance, either for the remainder of the day or per the manager's discretion.Implement logistics in accordance with company policies and procedures, and business courtesies, protocol and U.S. and foreign government guidelines.Develops plans with appropriate supervision (e.g., site inspections, planning meetings and solicits information on venues).Establishes and maintains relationships with internal and external customers/suppliers.Uses knowledge of company resources and vendor services to execute plans.Document and share results and suggested improvements to enhance quality of ongoing customer support and consistent services.Limited domestic and international travel, and overtime to be expected on some weekends, holidays, and evenings
These positions will sit in Seattle and/or Renton and do not offer relocation benefits. Applicants must live in the immediate area or be willing to relocate at their own expense.
Boeing is the world's largest aerospace company and leading manufacturer of commercial airplanes and defense, space and security systems. We are engineers and technicians. Skilled scientists and thinkers. Bold innovators and dreamers. Join us, and you can build something better for yourself, for our customers and for the world.Employer will not sponsor applicants for employment visa status.
Required Qualifications:Experience utilizing Microsoft Word, Excel and Outlook
Ability to travel domestically as well as internationally
Flexibility to work outside of standard business hours (evenings, weekends, and holidays)
Experience in a customer facing role engaging with internal and external customers
Preferred Qualifications:
Bachelor’s degree
Experience in organizing, planning and facilitating large scale events
Typical Education / Experience:
Bachelor's degree and typically 3 or more years' related work experience, a Master's degree and typically 1 or more years' related work experience or an equivalent combination of education and experience. Yes, 10 % of the Time BCA Sales & Customer Support Individual Contributor No No Standard United States; The Boeing Company Renton;Washington;United States~"	"3 days ago"	"character(0)"	2018-10-15	"Seattle%2C+WA"	90
"https://www.indeed.com/viewjob?jk=96e9a821b412fc8d"	"Data Scientist (Commercial Analytics)"	"Terex Corporation"	"469 reviews"	"Responsibilities and Scope:
The data scientist- Commercial Analytics will support our commercial team with insights gained from internal and external data sources. The data scientist – commercial analytics will develop methods to analyze & optimize the current commercial and operational constraints to meet annual financial goals. The ideal candidate will be intricately involved in running analytical experiments in a methodical manner, and will regularly evaluate alternate models via theoretical approaches. The ideal candidate must have strong experience using a variety of data mining/data analysis methods, using a variety of data tools, building and implementing models, creating algorithms and running simulations. Must have a proven ability to drive business results with their analytical insights. The position would require working closely with cross-functional teams and senior leadership.
Essential Duties and Responsibilities
Work with key stakeholders throughout the commercial organization to identify opportunities for leveraging company data to drive business solution and support operational and strategic decision-making.
Mine and analyze data from company databases and third party sources to develop market intelligence framework for organization.
Assess the effectiveness and accuracy of new data sources and data gathering techniques.
Develop custom data models and algorithms to apply to internal and external data sources.
Provide expertise in predictive modeling to develop and make strategic business decision recommendations focused on but not limited to short term and long term demand forecasting.
Develop processes and tools to monitor and analyze model performance and data accuracy.
Basic Qualification:
Minimum 4 years of data scientist or related experience
Bachelor's Degree in Computer Science, Math, Engineering, Statistics or other technical fields.
Preferred Qualifications:
Experience querying databases and using statistical computer languages: R, Python, SQL, etc. to manipulate data and draw insights from large data sets.
Experience with data visualization tools such as Tableau, Qlik, Shiny, etc.
Self-starter with strong analytical, critical thinking and problem solving skills; able to work independently as well as in fast-paced, cross-functional teams. Must have good time and project management skills and attention to detail.
Independent learner with a strong interest in broadening the competencies of the organization as well as extending his/her business acumen with drive to learn and master new technologies and techniques.
Proven ability to handle multiple priorities in a continuously changing environment.
Strong written and verbal communication skills for presenting complex concepts to senior managers.
Experience in working with multiple ERP systems, in particular Oracle.
Proficient with variety of machine learning techniques and their real-world advantages and drawbacks.
Experience creating and using advanced machine learning algorithms and statistics: Linear regression, simulation, scenario analysis, modeling, clustering, decision trees, neural networks, etc.
Demonstrated high respect for people as individuals and as members of the company team.
Master’s or PhD Degree in Computer Science, Math, Engineering, Statistics or other technical fields.
TRSR1234
Location: US-WA Redmond-B33 (HUB) HR
Department: Administration
Job ID: 329
Terex Overview:
Terex Corporation is a $4.5 billion, publicly traded global manufacturer of lifting and material processing products and services. The company is passionate about producing equipment that improves the lives of people around the world. Terex operations are global, yet each office or factory is a close-knit community. Terex provides team members with a rewarding career and the opportunity to make an impact. The company values diversity and inclusion, safety, integrity, respect, servant leadership, courage and citizenship. It encourages continuous improvement and offers free courses available through Terex University. Women@Terex provides a supportive network for Terex women in their jobs and careers. It’s an exciting time to be part of the expanding manufacturing sector. Terex is a place where you can work and grow. Come talk to us!
Additional Information:
It is the policy of the company to attract and retain the best qualified employees. We are committed to providing employment opportunities to the most qualified internal or external candidate based on work-related factors and without regard to non work-related factors including race, color, religion, national origin, gender, sexual orientation, gender identity, age, disability, or veteran status as a special disabled veteran, Vietnam Era Veteran, or other qualifying veteran.
The Company offers competitive salaries, advancement opportunities, and a full range of benefits, including paid vacation, 401(k), medical, dental, and vision.
Terex Corporation is an Equal Opportunity Employer and Affirmative Action Employer M/F/D/V."	"10 days ago"	"character(0)"	2018-10-15	"Seattle%2C+WA"	90
