"url"	"title"	"company_name"	"company_score"	"description"	"time_posted"	"metadata"	"date_scraped"	"city"	"page"
"https://www.indeed.com/viewjob?jk=8813a4390e8467d8"	"Data Scientist - Human Capital Analytics"	"Leidos"	"584 reviews"	"Job Description: Job Summary: Provide human capital data analytics support to the CHCO contract. Primary Responsibilities: Provide expert and professional data scientists to implement effective and innovative solutions meshing disparate data types to discover insights and trends in human capital information. Perform work on a data science team to advance HCA across the IC. Centralize IC CHCO data collection and synthesis, including survey data, enabling strategic and predictive analytics to guide business decisions. Develop or utilize complex programmatic and quantitative methods to find patterns and relationships in data sets; lead statistical modeling, or other data-driven problem-solving analysis to address novel or abstract business operation questions; and incorporate insights and findings into a range of products. Create detailed write-ups of processes used, logic applied, and methodologies used for creation, validation, analysis, and visualizations. Write ups shall occur initially, within a week of when process is created, and updated in writing when changes occur. Adapt freeware solutions such as R, and modular solutions for maximum flexibility. Provide an advanced capability for data analysis of human capital information from disparate data types, promoting visualization and storytelling to discover insights that help guide business decisions. Be forward leaning, exploring HCA solutions that benefit IC elements individually and collectively. Let the data tell the story including what is inconsistent or contradictory, and automate data cleansing as much as possible. Integrate data solutions and collection with IC Information Technology Enterprise to enhance connectivity with IC Elements. Identify and customize, if necessary, Commercial Off The Shelf (COTS) Information Technology (IT) tools for administration and data collection, or to leverage, support, and integrate the process with tools built for the IC and/or its component elements. Any tools developed shall be web-based and web-enabled, designed to maximize feedback effectiveness while protecting employee assessment information, and include both structured interview and web-based tools for gathering feedback. Assist in the development and maintenance of financial procedural guidance, templates and data formats, for identifying IC-wide workforce numbers, to include government, military, and contractor support. Review, assess data, identify data deficiencies and recommend solutions for remediation. Support quantitative and analytic efforts for workforce planning, development of financial procedural guidance data formats related to the Congressional Budget Justification Book (CBJB) planning displays, and analytic support for budget management and planning. Assist with ad hoc data requests from Congress, IC elements or as required by IC CHCO. Coordinate and facilitate community of practice and working group meetings, to include meeting logistics, agenda development and presenter coordination, day-of execution and facilitation, documentation and distribution of meeting minutes and presentations. Present or coordinate presentations on relevant topics as directed by IC CHCO. EDUCATION & EXPERIENCE: Typically requires BS and 4 - 8 years of prior relevant experience or Masters with 2 - 6 years of prior relevant experience. Basic Qualifications 5+ years relevant IC experience. Demonstrated knowledge of the Intelligence Community mission and understanding of the human capital life cycle activities and relationships. Demonstrated experience performing data analysis and modeling on an independent (i.e., without significant guidance or direction) basis. Demonstrated experience in developing and applying quantitative methods to find patterns and relationships in large human capital data sets (such as the Human Capital Data Call, Foreign Language Data Call, FAIR act data, etc.) using statistical and graphical packages. Applied knowledge in the mathematical sciences such as probability, statistics, predictive modeling, computational social sciences; computer programming such as but not limited to Python, R, SAS, SPSS; and COTS data visualization packages such as but not limited to Tableau. Experience with Oracle Database and Procedural language/Structured Query Language (PUSQL). Preferred experiences include but not limited to C#.NET, ASP.NET Model View Controller (MVC), jQuery, and Cascading Style Sheets (CSS), etc. Demonstrated experience with structuring data, natural language processing, database technologies, and machine learning algorithms. Ability to translate complex, technical, or analytic findings into an easily understood narrative - tell a story with the data in graphical, verbal, or written form. Expertise in supporting quantitative and analytic efforts and knowledge of workforce planning. Experience should include engagement with the Intelligence Community and expertise with using analytical software. Demonstrated professional experience in developing quantitative financial analysis related to budget formulation and execution. Experience in development of financial procedural guidance data formats related to CBJB workforce displays and analytic support, resource management and planning. Demonstrated experience in human resource management supporting the federal government. Demonstrated experience in the use of programming, design, development, and implementation of online and automated survey instruments. Bachelor's or advanced degree in social sciences or related fields and requisite experience. Related fields may include statistics, mathematics, computer science, physical science, economics, or engineering."	NA	"character(0)"	2018-10-15	"Washington%2C+DC"	50
"https://www.indeed.com/viewjob?jk=ef0e99db8eb52506"	"Data Scientist"	"CORMAC Corporation"	"4 reviews"	"Title: Data Scientist Job Location : Columbia MD [SF1] FLSA Status: Exempt Date: October 2018 POSITION PURPOSE: The right candidate will have a chance to help us define world-class data architecture, with open source software, and bleeding-edge data trends and technologies. Apply technical and advanced analytical expertise to explore and examine data from multiple disparate sources with the goal of discovering patterns and previously hidden insights, which in turn can provide a competitive advantage or address a pressing business problem. Leverage expertise in machine learning, data mining, statistical, and graph based algorithms in data analysis, solution development, analytic workflow processes, and complex data visualizations. Provide support at all levels of the organization to develop deliverables and implement change initiatives. Help senior-level decision makers to build their agenda, develop effective implementation strategies, and implement them to achieve sustainable results. REPORTING RELATIONSHIPS: Reports To: Project Manager Primary Working Relationships: Internal and External Customers RESPONSIBILITIES: On any given day in the Lab you’ll be:Using Hadoop and/or SAS and related tools to manage the analysis of billions of data records.Writing software to clean and investigate large amounts of numerical and textual data sets.Designing rich data visualizations to communicate complex ideas to customers or company leadersInvestigating the impact of new technologies on the future of health informatics of tomorrow The Ideal Candidate will be…Curious. You ask why, you exploreWrangler. You know how to move data around, from a database or an API, through a transformation or two, a model and into human-readable form (ROC curve, Excel chart, map, d3 visualization, Tableau, etc.).Do-er. You have a bias toward action, you are willing to try things, and you share both your successes and failures openlyFearless. Big, undefined problems and petabytes don't frighten you. You can work at a tiny crack until you've broken open the whole nut. POSITION QUALIFICATIONS: Bachelor’s or Master's Degree in Statistics or Computer Science. 3-5 years experience in the statistical tools and actuarial analysis. Experience with relational databases, SQL and distributed systems such as Hadoop Experience in applied statistics and exploratory analysis of large-scale datasets Experience in one or more of the following tools and languages is a plus. R, Java, C++, Python, SAS or other statistical tools. Exposure to Health care systems is a plus Ability to communicate effectively both orally and written"	"11 days ago"	"character(0)"	2018-10-15	"Washington%2C+DC"	50
"https://www.indeed.com/viewjob?jk=da33c4d8c6b57030"	"Data Analyst/Data Scientist"	"Booz Allen Hamilton"	"1,717 reviews"	"Key Role:A Day in the Life of a Data Analyst Consultant at Booz Allen: Data is a gold mine if you know how to read it. Do you? Leverage knowledge of Cloud computing technologies as part of the data science team. Work in conjunction with industry-leading Cloud computing technologists and develop machine learning, data mining, and statistical and graph-based algorithms designed to analyze massive datasets. Apply knowledge of and experience with Cloud technologies, partner with Cloud technologists, and ensure proper implementation and usage of algorithms. Work with a large financial government agency to save billions in tax fraud. Help a domestic intelligence agency reduce auto theft. Adapt mathematical and predictive models to deliver healthcare insights. These positions may be located in VA, DC, or MD. About Booz Allen: At Booz Allen, we’re empowering people to change the world—starting with you. On our team, you’ll enhance the security, economic well-being, health, and safety of people at home and around the globe. We’re setting and raising the bar in analytics, consulting, cyber, digital solutions, and engineering & science. We do it by finding the brightest minds and giving them a place to collaborate, take risks, and get even brighter. Our focus on people isn’t corporate jargon: it’s essential to our success. It’s the reason Fortune, Forbes, Corporate Equality Index, and other organizations have consistently rated us a best place to work. And it’s how we’re going to leave the world better than we found it. Because products alone can’t create progress—but people can. And our people do. Basic Qualifications:Experience with machine learning, data mining, statistics, or graph algorithms in academic or internship environments Experience with using R, Perl, Python, SAS, or SPSS for the analysis of data Knowledge of an object-oriented language, including Java, C++, C#, or Python Knowledge of Hadoop, MapReduce, or HDFS Ability to show excellent data gathering, analytical, and problem-solving expertise Ability to obtain a security clearance Scheduled to obtain a BA or BS degree in Winter 2018 or Spring 2019 Additional Qualifications:Pursuing a BS degree in CS, Computer Engineering, Systems Engineering, or a related field preferred; pursuing an MS degree in CS, Computer Engineering, Systems Engineering, or a related field a plus Clearance: Applicants selected will be subject to a security investigation and may need to meet eligibility requirements for access to classified information. We’re an EOE that empowers our people—no matter their race, color, religion, sex, gender identity, sexual orientation, national origin, disability, or veteran status—to fearlessly drive change."	"28 days ago"	"character(0)"	2018-10-15	"Washington%2C+DC"	50
"https://www.indeed.com/viewjob?jk=e2122550ce0d1081"	"Junior Data Scientist"	"Logistics Management Institute"	"44 reviews"	"Position is on the staff of a not-for-profit government consulting firm located in Tysons, VA. The Junior Data Scientist position will be embedded within our LMI Data Analytics Practice and leverage your curiosity and problem solving skills to explore, discover, and predict patterns contained within data sets for a wide range of government clients. This includes the derivation of clear narratives that help our clients understand their data and how those insights address their specific research questions. Responsibilities Demonstrate the ability to frame and scale data problems to effectively analyze, visualize and find data solutions. Possess the ability to work with and manipulate common data formats, including comma-delimited, text files, and JSON. Analyst must be able to transform data and analysis into informative data visualizations and/or interactive dashboards using open source and commercially available visualization and dashboard tools. Demonstrate the ability to derive insights and analytic narratives from data and visualizations for effective storytelling and clear communication in response to specific research questions. Ability to work in a fast-paced, solutions oriented environment focused on client deliverables, analysis and reporting. Possess the ability to work in teams and independently.Qualifications Bachelor’s degree in data science, mathematics, statistics, economics, computer science, engineering, or other related business or quantitative discipline is required. Experience working with tools including object-oriented programming (Python, Java), computational analysis tools (R, MATLAB), and associated data science libraries (scikit-learn). Experience creating meaningful data visualizations and/or interactive dashboards that communicate your findings and relate them back to how your insights create business impact using platforms such as Tableau, Qlik, Power BI, RShiny, plotly, and d3.js. Working knowledge of databases and SQL is desired. Preferred qualifications include linking analytic and data visualization products to database connections. Preferred experience with data science methods related to data architecture, data munging, data and feature engineering, and predictive analytics. Additional preferred qualifications include working with unstructured text and natural language processing. Superior communication skills, both oral and written. Applicants for this position may be subjected to a government security investigation and must meet eligibility requirements for access to classified information. Please note that only US Citizens are eligible to obtain security clearances."	NA	"character(0)"	2018-10-15	"Washington%2C+DC"	50
"https://www.indeed.com/viewjob?jk=5901fbd81e3119f4"	"Senior Data Scientist"	"American Nurses Association, Inc"	"45 reviews"	"Business Unit: American Nurses Credentialing Center Department: Measurement Services Salary Grade: 14 Employee Referral Bonus Amount: $500.00 TO APPLY: Apply online or email resume to chet.reisler@ana.orgKey technical expert, accountable for exam performance and psychometrics, resolution of data issues, and research addressing ANCC strategic goals. Leads efforts and provides consultation for MS staff to resolve data problems and establish data quality standards; develops presentations and publications for departments, Board of Directors, Commission on Certification, and other stakeholders; and proposes resources to support MS research activity. Serves as an expert in test development, scoring, research, and quantitative analyses. Develops software applications, programming, and syntax for report generation, statistical analyses, and graphic representations. Conducts quality assurance on scores, item functioning, and psychometric properties of exams. Drafts research reports. Ensures validity, reliability, and psychometric soundness of certification exams, using established industry and best practices.DUTIES:Conduct ongoing analysis of data systems. Review data management plans, revisions, and specifications and provide feedback. Plan and lead research (e.g., job analysis, validation, survey sampling, speededness and readability, test security, calibration, equating) to enhance exam performance, customer services, and product line as well as inform strategic planning. Monitor and evaluate item performance, differential item functioning, item drift, and exam psychometrics. Program for advanced statistical analyses using software programs (e.g., SAS, SPSS, Winsteps, R, SQL). Create and implement report generation, data collection, and sampling plans; develop conceptual frameworks for research and analyses; and recommend and adapt analytical and statistical methods. Identify strategies to generate useful feedback for examinees. Draw conclusions from research and make recommendations. Provide results, conclusions, and visuals and present to internal and external stakeholders (e.g., Executive Leadership, Boards of Directors, Commissions/Councils, program staff, governmental agencies, members of credentialed organizations). Travel as needed to deliver presentations at various venues or to meet with potential or current stakeholders. Plan and lead test development activities (e.g., standard setting, item and exam performance, exam field testing, form building). Facilitate focus groups, prepare meeting materials, review materials created by colleagues, analyze data, and write technical research reports and summaries. Coordinate with colleagues, subject matter experts, and vendors. Ensure compliance with industry best practice and accreditation requirements of ANCC certification programs. Maintain all necessary documentation in support of accreditation requirements. Establish data quality standards in collaboration with program staff. Troubleshoot issues and data errors. Consult with program staff on data preparation and data coding problems and assist in developing means for correcting the problems. Propose tools and resources to support research activity and enhance data system operations. Collaborate with ANA IT staff to evaluate and implement potential enhancements, to resolve quality assurance issues, and to ensure data systems are operational. Perform functional, cost-benefit, and risk analysis to support design changes. Assess risks and recommend mitigation strategies. Perform other duties as assigned to support the department’s objectives and strategic goals.QUALIFICATIONS REQUIREDEducationMaster’s degree (Ph.D. preferred) in industrial-organizational (I/O) psychology, testing and measurement, psychometrics, mathematics, research and statistics, or related field, with emphasis on quantitative analyses.Related Work ExperienceFive years of professional experience. Two years of assessment development, psychometrics, data management and analyses, and technical report writing.SkillsResearch design and completion Data collection, utilization, validation, security Data management and visualization Advanced data analysis (e.g., scaling and equating [CTT or IRT], simulation, sampling) Choosing and applying appropriate analysis techniques Test construction, development of alternative items, and test validation Meeting facilitation Oral and written communication Advanced use of office computer software (e.g., Microsoft Word, Excel, PowerPoint) and database and statistical software (e.g., SAS, SPSS, R, SQL) Analytical thinking Technical documentation and report writing Producing concise, high-level summaries and briefings to non-technical audiences Identifying and using emerging technologies"	NA	"character(0)"	2018-10-15	"Washington%2C+DC"	50
"https://www.indeed.com/viewjob?jk=5b153217147485d2"	"HP032 Data Technician"	"ADNET Systems, Inc."	"9 reviews"	"Part-timeHP032 Junior Data Technician, Part Time College student seeking part time position? I've got just the job for you at NASA. Our team environment encourages and empowers you to do your best work. Come share your knowledge with the world. Work side by side with top scientists. NASA has been voted top 50 Places in United States to work since 2010. NASA's Goddard Space Flight Center nestled in the Maryland suburbs of Greenbelt is just 30 minutes from the heartbeat of America - Washington, D.C. Now you can have it all, the nightlife, museums, great food and theatre. Work in a place that pushes the envelope of science every day, yet spy a deer or a Canadian goose as you stroll the grounds of Goddard during lunch. We are seeking a Junior Data Technician to support the Solar Data Analysis Center (SDAC) at NASA's Goddard Space Flight Center in Greenbelt, MD. The position is part-time at 8 hours per week and entails providing onsite back-up support to a lead Systems Administrator. Accordingly, it is an excellent opportunity for a college student who is currently studying for a career in computer systems administration and is interested in gaining professional IT experience working at an operating Data Center. The position requires a candidate who is a problem-solver, is a fast learner, and can work both independently and as part of a team. Previous experience working in a computer-related environment that involved diagnosing and repairing hardware and software issues is a strong plus. Additional on the job training will be provided. Duties include: Support the lead systems administrator with installing new and decommissioning old server hardware. Assist with performing operating system and software upgrades on Linux and Mac OS servers and desktop computers. Patch, upgrade, and configure software and operating systems to comply with GSFC IT security policies. Install application software. Diagnose and resolve computer and networking issues for local and remote users. Perform and manage system backups. Requirements: Minimum 1-year experience using Mac OS and/or Linux computer systems. Preferably working on a Bachelors (or equivalent) degree in Science, Computing or Engineering. US Citizenship."	"10 days ago"	"Part-time"	2018-10-15	"Washington%2C+DC"	50
"https://www.indeed.com/viewjob?jk=9eb2e0c9e796db94"	"Analytic Consultant (Multiple Positions and Multiple Levels)"	"ASR Analytics, LLC"	"-"	"Analytic Consultant (Multiple Positions and Multiple Levels from 0-5 Years of Experience)ASR Analytics, LLC (ASR) is a small, dynamic consulting firm with expertise in Data Science, Predictive Analytics, and Business Intelligence. Headquartered in the Washington, DC metro area, ASR delivers actionable insight to our public and private sector customers by unlocking value from their data.ASR has an immediate need for Analytic Consultants and Data Scientists in the Washington, DC area. The ideal candidate will be a self-starter with superior communication skills (verbal and written). An understanding of data science and analytics is valuable, and the desire and ability to learn quickly is vital. In addition, successful candidates will possess the following qualifications:Junior Consultants (0-2 Years of Experience)Degree in Economics, Statistics, Mathematics, Computer Science or a similar quantitative fieldExceptional verbal and written communication skillsExperience with at least one statistical programming packages – SQL, SAS, R, PythonAbility to clear a federal minimum background investigation (must be a U.S. citizen or permanent resident)Ability/Willingness to travel up to 25% Senior Consultants (2-5 Years of Experience)Degree in Economics, Statistics, Mathematics, Computer Science or a similar quantitative fieldExceptional verbal and written communication skillsExperience with one or more programming packages – SQL, SAS, R, Python, Neo4j, Spark/Scala, etc.Experience working with a variety of data types (e.g., structured, unstructured, graph)Experience with Agile development processes – SCRUM, Extreme Programming (XP), Kanban, etc.Ability to clear a federal minimum background investigation (must be a U.S. citizen or permanent resident)Ability/Willingness to travel up to 25% These positions offer highly competitive compensation (commensurate with experience), and a comprehensive benefits package (including medical benefits, 401k, profit sharing, and the opportunity for performance bonuses).Job Type: Full-timeExperience:Statistical Software such as SQL, R, SAS, Python, Neo4j: 1 year (Preferred)Data Science and Analytics: 1 year (Preferred)Education:Bachelor's (Required)Location:Washington, DC (Required)Work authorization:United States (Required)"	NA	"character(0)"	2018-10-15	"Washington%2C+DC"	50
