"url"	"title"	"company_name"	"company_score"	"description"	"time_posted"	"metadata"	"date_scraped"	"city"	"page"
"https://www.indeed.com/viewjob?jk=dd06d5583ad3256f"	"Entry Level Calibration Specialist"	"BOEING"	"5,793 reviews"	"Seattle,Washington,United States 6L9CN1 Plan, check, set up, and operate, Electronic Measurement and Test Equipment (M&TE) and/or process equipment. Use calibration standards to calibrate, adjust, certify, maintain, and repair M&TE/process equipment using approved calibration procedures, process specifications, equipment drawings, and M&TE /process equipment manufacturer's performance specifications. Conduct routine tests, analyze data and document results. Troubleshoot and recommend resolution of basic laboratory and test-related problems. Associated Duties and Responsibilities: Update equipment status using established systems and complete associated paperwork. Ensure equipment is ready for calibration per metrology processes. Prioritize and perform work according to automated daily report list, hot list, or as assigned by lead technician. Perform visual check of M&TE/process equipment for discrepancies and wear. Identify, document, and route non-conforming items in accordance with metrology lab processes. Provide information and clarification to customers on metrology processes. Work with other employees engaged in the calibration and certification of M&TE, and assist in the development of new calibration processes and procedures. Perform computations necessary to analyze measurement test results. DEFINITION OF TERMS *Basic Electronic M&TE and process equipment e.g. Digital meters, probes, scopes, generators, analyzers, resistance, capacitance, power supplies, etc. Boeing is the world's largest aerospace company and leading manufacturer of commercial airplanes and defense, space and security systems. We are engineers and technicians. Skilled scientists and thinkers. Bold innovators and dreamers. Join us, and you can build something better for yourself, for our customers and for the world. Typical Education/Experience: AA degree in related discipline Basic Qualifications (Required): This position must meet Export Control compliance requirements, therefore a “US Person” as defined by 22 C.F.R. § 120.15 is required. “US Person” includes US Citizen, lawful permanent resident, refugee, or asylee. Desired Qualifications (Preferred): AA degree or related military training in electronics and/or Metrology 3 to 5 years of calibration lab experience preferred No Engineering Test and Tech Individual Contributor Yes No Standard United States; The Boeing Company"	"3 days ago"	"character(0)"	2018-10-15	"Seattle%2C+WA"	100
"https://www.indeed.com/viewjob?jk=e6e9f02e2d012bf0"	"Data Scientist Technical Lead, Google Maps"	"Google"	"2,617 reviews"	"$107,000 - $136,000 a year (Indeed Est.) Note: By applying to this position your application is automatically submitted to the following locations: New York, NY, USA; Mountain View, CA, USA; Seattle, WA, USA The Geo team builds the most accurate, comprehensive, and useful maps for our users. More than a billion people rely on Google Maps services to explore the world and navigate their daily lives. That includes sailing down the Amazon river, choosing where to get a bite of pizza, flying over a 3D version of New York City and saving time commuting. Geo helps merchants get their businesses on Google, and more than a million developers use the power of Google Maps to enhance their apps and websites. They are solving complex computer science problems, designing beautiful and intuitive product experiences and improving the accuracy of our geo data, all in order to plot a course for the future of mapping. Responsibilities Work with large, complex Geo datasets and solve difficult, non-routine analysis problems, applying advanced analytical methods as needed. Conduct end-to-end analysis that includes data gathering and requirements specification, processing, analysis, ongoing deliverables, and presentations. Build and prototype analysis pipelines iteratively to provide insights at scale. Develop comprehensive understanding of Google data structures and metrics, advocating for changes where needed for both products development and sales activity. Make business recommendations (e.g., cost-benefit, forecasting, experiment analysis) with effective presentations of findings at multiple levels of stakeholders through visual displays of quantitative information. Research and develop analysis, forecasting and optimization methods to improve the quality of Google's user facing products; example application areas include ads quality, search quality, end-user behavioral modeling, and live experiments. Manage a data science team. Interact cross-functionally with a wide variety of leaders and teams, and work closely with Engineers and Product Managers to identify opportunities for design and to assess improvements for Google products. Qualifications Minimum qualifications:Master's degree in a quantitative discipline (e.g., Statistics, Operations Research, Bioinformatics, Economics, Computational Biology, Computer Science, Mathematics, Physics, Electrical Engineering, Industrial Engineering) or equivalent practical experience. 10 years of relevant experience in data analysis or related field as a Statistician, Data Scientist, Computational Biologist, or Bioinformatician. 5 years of experience in people management or leadership. Experience with statistical software (e.g., R, Python, MATLAB, pandas) and database languages (e.g., SQL). Preferred qualifications:Doctorate's degree in a quantitative discipline (e.g., Statistics, Operations Research, Bioinformatics, Economics, Computational Biology, Computer Science, Mathematics, Physics, Electrical Engineering, Industrial Engineering). 12 years of directly relevant, tech industry work experience (e.g., as a statistician, bioinformatician, or data scientist), with deep expertise in statistical data analysis, such as linear models, multivariate analysis, stochastic models, and sampling methods. 8 years of demonstrated leadership and self-direction including people management. Applied experience with machine learning on large datasets. Experience articulating business questions and using mathematical techniques to arrive at an answer using available data. Demonstrated skills in selecting the right statistical tools given a data analysis problem. At Google, we don’t just accept difference - we celebrate it, we support it, and we thrive on it for the benefit of our employees, our products and our community. Google is proud to be an equal opportunity workplace and is an affirmative action employer. We are committed to equal employment opportunity regardless of race, color, ancestry, religion, sex, national origin, sexual orientation, age, citizenship, marital status, disability, gender identity or Veteran status. We also consider qualified applicants regardless of criminal histories, consistent with legal requirements. If you have a disability or special need that requires accommodation, please let us know. To all recruitment agencies: Google does not accept agency resumes. Please do not forward resumes to our jobs alias, Google employees or any other company location. Google is not responsible for any fees related to unsolicited resumes."	NA	"$107,000 - $136,000 a year (Indeed Est.) "	2018-10-15	"Seattle%2C+WA"	100
"https://www.indeed.com/viewjob?jk=0e5d07db8de2d313"	"Lead Data Scientist"	"ServiceNow"	"97 reviews"	"$100,000 - $147,000 a year (Indeed Est.) Job Title: Senior Data Scientist - Automation CoreLocation: Kirkland, WA ServiceNow is changing the way people work. With a service-orientation toward the activities, tasks and processes that make up day-to-day work life, we help the modern enterprise operate faster and be more scalable than ever before. We’re disruptive. We work hard but try not to take ourselves too seriously. We are highly adaptable and constantly evolving. We are passionate about our product, and we live for our customers. We have high expectations and a career at ServiceNow means challenging yourself to always be better.What you get to do in this role: Apply machine learning and mathematical approaches to solving IT operations management Develop or enhance prototypes and acceptance tests for solutions to IT analytics problems like: Alert correlation Complex event processing Anomaly detection NLP on IT incidents Causal analysis and prediction Automation of IT remediations and processes Work with product managers and engineers to develop solutions to customer problems. Design and perform experiments to analyze/validate solutions to analytics problems In order to be successful, we need someone who has: Solution oriented attitude (you see yourself as a problem solver) Real passion for data Resourceful and creative approach to problems Flexibility and ability to live with imperfect data, problem definitions, and solutions Team oriented attitude (no stars please) Tenacity and patience solving problems Scientific attitude Required Skills & Experience Advanced degree in scientific or engineering discipline 3+ years experience in a commercial setting Strong background in statistics, probability, and machine learning Experience with Python scientific stack or R Experience working with machine learning tools like Scikit-Learn, Orange, RapidMiner, Weka, etc. Solid software development skills and understanding of computer science fundamentals Working knowledge of SQL We provide competitive compensation, generous benefits and a professional atmosphere. This is a very collaborative and inclusive work environment where individuals strong on aptitude and attitude will have an opportunity to grow their professional careers through working with some of the most advanced technology and talented developers in the business."	"10 days ago"	"$100,000 - $147,000 a year (Indeed Est.) "	2018-10-15	"Seattle%2C+WA"	100
"https://www.indeed.com/viewjob?jk=62e3e34bec528f0b"	"Statistician/Research Data Analyst"	"VA Puget Sound Research"	"-"	"$66,300 - $94,600 a yearAs a Statistician/Research Analyst in our multidisciplinary research team, you will work with research team to address issues related to Veterans’ healthcare delivery and policy-planning using large and complex healthcare databases. This position is based within the Health Services R&D program at VA Puget Sound in Seattle, WA. Responsibilities include providing advanced data management support as well as developing and estimating quantitative models for multiple health services research projects of varying scope and complexity under the supervision of Principal Investigators.Key Duties: Create analytic data files from multiple sources, including relational datasets from operational and clinical health services research databases, survey data, and clinical trial data.Perform advanced statistical analyses drawing on methods across fields including econometrics, biostatistics, and data science.Present statistical models and empirical results to the investigative teams in a clear mannerPrepare statistical and scientific reports and works with the investigative teams to publish the findings in peer-reviewed journals; potential to be first author on manuscripts, though not required.Collaborate with investigative teams and other scientific staff.Qualifications: Candidates must have a masters-level, PhD, or equivalent degree in health services, biostatistics, statistics, economics, psychology, applied mathematics or a closely related field. The applicant must be proficient in SQL and standard statistical software packages, such as Stata, R or SAS. Excellent written and spoken communication skills are necessary, as is the ability to work effectively in a team setting. The ideal candidate is excited about using diverse sources of data to answer high impact research questions facing health systems, has strong problem-solving skills and experience working in multidisciplinary teams with varying backgrounds.Candidates must be US citizens. Target salary will depend on the candidate’s experience.Please send a cover letter and resume using the subject line “HSR&D Statistician Application”.Job Type: Full-timeSalary: $66,300.00 to $94,600.00 /yearExperience:specialized: 2 years (Required)Education:Master's (Required)"	NA	"$66,300 - $94,600 a year"	2018-10-15	"Seattle%2C+WA"	100
"https://www.indeed.com/viewjob?jk=ec93065dfa5d8aff"	"Principal Data Scientist"	"Big Fish Games"	"16 reviews"	"COME PLAY! Since its founding in 2002, Big Fish has been the world’s largest producer and distributor of casual games. Our titles continuously land us at the top of app store charts. We’re bounding into the mid-core space, exploring new and exciting forms of gameplay, and producing more fun than ever! Big Fish is home to six individual studios, each with its unique style of gameplay. We’re united under a common goal: to produce and develop the very best in mobile gaming, and bring fun and entertainment to our millions of customers across the globe! THE MISSION We are looking for flexible individuals who have a strategic viewpoint and can grow as we grow our Data Science and Insights team in Seattle. You will work with our data scientists and game data analysts who are dedicated to making our games fun and enjoyable for our players. Your team's analytical capabilities provide valuable insights needed to make business decisions on a variety of topics including user acquisition, segmentation, engagement, monetization, network analysis, churn prediction, campaign analysis, fraud and game analytics. You will interact with our game analytics teams and business stakeholders regularly to understand their strategic goals and enable the team to work on the most valuable analytical problems. The Data Scientists are responsible for applying a wide variety of statistical and analytical techniques to business problems to glean valuable insights in support of key strategic business initiatives. They apply analytical rigor and statistical methods to data and are comfortable manipulating and analyzing complex, high-volume, and high-dimensionality data from varying sources. Incumbents are effective communicators capable of independently driving issues to resolution and communicating insights to non-technical audiences. YOU WILL… Provide thought leadership on the practical application of machine learning and advanced analytical methods and cultivate a data driven culture across the company Collaborate with key business leaders to understand business problems and formulate analytical solutions for problem solving Construct recommendations and strategic/tactical plans based on business data and market knowledge. Oversee methodology and problem definition, guide analytic deep dives and problem solving, share learning from projects. Translate ambiguous business problems into measurable analytical components. Lead or collaborate with a team of data scientists, game data analysts or big data engineers on analytical projects, proving benefits of solutions and helping with execution and measurement. Work with cross functional teams to enable the right set of tools and technology to implement end to end solutions. Perform statistical analysis on experimental or business data to validate and quantify trends or patterns. Design and implement: Online experiments and experimental frameworks, including A/A, A/B, A/B/n and multivariate testing End-to-end cloud based machine learning production pipelines Scalable and efficient modeling algorithms that can work in production systems Write advanced SQL for exploratory analysis, and translate computational solutions/statistical models to implementable code Work with unstructured/semi structured data to extract useful analytic measures. Mentor junior data analysts and data scientists. REQUIRED ABILITIES, ACHIEVEMENTS, AND XP Graduate or Post graduate work in a relevant technical field, or 10+ years of experience in a relevant role. Extensive experience solving analytical problems using quantitative and qualitative approaches A flexible analytic approach that allows for results at varying levels of precision A strong passion for empirical research and for answering tough questions with data. Demonstrated practical experience in building end to end data science solutions and applying machine learning methods to real world problems. Deep understanding of and experience with machine learning models and data analysis approaches. Experience with state-of-the-art techniques in machine learning algorithms, including deep neural networks, NLP, dimensionality reduction, ensemble methods, graph algorithms. Comfort manipulating and analyzing complex, high-volume, high-dimensionality data from varying sources Solid data structures & algorithms background. Exceptional technical skills: Strong programming skills in at least one language such as Python, Java, Scala or R. Demonstrated proficiency in SQL and relational databases. Experience working with semi structured data/unstructured data and turning them into actionable insights Experience using visualization techniques to record and communicate findings Experience in strategies for experimental analytics in complex scenarios. PREFERRED EXPERIENCE Big data experience (Hive, Spark, HDFS) a big plus! Experience in GCP, AWS, Azure or other cloud ecosystems. Published work in academic conferences or journals. YOU ARE Driven by curiosity and have a desire to go beneath the surface of a problem to ask the right business questions and identify potential answers that can be tested and proven LET’S GO! We’ve come a long way, and continue to grow! Since our founding in 2002, Big Fish has been an industry leader in mobile, free-to-play casual games, and are now embarking on our latest adventure in the mid-core space! With just over 700 employees across our Seattle headquarters and Oakland studio, the Big Fish Pond includes six studios, each with a unique personality and set of goals. We are where gamers, artists, and executives alike come together to collaborate and grow, while also enjoying the opportunities and benefits of a larger company. We’ve got you covered with great benefits including medical, dental and vision insurance, retirement options, transportation and fitness discounts, and great work-life balance! Want to discover more about life at Big Fish? Check us out on TheMuse.com! Come be the next Big Fish in the Pond!"	NA	"character(0)"	2018-10-15	"Seattle%2C+WA"	100
"https://www.indeed.com/viewjob?jk=201abf95039ec4a1"	"c(\"Machine Learning Researcher, Platform Architecture\", \"Key Qualifications\", \"\nDescription\", \"\nEducation\")"	"Apple"	"6,252 reviews"	"We are looking for engineers with a passion for using machine learning to build intelligent applications. In this highly accomplished, deeply technical and close-knit team of data scientists and machine learning engineers, you will create tools that are used by millions of people. You will design and implement new machine learning algorithms and techniques and collaborate with the most innovative product development teams in the world. We research new machine learning algorithms, models and techniques that will power amazingly intelligent user experiences. We are looking for new ambitious members to join our research ML group. In this role, you will design new models and algorithms, and actively engage with the academic community by publishing your work and participating in academic efforts. You will also have the opportunity to supply to every cool project around Apple, and use your data science, machine learning and artificial intelligence skills to transfer your ideas into solutions for some of the most challenging technical problems in the next generation of products that will delight millions of people. Key Qualifications STRONG ACADEMIC AND PUBLICATION RECORD Deep technical skills in machine learning, deep learning, computer vision, natural language processing, or artificial intelligence A passion for creating innovative techniques and making these methods robust and scalable ABILITY TO EXPLAIN AND PRESENT DEEP TECHNICAL IDEAS Creative, reciprocal, & innovation focused Description As a member of the ML Research team, you will design and evaluate new algorithms, models and methods that will affect Apple and the broad ML community. You will also collaborate with teams across Apple, who are building the newest, most compelling intelligent applications in the world. You will also be a trusted advisor for standard methodology machine learning development. - Your responsibilities include: - Researching, developing and implementing the most innovative machine learning, artificial intelligence, computer vision and NLP techniques - Publishing papers, software and building presentations - Transferring machine learning solutions to data scientists and engineers on product teams - Providing technical mentorship to product teams on the choice of machine learning approaches appropriate for a task - Providing architectural mentorship on transitioning prototypes to high-performance production models - Providing feedback on tools and new features needed back to platform development teams Education - PhD in Machine learning, Statistics, Computer Science, Physics, or related field or - MS in related field with a strong academic track record - 3+ years of research experience in academia or industry"	NA	"character(0)"	2018-10-15	"Seattle%2C+WA"	100
