"url"	"title"	"company_name"	"company_score"	"description"	"time_posted"	"metadata"	"date_scraped"	"city"	"page"
"https://www.indeed.com/viewjob?jk=0132648a2ed48352"	"Data Scientist"	"Quardev, Inc."	"-"	"Our downtown Seattle client seeks a Data Scientist with solid maths, Spark, and programming experience. You will be reporting to the Manager of Quality Engineering and work closely with software architects, testers, developers, and product management in all phases of the software development lifecycle. You will be responsible to build, develop and maintain data models, reporting systems, data automation systems, dashboards and performance metrics that support key business decisions. This is your opportunity to be part of a team working towards improving test coverage and predict quality of software by applying Machine learning and Data mining techniques on software testing.Sounds Interesting Read on to learn more. Responsibilities Provide technical leadership to Test Architects and Automation engineers around Test Metrics, Analytics and ML Participate in the design and implementation of Quality engineering / Test automation framework, systems and services Assist in setting architectural direction for Metrics dashboards, Test coverage tools, and Test analytics platform Define High level Test Metrics strategy and approaches for analyzing data generated by tests Oversee the design and delivery of reports and insights that analyze business functions and key operations and performance metrics Manage and optimize processes for data intake, validation, mining and engineering as well as modeling, visualization and communication deliverables Qualifications Experience with at least one programming language: Java, C#, or Python Experience with languages/ frameworks used in ML & Analytics: Spark, R etc Solid programming skills with querying languages: SQL, SAS, etc Experience with testing tools: TestNG, Selenium etc Experience with data visualization tools: Tableau, Raw, chart.js, etc Working knowledge of data mining principles: Predictive analytics, mapping, collecting data from multiple data systems on premises and cloud-based data sources Understanding of and experience using analytical concepts and statistical modeling techniques Experience either in web services development or test automation Familiarity with CICD, pipelines: Jenkins, Distelli or similar Thank you for considering Quardev. When you join Quardev consulting team, you join a team of industry veterans with a combined experience of over 30 years who are dedicated to creating a positive work environment that attracts and retains consultants through a combination of employee satisfaction, working conditions and company culture. Team members enjoy W-2 employment benefits, competitive salary, birthday off paid; affordable health, vision and dental insurance; 401K and fridge access at our corporate office. We pride ourselves on being a great place to work and strive to ensure our team members enjoy coming to work each day. For more information and new job opportunities, visit www.Quardev.com To check out our employee reviews on Glassdoor, click here"	"5 days ago"	"character(0)"	2018-10-15	"Seattle%2C+WA"	20
"https://www.indeed.com/viewjob?jk=d763466be11b1ee6"	"Data Scientist - Mortgages"	"Zillow Group"	"77 reviews"	"$108,000 - $159,000 a year (Indeed Est.) About the team You will join Zillow Group Mortgages, a dynamic, collaborative, and driven team. We are data-hungry and make almost all decisions using data. Our team structure if flat. You will communicate directly with Directors and VPs. You will have the opportunity to present results directly and help drive the direction of the business.About the role Zillow Group is currently seeking a Data Scientist to join the Zillow Group Mortgages Analytics team in our Seattle, WA office. Our team is tasked with absorbing billions of rows of data from dozens of sources, organizing them, visualizing them, and analyzing them to help inform both short- and long-term decision-making. You will not shy away from complexity and uncertainty, and you will develop a deep understanding of our mission, business models, and personas. We want you to use that intuition you’ve developed (both in business and real life) to use the data we have on hand to find opportunities for growth and to develop insights that help the broader organization meet its goals, improve its performance, and positively impact how our users and customers navigate the Mortgage market. Once you’re here, you’ll help engineer, analyze, and report on data to improve our Mortgage business and products. In this role you will: Dive into our internal data (think Hive, Presto, SQL Server, My SQL, Redshift, Python, Mode Analytics, Tableau, R), combining disparate sources of information into data sets you can analyze. Help sales, product and business leadership make decisions with data Tackle complex business problems by converting raw data into meaningful and actionable business ideas Craft insightful automated dashboards & data visualizations to track key metrics Work with a team of analysts to support Zillow’s mortgage product and sales team Who you are You will join Zillow Group Mortgages, a dynamic, collaborative, and driven team. We are data-hungry and make almost all decisions using data. Our team structure if flat. You will communicate directly with Directors and VPs. You will have the opportunity to present results directly and help drive the direction of the business. Who you are You are an all-around talent, you can think through a complex business problem and solve it You can interpret, and visually convey data results to generate insights You can to run multiple projects concurrently You are able to effectively communicate complex ideas to diverse audiences You have strong SQL coding and statistics skills You have 2+ years in highly analytical role with relevant experience (e.g. analytics, sales finance, management consulting or investment banking) You have a quantitative related degree (e.g. engineering, finance, and statistics) or quantitative training. Masters or PhD is highly regarded but not required. You have experience with Tableau, Salesforce as a plus Get to know us Zillow Group houses a portfolio of the largest and most vibrant real estate and home-related brands on the web and mobile. Our mission is to build the largest, most trusted and vibrant home-related marketplace in the world.Zillow Group is owned, fueled and grown by innovators who help people make better, smarter decisions around all things home. We encourage one another at every level, and our efforts are supported by employee-driven, world-class benefits that enable us to enjoy our lives outside the office while building fulfilling careers that impact millions of individuals every day. Zillow Group is an equal opportunity employer committed to fostering an inclusive, innovative environment with the best employees. Therefore, we provide employment opportunities without regard to age, race, color, ancestry, national origin, religion, disability, sex, gender identity or expression, sexual orientation, or any other protected status in accordance with applicable law. If there are preparations we can make to help ensure you have a comfortable and positive interview experience, please let us know."	"10 days ago"	"$108,000 - $159,000 a year (Indeed Est.) "	2018-10-15	"Seattle%2C+WA"	20
"https://www.indeed.com/viewjob?jk=c261efe94f3c8250"	"c(\"Senior Data Scientist\", \"As a Data Scientist You Will:\", \"Your Toolset Includes:\", \"Your Qualifications:\", \"Why We’ll Hire You:\", \"Benefits of Working at Rover.com:\")"	"Rover"	"422 reviews"	"Who we are: Rover.com connects pet parents with the nation’s largest network of pet sitters and dog walkers. On Rover, pet parents can easily discover, book, and manage personalized care for their dogs including pet sitting, dog walking, and doggy day care. Founded in 2011 on the belief that everyone should have the opportunity to experience the unconditional love of a dog, Rover improves and simplifies life for pet parents and the dogs they love. We're headquartered in downtown Seattle. We're an agile, fast-growing startup, and our leadership comes from some of the country's most respected tech companies. Our Senior Leadership team has been recognized by Forbes, Seattle Business, and Geekwire. For the past three years we have been nominated as one of Seattle's \"Best Places to Work\" by Seattle Business Magazine, and celebrated awards in 2016 and 2017 by Seattle Met magazine and the Puget Sound Business Journal. We're also the recipient of World’s Most Dog-Friendly Offices in 2016 by Inc.com. Needless to say (but we're going to say it anyway)—we love dogs, and we wouldn't dream of going to work without them by our sides. Who we're looking for: We are looking for people who understand that behind every data point there is a pet and a pet person. When you develop and deploy an algorithm, you are not just producing a score or rule set, you are altering the customer experience and impacting the business in measurable ways. You should be excited to tackle a broad array of problems and work in a fast-paced, collaborative startup environment. What does Data Science mean at Rover? At Rover we obsess over our customers’ needs, relying heavily on data to improve the customer journey, and to continuously optimize outcomes in our marketplaces. Our entire organization is metric driven and underpinned by data science. Data scientists are responsible for defining the right metrics, understanding nuanced marketplace dynamics, and developing models and algorithms that power our business and technology. As a Data Scientist You Will: Identify opportunities to operate the marketplace more efficiently, working closely with business, product, and engineering leaders Build multivariate models to arrive at inferences or predict future behavior Develop algorithms that match owners with providers or solve other customer needs Design and analyze A/B user tests and marketplace experiments, often in partnership with product managers Deploy machine learning models at scale, writing production code in collaboration with machine learning platform engineers Your Toolset Includes: SQL Python Probably at least one additional programming language / computational programming environment; e.g., R, Matlab, C++, etc Google Analytics or similar user funnel analytics tools Tableau, Looker, or similar data visualization tools Data-informed decision making with rigorous split testing. Integrated teams with developers, designers and analysts working side-by-side. Your Qualifications: B.S in a quantitative discipline required; advanced degree (MS or PhD) preferred Strong analytical, technical and coding skills Deep expertise in one or more core data science disciplines (e.g, supervised learning, machine learning, etc) Marketplace experience strongly preferred Experience in online user testing strongly preferred 8+ years of experience in a technical role Why We’ll Hire You: You are familiar with more than just the basics, and have more than cursory experience with at least sub-discipline in the broad field of data science. In other words, you know where the sharp edges are, and can lead decisions around what techniques are and are not appropriate to employ for particular classes of problem You’re a deeply analytical thinker who is passionate about finding structure in data, and using data to drive real value to the end user (and thus the business). You are passionate about our core business. You will instinctively dig into every aspect of what it means to be a dog sitter and a dog owner on the Rover platform. You can take abstractly defined problems and work with (imperfect) data to drive decisions You are a great partner to engineers and business owners alike You can pitch your own ideas and shepherd them through to completion You show a pattern of being self-started, self-taught and self-directed You favor open communication with willingness to ask and answer questions You are output- and outcome-oriented You have excellent written and verbal communication skills You play nicely with others (and dogs) Benefits of Working at Rover.com: Competitive compensation 401k Stock options 4 weeks paid time off Competitive benefits package, including medical, dental, and vision insurance Commuter benefits Bring your dog to work (and unlimited puppy time) Doggy benefits, including $1,000 toward adopting your first dog Stocked fridges, coffee, soda, and lots of treats (for humans and dogs) Free catered lunches semi-monthly Regular team activities, including happy hours, snow tubing, game nights, and more 50 free dog walks a year This position is based at Rover HQ in Downtown Seattle. Competitive salary & benefits depending on experience. Candidates must be eligible to work in the US."	NA	"character(0)"	2018-10-15	"Seattle%2C+WA"	20
"https://www.indeed.com/viewjob?jk=62e3e34bec528f0b"	"Statistician/Research Data Analyst"	"VA Puget Sound Research"	"-"	"$66,300 - $94,600 a yearAs a Statistician/Research Analyst in our multidisciplinary research team, you will work with research team to address issues related to Veterans’ healthcare delivery and policy-planning using large and complex healthcare databases. This position is based within the Health Services R&D program at VA Puget Sound in Seattle, WA. Responsibilities include providing advanced data management support as well as developing and estimating quantitative models for multiple health services research projects of varying scope and complexity under the supervision of Principal Investigators.Key Duties: Create analytic data files from multiple sources, including relational datasets from operational and clinical health services research databases, survey data, and clinical trial data.Perform advanced statistical analyses drawing on methods across fields including econometrics, biostatistics, and data science.Present statistical models and empirical results to the investigative teams in a clear mannerPrepare statistical and scientific reports and works with the investigative teams to publish the findings in peer-reviewed journals; potential to be first author on manuscripts, though not required.Collaborate with investigative teams and other scientific staff.Qualifications: Candidates must have a masters-level, PhD, or equivalent degree in health services, biostatistics, statistics, economics, psychology, applied mathematics or a closely related field. The applicant must be proficient in SQL and standard statistical software packages, such as Stata, R or SAS. Excellent written and spoken communication skills are necessary, as is the ability to work effectively in a team setting. The ideal candidate is excited about using diverse sources of data to answer high impact research questions facing health systems, has strong problem-solving skills and experience working in multidisciplinary teams with varying backgrounds.Candidates must be US citizens. Target salary will depend on the candidate’s experience.Please send a cover letter and resume using the subject line “HSR&D Statistician Application”.Job Type: Full-timeSalary: $66,300.00 to $94,600.00 /yearExperience:specialized: 2 years (Required)Education:Master's (Required)"	NA	"$66,300 - $94,600 a year"	2018-10-15	"Seattle%2C+WA"	20
"https://www.indeed.com/viewjob?jk=4d294400feee0d9c"	"c(\"Data Scientist\", \"As a Data Scientist You Will:\", \"Your Toolset Includes:\", \"Your Qualifications:\", \"Why We’ll Hire You:\", \"Benefits of Working at Rover.com:\")"	"Rover"	"422 reviews"	"Who we are: Rover.com connects pet parents with the nation’s largest network of pet sitters and dog walkers. On Rover, pet parents can easily discover, book, and manage personalized care for their dogs including pet sitting, dog walking, and doggy day care. Founded in 2011 on the belief that everyone should have the opportunity to experience the unconditional love of a dog, Rover improves and simplifies life for pet parents and the dogs they love. We're headquartered in downtown Seattle. We're an agile, fast-growing startup, and our leadership comes from some of the country's most respected tech companies. Our Senior Leadership team has been recognized by Forbes, Seattle Business, and Geekwire. For the past three years we have been nominated as one of Seattle's \"Best Places to Work\" by Seattle Business Magazine, and celebrated awards in 2016 and 2017 by Seattle Met magazine and the Puget Sound Business Journal. We're also the recipient of World’s Most Dog-Friendly Offices in 2016 by Inc.com. Needless to say (but we're going to say it anyway)—we love dogs, and we wouldn't dream of going to work without them by our sides. Who we're looking for: We are looking for people who understand that behind every data point there is a pet and a pet person. When you develop and deploy an algorithm, you are not just producing a score or rule set, you are altering the customer experience and impacting the business in measurable ways. You should be excited to tackle a broad array of problems and work in a fast-paced, collaborative startup environment. What does Data Science mean at Rover? At Rover we obsess over our customers’ needs, relying heavily on data to improve the customer journey, and to continuously optimize outcomes in our marketplaces. Our entire organization is metric driven and underpinned by data science. Data scientists are responsible for defining the right metrics, understanding nuanced marketplace dynamics, and developing models and algorithms that power our business and technology. As a Data Scientist You Will: Identify opportunities to operate the marketplace more efficiently, working closely with business, product, and engineering leaders Build multivariate models to arrive at inferences or predict future behavior Develop algorithms that match owners with providers or solve other customer needs Design and analyze A/B user tests and marketplace experiments, often in partnership with product managers Deploy machine learning models at scale, writing production code in collaboration with machine learning platform engineers Your Toolset Includes: SQL Python or R Google Analytics or similar user funnel analytics tools Tableau, Looker, or similar data visualization tools Data-informed decision making with rigorous split testing. Integrated teams with developers, designers and analysts working side-by-side. Your Qualifications: B.S in a quantitative discipline required; advanced degree (MS or PhD) preferred Strong analytical, technical and coding skills Expertise in one or more core data science disciplines (e.g, supervised learning, machine learning, etc) Marketplace experience preferred Experience in online user testing preferred 2+ years of experience in a technical role Why We’ll Hire You: You are familiar with more than just the basics, and have more than cursory experience with at least sub-discipline in the broad field of data science. In other words, you know where the sharp edges are, and can lead decisions around what techniques are and are not appropriate to employ for particular classes of problem You’re a deeply analytical thinker who is passionate about finding structure in data, and using data to drive real value to the end user (and thus the business). You are passionate about our core business. You will instinctively dig into every aspect of what it means to be a dog sitter and a dog owner on the Rover platform. You can take abstractly defined problems and work with (imperfect) data to drive decisions You are a great partner to engineers and business owners alike You can pitch your own ideas and shepherd them through to completion You show a pattern of being self-started, self-taught and self-directed You favor open communication with willingness to ask and answer questions You are output- and outcome-oriented You have excellent written and verbal communication skills You play nicely with others (and dogs) Benefits of Working at Rover.com: Competitive compensation 401k Stock options 4 weeks paid time off Competitive benefits package, including medical, dental, and vision insurance Commuter benefits Bring your dog to work (and unlimited puppy time) Doggy benefits, including $1,000 toward adopting your first dog Stocked fridges, coffee, soda, and lots of treats (for humans and dogs) Free catered lunches semi-monthly Regular team activities, including happy hours, snow tubing, game nights, and more 50 free dog walks a year This position is based at Rover HQ in Downtown Seattle. Competitive salary & benefits depending on experience. Candidates must be eligible to work in the US."	NA	"character(0)"	2018-10-15	"Seattle%2C+WA"	20
