"url"	"title"	"company_name"	"company_score"	"description"	"time_posted"	"metadata"	"date_scraped"	"city"	"page"
"https://www.indeed.com/viewjob?jk=53d760b7b8278adc"	"Senior Data Scientist"	"Octane Lending"	"-"	"$140,000 - $180,000 a yearFounded in 2014, Octane Lending is a fintech startup with the vision of making consumer financing as painless as cash. Serving the $60B consumer powersports and agricultural vehicle spaces (motorcycle, ATV, tractor, mower etc.), our technology powers transactions in over 2000 dealerships across the country. Less than two years after launch, our platform has generated over $1bn in loan requests and enabled thousands of customers to buy their dream products. We have raised $42M in venture capital from leading investors such as IA Ventures, Valar Ventures, and Contour Venture Partners and closed $145M in debt capital.
We are seeking a talented data scientist to lead projects related to credit risk analytics and model development. You will be working with a versatile team of data scientists and financial professionals to implement live loan models underlying core functions of Octane's lending business and loan portfolios.
Responsibilities:
Bridge the disciplines of data analytics and risk management to formulate evidence-based credit strategies that responsibly grow originations within the organization’s risk management appetite
Lead and manage the development of machine learning powered predictive models for Octane Lending’s real-time credit and fraud detection systems
Manage and mine large data sets of proprietary and third-party data to draw insights and recommendations for policy and strategy decisions
Champion data analytics and help advance our culture of data-driven decision-making
Design and implement customer-facing experiments that improve our user experience and grow loan originations
RequirementsA track record of taking initiative and driving results, and a passion to build, design and transform a young organization
Deep understanding of end-to-end development of machine learning systems, especially feature engineering and feature selection
Experience with both model development and systems integration
Strong communication skills and experience working across teams
Hands-on experience with SQL and Python or similar languages is required
5+ years of industry experience with 2+ years of managing data science projects or teams
BenefitsCompetitive base salary and equity
Rich health, vision and dental benefits
Life and disability insurance policies
Transit reimbursement
FSA account
Flexible work hours and remote friendly environment
15 days PTO"	"10 days ago"	"$140,000 - $180,000 a year"	2018-10-15	"New+York%2C+NY"	10
"https://www.indeed.com/viewjob?jk=291e4f993f99e999"	"c(\"Data Scientist\", \"WITHIN 30 DAYS, YOU WILL:\", \"WITHIN 60 DAYS, YOU WILL:\", \"WITHIN 90 DAYS, YOU WILL:\", \"WHAT YOU'LL NEED TO BE SUCCESSFUL IN THIS ROLE:\", \"WHAT YOU'LL GET FROM US:\")"	"HotelTonight"	"6 reviews"	"HotelTonight makes it remarkably easy to book great hotels at amazing rates on your mobile device, for tonight, tomorrow and beyond. Our goal is to be the premier and most loved way to book a place to stay and we’re looking for a Data Scientist to help do just that.
If hotel rooms are the fuel that powers HotelTonight, data is the oil that makes it fire on all cylinders. Leveraging this data in the right way is what will differentiate HotelTonight and make it the leading hotel booking app on the planet.
As one of the first Data Scientists on the Data & Strategy team, you will drive business decisions across the company using data and be responsible for implementing and fostering an environment that thrives on advanced analysis. You'll work closely with teams across Marketing, Supply and Finance on projects around customer segmentation, forecasting user quality and forecasting business performance - just to name a few!
Check out this post to learn more about how the D&S team empowers the company to make smarter decisions based on data.
WITHIN 30 DAYS, YOU WILL:
Become familiar with our datasets and the analysis tools that we work with
Learn about the business and the problems (short-term and long-term) that we face
Start to fill holes in our analysis platform and identify the areas of our business that are most important to focus on
WITHIN 60 DAYS, YOU WILL:
Deliver your first detailed analysis, which includes a strategic plan for how to act upon your findings
Improve the team’s access to advanced analysis tools and begin teaching them how to most effectively use them
Increase your knowledge of the business and the teams involved, and prioritize the most impactful projects
WITHIN 90 DAYS, YOU WILL:
Establish a roadmap for advanced analysis projects for the next few months
Implement your first strategic initiatives and begin measuring the impact on key metrics associated with the initiative
Empower the rest of the team to apply advanced analysis to their own projects using your analysis tools
WHAT YOU'LL NEED TO BE SUCCESSFUL IN THIS ROLE:
Professional experience using advanced analysis to guide strategic decisions at the company level
You know how to use the right tool for the job, whether that's a programming language (like R or Python) or just plain old SQL
Experience working with statistics and supervised/unsupervised models
Communication: you love to talk about your work and findings, and can clearly explain the details
Familiarity with Amazon Web Services, Apache Spark, Tensorflow, etc
Ability to move quickly by making smart assumptions
Experience working with e-commerce marketplaces is a big plus
A love for travel, especially the hotel part!
WHAT YOU'LL GET FROM US:
An official Best Places to Work (we're in the top 10!)
The opportunity to define mobile commerce and change the way people book travel
A people-focused organization dedicated to making sure you're challenged, learning, growing, and recognized for all the great work you do
The camaraderie of a driven, agile team that is building something disruptive
Excellent health, dental, vision and 401k plans, and stock options too
Fun stuff - quarterly travel stipend, flexible time off, subsidized cell phone plans and fitness memberships, and the opportunity to spin the HT Roulette wheel to win a spontaneous weekend getaway!
We are on a mission to radically transform hotel bookings. Doing this requires us to think differently and to question conventional approaches, therefore it’s essential to have a diverse team of the very best people with all types of backgrounds and experiences to bring the best ideas to life. We are committed to maintaining an environment where all of our team members have the opportunity to be heard, to make an impact and to do the best work of their lives."	"19 days ago"	"character(0)"	2018-10-15	"New+York%2C+NY"	10
"https://www.indeed.com/viewjob?jk=9e0a92dbc518508e"	"Data Scientist"	"Qloo"	"-"	"OtherFunded downtown startup with competitive salary is seeking a data scientist from experienced to senior and above.We're a small company with outsized output. There will be endless opportunity for an array of technologies, but you should know the idiosyncrasies of the Spark ecosystem.The following would be nice but is not necessary:- Advanced degree (MEng, MSc or PhD) in one of the following disciplines: math, physics, engineering, computer science.- At least four years of experience in quantitative analysis with real data in a product or research role.- Strong familiarity with programming concepts (data structures, computational analysis).Reply with relevant experience in your cover. We have a ton of data to wade through, so any large scale projects you've worked on are worth leading with.We have a sunlit, dog-friendly office in a great SoHo location.Health insurance, flexible hours and partial telecommute for the right candidate.Job Type: Full-timeExperience:Spark: 2 years (Required)Location:NYC, NY (Required)"	"6 days ago"	"Other"	2018-10-15	"New+York%2C+NY"	10
"https://www.indeed.com/viewjob?jk=d70028303293300c"	"Data Scientist"	"MediQuire"	"-"	"$116,000 - $147,000 a year (Indeed Est.) MediQuire – Data Scientist
Are you interested in products that make lives better for those most in need and help reshape healthcare in the US? As a Data Scientist, you will be at the forefront of the development and deployment of MediQuire’s data-driven solutions in value-based healthcare. You will be joining a fast-growing VC-backed company, with a unique team of seasoned professionals with a vast combined expertise in both the technical and the healthcare space.
Position:
As a Data Scientist, you will have an opportunity to contribute to MediQuire’s healthcare analytics platform that helps medical providers and payers drive improved outcomes and optimize cost and utilization. Data-driven capabilities form the underpinnings of MediQuire’s population health and value-based contracting offerings. You will contribute to building data analysis pipelines and predictive analytics tools that transform clinical and utilization data into information to impact the delivery and quality of care of some of the most underserved patient populations in the United States.
Internally, you will have an essential role in creating analysis insights that will inform and guide our Product and Engineering teams and help derive insights that will impact care best practices guidelines on our clients’ side. You will be working with a number of large datasets of pharmacy and medical claims data and a rich nationwide database of Electronic Health Records.
Main Responsibilities:
Design, implementation, and deployment of solutions for delivery of healthcare based on clinical outcomes, socio-economic factors, as well as healthcare cost and utilization. In this, you will have a unique opportunity to build models and predictive analytics tools that prioritize patients in greatest need of care, as well as enable providers and payers to manage the health of their patient population through improved outcomes and higher quality of care while optimizing cost and utilization.
Developing innovative methods to collect data and extract information from heterogeneous sources building on our current product platform that already delivers clinical data insights superior to the traditional clinical informatics solutions.
Work closely with the Product and Engineering teams towards scalable integration and deployment of our data-driven advanced analytics components into MediQuire’s offerings.
Last but not least, continuously enrich our data as an asset: building insights driven by clinical outcomes, cost, and utilization; and continuously tracking and improving our models’ performance.
Minimum Qualifications:
You have a Graduate degree in a relevant field (data science, computer science, machine learning, statistics).
At least 3 years of real-world experience of building data-driven solutions based on sound quantitative approaches.
You have a strong track record of developing and applying advanced methods for managing large and heterogeneous data sources, information extraction, predictive modeling and model validation.
You have a continuous drive to crack challenging problems, and eager to find the best possible way to convert data into actionable information.
You love working in a team and continuously and effectively communicate your ideas and findings. You know how to use your tools to visualize data to tell stories to internal and external stakeholders.
You have advanced knowledge and a track of implemented solutions in at least one of R, Python, Java, Scala.
You have excellent understanding of databases and working knowledge of using datastores to effectively manipulate large amounts of heterogeneous data.
Preferably, you will have working knowledge and experience utilizing and interfacing distributed computing frameworks such as Spark.
Having experience in developing solutions over clinical records and claims data is a huge plus.
Personal Characteristics:
You are organized, love making to-do lists, are flexible to re-prioritize on the fly
Hospitable and solution-oriented in nature
You write down your goals and measure them regularly
You love to win, more than you hate to lose
You have high expectations of yourself and those around you
You enjoy being part of a team and doing whatever it takes to help that team succeed
Location:
New York City"	"12 days ago"	"$116,000 - $147,000 a year (Indeed Est.) "	2018-10-15	"New+York%2C+NY"	10
"https://www.indeed.com/viewjob?jk=892632a452507bd1"	"Data Scientist - Hedge Fund - Manhattan & Stanford CT"	"Asset Management Specialists"	"-"	"ContractJob TitleMarket Intelligence Technology Data Scientist.SummaryOur Technology team is looking to hire a senior Data Scientist for a central data initiative to build out a data science platform that will provide analytic and machine learning workspaces. These are 12+ month rolling contracts paying market leading rates (depending on experience) What you’ll doAs a data scientist you will be working on building out new technology platform that will be used by Firm’s data scientists and analysts. You are expected to work on fast paced and highly visible project that has significant business impact.Writing efficient, modular, and dependable code, packages, libraries, and scriptsWork closely with team’s data engineer/systems developer and platform customers to design research (e.g., back-testing software) and production (e.g., model serving API) processesDocumenting all work extensively and train teammates on use of work products (e.g., custom Python libraries or R packages)Collaborating regularly with firm’s Big Data group and other firm resourcesFacilitate building research hypotheses and assumptions of portfolio manager and investment analysts by designing methodology and writing necessary code to perform back-testing, cross-validation, event studies, data analysis, etc.,Function as an extension of data engineering team to build out data science use cases of the platformWhat’s requiredSeasoned data scientist with experience on buy side or sell side Firms doing equity research.An expert in Python or R with 5 years of programming experienceStrong programming skills in Relational SQL/NoSQL databasesStrong written and verbal communication skillsHold and advanced degree in Computer Science or relevant Engineering disciplineConversant with advanced statistical analysisJob Type: ContractSalary: $50.00 to $200.00 /hourExperience:Python: 2 years (Required)R: 2 years (Required)Location:New York, NY (Required)"	"5 days ago"	"Contract"	2018-10-15	"New+York%2C+NY"	10
"https://www.indeed.com/viewjob?jk=24bb4490d3ab4aab"	"Research Analyst (Entry Level)"	"Research Partnership"	"4 reviews"	"About Research PartnershipOne of the world’s largest independent healthcare market research and consulting agenciesWe are trusted by the global pharmaceutical industry to provide the intelligence they need to flourish in an environment that's becoming ever more challenging.We work solely in healthcare, where our expertise and passion are unparalleled. Because we are independent, we can provide a truly bespoke service, managed by our large and experienced senior team and supported by our talented pool of professionally-trained researchers.What we deliver goes beyond research. Our clients see us as a valued healthcare consulting partner working to resolve their business challenges, providing strategic recommendations, immersion workshops and brand roadmaps to maximize their competitive edge.Graduate ProgramWe look for bright and inquisitive graduates who want to join a company that's pushing the boundaries of pharmaceutical market researchWe are proud of our graduate program which operates annually and offers great training and career opportunities. Many of our senior staff started on our graduate schemes.We believe in investing in our employees' training and development right from the start and throughout their careers. We provide learning and support at every stage of their journey so that employees can enjoy a career that's stimulating and develops future industry leaders.The RoleThis is an entry level job, perfect for those graduating college or less than 2 years of work experience.In your first year your role will focus on project management and analysis; you will be working on multiple projects at a time. To ensure you receive a broad grounding in a range of market research techniques and methodologies, you will support teams on both quantitative and qualitative studies. Working across both research disciplines, you will find no two days are the same. Responsibilities will range from content analysis of qualitative interviews to the charting of quantitative data in PowerPoint, as well as day-to-day project management responsibilities on international research studies. You will also be responsible for liaising with external fieldwork agencies to recruit respondents (e.g. doctors, nurses, patients) who agree to participate in our market research. As you progress further into your career with us, you will gain more responsibility for material design, report writing, presenting and overseeing an internal team. With the majority of our 180+ annual projects conducted in multiple markets you will get the chance to research markets across the globe and have the opportunity to travel. Our clients often want to view the research live at a Central Location in order to observe how respondents answer their questions. In this situation, someone from RP will attend to ensure the client is satisfied with the research and that everything is running smoothlyTo find out more information and to apply, please visit: https://www.researchpartnership.com/careers/graduatecareers/usgrad/To apply directly, please visit: http://survey.euro.confirmit.com/wix/0/p1865272640.aspxJob Type: Full-time"	"21 days ago"	"character(0)"	2018-10-15	"New+York%2C+NY"	10
"https://www.indeed.com/viewjob?jk=0f28dc0aafb427e0"	"Data Scientist"	"National Debt Relief"	"99 reviews"	"We are seeking an innovative and passionate Data Scientist to join our growing team to help promote our analytical culture, while leveraging data to maximize marketing performance and deliver a best-in-class experience for the clients we serve.
The ideal candidate will apply analytical rigor and data driven reasoning to guide the development and execution of marketing strategies and experiential initiatives across the organization. This individual will bring a sense of curiosity to seek out opportunities for improvement through internally and externally sourced data. This person will play a critical role in providing thought leadership, building statistical models to understand consumer behavior and intent, and identifying optimization opportunities across programs.
This is an opportunity to grow with a diverse team and have a measurable impact on a rapidly growing organization. It is a great fit for an entrepreneurial professional with a strong background in statistical modeling and a passion for translating data into actionable insight. Principle Duties and Responsibilities:Develop and implement advanced statistical models to guide business strategy and deliver incremental growth and value throughout the company.
Perform analysis of structured and unstructured data to solve complex business problems.
Use statistical techniques to build marketing segments, evaluate scenarios, predict future outcomes, and optimize performance.
Lead complex research and analytics projects across teams.
Research, test, and validate new modeling techniques as appropriate for specific solutions.
Present and depict recommendations so that stakeholders can make data-informed decisions.
Qualifications:
5+ years of experience as a data scientist conducting data mining and building and implementing complex models in a fast-paced, marketing-driven environment.
Experience working with large internal and external data sets covering new and existing client programs to include direct mail, TV, radio, search engine marketing and email preferred.
Undergraduate degree in a quantitative discipline (i.e. Statistics, Mathematics, Computer Science or equivalent quantitative discipline), advanced degree is preferred.
Expert knowledge of SAS, R/Python and SQL or similar industry standard tools use for large-scale data analysis and modeling.
Experience linking multiple data platforms with data visualization tools is a plus.
In-depth knowledge and experience in data mining and statistical modeling techniques (regression, decision tree, time series, etc. Knowledge of optimization theory and statistical model application are also preferred.
Strong analytical and problem-solving skills with the ability to interpret large amounts of data with business insight to support growth.
Strong consultative acumen with responsibility for analytical project design, management, and presentation of results to internal and external stakeholders.
Ability to clearly present statistical solutions to non-statistical people, articulating value and insights to the business.
Strong project management skills with a proven ability to set clear goals and design detailed plan against tight timelines. Evidence of self-motivated initiatives, high productivity, and good team work is desired.
What We Offer:
We believe in a team-first culture, full of rewards and recognition for our employees. We are dedicated to our employees’ success and growth within the company, through our employee mentorship and leadership programs.
Our extensive benefits package includes:
Medical, Dental, and Vision Benefits
401(k) Match
Paid Holidays, Sick Days, and Vacation
6 Weeks Paid Parental Leave
Pre-tax Transit Benefits
Discounted Gym Membership
No-cost Life Insurance Benefits"	"24 days ago"	"character(0)"	2018-10-15	"New+York%2C+NY"	10
"https://www.indeed.com/viewjob?jk=aea9fe0330576ef8"	"Data Scientist"	"Fora Financial LLC"	"20 reviews"	"Fora Financial, located in NYC, is a leading financial services company providing working capital to small and mid-size businesses nationwide.
Established in 2008, we support small businesses in need of financing to sustain or grow their enterprise by providing innovative, customized, and flexible working capital solutions. We operate through a consultative approach, listening to customers and providing what best meets their needs in an ever-changing financial market. To date, Fora Financial has funded over 22,000 individual transactions to more than 15,000 unique customers. The company has funded over $750 million in working capital solutions for small businesses since its inception.
A Day in the Life of a Data Scientist:
Build predictive models including but not limited to credit risk. fraud, response, and offer acceptance propensity
Perform through testing and validation of models and support various aspects of the business with data analytics
Identify new data sources/patterns that add significant lift to predictive modeling capabilities
Conduct analysis and turn insights into actionable changes for predictive models or policies
Develop analytics and advanced visualization to assist with portfolio surveillance. Typical functions are loss forecasting, mix management, risk appetite management, collections strategy, and reporting related to KPIs that affect portfolio surveillance such as non-performance, loss rates and loss severity
Partner with IT to integrate and productionize new data sources for modeling use
What You Have:
B.S. degree or higher in Statistics, Applied Math, Computer Science, Engineering or other quantitative program
3 years minimum experience with credit risk modeling; 5 years minimum preferred
Proven track record of building new models and improving existing models
Deep understanding of consumer credit report variables/attributes at both summary and tradeline level
Experience with small business lending and portfolio management is a plus
Passionate about solving problems with data and high level of intellectual curiosity
Thorough understanding of statistical modeling techniques
Proficiency in at least one of the following languages: R, SAS, SQL, Python
Highly motivated to work on multiple projects in parallel and team player with a start up spirit
Solid written and oral communication skills and ability to share findings with non-technical audienceThe Benefits of Working for Fora Financial:
A good work/life balance
Medical, Dental, Vision Coverage
401K Match
Life Insurance at No Cost to Employees
Generous Time Off Plan Including Rollover Vacation Days
Commuter Benefits
Health Care and Dependent Care Flexible Spending"	"27 days ago"	"character(0)"	2018-10-15	"New+York%2C+NY"	10
