"url"	"title"	"company_name"	"company_score"	"description"	"time_posted"	"metadata"	"date_scraped"	"city"	"page"
"https://www.indeed.com/viewjob?jk=9e5f2a939cf8da9d"	"Data Scientist: NLP Specialist"	"pymetrics"	"2 reviews"	"Using neuroscience-based assessments and machine learning algorithms, pymetrics is reinventing the recruiting industry by matching candidates to jobs where they are most likely to succeed. We are leading the charge in an evolving industry and growing our amazing team to support the mission of using data to unleash one's full potential.
We are looking for a talented data scientist to develop NLP algorithms for gathering insights spanning all stages of the hiring process from resumes to interviews. The ideal candidate would bring experience building scalable algorithms using audio and text data, have the ability to communicate with a bright team from diverse backgrounds, and be able to tackle interesting problems independently and with scientific rigor.
Responsibilities:Plan, implement and improve new and existing data products relating to hiring, including resume review, behavioral assessment and video interviews
Build models to parse documents for client-relevant information
Advise product and science teams on use of text analysis in future job assessments
Extract insights from audio channels of video interviews
Generate aggregated reports from text and audio data (e.g., the typicality of words in a work sample)
Collaborate with and train other members of the data science team
Write production level code for practical application of data products
Interact with data scientists, analysts, engineers and product managers on other data products implemented at pymetrics, including computer vision, behavioral assessment, statistical analysis and clustering techniques
Requirements:MS/PhD preferred
2+ years experience in data science preferred
Experience with making predictions and extracting insights from audio/text data
Practical knowledge of Python and its scientific libraries SciPy, Scikit, Pandas, and NumPy, with extensive knowledge of programming best practices.
Familiarity with common tools for NLP, especially NLTK and Word2Vec
Solid foundation in machine learning models, processes, and theories, with the ability to evaluate different algorithmic approaches
Specific knowledge of foundational techniques within NLP, such as text processing, document classification, sentiment analysis, etc.
Working knowledge of statistics and probability (statistical inference, Bayesian statistics).
Embodiment of our core company values of motivation, positivity, curiosity, humility and integrity, and buy-in for our company mission of eliminating bias in hiring
Nice to Haves:Knowledge of psych/cogsci/neuroscience research
Interest in issues of transparency and fairness in AI
Experience with deep learning using python
Eye for data visualization and presentation of data-driven insights
Benefits:Health care plan (medical, dental & vision)
Flexible paid time off
Family leave (maternity, paternity)
401k
Team budget for training & development
Stock option plan
Commuter transportation reimbursement
Midtown Manhattan location
Dog-friendly workplace
Fun, diverse and intellectually eager coworkers
Team happy hours and retreats
"	NA	"character(0)"	2018-10-15	"New+York%2C+NY"	80
"https://www.indeed.com/viewjob?jk=059d6d3b2a51049b"	"Marketing Data Scientist"	"qualifIQ"	"-"	"$120,000 - $150,000 a yearOur client is one of the country’s largest and most reputable debt settlement companies. They are seeking an innovative and passionate Data Scientist to join their growing team to help promote their analytical culture, while leveraging data to maximize marketing performance and deliver a best-in-class experience for the clients they serve.The ideal candidate will apply analytical rigor and data driven reasoning to guide the development and execution of marketing strategies and experiential initiatives across the organization. This individual will bring a sense of curiosity to seek out opportunities for improvement through internally and externally sourced data. This person will play a critical role in providing thought leadership, building statistical models to understand consumer behavior and intent, and identifying optimization opportunities across programs.This is an opportunity to grow with a diverse team and have a measurable impact on a rapidly growing organization. It is a great fit for an entrepreneurial professional with a strong background in statistical modeling and a passion for translating data into actionable insight.ResponsibilitiesDevelop and implement advanced statistical models to guide business strategy and deliver incremental growth and value throughout the company.Perform analysis of structured and unstructured data to solve complex business problems.Use statistical techniques to build marketing segments, evaluate scenarios, predict future outcomes, and optimize performance.Lead complex research and analytics projects across teams.Research, test, and validate new modeling techniques as appropriate for specific solutions.Present recommendations so that stakeholders can make data-informed decisions.Qualifications5+ years of experience as a data scientist conducting data mining and building and implementing complex models in a fast-paced, marketing-driven environment.Experience working with large internal and external data sets covering new and existing client programs to include direct mail, TV, radio, search engine marketing and email preferred.Undergraduate degree in a quantitative discipline (i.e. Statistics, Mathematics, Computer Science or equivalent quantitative discipline), advanced degree is preferred.Expert knowledge of SAS, R/Python and SQL or similar industry standard tools use for large-scale data analysis and modeling.Experience linking multiple data platforms with data visualization tools is a plus.In-depth knowledge and experience in data mining and statistical modeling techniques (regression, decision tree, time series, etc. Knowledge of optimization theory and statistical model application are also preferred.Strong analytical and problem-solving skills with the ability to interpret large amounts of data with business insight to support growth.Strong consultative acumen with responsibility for analytical project design, management, and presentation of results to internal and external stakeholders.Ability to clearly present statistical solutions to non-statistical people, articulating value and insights to the business.Strong project management skills with a proven ability to set clear goals and design detailed plan against tight timelines. Evidence of self-motivated initiatives, high productivity, and good team work is desired.What our client offersMedical, Dental, and Vision Benefits401(k) MatchPaid Holidays, Sick Days, and Vacation6 Weeks Paid Parental LeavePre-tax Transit BenefitsDiscounted Gym MembershipNo-cost Life Insurance BenefitsJob Type: Full-timeSalary: $120,000.00 to $150,000.00 /yearExperience:Data Science: 4 years (Preferred)Location:New York, NY 10016 (Preferred)Work authorization:United States (Required)"	"20 days ago"	"$120,000 - $150,000 a year"	2018-10-15	"New+York%2C+NY"	80
"https://www.indeed.com/viewjob?jk=6a7e8a96d22f9b7a"	"Data Scientist"	"PebblePost"	"-"	"The PebblePost platform is the first to bring digital advertising capabilities to direct mail. Our platform is built on a robust foundation of big data, data science and algorithmic optimization. The PebblePost engineering team works on a set of unique and exciting challenges innovating and delivering personalized, Programmatic Direct Mail®. We process billions of events, store terabytes of information, and send millions of relevant and meaningful offers from brands consumers love.
We focus the bulk of our technical efforts in three areas:The PebblePost Graph uses distributed data and graph processing to create connections between online browsing activity and physical location in a privacy-compliant, consumer-centric fashion.
Our Decisioning Engine uses machine learning and predictive analytics to determine an ideal recipient for an offer, and manages delivery intelligence for each personalized PDM™ send.
Our data warehouse delivers real-time insights for brands on campaign effectiveness utilizing first and third-party data.

We are looking for data scientists to join our cloud team where the focus is on helping engineering and business teams to deliver more relevant brand marketing that consumers will appreciate.
What You'll Be Up To:Architect data science solutions to improve performance within a fast-growing, disruptive first-mover company
Collaborate with product managers and team members to gather requirements, design, and develop solutions within an agile environment.
Participate in code reviews and help maintain high standards of code quality
Stay up to date with relevant science and technologies to create an exceptional product
Work with engineering team to design, implement, and test applications to our cloud environments.
What You'll Need To Have:Expertise in regression analysis
Expertise in SQL and one or more relational databases
Expertise in machine learning techniques (e.g. clustering, decision tree learning, artificial neural networks, etc) and the pros/cons of when to use each
Experience with a scripting language ( e.g. Python) and statistical computer languages e.g .R.
High-level verbal and written communications skills
Excellent problem-solving and implementation skills
Self-motivated and passionate about apply data science to real world problems
Master or PhD in Computer Science, Statistics, Math, Industrial research or related fields
Bonus Skills:Experience in building production-level prediction and optimization systems
Expertise in the Hadoop Ecosystem (e.g. Spark, PySpark, HDFS, Hive, HBase, Impala, etc)
Experience with AWS cloud computing technologies (e.g. EMR, etc)
"	"20 days ago"	"character(0)"	2018-10-15	"New+York%2C+NY"	80
"https://www.indeed.com/viewjob?jk=20b3fc7d8a67b72e"	"Data Scientist"	"DigitasLBi"	"153 reviews"	"Overview
Data & Analysis – Data Scientist
Digitas is a highly-caffeinated playground where brilliant minds come together to bring bold, award-winning ideas to life.
The Data & Analysis team uses data-driven insights to fuel strategic growth for clients. We believe that data should never exist in a vacuum; instead, it should be put to work to bring the best ideas and stories to our clients.
Digitas Data Science practice sits within our DNA (Data & Analysis) capability, and develops industry-leading analytical solutions for clients across industries, channels and business functions. We apply a bespoke and cutting-edge arsenal of statistical, analytical and computing techniques to complex data problems at scale, with an emphasis on game-changing—and measureable—business impact. We work in close collaboration with colleagues across all agency disciplines to develop truly innovative, highly effective, data-powered solutions for our clients.
To help with this, we’re looking for an outstanding Data Scientist – an intellectually curious and creative problem solver who is willing to tackle the familiar and unfamiliar of all things data, including methods, technologies and applications. Sound like you? Read on.
What you’ll do:
Our Data Scientists deliver analytic solutions across a wide variety of client applications. We build inferential and predictive models, including machine learning algorithms and AI; we process, integrate and manipulate big data with distributed systems and customer data pipelines; we synthesize results and translate findings into compelling stories that resonate with clients.
As a Data Scientist, you’ll address complex marketing and business challenges—from cross-channel media and customer experience optimization to segmentation, targeting and business strategy—by accessing, integrating, manipulating, mining and modeling a wide array of data sources.
Day-to-day, your role includes:
Translating marketing and business questions into data queries.
Using distributed computing systems to access and manipulate big data sources.
Conducting exploratory analysis to identify relevant insights and useful transformations.
Applying quantitative techniques to uncover latent patterns in the data.
Interpreting data, analytical results and visuals to generate conclusions and recommendations.
Testing scalable data pipelines or models for real-time applications.
Ensuring that analytic tasks and results meet established objectives and timelines.
Sharing knowledge and conducting research to advance the collective knowledge and skills of our Data Science practice.
We’re looking for relevant academic, research or work experience, which typically includes:
A Bachelor’s or Master’s degree in a quantitative field such as statistics, mathematics, econometrics, operations research, data science, computer science, engineering, marketing or social science methods.
Hands-on experience analyzing data for patterns and insights.
Hands-on experience running basic statistical or machine learning procedures, such as descriptive statistics, hypothesis testing, supervised or unsupervised learning.
Hands-on experience with Python or R. Familiarity with SQL, Linux, and/or distributed computing systems such as Hadoop or AWS preferred.
Demonstrated interest in marketing analytic applications.
Demonstrated self-starter who thrives in a fast-paced environment with flat structure.
Got what it takes? We’d love to hear from you.
Digitas is an equal opportunity employer."	NA	"character(0)"	2018-10-15	"New+York%2C+NY"	80
"https://www.indeed.com/viewjob?jk=0e7e36fccde84f3b"	"Data Scientist, Marketing Effectiveness"	"Harnham"	"6 reviews"	"$110,000 - $130,000 a yearData Scientist, Marketing EffectivenesseCommerce Buying & SellingNew York City$110,000 - $130,000
Do you want to join a rapidly growing eCommerce Buying & Selling company who have had over 75 million unique downloads of their app across the globe in the last 2 years alone? Described as one of the hottest start-ups to work for in NYC with features in the New York Times and The Today Show among many, this company is revolutionizing the way people buy and sell products online. As a result, they have had a huge amount of investment and are looking for a highly skilled Data Scientist with a background in marketing effectiveness and forecasting in open source technologies, including Python, SQL and R to optimize their marketing spend to achieve key business goals? If you're looking for a new challenge and have experience in the end-to-end marketing analytics cycle, specifically in the offline space, then this could be the next step for you.
THE ROLE:
As a Data Scientist, Marketing Effectiveness, you will be proactively involved in managing all the marketing channels, performing highly statistical analysis to understand how effective each channel of communication is for the business to optimize marketing spend and ROI. You will be part of a team of 4 Data Scientists, but be the sole person focusing on all marketing effectiveness capabilities for this growing business. You will focus on:
Understanding all of the company's marketing constraints across all channels of engagement building Marketing Mix and multi-touch attribution models in R to understand how effective their TV, Radio, Newspaper and Social channels are
Making recommendations on how to increase their marketing efficiency, effectiveness, and ROI by which clients they partner with, as well as where and when they advertise across the diverse channel base
Working with diverse teams across the business including Marketing, Sales and BI teams, as well as the wider Data Science team across the glove to ensure that the quality of the data and models are of the highest standard
Delivering insights and recommendations to diverse stakeholders on how to improve their marketing performance and increase customer engagement
YOUR SKILLS AND EXPERIENCE:
Degree educated in a numerical discipline such as Math, Stats, Computer Science or similar
Experienced in building market mix and multi-touch attribution models in R as well as strong SQL coding/python background
Proven experience in building and maintaining relationships, as well as delivering insights and recommendations to C-Level stakeholders
Project management capabilities, with a strong business acumen are essential
BENEFITS:
As a Data Scientist, Marketing Effectiveness, you can expect to earn up to $130,000 (depending on experience), plus competitive benefits."	NA	"$110,000 - $130,000 a year"	2018-10-15	"New+York%2C+NY"	80
"https://www.indeed.com/viewjob?jk=0f28dc0aafb427e0"	"Data Scientist"	"National Debt Relief"	"99 reviews"	"We are seeking an innovative and passionate Data Scientist to join our growing team to help promote our analytical culture, while leveraging data to maximize marketing performance and deliver a best-in-class experience for the clients we serve.
The ideal candidate will apply analytical rigor and data driven reasoning to guide the development and execution of marketing strategies and experiential initiatives across the organization. This individual will bring a sense of curiosity to seek out opportunities for improvement through internally and externally sourced data. This person will play a critical role in providing thought leadership, building statistical models to understand consumer behavior and intent, and identifying optimization opportunities across programs.
This is an opportunity to grow with a diverse team and have a measurable impact on a rapidly growing organization. It is a great fit for an entrepreneurial professional with a strong background in statistical modeling and a passion for translating data into actionable insight. Principle Duties and Responsibilities:Develop and implement advanced statistical models to guide business strategy and deliver incremental growth and value throughout the company.
Perform analysis of structured and unstructured data to solve complex business problems.
Use statistical techniques to build marketing segments, evaluate scenarios, predict future outcomes, and optimize performance.
Lead complex research and analytics projects across teams.
Research, test, and validate new modeling techniques as appropriate for specific solutions.
Present and depict recommendations so that stakeholders can make data-informed decisions.
Qualifications:
5+ years of experience as a data scientist conducting data mining and building and implementing complex models in a fast-paced, marketing-driven environment.
Experience working with large internal and external data sets covering new and existing client programs to include direct mail, TV, radio, search engine marketing and email preferred.
Undergraduate degree in a quantitative discipline (i.e. Statistics, Mathematics, Computer Science or equivalent quantitative discipline), advanced degree is preferred.
Expert knowledge of SAS, R/Python and SQL or similar industry standard tools use for large-scale data analysis and modeling.
Experience linking multiple data platforms with data visualization tools is a plus.
In-depth knowledge and experience in data mining and statistical modeling techniques (regression, decision tree, time series, etc. Knowledge of optimization theory and statistical model application are also preferred.
Strong analytical and problem-solving skills with the ability to interpret large amounts of data with business insight to support growth.
Strong consultative acumen with responsibility for analytical project design, management, and presentation of results to internal and external stakeholders.
Ability to clearly present statistical solutions to non-statistical people, articulating value and insights to the business.
Strong project management skills with a proven ability to set clear goals and design detailed plan against tight timelines. Evidence of self-motivated initiatives, high productivity, and good team work is desired.
What We Offer:
We believe in a team-first culture, full of rewards and recognition for our employees. We are dedicated to our employees’ success and growth within the company, through our employee mentorship and leadership programs.
Our extensive benefits package includes:
Medical, Dental, and Vision Benefits
401(k) Match
Paid Holidays, Sick Days, and Vacation
6 Weeks Paid Parental Leave
Pre-tax Transit Benefits
Discounted Gym Membership
No-cost Life Insurance Benefits"	"24 days ago"	"character(0)"	2018-10-15	"New+York%2C+NY"	80
"https://www.indeed.com/viewjob?jk=ce9a1cbf356bd4dc"	"Data Scientist, Group Benefits and Middle Market P&C"	"The Hartford"	"1,449 reviews"	"Overview of the Position
The Hartford seeks energetic and passionate Data Scientists to focus on designing, developing and implementing solutions that will make an impact on our business. This role will focus on developing solutions in support of our Middle Market and Group Benefits business. In addition the Data Scientist will participate in a variety of ad hoc projects.
Our Data Scientists play a significant role by both leading and partnering with the business and data teams for a better understanding of the customer journey across multiple lines of business. As a Data Scientist you will focus on research for deliverables that support the long term plan to evolve the department’s capabilities to further develop and deliver impactful products to drive outcomes for both the business and clients.
Solutions that are developed will support a wide range of business areas which include underwriting, claims, operations, risk engineering, and digital analytics. As a Data Scientist you will focus on developing analytic and predictive modeling solutions that feature engineering assets, experimental design, as well as modeling techniques and abilities. Our Data Scientist toolbox consists of but not limited to predictive Modeling Techniques, Machine Learning, Cognitive Computing, Unsupervised learning, and Augmented intelligence. As a Data Scientist you will support and explore those assets overtime through customer adoption and establishing a rhythm within the data science community.
Responsibilities:
Collaborate and partner with business stakeholders in a way that supports the vision and sustains a culture that treats analytics as a corporate asset.
Participate in reviewing work with partners on an ongoing basis to calibrate deliverables against expectations
Help identify long term opportunities within the customer journey through the creation of algorithms and machine learning techniques to achieve financial objectives and solve problems.
Participate in the creation and deployment of long term tools to continually evolve the business.
Assist in identifying and assessing the value of new data sources and analytical techniques to ensure ongoing competitive advantage
Contribute to the successful implementation of strategies to achieve targeted business objectives.
Accountable for short term ownership and evolution of models developed
Support the processes used to develop and enhance our business needs
Support a high-performance collaborative culture
Develop knowledge of The Hartford's formal and informal structures, business processes, and data sources in your area of expertise
Remain current on research techniques and become familiar with state of the art tools applicable to your function
Present complex modeling to Senior Data Scientists that maximizes the bottom-line impact of modeling results
Provide economic, qualitative, and statistical support to ensure accuracy of characteristics and metrics being applied to business decisions.
Assist in estimating the economic impact of operational decisions
Promote analytics opportunities of the company with customers and business partners.
As requested, provide timely feedback and opportunities for your colleagues.
Suggest and participate in training opportunities for research staff and others in the organization
Qualifications
Experience & Skills
Master’s or Ph.D. in Statistics, Applied Mathematics, Actuarial Science, Quantitative Economics or other similar analytical field
2+ years of relevant experience in Research Function in Insurance or Financial Services or related field.
Experience in large scale operations environments (Claim Centers, Call Centers, Manufacturing) a plus.
Technical/Functional Skills
Experience modeling data and analytical capability.
Advanced coding skills in various languages e.g. R, Python etc.
Developed verbal/written communication skills.
Ability to translate complex technical topics into business solutions and strategies, including visualization.
Exposure to executing change to core business processes through the innovative use of quantitative techniques.
Competencies
Drive and commitment to what is necessary to get the job done efficiently, thoroughly, and professionally.
Innovative. Seeks new and creative ways to approach analytical exercises and development projects.
Results-oriented. Demonstrates a sense of urgency and accountability for business issues.
Customer focused. Builds effective relationships within the data science community
Equal Opportunity Employer/Females/Minorities/Veterans/Disability/Sexual Orientation/Gender Identity or Expression/Religion/Age
** NO AGENCIES PLEASE **Job Function
: Data Science
Primary Location
: United States-New York
Other Locations
: United States-Connecticut-Hartford
Schedule
: Full-time
Job Level
: Individual Contributor
Education Level
: Master's Degree (±18 years)
Job Type
: Standard
Shift
: Day Job
Employee Status
: Regular
Overtime Status
: Exempt
Travel
: No
Job Posting
: Oct 8, 2018, 7:37:49 PM
Remote Worker Option : No"	NA	"character(0)"	2018-10-15	"New+York%2C+NY"	80
